"Subject","Start Date","Start Time","End Date","End Time","Location","Description","Organizer","All Day","Importance","Busy Status","Sensitivity","Is Recurring","Recurrence Pattern","Reminder (minutes)"
"Steph & Ray Borwell's Birthday (13/06/1926)","1926-06-13","All Day","1926-06-13","All Day","","","","Yes","normal","free","normal","Yes","RRULE;FREQ=YEARLY;INTERVAL=12;BYMONTHDAY=13",""
"Jim & Winnie Dennis's Birthday (16/05/1929)","1929-05-16","All Day","1929-05-16","All Day","","","","Yes","normal","free","normal","Yes","RRULE;FREQ=YEARLY;INTERVAL=12;BYMONTHDAY=16",""
"Anniversary - David Annal's Birthday (04/10/1934)","1934-10-04","All Day","1934-10-04","All Day","","","","Yes","normal","free","normal","Yes","RRULE;FREQ=YEARLY;INTERVAL=12;BYMONTHDAY=4",""
"David Annal's Birthday (04/10/1934)","1934-10-04","All Day","1934-10-04","All Day","","","","Yes","normal","free","normal","Yes","RRULE;FREQ=YEARLY;INTERVAL=12;BYMONTHDAY=4",""
"Peter & Kay Eady's Birthday (20/06/1946)","1946-06-20","All Day","1946-06-20","All Day","","","","Yes","normal","free","normal","Yes","RRULE;FREQ=YEARLY;INTERVAL=12;BYMONTHDAY=20",""
"David & Lynne Steel's Birthday (22/08/1946)","1946-08-22","All Day","1946-08-22","All Day","","","","Yes","normal","free","normal","Yes","RRULE;FREQ=YEARLY;INTERVAL=12;BYMONTHDAY=22",""
"Trevor Simmonds's Birthday (04/06/1947)","1947-06-04","All Day","1947-06-04","All Day","","","","Yes","normal","free","normal","Yes","RRULE;FREQ=YEARLY;INTERVAL=12;BYMONTHDAY=4",""
"Trevor & Jean Simmonds's Birthday (04/06/1947)","1947-06-04","All Day","1947-06-04","All Day","","","","Yes","normal","free","normal","Yes","RRULE;FREQ=YEARLY;INTERVAL=12;BYMONTHDAY=4",""
"Steve & Elaine Thourgood's Birthday (21/05/1948)","1948-05-21","All Day","1948-05-21","All Day","","","","Yes","normal","free","normal","Yes","RRULE;FREQ=YEARLY;INTERVAL=12;BYMONTHDAY=21",""
"Jim & Winnie Dennis's Anniversary (30/04/1949)","1949-04-30","All Day","1949-04-30","All Day","","","","Yes","normal","free","normal","Yes","RRULE;FREQ=YEARLY;INTERVAL=12;BYMONTHDAY=30",""
"Colin Dow's Birthday (17/12/1949)","1949-12-17","All Day","1949-12-17","All Day","","","","Yes","normal","free","normal","Yes","RRULE;FREQ=YEARLY;INTERVAL=12;BYMONTHDAY=17",""
"Colin & Theresa Dow's Birthday (17/12/1949)","1949-12-17","All Day","1949-12-17","All Day","","","","Yes","normal","free","normal","Yes","RRULE;FREQ=YEARLY;INTERVAL=12;BYMONTHDAY=17",""
"Richard Carr's Birthday (16/06/1950)","1950-06-16","All Day","1950-06-16","All Day","","","","Yes","normal","free","normal","Yes","RRULE;FREQ=YEARLY;INTERVAL=12;BYMONTHDAY=16",""
"Richard Leathley's Birthday (04/07/1951)","1951-07-04","All Day","1951-07-04","All Day","","","","Yes","normal","free","normal","Yes","RRULE;FREQ=YEARLY;INTERVAL=12;BYMONTHDAY=4",""
"Bithday - Jean Fulton (1951)","1951-10-16","All Day","1951-10-17","All Day","","","","Yes","normal","free","normal","Yes","RRULE;FREQ=YEARLY;INTERVAL=12;BYMONTHDAY=16",""
"Simon & Jeanette Tranmer's Birthday (11/07/1953)","1953-07-11","All Day","1953-07-11","All Day","","","","Yes","normal","free","normal","Yes","RRULE;FREQ=YEARLY;INTERVAL=12;BYMONTHDAY=11",""
"Peter & Miriam Hamilton's Anniversary (12/12/1953)","1953-12-12","All Day","1953-12-12","All Day","","","","Yes","normal","free","normal","Yes","RRULE;FREQ=YEARLY;INTERVAL=12;BYMONTHDAY=12",""
"Birthday - David Horsley (16/10/1954)","1954-10-16","All Day","1954-10-16","All Day","","","","Yes","normal","free","normal","Yes","RRULE;FREQ=YEARLY;INTERVAL=12;BYMONTHDAY=16",""
"Birthday - Judy Hemmings (17/10/1954)","1954-10-17","All Day","1954-10-17","All Day","","","","Yes","normal","free","normal","Yes","RRULE;FREQ=YEARLY;INTERVAL=12;BYMONTHDAY=17",""
"Tom Cranstoun's Birthday (29/06/1955)","1955-06-29","All Day","1955-06-29","All Day","","","","Yes","normal","free","normal","Yes","RRULE;FREQ=YEARLY;INTERVAL=12;BYMONTHDAY=29",""
"Tom Cranstoun's Birthday (29/06/1955)","1955-06-29","All Day","1955-06-29","All Day","","","","Yes","normal","free","normal","Yes","RRULE;FREQ=YEARLY;INTERVAL=12;BYMONTHDAY=29",""
"Birthday - Jacqui  Boulton (25/05/1956)","1956-05-25","All Day","1956-05-25","All Day","","","","Yes","normal","free","normal","Yes","RRULE;FREQ=YEARLY;INTERVAL=12;BYMONTHDAY=25",""
"Jacqui & Steve Boulton's Birthday (25/05/1956)","1956-05-25","All Day","1956-05-25","All Day","","","","Yes","normal","free","normal","Yes","RRULE;FREQ=YEARLY;INTERVAL=12;BYMONTHDAY=25",""
"Steve Holloway's Birthday (21/11/1956)","1956-11-21","All Day","1956-11-21","All Day","","","","Yes","normal","free","normal","Yes","RRULE;FREQ=YEARLY;INTERVAL=12;BYMONTHDAY=21",""
"Anne Walker's Birthday (25/05/1957)","1957-05-25","All Day","1957-05-25","All Day","","","","Yes","normal","free","normal","Yes","RRULE;FREQ=YEARLY;INTERVAL=12;BYMONTHDAY=25",""
"Birthday - Jane Bourke (13/10/1958)","1958-10-13","All Day","1958-10-13","All Day","","","","Yes","normal","free","normal","Yes","RRULE;FREQ=YEARLY;INTERVAL=12;BYMONTHDAY=13",""
"Jen & Geoff Prestage's Anniversary (19/09/1959)","1959-09-19","All Day","1959-09-19","All Day","","","","Yes","normal","free","normal","Yes","RRULE;FREQ=YEARLY;INTERVAL=12;BYMONTHDAY=19",""
"Jen & Geoff Prestage's Anniversary (19/09/1959)","1959-09-19","All Day","1959-09-19","All Day","","","","Yes","normal","free","normal","Yes","RRULE;FREQ=YEARLY;INTERVAL=12;BYMONTHDAY=19",""
"Steve & Gina May's Birthday (12/05/1960)","1960-05-12","All Day","1960-05-12","All Day","","","","Yes","normal","free","normal","Yes","RRULE;FREQ=YEARLY;INTERVAL=12;BYMONTHDAY=12",""
"Richard Hamilton's Birthday (20/07/1961)","1961-07-20","All Day","1961-07-20","All Day","","","","Yes","normal","free","normal","Yes","RRULE;FREQ=YEARLY;INTERVAL=12;BYMONTHDAY=20",""
"work Richard Hamilton's Birthday (20/07/1961)","1961-07-20","All Day","1961-07-20","All Day","","","","Yes","normal","free","normal","Yes","RRULE;FREQ=YEARLY;INTERVAL=12;BYMONTHDAY=20",""
"Richard Hamilton's Birthday (20/07/1961)","1961-07-20","All Day","1961-07-20","All Day","","","","Yes","normal","free","normal","Yes","RRULE;FREQ=YEARLY;INTERVAL=12;BYMONTHDAY=20",""
"Roger & Margaret Spreckley's Anniversary (10/09/1962)","1962-09-10","All Day","1962-09-10","All Day","","","","Yes","normal","free","normal","Yes","RRULE;FREQ=YEARLY;INTERVAL=12;BYMONTHDAY=10",""
"Barbara Rule's Birthday (09/08/1965)","1965-08-09","All Day","1965-08-09","All Day","","","","Yes","normal","free","normal","Yes","RRULE;FREQ=YEARLY;INTERVAL=12;BYMONTHDAY=9",""
"Dave & Barbara Rule's Birthday (09/08/1965)","1965-08-09","All Day","1965-08-09","All Day","","","","Yes","normal","free","normal","Yes","RRULE;FREQ=YEARLY;INTERVAL=12;BYMONTHDAY=9",""
"Birthday - Lucy Collins (28/05/1967)","1967-05-28","All Day","1967-05-28","All Day","","","","Yes","normal","free","normal","Yes","RRULE;FREQ=YEARLY;INTERVAL=12;BYMONTHDAY=28",""
"Lucy & Richard Collins's Birthday (28/05/1967)","1967-05-28","All Day","1967-05-28","All Day","","","","Yes","normal","free","normal","Yes","RRULE;FREQ=YEARLY;INTERVAL=12;BYMONTHDAY=28",""
"Birthday - Helen Dean / Harley (02/05/1970)","1970-05-02","All Day","1970-05-02","All Day","","","","Yes","normal","free","normal","Yes","RRULE;FREQ=YEARLY;INTERVAL=12;BYMONTHDAY=2",""
"Stephen Dow's Birthday (27/04/1977)","1977-04-27","All Day","1977-04-27","All Day","","","","Yes","normal","free","normal","Yes","RRULE;FREQ=YEARLY;INTERVAL=12;BYMONTHDAY=27",""
"Stephen Dow's Birthday (27/04/1977)","1977-04-27","All Day","1977-04-27","All Day","","","","Yes","normal","free","normal","Yes","RRULE;FREQ=YEARLY;INTERVAL=12;BYMONTHDAY=27",""
"Wedding Anniversary - Paul & Carol (11/05/1978)","1978-05-11","All Day","1978-05-11","All Day","","false
false
false

EN-GB
X-NONE
AR-SA
















































































































































































































































































































































































































/* Style Definitions */
table.MsoNormalTable
	{mso-style-name:""Table Normal"";
	mso-tstyle-rowband-size:0;
	mso-tstyle-colband-size:0;
	mso-style-noshow:yes;
	mso-style-priority:99;
	mso-style-parent:"""";
	mso-padding-alt:0in 5.4pt 0in 5.4pt;
	mso-para-margin:0in;
	mso-para-margin-bottom:.0001pt;
	mso-pagination:widow-orphan;
	font-size:11.0pt;
	font-family:""Calibri"",sans-serif;
	mso-ascii-font-family:Calibri;
	mso-hansi-font-family:Calibri;
	mso-bidi-font-family:Arial;
	mso-fareast-language:EN-US;}","","Yes","normal","free","normal","Yes","RRULE;FREQ=YEARLY;INTERVAL=12;BYMONTHDAY=11",""
"Kevin & Sue Humphrey's Anniversary (05/05/1979)","1979-05-05","All Day","1979-05-05","All Day","","","","Yes","normal","free","normal","Yes","RRULE;FREQ=YEARLY;INTERVAL=12;BYMONTHDAY=5",""
"Alex & Sandra MacPhail's Birthday (27/09/1979)","1979-09-27","All Day","1979-09-27","All Day","","","","Yes","normal","free","normal","Yes","RRULE;FREQ=YEARLY;INTERVAL=12;BYMONTHDAY=27",""
"Birthday - Richard Stephen (08/03/1980)","1980-03-08","All Day","1980-03-08","All Day","","","","Yes","normal","free","normal","Yes","RRULE;FREQ=YEARLY;INTERVAL=12;BYMONTHDAY=8",""
"Ivor Hartley's Birthday (23/04/1980)","1980-04-23","All Day","1980-04-23","All Day","","","","Yes","normal","free","normal","Yes","RRULE;FREQ=YEARLY;INTERVAL=12;BYMONTHDAY=23",""
"Kevin & Sue Humphrey's Anniversary (05/05/1980)","1980-05-05","All Day","1980-05-05","All Day","","","","Yes","normal","free","normal","Yes","RRULE;FREQ=YEARLY;INTERVAL=12;BYMONTHDAY=5",""
"Steve & Gina May's Birthday (12/05/1980)","1980-05-12","All Day","1980-05-12","All Day","","","","Yes","normal","free","normal","Yes","RRULE;FREQ=YEARLY;INTERVAL=12;BYMONTHDAY=12",""
"Jim & Winnie Dennis's Birthday (16/05/1980)","1980-05-16","All Day","1980-05-16","All Day","","","","Yes","normal","free","normal","Yes","RRULE;FREQ=YEARLY;INTERVAL=12;BYMONTHDAY=16",""
"Steve & Elaine Thourgood's Birthday (21/05/1980)","1980-05-21","All Day","1980-05-21","All Day","","","","Yes","normal","free","normal","Yes","RRULE;FREQ=YEARLY;INTERVAL=12;BYMONTHDAY=21",""
"Jacqui & Steve Boulton's Birthday (25/05/1980)","1980-05-25","All Day","1980-05-25","All Day","","","","Yes","normal","free","normal","Yes","RRULE;FREQ=YEARLY;INTERVAL=12;BYMONTHDAY=25",""
"Lucy & Richard Collins's Birthday (28/05/1980)","1980-05-28","All Day","1980-05-28","All Day","","","","Yes","normal","free","normal","Yes","RRULE;FREQ=YEARLY;INTERVAL=12;BYMONTHDAY=28",""
"Trevor & Jean Simmonds's Birthday (04/06/1980)","1980-06-04","All Day","1980-06-04","All Day","","","","Yes","normal","free","normal","Yes","RRULE;FREQ=YEARLY;INTERVAL=12;BYMONTHDAY=4",""
"Steve& Marie Clifford's Birthday (10/06/1980)","1980-06-10","All Day","1980-06-10","All Day","","","","Yes","normal","free","normal","Yes","RRULE;FREQ=YEARLY;INTERVAL=12;BYMONTHDAY=10",""
"Steph & Ray Borwell's Birthday (13/06/1980)","1980-06-13","All Day","1980-06-13","All Day","","","","Yes","normal","free","normal","Yes","RRULE;FREQ=YEARLY;INTERVAL=12;BYMONTHDAY=13",""
"Richard Carr's Birthday (16/06/1980)","1980-06-16","All Day","1980-06-16","All Day","","","","Yes","normal","free","normal","Yes","RRULE;FREQ=YEARLY;INTERVAL=12;BYMONTHDAY=16",""
"Tom Cranstoun's Birthday (29/06/1980)","1980-06-29","All Day","1980-06-29","All Day","","","","Yes","normal","free","normal","Yes","RRULE;FREQ=YEARLY;INTERVAL=12;BYMONTHDAY=29",""
"Richard Leathley's Birthday (04/07/1980)","1980-07-04","All Day","1980-07-04","All Day","","","","Yes","normal","free","normal","Yes","RRULE;FREQ=YEARLY;INTERVAL=12;BYMONTHDAY=4",""
"Simon & Jeanette Tranmer's Birthday (11/07/1980)","1980-07-11","All Day","1980-07-11","All Day","","","","Yes","normal","free","normal","Yes","RRULE;FREQ=YEARLY;INTERVAL=12;BYMONTHDAY=11",""
"Jacqui & Steve Boulton's Anniversary (19/07/1980)","1980-07-19","All Day","1980-07-19","All Day","","","","Yes","normal","free","normal","Yes","RRULE;FREQ=YEARLY;INTERVAL=12;BYMONTHDAY=19",""
"Jacqui & Steve Boulton's Anniversary (19/07/1980)","1980-07-19","All Day","1980-07-19","All Day","","","","Yes","normal","free","normal","Yes","RRULE;FREQ=YEARLY;INTERVAL=12;BYMONTHDAY=19",""
"David & Lynne Steel's Birthday (22/08/1980)","1980-08-22","All Day","1980-08-22","All Day","","","","Yes","normal","free","normal","Yes","RRULE;FREQ=YEARLY;INTERVAL=12;BYMONTHDAY=22",""
"Roger & Margaret Spreckley's Anniversary (10/09/1980)","1980-09-10","All Day","1980-09-10","All Day","","","","Yes","normal","free","normal","Yes","RRULE;FREQ=YEARLY;INTERVAL=12;BYMONTHDAY=10",""
"Jen & Geoff Prestage's Anniversary (19/09/1980)","1980-09-19","All Day","1980-09-19","All Day","","","","Yes","normal","free","normal","Yes","RRULE;FREQ=YEARLY;INTERVAL=12;BYMONTHDAY=19",""
"Alex & Sandra MacPhail's Birthday (27/09/1980)","1980-09-27","All Day","1980-09-27","All Day","","","","Yes","normal","free","normal","Yes","RRULE;FREQ=YEARLY;INTERVAL=12;BYMONTHDAY=27",""
"Andrew McGregor's Birthday (29/09/1980)","1980-09-29","All Day","1980-09-29","All Day","","","","Yes","normal","free","normal","Yes","RRULE;FREQ=YEARLY;INTERVAL=12;BYMONTHDAY=29",""
"David Annal's Birthday (04/10/1980)","1980-10-04","All Day","1980-10-04","All Day","","","","Yes","normal","free","normal","Yes","RRULE;FREQ=YEARLY;INTERVAL=12;BYMONTHDAY=4",""
"Birthday - Phil Barber (16/10/1980)","1980-10-16","All Day","1980-10-16","All Day","","","","Yes","normal","free","normal","Yes","RRULE;FREQ=YEARLY;INTERVAL=12;BYMONTHDAY=16",""
"Steve Holloway's Birthday (21/11/1980)","1980-11-21","All Day","1980-11-21","All Day","","","","Yes","normal","free","normal","Yes","RRULE;FREQ=YEARLY;INTERVAL=12;BYMONTHDAY=21",""
"Peter & Miriam Hamilton's Anniversary (12/12/1980)","1980-12-12","All Day","1980-12-12","All Day","","","","Yes","normal","free","normal","Yes","RRULE;FREQ=YEARLY;INTERVAL=12;BYMONTHDAY=12",""
"Colin & Theresa Dow's Birthday (17/12/1980)","1980-12-17","All Day","1980-12-17","All Day","","","","Yes","normal","free","normal","Yes","RRULE;FREQ=YEARLY;INTERVAL=12;BYMONTHDAY=17",""
"Suzanne Dow's Birthday (08/05/1981)","1981-05-08","All Day","1981-05-08","All Day","","","","Yes","normal","free","normal","Yes","RRULE;FREQ=YEARLY;INTERVAL=12;BYMONTHDAY=8",""
"Claire Louise Le Fevre's Birthday (28/07/1982)","1982-07-28","All Day","1982-07-28","All Day","","","","Yes","normal","free","normal","Yes","RRULE;FREQ=YEARLY;INTERVAL=12;BYMONTHDAY=28",""
"Claire Le Fevre's Birthday (28/07/1982)","1982-07-28","All Day","1982-07-28","All Day","","","","Yes","normal","free","normal","Yes","RRULE;FREQ=YEARLY;INTERVAL=12;BYMONTHDAY=28",""
"Birthday - Lauren Jacovides's (10/08/1982)","1982-08-10","All Day","1982-08-10","All Day","","","","Yes","normal","free","normal","Yes","RRULE;FREQ=YEARLY;INTERVAL=12;BYMONTHDAY=10",""
"Birthday - Jo Dean (25/10/1982)","1982-10-25","All Day","1982-10-25","All Day","","","","Yes","normal","free","normal","Yes","RRULE;FREQ=YEARLY;INTERVAL=12;BYMONTHDAY=25",""
"Jill & Richard Brown's Anniversary (03/07/1987)","1987-07-03","All Day","1987-07-03","All Day","","","","Yes","normal","free","normal","Yes","RRULE;FREQ=YEARLY;INTERVAL=12;BYMONTHDAY=3",""
"Lauren Fulton's Birthday (30/08/1987)","1987-08-30","All Day","1987-08-30","All Day","","","","Yes","normal","free","normal","Yes","RRULE;FREQ=YEARLY;INTERVAL=12;BYMONTHDAY=30",""
"Claire Humphrey's Birthday (09/05/1988)","1988-05-09","All Day","1988-05-09","All Day","","","","Yes","normal","free","normal","Yes","RRULE;FREQ=YEARLY;INTERVAL=12;BYMONTHDAY=9",""
"!Claire Humphrey's Birthday (09/05/1988)","1988-05-09","All Day","1988-05-09","All Day","","","","Yes","normal","free","normal","Yes","RRULE;FREQ=YEARLY;INTERVAL=12;BYMONTHDAY=9",""
"Margaret & Sam McKinlay's Anniversary (19/12/1988)","1988-12-19","All Day","1988-12-19","All Day","","","","Yes","normal","free","normal","Yes","RRULE;FREQ=YEARLY;INTERVAL=12;BYMONTHDAY=19",""
"Debbie Haynes's Anniversary (30/06/1990)","1990-06-30","All Day","1990-06-30","All Day","","","","Yes","normal","free","normal","Yes","RRULE;FREQ=YEARLY;INTERVAL=12;BYMONTHDAY=30",""
"Ian Haynes's Anniversary (30/06/1990)","1990-06-30","All Day","1990-06-30","All Day","","","","Yes","normal","free","normal","Yes","RRULE;FREQ=YEARLY;INTERVAL=12;BYMONTHDAY=30",""
"Birthday  - Amy Fulton (20/10/1990)","1990-10-20","All Day","1990-10-20","All Day","","","","Yes","normal","free","normal","Yes","RRULE;FREQ=YEARLY;INTERVAL=12;BYMONTHDAY=20",""
"Penny & Chris Prestage-Roles's Anniversary (20/06/1992)","1992-06-20","All Day","1992-06-20","All Day","","","","Yes","normal","free","normal","Yes","RRULE;FREQ=YEARLY;INTERVAL=12;BYMONTHDAY=20",""
"Lucy & Richard Collins's Anniversary (04/09/1992)","1992-09-04","All Day","1992-09-04","All Day","","","","Yes","normal","free","normal","Yes","RRULE;FREQ=YEARLY;INTERVAL=12;BYMONTHDAY=4",""
"Anne & Steve's Anniversary (24/06/1994)","1994-06-24","All Day","1994-06-24","All Day","","","","Yes","normal","free","normal","Yes","RRULE;FREQ=YEARLY;INTERVAL=12;BYMONTHDAY=24",""
"Anne & Steve's Anniversary (24/06/1994)","1994-06-24","All Day","1994-06-24","All Day","","","","Yes","normal","free","normal","Yes","RRULE;FREQ=YEARLY;INTERVAL=12;BYMONTHDAY=24",""
"Heather & Christopher Bates's Birthday (03/08/1994)","1994-08-03","All Day","1994-08-03","All Day","","","","Yes","normal","free","normal","Yes","RRULE;FREQ=YEARLY;INTERVAL=12;BYMONTHDAY=3",""
"Daniel & Sue Prestage's Anniversary (03/10/1994)","1994-10-03","All Day","1994-10-03","All Day","","","","Yes","normal","free","normal","Yes","RRULE;FREQ=YEARLY;INTERVAL=12;BYMONTHDAY=3",""
"Penny Prestage-Roles's Birthday (02/06/1997)","1997-06-02","All Day","1997-06-02","All Day","","","","Yes","normal","free","normal","Yes","RRULE;FREQ=YEARLY;INTERVAL=12;BYMONTHDAY=2",""
"Penny & Chris Prestage-Roles's Birthday (02/06/1997)","1997-06-02","All Day","1997-06-02","All Day","","","","Yes","normal","free","normal","Yes","RRULE;FREQ=YEARLY;INTERVAL=12;BYMONTHDAY=2",""
"Phil & Barbara Brown's Anniversary (22/08/1998)","1998-08-22","All Day","1998-08-22","All Day","","","","Yes","normal","free","normal","Yes","RRULE;FREQ=YEARLY;INTERVAL=12;BYMONTHDAY=22",""
"The Board Meeting","2000-01-12","14:00:00","2000-01-12","18:00:00","127 COR","The Time quoted is for guidance - each meeting will be confirmed at the end of each previous meeting.
","","No","normal","tentative","normal","No","",""
"Course at THC","2000-02-29","09:00:00","2000-02-29","17:00:00","","","","No","normal","busy","normal","No","",""
"Assist/ Keith re AMP data transfer","2000-03-01","10:00:00","2000-03-01","12:00:00","","","","No","normal","busy","normal","No","",""
"Asbestos Steering Group, 208 - BS&S","2000-03-01","14:30:00","2000-03-01","16:30:00","","","","No","normal","busy","normal","No","",""
"Train to Fareham","2000-03-03","08:30:00","2000-03-03","10:05:00","","","","No","normal","busy","normal","No","",""
"Bob's Funeral - Porchester Crem","2000-03-03","11:45:00","2000-03-03","12:15:00","","","","No","normal","busy","normal","No","",""
"DON - Ealdham Annual Review (Pilot)","2000-03-03","14:30:00","2000-03-03","16:30:00","","","","No","normal","busy","normal","No","",""
"Train to Waterloo","2000-03-03","15:00:00","2000-03-03","17:00:00","","","","No","normal","busy","normal","No","",""
"Train to York with Barbara & Phil","2000-03-03","18:30:00","2000-03-03","20:30:00","","","","No","normal","busy","normal","No","",""
"Lucy Nelson at Merchant Way","2000-03-04","09:30:00","2000-03-04","11:00:00","","","","No","normal","busy","normal","No","",""
"Malton Swim","2000-03-05","17:00:00","2000-03-05","18:00:00","","","","No","normal","busy","normal","No","",""
"Aamir & Richard re Asbestos Timetable","2000-03-06","10:30:00","2000-03-06","11:30:00","","","","No","normal","busy","normal","No","",""
"Governors Property Consultative","2000-03-06","13:30:00","2000-03-06","15:00:00","","","","No","normal","busy","normal","No","",""
"Home Building & Renovation Ex  - NEC","2000-03-09","10:00:00","2000-03-09","18:00:00","","","","No","normal","busy","normal","No","",""
"GPMT","2000-03-09","15:00:00","2000-03-09","18:00:00","","","","No","normal","busy","normal","No","",""
"HB & R Exhib - NEC","2000-03-10","10:00:00","2000-03-10","18:00:00","","","","No","normal","busy","normal","No","",""
"HB&R Exhib - NEC","2000-03-11","10:00:00","2000-03-11","18:00:00","","","","No","normal","busy","normal","No","",""
"SWAN to Brighton","2000-03-11","18:00:00","2000-03-11","21:00:00","","","","No","normal","busy","normal","No","",""
"York Water World","2000-03-11","18:00:00","2000-03-11","22:00:00","","","","No","normal","busy","normal","No","",""
"Glassex @ NEC","2000-03-12","10:00:00","2000-03-12","17:00:00","","","","No","normal","busy","normal","No","",""
"HB&R Exhib @ NEC","2000-03-12","10:00:00","2000-03-12","18:00:00","","","","No","normal","busy","normal","No","",""
"Tom To Computer Fair @ Bromley with Dr David","2000-03-12","11:00:00","2000-03-12","15:00:00","","","","No","normal","busy","normal","No","",""
"Chase AGM","2000-03-18","14:00:00","2000-03-18","16:00:00","","","","No","normal","busy","normal","No","",""
"Ofsted action Plan Review - Dick's Office.","2000-03-23","10:00:00","2000-03-23","12:00:00","","","","No","normal","busy","normal","No","",""
"Heads Property Consultative - PDC","2000-03-23","13:30:00","2000-03-23","15:00:00","","","","No","normal","busy","normal","No","",""
"Asbestos Steering Group BSS Room 208","2000-03-23","14:00:00","2000-03-23","14:00:00","","","","No","normal","busy","normal","No","",""
"Colin & Jenny in York","2000-03-24","00:00:00","2000-03-26","22:00:00","","","","No","normal","free","normal","No","",""
"Colin & Jenny in York","2000-03-24","All Day","2000-03-27","All Day","","","","Yes","normal","free","normal","No","",""
"Meet YORK","2000-03-24","08:00:00","2000-03-24","17:00:00","","","","No","normal","busy","normal","No","",""
"1-1 with Dean","2000-03-28","09:30:00","2000-03-28","11:00:00","","","","No","normal","busy","normal","No","",""
"AFH SS Liaison","2000-03-28","13:00:00","2000-03-28","15:00:00","","","","No","normal","busy","normal","No","",""
"1-1 with Laurence","2000-03-30","09:00:00","2000-03-30","10:30:00","","","","No","normal","busy","normal","No","",""
"HOLIDAY - Bahamas Bliss","2000-04-05","09:00:00","2000-04-14","07:00:00","","","","No","normal","busy","normal","No","",""
"GPMT","2000-04-06","08:30:00","2000-04-06","11:30:00","","","","No","normal","busy","normal","No","",""
"OUBS Creativity Weekend, Newport Pagnall","2000-04-07","18:00:00","2000-04-09","11:30:00","","","","No","normal","busy","normal","No","",""
"Doncater Dome Tel:01723 503456","2000-04-08","17:00:00","2000-04-08","21:00:00","","","","No","normal","busy","normal","No","",""
"Silverleigh","2000-04-08","18:00:00","2000-04-08","21:00:00","","","","No","normal","busy","normal","No","",""
"Collect Poke","2000-04-14","09:00:00","2000-04-14","09:00:00","","","","No","normal","busy","normal","No","",""
"Visit Andrew re costs","2000-04-14","09:00:00","2000-04-14","09:00:00","","","","No","normal","busy","normal","No","",""
"Updated: Planning Meeting","2000-04-18","10:00:00","2000-04-18","11:00:00","127 COR","This meeting has been put back due to a change in the Board Meeting time.

Hope this is satisfactory.
Many thanks
","","No","normal","busy","normal","No","",""
"Directors H&S visit","2000-04-18","13:00:00","2000-04-18","16:00:00","","","","No","normal","busy","normal","No","",""
"GPMT","2000-04-18","13:30:00","2000-04-18","14:30:00","","","","No","normal","busy","normal","No","",""
"Updated: Board Meeting","2000-04-18","17:30:00","2000-04-18","21:30:00","","This confirms that the Board meeting is now at a later time.  Hope this is satisfactory.  The Location might change due to it being an evening meeting.  Will confirm on 17th April.
Many thanks
","","No","normal","tentative","normal","No","",""
"Steve Interview","2000-04-20","09:00:00","2000-04-20","10:00:00","","
------------
From:	Jeannette Bourton
Sent:	18 April 2000 17:04
To:	Tom Cranstoun
Subject:	Thursdays Interviews

Tom,

Steve is coming at 10 am on Thursday.

Colin is coming at 12 noon on Thursday.

Jeannette Bourton
Technical Executive
Top Hat Computing Ltd
Tel: 020 8680 4860
E-Mail: jeannette@tophat.co.uk



","","No","normal","busy","normal","No","",""
"1-1 with Dean","2000-04-20","09:30:00","2000-04-20","11:00:00","","","","No","normal","busy","normal","No","",""
"Colin Interview","2000-04-20","11:00:00","2000-04-20","12:00:00","","","","No","normal","busy","normal","No","",""
"Bank Holiday","2000-04-21","08:00:00","2000-04-21","17:00:00","","","","No","normal","busy","normal","No","",""
"Easter Sunday","2000-04-23","07:00:00","2000-04-23","07:00:00","","","","No","normal","busy","normal","No","",""
"Easter Monday","2000-04-24","07:00:00","2000-04-24","22:30:00","","","","No","normal","busy","normal","No","",""
"Bank Holiday","2000-04-24","08:00:00","2000-04-24","17:00:00","","","","No","normal","busy","normal","No","",""
"4MC Media Server Demonstration","2000-04-25","08:00:00","2000-04-25","16:00:00","127 COR","","","No","normal","busy","normal","No","",""
"1-1 with Dean","2000-04-25","09:30:00","2000-04-25","11:00:00","","","","No","normal","busy","normal","No","",""
"1-1 with Laurence","2000-04-27","09:00:00","2000-04-27","10:30:00","","","","No","normal","busy","normal","No","",""
"Meeting with Mike Fitzsimons - thenetchart.com","2000-04-28","09:30:00","2000-04-28","12:00:00","127 COR","","","No","normal","busy","normal","No","",""
"May Day Bank Holiday","2000-05-01","07:00:00","2000-05-01","22:30:00","","","","No","normal","busy","normal","No","",""
"York all Day","2000-05-02","08:00:00","2000-05-02","16:00:00","","","","No","normal","busy","normal","No","",""
"Lee McGinty - Unique","2000-05-03","13:30:00","2000-05-03","15:00:00","77 Long Lane","77 Long Lane
","","No","normal","busy","normal","No","",""
"At BBC with Jon Westgate","2000-05-09","08:00:00","2000-05-09","13:00:00","","","","No","normal","busy","normal","No","",""
"Martin for his appraisal","2000-05-09","13:00:00","2000-05-09","16:00:00","White City - BBC","Martin

Change of venue - still same time, but at White City.  Many thanks

","","No","normal","busy","normal","No","",""
"Meeting with Steve","2000-05-10","10:00:00","2000-05-10","12:00:00","IOD","Sorry Steve - time has changed.
","","No","normal","busy","normal","No","",""
"Kitchens Meeting","2000-05-12","09:30:00","2000-05-12","12:00:00","","","","No","normal","busy","normal","No","",""
"Silverleigh","2000-05-13","18:00:00","2000-05-13","21:00:00","","","","No","normal","busy","normal","No","",""
"Discussions about businessesforsale.com","2000-05-15","08:00:00","2000-05-15","09:30:00","Cherries?","","","No","normal","busy","normal","No","",""
"Updated: Meeting regarding Timesheets","2000-05-16","09:30:00","2000-05-16","10:30:00","127 COR","Change of plan - Tuesday instead...
","","No","normal","busy","normal","No","",""
"Meeting with Colin Shepherd","2000-05-16","11:00:00","2000-05-16","12:30:00","Victoria (Garfunkels)","","","No","normal","busy","normal","No","",""
"Board Meeting","2000-05-16","13:00:00","2000-05-16","16:00:00","127 COR","


Top Hat Computing Ltd, 130 Cherry Orchard Road, Croydon, CR0 6BB
Tel: 020 8680 4860   Fax: 020 8680 8204   Web: www.tophat.co.uk
 
This e-mail, and any attachment, is confidential. If you have received it in error, please delete it from your system, do not use or disclose the information in any way, and notify me immediately. The contents of this message may contain personal views that are not the views of Top Hat Computing, unless specifically stated.

","","No","normal","busy","normal","No","",""
"Meal - La Dolce Vita","2000-05-16","18:00:00","2000-05-16","23:00:00","","","","No","normal","busy","normal","No","",""
"Tom to Osteopath","2000-05-18","16:00:00","2000-05-18","16:30:00","","","","No","normal","busy","normal","No","",""
"Tom to Hairdressers","2000-05-20","08:00:00","2000-05-20","08:30:00","","","","No","normal","busy","normal","No","",""
"Massage Class","2000-05-20","08:30:00","2000-05-20","12:00:00","","","","No","normal","busy","normal","No","",""
"Interbuild - NEC","2000-05-21","09:00:00","2000-05-21","17:00:00","","","","No","normal","busy","normal","No","",""
"4MC at Office","2000-05-25","08:00:00","2000-05-25","16:00:00","","","","No","normal","busy","normal","No","",""
"Holiday (Leave)","2000-05-26","07:00:00","2000-05-26","16:00:00","","","","No","normal","busy","normal","No","",""
"Dentist","2000-05-30","07:00:00","2000-05-30","08:00:00","","","","No","normal","busy","normal","No","",""
"Manchester for SPOL with Ralph","2000-05-30","12:00:00","2000-05-30","18:00:00","","","","No","normal","busy","normal","No","",""
"Manchester visit ii","2000-05-31","07:00:00","2000-05-31","15:30:00","","","","No","normal","busy","normal","No","",""
"Planning meeting","2000-06-01","07:30:00","2000-06-01","08:30:00","","","","No","normal","busy","normal","No","",""
"THC Admin","2000-06-01","08:30:00","2000-06-01","15:30:00","","","","No","normal","busy","normal","No","",""
"ENPS ","2000-06-02","08:00:00","2000-06-02","16:30:00","","","","No","normal","busy","normal","No","",""
"- space oddity york","2000-06-03","16:30:00","2000-06-03","21:30:00","","","","No","normal","busy","normal","No","",""
"York Office - THC Admin/spol","2000-06-05","08:00:00","2000-06-05","17:00:00","","","","No","normal","busy","normal","No","",""
"tack house","2000-06-07","08:00:00","2000-06-07","13:00:00","","","","No","normal","busy","normal","No","",""
"Businesses for Sale.com - Meeting over Lunch","2000-06-08","10:00:00","2000-06-08","14:30:00","","","","No","normal","busy","normal","No","",""
"ENPS","2000-06-09","08:00:00","2000-06-09","16:00:00","","","","No","normal","busy","normal","No","",""
"[london]","2000-06-10","07:00:00","2000-06-10","08:00:00","","","","No","normal","busy","normal","No","",""
"[london]","2000-06-11","11:00:00","2000-06-11","12:00:00","","","","No","normal","busy","normal","No","",""
"In office","2000-06-12","08:00:00","2000-06-12","16:30:00","","","","No","normal","busy","normal","No","",""
"Planning Meeting ","2000-06-13","07:00:00","2000-06-13","09:00:00","","","","No","normal","busy","normal","No","",""
"BBC ENPS","2000-06-13","09:00:00","2000-06-13","17:00:00","","","","No","normal","busy","normal","No","",""
"Pictures Film Club","2000-06-13","17:25:00","2000-06-13","21:25:00","","","","No","normal","busy","normal","No","",""
"BBC ENPS","2000-06-14","08:30:00","2000-06-14","16:00:00","","","","No","normal","busy","normal","No","",""
"THC Admin - (Feeling poorly)","2000-06-15","08:30:00","2000-06-15","11:00:00","","","","No","normal","busy","normal","No","",""
"Brinkman","2000-06-16","07:00:00","2000-06-16","16:30:00","","","","No","normal","busy","normal","No","",""
"[york]","2000-06-17","07:00:00","2000-06-17","08:00:00","","","","No","normal","busy","normal","No","",""
"-Millenium bug beetle drive","2000-06-17","18:30:00","2000-06-17","23:00:00","","","","No","normal","busy","normal","No","",""
"[york]","2000-06-18","07:00:00","2000-06-18","08:00:00","","","","No","normal","busy","normal","No","",""
"Work in York","2000-06-19","07:00:00","2000-06-19","22:30:00","","","","No","normal","busy","normal","No","",""
"Return to London","2000-06-20","05:30:00","2000-06-20","09:00:00","","","","No","normal","busy","normal","No","",""
"Tom and Phil at IOD","2000-06-20","13:00:00","2000-06-20","17:00:00","McAdam Room  - Booking Ref: CO66029","
£85.00 to be invoiced.





","","No","normal","busy","normal","No","",""
"Bank Manager coming in","2000-06-21","08:00:00","2000-06-21","09:00:00","127 COR","Jon Skeet and Mr Warren Mulvihill, but he doesn't officially start until Mon 26/06.




","","No","normal","busy","normal","No","",""
"ICPUGSE 20th birthday","2000-06-22","18:30:00","2000-06-22","21:00:00","","
------------
From:	jbickerstaff@cix.compulink.co.uk
Sent:	19 March 2000 01:35
To:	tom.cranstoun@tophatcomputing.co.uk
Cc:	jbickerstaff@cix.compulink.co.uk; johnbickerstaff@cableinet.co.uk
Subject:	ICPUGSE 20th birthday

Hi Tom,

Hope you are both well.

We are hoping to have a party to celebrate the 20th
birthday of ICPUGSE on the 22nd June. If you are 
around we hope you will both come.

Do you still have an address for Kevin Viney? If so
please email it to us as we would like to ask him to 
come to the party too.

Best wishes

Janet and John


JohnB








","","No","normal","busy","normal","No","",""
"Eleanor home","2000-06-22","21:00:00","2000-06-22","22:00:00","","","","No","normal","busy","normal","No","",""
"Da - surfprint","2000-06-23","09:00:00","2000-06-23","10:00:00","","","","No","normal","busy","normal","No","",""
"Alton towers","2000-06-23","17:00:00","2000-06-23","22:00:00","","","","No","normal","busy","normal","No","",""
"Alton towers","2000-06-24","06:30:00","2000-06-24","23:00:00","","","","No","normal","busy","normal","No","",""
"Alton towers","2000-06-25","07:00:00","2000-06-25","13:00:00","","","","No","normal","busy","normal","No","",""
"Jane Duckworth - North Dulwich - Marketing Meeting","2000-06-26","09:30:00","2000-06-26","10:30:00","Dulwich","","","No","normal","busy","normal","No","",""
"Planning Meeting","2000-06-27","07:30:00","2000-06-27","09:30:00","127","","","No","normal","busy","normal","No","",""
"BBC - White City","2000-06-27","11:00:00","2000-06-27","16:30:00","","","","No","normal","busy","normal","No","",""
"Ralphs appraisal","2000-06-29","13:00:00","2000-06-29","15:00:00","IOD London","","","No","normal","busy","normal","No","",""
"Phil's appraisal","2000-06-29","15:00:00","2000-06-29","17:00:00","IOD London","Carnegie Room - Booking reference - c066385

","","No","normal","busy","normal","No","",""
"Eleanor home","2000-06-29","20:30:00","2000-06-29","22:30:00","","","","No","normal","busy","normal","No","",""
"Eleanor home","2000-06-30","08:00:00","2000-06-30","19:00:00","","","","No","normal","busy","normal","No","",""
"[london]","2000-07-01","11:00:00","2000-07-01","12:00:00","","","","No","normal","busy","normal","No","",""
"-silverleigh rescheduled?","2000-07-01","17:00:00","2000-07-01","21:00:00","","","","No","normal","busy","normal","No","",""
"[london]","2000-07-02","11:00:00","2000-07-02","12:00:00","","","","No","normal","busy","normal","No","",""
"Tack Programming","2000-07-03","08:00:00","2000-07-03","12:00:00","Home","","","No","normal","busy","normal","No","",""
"-Eleanor home massage practical exam","2000-07-03","11:00:00","2000-07-03","12:00:00","","","","No","normal","busy","normal","No","",""
"BBC SPOL Meeting","2000-07-03","13:00:00","2000-07-03","15:00:00","room 602 Henry Wood House","","","No","normal","busy","normal","No","",""
"Meeting re SPOL","2000-07-04","08:30:00","2000-07-04","10:00:00","127 cOR","Martin
Please can you let me know asap whether you can make it

Thanks

","","No","normal","busy","normal","No","",""
"Travel to Northampton to meet Steve","2000-07-05","14:00:00","2000-07-05","16:00:00","","","","No","normal","busy","normal","No","",""
"Dinner with Steve","2000-07-05","16:00:00","2000-07-05","20:30:00","","","","No","normal","busy","normal","No","",""
"BBC ENPS WC","2000-07-06","08:00:00","2000-07-06","16:00:00","","","","No","normal","busy","normal","No","",""
"BBC ENPS WC","2000-07-07","08:00:00","2000-07-07","16:00:00","","","","No","normal","busy","normal","No","",""
"Jane Duckworth - Website Opportunity","2000-07-07","10:30:00","2000-07-07","11:30:00","","","","No","normal","busy","normal","No","",""
"[york] travel out","2000-07-07","20:00:00","2000-07-07","20:30:00","","","","No","normal","busy","normal","No","",""
"[york]","2000-07-08","06:00:00","2000-07-08","07:00:00","","","","No","normal","busy","normal","No","",""
"-white rose boules","2000-07-08","11:00:00","2000-07-08","12:00:00","","","","No","normal","busy","normal","No","",""
"-copmanthorpe carnival ","2000-07-08","11:00:00","2000-07-08","12:00:00","","","","No","normal","busy","normal","No","",""
"-York water world","2000-07-08","18:00:00","2000-07-08","22:30:00","","","","No","normal","busy","normal","No","",""
"[york]","2000-07-09","11:00:00","2000-07-09","12:00:00","","","","No","normal","busy","normal","No","",""
"[York] art","2000-07-10","08:00:00","2000-07-10","16:30:00","","
01904 540301 07885297669

Barrie stephenson

","","No","normal","busy","normal","No","",""
"Return to London","2000-07-11","07:00:00","2000-07-11","10:30:00","","","","No","normal","busy","normal","No","",""
"Planning Meeting","2000-07-12","09:00:00","2000-07-12","10:00:00","127 COR","
Hope everyone can make this one.  Taking advanced orders for tea and coffee.

Many thanks

Helen

","","No","normal","busy","normal","No","",""
"Management Understanding Dinner","2000-07-12","16:00:00","2000-07-12","22:00:00","Brighton","","","No","normal","busy","normal","No","",""
"Osteopath","2000-07-13","08:30:00","2000-07-13","09:00:00","","","","No","normal","busy","normal","No","",""
"Heather Kirby - Croydon Library","2000-07-13","13:00:00","2000-07-13","14:00:00","","","","No","normal","busy","normal","No","",""
"Netchart","2000-07-13","15:00:00","2000-07-13","17:00:00","","Possible NetChart




","","No","normal","busy","normal","No","",""
"Icpug bring and buy","2000-07-13","19:00:00","2000-07-13","22:00:00","","","","No","normal","busy","normal","No","",""
"David  Cowle","2000-07-14","09:00:00","2000-07-14","10:00:00","","","","No","normal","busy","normal","No","",""
"Alan Merricks","2000-07-14","10:00:00","2000-07-14","11:00:00","","can you cope
","","No","normal","busy","normal","No","",""
"Travel to York","2000-07-15","07:00:00","2000-07-15","10:00:00","","","","No","normal","busy","normal","No","",""
"[york]","2000-07-15","11:00:00","2000-07-15","12:00:00","","","","No","normal","busy","normal","No","",""
"Copmanthorpe  horticultural show ","2000-07-15","13:00:00","2000-07-15","14:00:00","","","","No","normal","busy","normal","No","",""
"-2000 bc party","2000-07-15","18:30:00","2000-07-15","23:00:00","","","","No","normal","busy","normal","No","",""
"[york]","2000-07-16","05:00:00","2000-07-16","06:00:00","","","","No","normal","busy","normal","No","",""
"-wr breakfast + visit","2000-07-16","07:00:00","2000-07-16","17:00:00","","","","No","normal","busy","normal","No","",""
"Travel to London","2000-07-17","07:00:00","2000-07-17","11:00:00","","","","No","normal","busy","normal","No","",""
"Art Update ","2000-07-17","14:30:00","2000-07-17","15:30:00","Rm 390 Design Block","Rm 390 Design Block


","","No","normal","busy","normal","No","",""
"WS - PSIMs meeting with Braham","2000-07-18","09:30:00","2000-07-18","10:00:00","Bush House","","","No","normal","busy","normal","No","",""
"Dentist","2000-07-18","13:00:00","2000-07-18","13:30:00","","","","No","normal","busy","normal","No","",""
"SPOL","2000-07-19","08:00:00","2000-07-19","12:00:00","","","","No","normal","busy","normal","No","",""
"Off to York","2000-07-19","12:00:00","2000-07-19","16:30:00","","","","No","normal","busy","normal","No","",""
"York Radio - SPOL","2000-07-20","08:00:00","2000-07-20","16:30:00","","","","No","normal","busy","normal","No","",""
"Eleanor croydon","2000-07-20","20:30:00","2000-07-20","21:30:00","","","","No","normal","busy","normal","No","",""
"BBC -ENPS in croydon","2000-07-21","08:00:00","2000-07-21","11:00:00","","","","No","normal","busy","normal","No","",""
"[london]","2000-07-21","11:00:00","2000-07-21","12:00:00","","","","No","normal","busy","normal","No","",""
"Eleanor Massage exam ","2000-07-21","11:00:00","2000-07-21","12:00:00","","","","No","normal","busy","normal","No","",""
"Tiffany - Lunch","2000-07-21","12:00:00","2000-07-21","13:30:00","","","","No","normal","busy","normal","No","",""
"Board Meeting","2000-07-21","14:00:00","2000-07-21","16:00:00","127 COR","Dear all

Hope that this date is suitable.  We should be finished in time for the Monopoly night.
Any subjects for the agenda?

Thanks
","","No","normal","busy","normal","No","",""
"[london]","2000-07-22","05:30:00","2000-07-22","06:30:00","","","","No","normal","busy","normal","No","",""
"[london]","2000-07-22","07:00:00","2000-07-22","08:00:00","","","","No","normal","busy","normal","No","",""
"Barb and phil","2000-07-22","14:00:00","2000-07-22","22:30:00","","","","No","normal","busy","normal","No","",""
"[london]","2000-07-22","23:00:00","2000-07-23","08:30:00","","","","No","normal","busy","normal","No","",""
"[london]","2000-07-23","11:00:00","2000-07-23","12:00:00","","","","No","normal","busy","normal","No","",""
"Sylvia and Terry for Lunch","2000-07-23","11:30:00","2000-07-23","16:00:00","","","","No","normal","busy","normal","No","",""
"Sylvia and Terry for Lunch","2000-07-23","12:00:00","2000-07-23","16:00:00","","","","No","normal","busy","normal","No","",""
"Out of Office - hopefully at BBC ","2000-07-24","08:00:00","2000-07-24","12:00:00","White City","","","No","normal","busy","normal","No","",""
"Hayley Interview ","2000-07-24","13:30:00","2000-07-24","14:30:00","127 COR","","","No","normal","busy","normal","No","",""
"Meeting with Steve","2000-07-24","14:30:00","2000-07-24","16:00:00","127 COR","","","No","normal","busy","normal","No","",""
"Ring eleanor","2000-07-24","18:00:00","2000-07-24","19:00:00","","","","No","normal","busy","normal","No","",""
"THC ADmin","2000-07-25","08:30:00","2000-07-25","09:30:00","","","","No","normal","busy","normal","No","",""
"David Cowle - Pensions","2000-07-25","09:30:00","2000-07-25","11:00:00","","","","No","normal","busy","normal","No","",""
"Travel to BBC","2000-07-25","11:00:00","2000-07-25","12:00:00","","","","No","normal","busy","normal","No","",""
"Lunch with Has","2000-07-25","12:00:00","2000-07-25","13:30:00","","","","No","normal","busy","normal","No","",""
"Travel back to office","2000-07-25","13:30:00","2000-07-25","14:30:00","","","","No","normal","busy","normal","No","",""
"BBC - ENPS ","2000-07-25","13:30:00","2000-07-25","15:30:00","WC","","","No","normal","busy","normal","No","",""
"THC Admin","2000-07-25","14:30:00","2000-07-25","16:30:00","","","","No","normal","busy","normal","No","",""
"Planning Meeting","2000-07-27","07:30:00","2000-07-27","08:30:00","Garfunkals, Victoria","","","No","normal","busy","normal","No","",""
"RE: ART Pilots andy leigh","2000-07-27","10:30:00","2000-07-27","11:30:00","","
------------
From:	Roy Saatchi-BH [roy.saatchi@bbc.co.uk]
Sent:	26 July 2000 12:56
To:	'Tom Cranstoun'
Subject:	RE: ART Pilots

Presence if poss Tom.  I think there are a number of important issues -
including piloting at an all-analogue station.  Is that OK for you ?
Roy

> -----Original Message-----
> From:	Tom Cranstoun [SMTP:tom.cranstoun@tophat.co.uk]
> Sent:	Wednesday, July 26, 2000 12:59 PM
> To:	'Roy Saatchi-BH '
> Subject:	RE: ART Pilots
> 
>  
> By phone or presence??
> 
> 
> Tom
> -----Original Message-----
> From: Roy Saatchi-BH
> To: 'Tom Cranstoun'; 'Kofi Sekyere '; 'Colin Nesbit '
> Cc: Helen Dean; Howard Nurse
> Sent: 26/07/2000 12:52
> Subject: ART Pilots
> 
> The project progress meeting is now set for 1130 in Pete Clifton's
> office
> tomorrow - Thursday.
> 
> Regards
> 
> Roy
> 
> This e-mail, and any attachment, is confidential. If you have received
> it in error, please delete it from your system, do not use or disclose
> the information in any way, and notify me immediately. The contents of
> this message may contain personal views which are not the views of the
> BBC, unless specifically stated.
> 
> Top Hat Computing Ltd, 130 Cherry Orchard Road, Croydon, CR0 6BB
> Tel: 020 8680 4860   Fax: 020 8680 8204   Web: http://www.tophat.co.uk 
>  
> This e-mail, and any files transmitted with it, are confidential. If you
> are
> not the intended recipient or the person responsible for delivering to the
> intended recipient, then you have received it in error.  Please delete it
> from your system, do not use or disclose the information in any way and
> inform THC by telephone on the above number or by email to
> info@tophat.co.uk
> immediately. Any opinions expressed in this email are those of the
> individual and not necessarily the Company. 

This e-mail, and any attachment, is confidential. If you have received it in error, please delete it from your system, do not use or disclose the information in any way, and notify me immediately. The contents of this message may contain personal views which are not the views of the BBC, unless specifically stated.



","","No","normal","busy","normal","No","",""
"Netchart meeting","2000-07-27","13:00:00","2000-07-27","15:00:00","4MC London","","","No","normal","busy","normal","No","",""
"Helen James - Leaving Do","2000-07-27","16:30:00","2000-07-27","18:00:00","","","","No","normal","busy","normal","No","",""
"Travel to york","2000-07-27","20:00:00","2000-07-27","23:30:00","","","","No","normal","busy","normal","No","",""
"Leave","2000-07-28","08:00:00","2000-07-28","16:30:00","","","","No","normal","busy","normal","No","",""
"Claire's 18th birthday party","2000-07-28","19:00:00","2000-07-28","23:00:00","","","","No","normal","busy","normal","No","",""
"-wr visit","2000-07-29","07:00:00","2000-07-29","07:30:00","","","","No","normal","busy","normal","No","",""
"[york]","2000-07-29","11:00:00","2000-07-29","12:00:00","","","","No","normal","busy","normal","No","",""
"[york]","2000-07-30","11:00:00","2000-07-30","12:00:00","","","","No","normal","busy","normal","No","",""
"Return to London","2000-07-31","07:00:00","2000-07-31","08:30:00","","","","No","normal","busy","normal","No","",""
"Brinkmans","2000-07-31","08:30:00","2000-07-31","16:30:00","","New computer - Elaine and backups 

","","No","normal","busy","normal","No","",""
"Return to London","2000-08-01","07:00:00","2000-08-01","08:30:00","","","","No","normal","busy","normal","No","",""
"Mike Brazier's Appraisal","2000-08-01","11:30:00","2000-08-01","13:30:00","","","","No","normal","busy","normal","No","",""
"Updated: Strategy Meeting","2000-08-01","15:00:00","2000-08-01","19:30:00","127 COR","Taking orders for Fish and Chips/Pizza/chicken/chinese/indian - any preferences?

Thanks
","","No","normal","busy","normal","No","",""
"Interview with Christopher Haughton","2000-08-02","09:00:00","2000-08-02","09:30:00","","","","No","normal","busy","normal","No","",""
"Interview with Tim Kershaw","2000-08-02","11:00:00","2000-08-02","11:30:00","","","","No","normal","busy","normal","No","",""
"TACK - Warrior","2000-08-03","10:00:00","2000-08-03","11:30:00","127 COR","
Paul Charambulous and Simon  poss new MD as well.
TBC.

","","No","normal","busy","normal","No","",""
"Shares","2000-08-03","13:00:00","2000-08-03","15:00:00","","","","No","normal","busy","normal","No","",""
"Interview with Mohammed Rahman","2000-08-04","09:00:00","2000-08-04","09:30:00","","","","No","normal","busy","normal","No","",""
"Interview with David Wells","2000-08-04","11:00:00","2000-08-04","11:30:00","","","","No","normal","busy","normal","No","",""
"Sue and kevin ","2000-08-04","15:00:00","2000-08-04","23:00:00","","","","No","normal","busy","normal","No","",""
"[london]","2000-08-05","05:00:00","2000-08-05","06:00:00","","","","No","normal","busy","normal","No","",""
"-Sue and kevin ","2000-08-05","06:30:00","2000-08-05","21:00:00","","","","No","normal","busy","normal","No","",""
"-Brockenhurst weekend","2000-08-05","07:00:00","2000-08-05","23:00:00","","","","No","normal","busy","normal","No","",""
"[london]","2000-08-06","06:30:00","2000-08-06","07:30:00","","","","No","normal","busy","normal","No","",""
"-Dome visit sue and kevin","2000-08-06","07:00:00","2000-08-06","17:00:00","","","","No","normal","busy","normal","No","",""
"Meeting with Ralph re processes for future","2000-08-07","13:00:00","2000-08-07","14:30:00","","","","No","normal","busy","normal","No","",""
"BBC White City all day","2000-08-08","08:00:00","2000-08-08","16:30:00","","","","No","normal","busy","normal","No","",""
"9.30 pete clifton spol","2000-08-09","08:30:00","2000-08-09","10:30:00","","","","No","normal","busy","normal","No","",""
"Tiffany Hall - Lunch","2000-08-09","11:00:00","2000-08-09","13:30:00","TVC - BBC","TVC - at 12pm

","","No","normal","busy","normal","No","",""
"Osteopath","2000-08-10","08:30:00","2000-08-10","09:30:00","Osteopath","","","No","normal","busy","normal","No","",""
"Planning Meeting","2000-08-10","09:30:00","2000-08-10","11:00:00","","","","No","normal","busy","normal","No","",""
"Updated: Board Meeting","2000-08-10","13:00:00","2000-08-10","16:30:00","127 COR","","","No","normal","busy","normal","No","",""
"banana leaf/pub wel fed","2000-08-10","18:00:00","2000-08-10","21:30:00","","","","No","normal","busy","normal","No","",""
"Interview -  Demitri Grammatopoulos ","2000-08-11","09:00:00","2000-08-11","10:00:00","","","","No","normal","busy","normal","No","",""
"Richard Stephen - Interview","2000-08-11","11:00:00","2000-08-11","11:30:00","","","","No","normal","busy","normal","No","",""
"Handover with Andrew - before his hols","2000-08-11","12:30:00","2000-08-11","16:30:00","","","","No","normal","busy","normal","No","",""
"[london]","2000-08-12","11:00:00","2000-08-12","12:00:00","","","","No","normal","busy","normal","No","",""
"[london]","2000-08-13","11:00:00","2000-08-13","12:00:00","","","","No","normal","busy","normal","No","",""
"White City - BBC ENPS","2000-08-14","08:30:00","2000-08-14","15:00:00","","","","No","normal","busy","normal","No","",""
"Adastra Design","2000-08-14","15:45:00","2000-08-14","16:45:00","127 COR","","","No","normal","busy","normal","No","",""
"Ian Hare - Sushi","2000-08-16","11:00:00","2000-08-16","13:30:00","Upper St Martins Lane","","","No","normal","busy","normal","No","",""
"Steve Re Colin","2000-08-16","14:00:00","2000-08-16","17:00:00","","","","No","normal","busy","normal","No","",""
"Colin S - Appraisal","2000-08-18","08:00:00","2000-08-18","10:00:00","","","","No","normal","busy","normal","No","",""
"Write Pat the para on Network Performance for ENPS","2000-08-18","11:30:00","2000-08-18","13:30:00","","","","No","normal","busy","normal","No","",""
"-[scotland]","2000-08-19","07:00:00","2000-08-20","21:00:00","","","","No","normal","busy","normal","No","",""
"-wr quiz and ale","2000-08-19","11:00:00","2000-08-19","12:00:00","","","","No","normal","busy","normal","No","",""
"[york]","2000-08-19","11:00:00","2000-08-19","12:00:00","","","","No","normal","busy","normal","No","",""
"-[york]","2000-08-20","11:00:00","2000-08-20","12:00:00","","","","No","normal","busy","normal","No","",""
"Demitri - starting - meeting at 127","2000-08-21","08:30:00","2000-08-21","09:00:00","","","","No","normal","busy","normal","No","",""
"Richard starting - 127","2000-08-21","08:30:00","2000-08-21","09:00:00","","","","No","normal","busy","normal","No","",""
"Planning meeting","2000-08-22","07:30:00","2000-08-22","11:00:00","127","","","No","normal","busy","normal","No","",""
"BBC Site-Seer","2000-08-23","08:30:00","2000-08-23","16:30:00","WC","","","No","normal","busy","normal","No","",""
"Pats Leaving Do","2000-08-23","17:00:00","2000-08-23","19:00:00","BBC Club","","","No","normal","busy","normal","No","",""
"BBC ","2000-08-25","09:00:00","2000-08-25","16:30:00","WC","","","No","normal","busy","normal","No","",""
"[york]","2000-08-26","11:00:00","2000-08-26","12:00:00","","","","No","normal","busy","normal","No","",""
"-wr caribbean pool party ","2000-08-26","11:00:00","2000-08-26","12:00:00","","","","No","normal","busy","normal","No","",""
"-wr bbq lunch","2000-08-27","11:00:00","2000-08-27","12:00:00","","","","No","normal","busy","normal","No","",""
"[york]","2000-08-27","11:00:00","2000-08-27","12:00:00","","","","No","normal","busy","normal","No","",""
"-wr skittles","2000-08-27","11:00:00","2000-08-27","12:00:00","","","","No","normal","busy","normal","No","",""
"[york]","2000-08-28","06:00:00","2000-08-28","07:00:00","","","","No","normal","busy","normal","No","",""
"-wr miniten","2000-08-28","11:00:00","2000-08-28","12:00:00","","","","No","normal","busy","normal","No","",""
"-Flea market ","2000-08-28","11:00:00","2000-08-28","12:00:00","","","","No","normal","busy","normal","No","",""
"[york]","2000-09-02","11:00:00","2000-09-02","12:00:00","","","","No","normal","busy","normal","No","",""
"-wr cribbage comp.","2000-09-02","11:00:00","2000-09-02","12:00:00","","","","No","normal","busy","normal","No","",""
"[york]","2000-09-03","11:00:00","2000-09-03","12:00:00","","","","No","normal","busy","normal","No","",""
"Possible marketing interview","2000-09-05","09:00:00","2000-09-05","10:00:00","","Daniel Odonaghue - sales and marketing agency - poss Marketing person - 020 7559 9640

","","No","normal","busy","normal","No","",""
"David Cowle","2000-09-07","09:30:00","2000-09-07","11:00:00","","","","No","normal","busy","normal","No","",""
"Jean & jeff","2000-09-08","21:00:00","2000-09-10","22:00:00","London","","","No","normal","busy","normal","No","",""
"-Collect 2000","2000-09-09","10:00:00","2000-09-10","15:00:00","Wembley exhibition centre","","","No","normal","busy","normal","No","",""
"[london ]","2000-09-09","11:00:00","2000-09-09","12:00:00","","","","No","normal","busy","normal","No","",""
"[london ] Jean + Jeff","2000-09-09","11:00:00","2000-09-09","12:00:00","","","","No","normal","busy","normal","No","",""
"[london] Jean + Jeff","2000-09-10","11:00:00","2000-09-10","12:00:00","","","","No","normal","busy","normal","No","",""
"[london]","2000-09-10","11:00:00","2000-09-10","12:00:00","","","","No","normal","busy","normal","No","",""
"IBC Amsterdam - BBC ENPS","2000-09-11","08:00:00","2000-09-11","16:30:00","","","","No","normal","busy","normal","No","",""
"IBC Amsterdam - BBC ENPS","2000-09-12","08:00:00","2000-09-12","16:30:00","","","","No","normal","busy","normal","No","",""
"Spol training.","2000-09-13","13:00:00","2000-09-13","19:00:00","Tvc.","","","No","normal","busy","normal","No","",""
"SPOl News Editor Training","2000-09-14","08:30:00","2000-09-14","17:00:00","","","","No","normal","busy","normal","No","",""
"[york]","2000-09-16","11:00:00","2000-09-16","12:00:00","","","","No","normal","busy","normal","No","",""
"[york]","2000-09-17","11:00:00","2000-09-17","12:00:00","","","","No","normal","busy","normal","No","",""
"Planning Meeting","2000-09-19","07:30:00","2000-09-19","09:00:00","Porkies","","","No","normal","busy","normal","No","",""
"Jerry Tse","2000-09-20","18:00:00","2000-09-20","21:30:00","Joy King Lau Chinese restaurant  - 3 Leicester Street London WC2","Okay, I will reserve a table at Joy King Lau Chinese restaurant at 7:00pm.
Its address is - .  It is one of the street
leading away from Leicester Square toward Chinatown.  I shall see you there.

Jerry.

","","No","normal","busy","normal","No","",""
"Live 2000","2000-09-21","09:00:00","2000-09-24","14:00:00","Earls court","","","No","normal","busy","normal","No","",""
"Institute of Directors","2000-09-22","11:00:00","2000-09-22","14:30:00","","","","No","normal","busy","normal","No","",""
"[london]","2000-09-23","11:00:00","2000-09-23","12:00:00","","","","No","normal","busy","normal","No","",""
"London river race","2000-09-23","11:00:00","2000-09-23","12:00:00","","","","No","normal","busy","normal","No","",""
"[london]","2000-09-24","11:00:00","2000-09-24","12:00:00","","","","No","normal","busy","normal","No","",""
"Board meeting","2000-09-25","13:00:00","2000-09-25","16:30:00","127 COR","When: 25 September 2000 14:00-17:30 (GMT) Greenwich Mean Time : Dublin, Edinburgh, Lisbon, London.
Where: 127 COR

*~*~*~*~*~*~*~*~*~*


","","No","normal","busy","normal","No","",""
"BBC - ENPS","2000-09-26","11:00:00","2000-09-26","16:30:00","","","","No","normal","busy","normal","No","",""
"Visiting Acorn re Storage","2000-09-27","08:30:00","2000-09-27","11:30:00","","","","No","normal","busy","normal","No","",""
"THC Admin","2000-09-27","12:30:00","2000-09-27","14:30:00","","","","No","normal","busy","normal","No","",""
"bank meeting - Warren Mulvihill","2000-09-27","14:30:00","2000-09-27","16:00:00","","Meeting confirmed, although Eleanor I know cannot attend. Prepare approach at Monday's Board meeting.
","","No","normal","tentative","normal","No","",""
"Updated: Team Meeting - Fish and Chips","2000-09-27","18:00:00","2000-09-27","20:00:00","130 COR","When: 27 September 2000 19:00-21:00 (GMT) Greenwich Mean Time : Dublin, Edinburgh, Lisbon, London.
Where: 130 COR

*~*~*~*~*~*~*~*~*~*



Dear all 

Sorry change of venue - its going to be held at 130 not 127 - Phils team is having a meeting on the same night and going down the pub after so if any of you fancy joining them after our meeting - I believe they are off to the Orchard - practicing for the Pool Tournament probably...

Many thanks

btw - can you let me know in advance what you would like to eat so I can get the order in and save time?  Need to know if you want Salt and Vinegar/ketchup etc too.

ta
","","No","normal","busy","normal","No","",""
"BBC - ENPS","2000-09-28","08:00:00","2000-09-28","16:30:00","","","","No","normal","busy","normal","No","",""
"FW: The Microsoft.NET Enterprise Servers Launch","2000-09-29","08:30:00","2000-09-29","15:00:00","","
------------
From:	Michelle Chapman
Sent:	22 September 2000 09:27
To:	Tom Cranstoun
Subject:	FW: The Microsoft.NET Enterprise Servers Launch - Confirmation of Booking

FYI

-----Original Message-----
From: Microsoft Conferences Registration Office
[mailto:microsoft@delegate.com]
Sent: 21 September 2000 18:45
To: Tom Cranstoun - Top Hat Computing 
Subject: The Microsoft.NET Enterprise Servers Launch - Confirmation of
Booking


Dear Mr Cranstoun 

We have pleasure in confirming your booking at The Microsoft.NET Enterprise Servers Launch on 29th September 2000 at the National Hall, Olympia, London.

Approximately one week prior to the event, we will send your delegate badge and location map.  If you have any further queries or have any special needs or dietary requirements, please do not hesitate to contact the Microsoft MSDN Registration Office on 0870 166 6640.

For the latest event information, please visit our website www.microsoft.com/uk/msdn/

We look forward to welcoming you to the event!

Yours sincerely

Microsoft Conferences Registration Office



","","No","normal","busy","normal","No","",""
"[york]","2000-09-30","11:00:00","2000-09-30","12:00:00","","","","No","normal","busy","normal","No","",""
"Comic fair","2000-09-30","19:00:00","2000-09-30","20:00:00","Hallam uni sheffield [information@goldenorbit.co.uk]","","","No","normal","busy","normal","No","",""
"-Comic fair","2000-10-01","11:00:00","2000-10-01","13:00:00","National hotel","","","No","normal","busy","normal","No","",""
"[york]","2000-10-01","11:00:00","2000-10-01","12:00:00","","","","No","normal","busy","normal","No","",""
"Annual Leave","2000-10-02","08:00:00","2000-10-02","16:30:00","","","","No","normal","busy","normal","No","",""
"Planning Meeting","2000-10-03","07:30:00","2000-10-03","09:00:00","127 COR","Dear all

Its that time again - please can you confirm if you can make it.  

Many thanks
","","No","normal","busy","normal","No","",""
"BBC - ENPS","2000-10-05","12:00:00","2000-10-05","16:00:00","","","","No","normal","busy","normal","No","",""
"BBC ENPS","2000-10-06","08:00:00","2000-10-06","13:30:00","","","","No","normal","busy","normal","No","",""
"World Service with Colin S","2000-10-06","14:00:00","2000-10-06","15:00:00","","","","No","normal","busy","normal","No","",""
"-wr president's evening","2000-10-07","11:00:00","2000-10-07","12:00:00","","","","No","normal","busy","normal","No","",""
"[york]","2000-10-07","11:00:00","2000-10-07","12:00:00","","","","No","normal","busy","normal","No","",""
"Silverleigh (poss)","2000-10-07","17:00:00","2000-10-07","21:30:00","","","","No","normal","busy","normal","No","",""
"[york]","2000-10-08","11:00:00","2000-10-08","12:00:00","","","","No","normal","busy","normal","No","",""
"Brinkman Visit","2000-10-09","09:00:00","2000-10-09","16:00:00","","","","No","normal","busy","normal","No","",""
"BBC ENPS","2000-10-10","08:00:00","2000-10-10","12:00:00","","","","No","normal","busy","normal","No","",""
"Meeting with Colin S re Databases ","2000-10-10","13:00:00","2000-10-10","15:00:00","Bush House","","","No","normal","busy","normal","No","",""
"AMT Meeting, preston circus","2000-10-11","08:00:00","2000-10-11","11:00:00","","","","No","normal","busy","normal","No","",""
"Radio 5 Rollout for ENPS","2000-10-11","12:00:00","2000-10-11","16:00:00","","","","No","normal","busy","normal","No","",""
"Blackpool","2000-10-13","14:00:00","2000-10-15","14:30:00","","
------------
From:	Emma Clifford
Sent:	10 August 2000 10:37
To:	Social Club
Subject:	Blackpool

	
All, 

Due to the lack of interest in the Amsterdam trip we have decided to cancel that in favour of a weekend in Blackpool to see the illuminations.  The planned dates are 13/14/15 October.  Can you email me back if you are interested, estimated costs are £19 travel and £13 - £20 per night B&B.

Thanks

Emma


","","No","normal","busy","normal","No","",""
"[london]","2000-10-14","11:00:00","2000-10-14","12:00:00","","","","No","normal","busy","normal","No","",""
"[london]","2000-10-15","11:00:00","2000-10-15","12:00:00","","","","No","normal","busy","normal","No","",""
"Planning Meeting","2000-10-17","07:30:00","2000-10-17","08:30:00","127 Cherry Orchard Rd","Attached are the minutes of the last meeting.

 

","","No","normal","busy","normal","No","",""
"Media Mindstorm","2000-10-17","17:00:00","2000-10-17","18:30:00","127 Cherry Orchard Rd","When: 17 October 2000 18:00-19:30 (GMT) Greenwich Mean Time : Dublin, Edinburgh, Lisbon, London.
Where: 127 Cherry Orchard Rd

*~*~*~*~*~*~*~*~*~*


","","No","normal","busy","normal","No","",""
"ENPS - White City","2000-10-19","08:00:00","2000-10-19","16:30:00","","","","No","normal","busy","normal","No","",""
"Updated: Board meeting","2000-10-20","08:00:00","2000-10-20","10:00:00","127","When: 20 October 2000 09:00-11:00 England Man, England.
Where: 127

*~*~*~*~*~*~*~*~*~*

Provisional time, Tom & Eleanor are unable to make the afternoon

cheers

PB
","","No","normal","busy","normal","No","",""
"[york]","2000-10-21","11:00:00","2000-10-21","12:00:00","","","","No","normal","busy","normal","No","",""
"[york]","2000-10-22","11:00:00","2000-10-22","12:00:00","","","","No","normal","busy","normal","No","",""
"ENPS - White City","2000-10-23","11:30:00","2000-10-23","16:00:00","","","","No","normal","busy","normal","No","",""
"[London]","2000-10-23","18:00:00","2000-10-29","21:00:00","","","","No","normal","busy","normal","No","",""
"Barbara & Phil for Dinner","2000-10-25","17:00:00","2000-10-25","20:00:00","","","","No","normal","busy","normal","No","",""
"Meet with Ashok at WS","2000-10-26","10:30:00","2000-10-26","13:00:00","","","","No","normal","busy","normal","No","",""
"Leave - London","2000-10-27","07:00:00","2000-10-27","16:00:00","","","","No","normal","busy","normal","No","",""
"(No Subject)","2000-10-27","08:00:00","2000-10-27","09:00:00","","","","No","normal","busy","normal","No","",""
"Dentist","2000-10-27","08:10:00","2000-10-27","09:00:00","","","","No","normal","busy","normal","No","",""
"Hairdresssers - John & Sylvia","2000-10-28","08:00:00","2000-10-28","08:30:00","","","","No","normal","busy","normal","No","",""
"Roger and Margaret for Lunch","2000-10-28","10:00:00","2000-10-28","14:30:00","","","","No","normal","busy","normal","No","",""
"[london]","2000-10-28","11:00:00","2000-10-28","12:00:00","","","","No","normal","busy","normal","No","",""
"[london]","2000-10-29","12:00:00","2000-10-29","13:00:00","","","","No","normal","busy","normal","No","",""
"()","2000-10-30","08:00:00","2000-10-30","08:30:00","","","","No","normal","busy","normal","No","",""
"Colin + isdn router flat 7","2000-10-31","20:00:00","2000-10-31","22:00:00","","","","No","normal","busy","normal","No","",""
"Film Club -- What Lies Beneath","2000-11-01","18:00:00","2000-11-01","21:30:00","","","","No","normal","busy","normal","No","",""
"Planning Meeting","2000-11-02","08:30:00","2000-11-02","09:30:00","127 Cherry Orchard Rd","","","No","normal","busy","normal","No","",""
"sick","2000-11-02","15:00:00","2000-11-02","17:30:00","","","","No","normal","busy","normal","No","",""
"sick leave","2000-11-03","09:00:00","2000-11-03","17:30:00","","","","No","normal","busy","normal","No","",""
"[york]","2000-11-04","07:30:00","2000-11-04","08:30:00","","","","No","normal","busy","normal","No","",""
"[York]","2000-11-04","08:00:00","2000-11-05","21:00:00","","","","No","normal","busy","normal","No","",""
"WR - Halloween","2000-11-04","18:00:00","2000-11-04","22:00:00","","","","No","normal","busy","normal","No","",""
"-wr Halloween night","2000-11-04","18:00:00","2000-11-04","22:30:00","","","","No","normal","busy","normal","No","",""
"[york]","2000-11-05","12:00:00","2000-11-05","13:00:00","","","","No","normal","busy","normal","No","",""
"[London]","2000-11-11","08:00:00","2000-11-12","21:00:00","","","","No","normal","busy","normal","No","",""
"[london]","2000-11-11","12:00:00","2000-11-11","13:00:00","","","","No","normal","busy","normal","No","",""
"-Silverleigh","2000-11-11","18:00:00","2000-11-11","22:00:00","","","","No","normal","busy","normal","No","",""
"[london]","2000-11-12","12:00:00","2000-11-12","13:00:00","","","","No","normal","busy","normal","No","",""
"Board Meeting","2000-11-13","09:30:00","2000-11-13","12:00:00","127 COR","","","No","normal","busy","normal","No","",""
"Updated: Alex Lawrie Meeting","2000-11-13","10:30:00","2000-11-13","12:30:00","127 COR","Top Hat Computing Ltd, 130 Cherry Orchard Road, Croydon, CR0 6BB
Tel: 020 8680 4860   Fax: 020 8680 8204   Web: www.tophat.co.uk
 
This e-mail, and any attachment, is confidential. If you have received it in error, please delete it from your system, do not use or disclose the information in any way, and notify me immediately. The contents of this message may contain personal views that are not the views of Top Hat Computing, unless specifically stated.
","","No","normal","tentative","normal","No","",""
"Alex Lawrie Meeting","2000-11-13","14:00:00","2000-11-13","16:00:00","127 COR","Top Hat Computing Ltd, 130 Cherry Orchard Road, Croydon, CR0 6BB
Tel: 020 8680 4860   Fax: 020 8680 8204   Web: www.tophat.co.uk
 
This e-mail, and any attachment, is confidential. If you have received it in error, please delete it from your system, do not use or disclose the information in any way, and notify me immediately. The contents of this message may contain personal views that are not the views of Top Hat Computing, unless specifically stated.
","","No","normal","tentative","normal","No","",""
"Board Meeting","2000-11-13","14:00:00","2000-11-13","17:00:00","127 COR","


Top Hat Computing Ltd, 130 Cherry Orchard Road, Croydon, CR0 6BB
Tel: 020 8680 4860   Fax: 020 8680 8204   Web: http://www.tophat.co.uk 
 
This e-mail, and any files transmitted with it, are confidential. If you are not the intended recipient or the person responsible for delivering to the intended recipient, then you have received it in error.  Please delete it from your system, do not use or disclose the information in any way and inform THC by telephone on the above number or by email to info@tophat.co.uk immediately. Any opinions expressed in this email are those of the individual and not necessarily the Company. 

","","No","normal","busy","normal","No","",""
"Planning Meeting","2000-11-14","13:00:00","2000-11-14","14:00:00","Pizza Express, Golden Square, Soho","Sorry to change the planning meeting, but I have got to go to 4mc on Tuesday.

Cheers

PB
","","No","normal","busy","normal","No","",""
"[York]","2000-11-18","08:00:00","2000-11-19","21:00:00","","","","No","normal","busy","normal","No","",""
"[york]","2000-11-18","12:00:00","2000-11-18","13:00:00","","","","No","normal","busy","normal","No","",""
"[york]","2000-11-19","12:00:00","2000-11-19","13:00:00","","","","No","normal","busy","normal","No","",""
"-flea market at racecourse","2000-11-19","12:00:00","2000-11-19","13:00:00","","","","No","normal","busy","normal","No","",""
"Brinkman ","2000-11-20","09:00:00","2000-11-20","17:30:00","","","","No","normal","busy","normal","No","",""
"BBC _ White City","2000-11-21","09:00:00","2000-11-21","17:30:00","","","","No","normal","busy","normal","No","",""
"BBC - White City","2000-11-22","09:00:00","2000-11-22","17:30:00","","","","No","normal","busy","normal","No","",""
"In office","2000-11-23","09:00:00","2000-11-23","13:00:00","","","","No","normal","busy","normal","No","",""
"Demitris appraisal","2000-11-23","14:00:00","2000-11-23","16:00:00","127 COR","","","No","normal","busy","normal","No","",""
"BBC - White City","2000-11-24","09:00:00","2000-11-24","17:30:00","","","","No","normal","busy","normal","No","",""
"Roger &  Marageret's with Dr David","2000-11-25","16:00:00","2000-11-25","20:00:00","","","","No","normal","busy","normal","No","",""
"planning meeting","2000-11-28","08:30:00","2000-11-28","09:30:00","127 COR","When: 28 November 2000 08:30-09:30 (GMT) Greenwich Mean Time : Dublin, Edinburgh, Lisbon, London.
Where: 127 COR

*~*~*~*~*~*~*~*~*~*


Its that time of the morning again - for those of you who arent regular attendees, feel free to come along if you can.

Many thanks
","","No","normal","busy","normal","No","",""
"BBC Meeting with John and Sheila","2000-11-29","10:00:00","2000-11-29","11:00:00","White City","","","No","normal","busy","normal","No","",""
"Board Meeting","2000-12-01","14:00:00","2000-12-01","17:30:00","","","","No","normal","busy","normal","No","",""
"[York]","2000-12-02","08:00:00","2000-12-03","21:00:00","","","","No","normal","busy","normal","No","",""
"[york]","2000-12-02","12:00:00","2000-12-02","13:00:00","","","","No","normal","busy","normal","No","",""
"WR - Christmas Dinner","2000-12-02","18:00:00","2000-12-02","23:00:00","","","","No","normal","busy","normal","No","",""
"[york]","2000-12-03","12:00:00","2000-12-03","13:00:00","","","","No","normal","busy","normal","No","",""
"eye appt","2000-12-04","09:00:00","2000-12-04","09:00:00","","","","No","normal","busy","normal","No","",""
"Office + Bookshopping","2000-12-05","10:00:00","2000-12-05","12:30:00","","","","No","normal","busy","normal","No","",""
"Meet Phil At Borders","2000-12-05","12:30:00","2000-12-05","14:00:00","","","","No","normal","busy","normal","No","",""
"BBC WC ENPS","2000-12-05","14:00:00","2000-12-05","17:30:00","","","","No","normal","busy","normal","No","",""
"Eyesight Test 9.10","2000-12-06","09:00:00","2000-12-06","09:30:00","","","","No","normal","busy","normal","No","",""
"WC BBC ENPS","2000-12-06","10:30:00","2000-12-06","17:30:00","","","","No","normal","busy","normal","No","",""
"WC BBC ENPS","2000-12-07","09:30:00","2000-12-07","17:00:00","","","","No","normal","busy","normal","No","",""
"Scott McGregor","2000-12-08","10:00:00","2000-12-08","17:30:00","","","","No","normal","busy","normal","No","",""
"THC Board Meeting","2000-12-08","14:00:00","2000-12-08","18:00:00","","","","No","normal","busy","normal","No","",""
"[London]","2000-12-09","08:00:00","2000-12-10","21:00:00","","","","No","normal","busy","normal","No","",""
"Steve Rab etc at BBC meet Helen and Nick","2000-12-09","08:00:00","2000-12-09","13:00:00","","","","No","normal","busy","normal","No","",""
"-Silverleigh","2000-12-09","18:00:00","2000-12-09","22:00:00","","","","No","normal","busy","normal","No","",""
"Dentist - Check Up","2000-12-11","08:00:00","2000-12-11","08:30:00","","","","No","normal","busy","normal","No","",""
"Southampton","2000-12-11","08:00:00","2000-12-11","18:00:00","","","","No","normal","busy","normal","No","",""
"BBC ENPS NetSniff","2000-12-12","09:00:00","2000-12-12","14:30:00","","","","No","normal","busy","normal","No","",""
"William OShea","2000-12-12","14:30:00","2000-12-12","15:30:00","IOD Picadilly","tel 020 8741 4685
","","No","normal","busy","normal","No","",""
"BBC ENPS Sheila RAS Stuff","2000-12-13","10:00:00","2000-12-13","17:00:00","","","","No","normal","busy","normal","No","",""
"Planning Meeting","2000-12-14","08:30:00","2000-12-14","09:30:00","127 Cherry Orchard Rd","When: 12 December 2000 08:30-09:30 (GMT) Greenwich Mean Time : Dublin, Edinburgh, Lisbon, London.
Where: 127 Cherry Orchard Rd

*~*~*~*~*~*~*~*~*~*


","","No","normal","busy","normal","No","",""
"Working in Croydon -- Payroll Signoff","2000-12-14","10:30:00","2000-12-14","11:00:00","","","","No","normal","busy","normal","No","",""
"BBC ENPS WC","2000-12-15","09:00:00","2000-12-15","13:00:00","","","","No","normal","busy","normal","No","",""
"Leave","2000-12-18","09:00:00","2000-12-18","17:00:00","","","","No","normal","busy","normal","No","",""
"Leave","2000-12-19","09:00:00","2000-12-19","17:30:00","","","","No","normal","busy","normal","No","",""
"Holiday - Fuerteventura","2000-12-20","10:00:00","2001-01-03","15:00:00","","","","No","normal","busy","normal","No","",""
"Planning Meeting - tbc","2001-01-09","08:00:00","2001-01-09","09:00:00","127 COR","

Im not sure if this is definitely taking place - but since its the next due date thought I would email out anyway.

thanks
","","No","normal","busy","normal","No","",""
"BBC White City","2001-01-10","13:00:00","2001-01-10","17:00:00","","","","No","normal","busy","normal","No","",""
"BBC White City","2001-01-11","09:00:00","2001-01-11","17:00:00","","","","No","normal","busy","normal","No","",""
"Mark Bishop - Winchester Trading Ltd","2001-01-12","08:30:00","2001-01-12","09:30:00","Lead Meeting at 130 COR","","","No","normal","busy","normal","No","",""
"BBC White City","2001-01-12","09:30:00","2001-01-12","16:30:00","","","","No","normal","busy","normal","No","",""
"Ann & Philip","2001-01-13","20:00:00","2001-01-13","22:00:00","","","","No","normal","busy","normal","No","",""
"Meeting with Ashok and Colin S for lunch","2001-01-15","12:30:00","2001-01-15","14:00:00","Bush House to start","","","No","normal","busy","normal","No","",""
"Meeting with Pete Clifton and Kofi Sekeryi","2001-01-15","15:00:00","2001-01-15","16:00:00","Pete Cliftons Office - TVC","","","No","normal","busy","normal","No","",""
"Stuart Timms Do","2001-01-19","18:00:00","2001-01-19","18:00:00","","","","No","normal","busy","normal","No","",""
"Dr David for Indian","2001-01-23","18:30:00","2001-01-23","22:30:00","","","","No","normal","busy","normal","No","",""
"To Scotland","2001-01-26","22:00:00","2001-01-26","22:00:00","","","","No","normal","busy","normal","No","",""
"Employment Tribunal - Martin Galloway","2001-02-22","10:00:00","2001-02-22","16:30:00","Montague Court - London Road","


Top Hat Computing Ltd, 130 Cherry Orchard Road, Croydon, CR0 6BB
Tel: 020 8680 4860   Fax: 020 8680 8204   Web: www.tophat.co.uk
 
This e-mail, and any attachment, is confidential. If you have received it in error, please delete it from your system, do not use or disclose the information in any way, and notify me immediately. The contents of this message may contain personal views that are not the views of Top Hat Computing, unless specifically stated.

","","No","normal","busy","normal","No","",""
"Diabetic Clinic","2001-02-23","15:45:00","2001-02-23","17:00:00","","","","No","normal","busy","normal","No","",""
"ring tim","2001-03-12","09:00:00","2001-03-12","10:00:00","","","","No","normal","busy","normal","No","",""
"lucy collins","2001-03-12","18:00:00","2001-03-12","20:00:00","","","","No","normal","busy","normal","No","",""
"travel to york","2001-03-14","18:00:00","2001-03-14","20:00:00","","","","No","normal","busy","normal","No","",""
"tom for shower","2001-03-17","09:00:00","2001-03-17","11:00:00","","","","No","normal","busy","normal","No","",""
"live and kicking maybe","2001-03-24","08:00:00","2001-03-24","09:00:00","london","","","No","normal","busy","normal","No","",""
"For your Diary","2001-03-28","07:30:00","2001-03-28","08:00:00","","
------------
From:	Cranstoun, Eleanor [eleanor.cranstoun@york.gov.uk]
Sent:	20 March 2001 15:42
To:	'tom@shoal.demon.co.uk'
Subject:	For your Diary

Wednesday 28th March 2001 08:30

Dr Glassborough - She has taken over from Dr Jupp who retired last year
apparently.

We MUST cancel this if we do not need it.

In addition you can call and speak to Dr Glassborough between 10.20 and
11.00 on Thursday morning if you want.

Also sorted out your prescription things - should be at Fishers next time
you go up.

Eleanor Cranstoun
Projects Manager
X3342


* * * * * * * * * * * *
This email and any files transmitted with it are confidential and intended
solely for the use of the individual or entity to whom they are addressed.
This email represents the personal views of the author/sender.  The
author/sender has no authority or delegation to bind the City of York
Council by this e-mail and the City of York Council accepts no
responsibility whatsoever for its contents.  Please note that any reply to
this email may be screened.



","","No","normal","busy","normal","No","",""
"wr -- working weekend","2001-03-31","07:00:00","2001-03-31","08:00:00","","","","No","normal","busy","normal","No","",""
"Pilkington Replacement Stage 2 Mtg","2001-04-12","12:30:00","2001-04-12","14:30:00","Room 2752 BH","2nd time lucky!! Let me know how everyone is for this day!!
Many Thanks,
Kellie
Kellie Paterson
BBC Nations and Regions HQ
(T) 0207 76(50107)
Room 2661
Broadcasting House
Portland Place
London W1A 1AA
","","No","normal","busy","normal","No","",""
"York","2001-04-12","16:00:00","2001-04-12","17:00:00","","","","No","normal","busy","normal","No","",""
"Good Friday","2001-04-13","07:00:00","2001-04-13","07:00:00","","","","No","normal","busy","normal","No","",""
"Fly to Scotland","2001-04-25","18:30:00","2001-04-25","21:00:00","","","","No","normal","busy","normal","No","",""
"Largs","2001-04-26","17:00:00","2001-04-29","18:00:00","","","","No","normal","busy","normal","No","",""
"(No Subject)","2001-06-02","01:00:00","2001-06-02","02:00:00","","","","No","normal","free","normal","No","",""
"Battle of the Boyne (N. Ireland)","2001-07-12","06:59:00","2001-07-12","06:59:00","","","","No","normal","busy","private","No","",""
"Tom To York","2001-07-19","20:00:00","2001-07-19","20:30:00","","","","No","normal","busy","normal","No","",""
"Jean & Family in York","2001-07-21","06:59:00","2001-07-21","06:59:00","","","","No","normal","busy","private","No","",""
"Tom to London","2001-07-30","05:00:00","2001-07-30","05:30:00","","","","No","normal","busy","normal","No","",""
"Facilities Team Meeting","2001-08-01","13:00:00","2001-08-01","14:30:00","","","","No","normal","busy","normal","No","",""
"-Silverleigh","2001-08-11","17:00:00","2001-08-11","21:30:00","","","","No","normal","busy","private","No","",""
"Silverleigh","2001-08-11","17:00:00","2001-08-11","21:00:00","","","","No","normal","busy","normal","No","",""
"WR- Skittles?","2001-08-26","18:00:00","2001-08-26","21:30:00","","","","No","normal","busy","normal","No","",""
"Stamp fair","2001-09-01","09:00:00","2001-09-01","15:30:00","","","","No","normal","busy","private","No","",""
"Blackpool","2001-10-27","23:00:00","2001-10-28","20:00:00","","","","No","normal","busy","normal","No","",""
"Facilities Team Meeting","2001-11-07","14:00:00","2001-11-07","15:30:00","","","","No","normal","busy","normal","No","",""
"-Silverleigh","2001-11-10","18:00:00","2001-11-10","22:30:00","","","","No","normal","busy","private","No","",""
"Back to wc","2001-11-27","09:00:00","2001-11-27","17:30:00","","","","No","normal","busy","normal","No","",""
"Glloucester","2001-11-27","15:00:00","2001-11-27","19:00:00","","","","No","normal","busy","normal","No","",""
"Facilities Team Meeting","2001-12-05","14:00:00","2001-12-05","15:30:00","","","","No","normal","busy","normal","No","",""
"Silverleigh","2001-12-08","18:00:00","2001-12-08","22:00:00","","","","No","normal","busy","normal","No","",""
"Jinnahs","2001-12-09","13:00:00","2001-12-09","15:00:00","","","","No","normal","busy","private","No","",""
"Tom to Osteopath","2001-12-10","14:00:00","2001-12-10","14:45:00","","","","No","normal","busy","normal","No","",""
"Pencil in Ray Bacon","2001-12-13","14:00:00","2001-12-13","17:30:00","","","","No","normal","busy","normal","No","",""
"Brinkman UK","2001-12-20","09:00:00","2001-12-20","17:00:00","","","","No","normal","busy","normal","No","",""
"Mum + sam to thirsk ","2001-12-20","16:00:00","2001-12-20","17:00:00","","","","No","normal","busy","normal","No","",""
"Off To Northumbria ","2001-12-21","09:00:00","2001-12-22","00:00:00","","","","No","normal","busy","normal","No","",""
"Christmas ","2001-12-25","16:00:00","2001-12-25","17:00:00","","","","No","normal","busy","normal","No","",""
"[york]","2002-01-04","18:00:00","2002-01-04","19:00:00","","","","No","normal","busy","normal","No","",""
"Bark laying","2002-01-05","09:00:00","2002-01-05","10:00:00","","","","No","normal","busy","normal","No","",""
"[york]","2002-01-07","09:00:00","2002-01-07","10:00:00","","","","No","normal","busy","normal","No","",""
"Sky box","2002-01-07","09:30:00","2002-01-07","18:00:00","","","","No","normal","busy","normal","No","",""
"[york]","2002-01-08","09:00:00","2002-01-08","10:00:00","","","","No","normal","busy","normal","No","",""
"Brinkman","2002-01-08","09:00:00","2002-01-08","17:00:00","","","","No","normal","busy","normal","No","",""
"Nicola pmime","2002-01-08","18:00:00","2002-01-08","19:00:00","","","","No","normal","busy","normal","No","",""
"NETMAG Meeting","2002-01-09","10:30:00","2002-01-09","12:30:00","Council Chamber","","","No","normal","busy","normal","No","",""
"JC Meeting -- Desktops","2002-01-09","14:00:00","2002-01-09","15:30:00","","","","No","normal","busy","normal","No","",""
"Desktop Meeting -- Sue Lewis, John Conway, others","2002-01-11","10:00:00","2002-01-11","13:00:00","","","","No","normal","busy","normal","No","",""
"[York]","2002-01-11","18:00:00","2002-01-11","19:00:00","","","","No","normal","busy","normal","No","",""
"Wakefield Computer fair","2002-01-13","11:00:00","2002-01-13","13:30:00","(Thornes Park) ATHLETIC STADIUM ","(Thornes Park) ATHLETIC STADIUM 

","","No","normal","busy","normal","No","",""
"Travel to Gloucester","2002-01-15","14:00:00","2002-01-15","17:00:00","","","","No","normal","busy","normal","No","",""
"Myersholme","2002-01-16","14:00:00","2002-01-16","15:30:00","","","","No","normal","busy","normal","No","",""
"Admin Accom Forum","2002-01-16","14:30:00","2002-01-16","16:30:00","Conference Room 1","","","No","normal","busy","normal","No","",""
"Lowfield Lift Meeting","2002-01-16","15:30:00","2002-01-16","17:00:00","","","","No","normal","busy","normal","No","",""
"[london]","2002-01-18","18:00:00","2002-01-18","19:00:00","","","","No","normal","busy","normal","No","",""
"Beths Computer Fair","2002-01-20","10:30:00","2002-01-20","13:00:00","Black Prince","","","No","normal","busy","normal","No","",""
"Updated: Radio Gloucester","2002-01-23","11:00:00","2002-01-23","14:00:00","Conference Room, Gloucester","Dear all, 

Please note room for this meeting.

All the best


Mary 

Mary Jones  | Secretary, Consulting & Projects
BBC Technology | Room 1200 | Stadium House | 68 Wood Lane, London W12 7TA
T: +44 (0)20 822 56371 F: +44 (0)20 857 64571 
<http://www.bbctechnology.com>


","","No","normal","busy","normal","No","",""
"James haslam, Oracle UK","2002-01-24","09:00:00","2002-01-24","10:00:00","Raynes Park","","","No","normal","busy","normal","No","",""
"Possible Camden to AP with DSD","2002-01-24","10:30:00","2002-01-24","17:00:00","","","","No","normal","busy","normal","No","",""
"Swim Duty","2002-01-27","16:00:00","2002-01-27","17:30:00","","","","No","normal","busy","normal","No","",""
"Oakland School","2002-01-31","14:00:00","2002-01-31","15:00:00","","","","No","normal","busy","normal","No","",""
"Commence Travel To scotland","2002-01-31","15:00:00","2002-01-31","15:15:00","","","","No","normal","busy","normal","No","",""
"Scottish Trip","2002-01-31","15:00:00","2002-02-04","17:00:00","","","","No","normal","busy","normal","No","",""
"19:45 Gatwick North - Glasgow","2002-01-31","15:30:00","2002-01-31","21:30:00","Arrives 21:20","","","No","normal","busy","normal","No","",""
"15:32 York to Glasgow - Eleanor","2002-01-31","15:30:00","2002-01-31","21:00:00","Arrives 21:00","","","No","normal","busy","normal","No","",""
"Hertz Car Reservation","2002-01-31","21:30:00","2002-01-31","22:00:00","Ref:B7132614D97","","","No","normal","busy","normal","No","",""
"Work In Largs","2002-02-01","09:00:00","2002-02-01","17:30:00","","","","No","normal","busy","normal","No","",""
"[york]","2002-02-01","18:00:00","2002-02-01","19:00:00","","","","No","normal","busy","normal","No","",""
"18:00 Train to York","2002-02-04","18:00:00","2002-02-04","21:30:00","Arrives 21:30","","","No","normal","busy","normal","No","",""
"Guild - TBA","2002-02-06","19:00:00","2002-02-06","21:00:00","","","","No","normal","busy","normal","No","",""
"Nationwide to Collect Car","2002-02-07","08:00:00","2002-02-07","08:30:00","","","","No","normal","busy","normal","No","",""
"Osteopath","2002-02-08","12:30:00","2002-02-08","13:30:00","","","","No","normal","busy","normal","No","",""
"[london]","2002-02-08","18:00:00","2002-02-08","19:00:00","","Eleanor get 17.50 from york

","","No","normal","busy","normal","No","",""
"17:50 Eleanor York  to KX","2002-02-08","18:00:00","2002-02-08","20:00:00","","","","No","normal","busy","normal","No","",""
"Sounds Alarming, Tel:020 8301 1234","2002-02-09","16:00:00","2002-02-09","17:00:00","Welling","","","No","normal","busy","normal","No","",""
"Silverleigh","2002-02-09","18:00:00","2002-02-09","22:00:00","","","","No","normal","busy","normal","No","",""
"Doncaster Dome","2002-02-09","19:00:00","2002-02-09","22:30:00","","","","No","normal","busy","normal","No","",""
"Sunday Lunch with Helen??","2002-02-10","13:00:00","2002-02-10","13:30:00","","","","No","normal","busy","normal","No","",""
"05:55 Eleanor KX to York","2002-02-11","06:00:00","2002-02-11","08:30:00","","","","No","normal","busy","normal","No","",""
"NO Aromatherapy - Half Term","2002-02-11","17:00:00","2002-02-11","19:15:00","","","","No","normal","busy","normal","No","",""
"Guild - Fire Investigation","2002-02-12","19:00:00","2002-02-12","21:00:00","","","","No","normal","busy","normal","No","",""
"[york]","2002-02-15","18:00:00","2002-02-15","19:00:00","","","","No","normal","busy","normal","No","",""
"wr working weekend","2002-02-16","10:00:00","2002-02-17","16:00:00","","","","No","normal","busy","normal","No","",""
"Dave And Ann TBA","2002-02-17","17:00:00","2002-02-17","19:00:00","","","","No","normal","busy","normal","No","",""
"FW: ENPS  meeting","2002-02-18","13:00:00","2002-02-18","14:30:00","Rm 525 BH","-----Original Appointment-----
From: 	Mike Roscoe-ENPS  
Sent:	08 February 2002 12:54
To:	Mike Roscoe-ENPS; Ticks Safri; Richard Crawford
Subject:	ENPS  meeting 
When:	18 February 2002 13:00-14:30 (GMT) Greenwich Mean Time : Dublin, Edinburgh, Lisbon, London.
Where:	Rm 525 BH


To discuss 

1. AP's use of a non user account to handle 2000 ENPS installation on secure desktops.

2. MSI - problems found by AP when attempting to implement previously agreed MSI installation.
","","No","normal","tentative","normal","No","",""
"FW: ENPS  meeting ","2002-02-18","13:00:00","2002-02-18","14:30:00","Rm 525 BH","

 -----Original Appointment-----
From: 	Mike Roscoe-ENPS  
Sent:	08 February 2002 12:54
To:	Mike Roscoe-ENPS; Ticks Safri; Richard Crawford
Subject:	ENPS  meeting 
When:	18 February 2002 13:00-14:30 (GMT) Greenwich Mean Time : Dublin, Edinburgh, Lisbon, London.
Where:	Rm 525 BH


To discuss 

1. AP's use of a non user account to handle 2000 ENPS installation on secure desktops.

2. MSI - problems found by AP when attempting to implement previously agreed MSI installation. 



","","No","normal","tentative","normal","No","",""
"FW: ENPS/DSD","2002-02-19","11:00:00","2002-02-19","13:00:00","210BH","

> -----Original Appointment-----
>From: 	Kirtida Parekh  
>Sent:	13 February 2002 16:31
>To:	Kirtida Parekh; Theresa Goldband; Ken Skuse; Ticks Safri; Jackie Kearney; Jenny Saunders-ENPS; Spencer Healey; Richard Crawford; Darrel deSouza; Dean Biffin
>Subject:	ENPS/DSD
>When:	19 February 2002 11:00-13:00 (GMT) Greenwich Mean Time : Dublin, Edinburgh, Lisbon, London.
>Where:	210BH
>
>Please note that Firday's meeting has been rescheduled and will now take place on Tuesday 19 February 2002 at 11am.
>
>
","","No","normal","tentative","normal","No","",""
"Steven r","2002-02-20","18:30:00","2002-02-20","19:30:00","China","","","No","normal","busy","normal","No","",""
"FW: ENPS/DSD","2002-02-21","11:00:00","2002-02-21","13:00:00","210BH","

> -----Original Appointment-----
>From: 	Kirtida Parekh  
>Sent:	13 February 2002 16:34
>To:	Kirtida Parekh; Mike Roscoe-ENPS
>Subject:	ENPS/DSD
>When:	19 February 2002 11:00-13:00 (GMT) Greenwich Mean Time : Dublin, Edinburgh, Lisbon, London.
>Where:	210BH
>
>Michael
>
>The meeting on Friday has been rescheduled and will now take place on Tuesday 19 February 2002.
>
>Thanks
>
>
","","No","normal","tentative","normal","No","",""
"Evening - Eleanor to London -- Packed for a holiday!!!!!","2002-02-21","18:00:00","2002-02-21","20:00:00","","","","No","normal","busy","normal","No","",""
"[london]","2002-02-22","12:00:00","2002-02-22","13:00:00","","","","No","normal","busy","normal","No","",""
"Diabetic checkup","2002-02-22","15:45:00","2002-02-22","16:45:00","Mayday","","","No","normal","busy","normal","No","",""
"travel to miami Flight is 13.30 at terminal 3","2002-02-23","09:00:00","2002-02-23","09:00:00","","","","No","normal","busy","private","No","",""
"[holiday]","2002-02-23","12:00:00","2002-03-09","13:00:00","","","","No","normal","busy","normal","No","",""
"Stamp fair","2002-03-02","10:00:00","2002-03-02","16:30:00","","","","No","normal","busy","normal","No","",""
"wr working weekend","2002-03-02","11:00:00","2002-03-03","16:00:00","","","","No","normal","busy","private","No","",""
"return from jfk to london","2002-03-08","09:00:00","2002-03-08","09:00:00","","","","No","normal","busy","normal","No","",""
"returned from jfk 08:05","2002-03-09","08:00:00","2002-03-09","10:30:00","","","","No","normal","busy","normal","No","",""
"Hair","2002-03-09","15:00:00","2002-03-09","16:00:00","","","","No","normal","busy","normal","No","",""
"York Waterworld","2002-03-09","19:00:00","2002-03-09","22:30:00","","","","No","normal","busy","normal","No","",""
"Silverleigh","2002-03-09","19:00:00","2002-03-09","22:30:00","","","","No","normal","busy","normal","No","",""
"[Eleanor to York]","2002-03-10","17:30:00","2002-03-10","18:00:00","","","","No","normal","busy","normal","No","",""
"Guild - St Johns College","2002-03-13","19:00:00","2002-03-13","21:00:00","","","","No","normal","busy","normal","No","",""
"X-Box Day","2002-03-14","11:00:00","2002-03-14","18:30:00","","","","No","normal","busy","normal","No","",""
"12:30 Osteopath","2002-03-15","12:00:00","2002-03-15","12:00:00","","","","No","normal","busy","normal","No","",""
"[york]","2002-03-15","18:00:00","2002-03-15","19:00:00","","","","No","normal","busy","normal","No","",""
"[london]","2002-03-15","18:00:00","2002-03-15","19:00:00","","","","No","normal","busy","normal","No","",""
"Thai in Hull (Sue & Kevin)","2002-03-15","19:00:00","2002-03-15","20:30:00","","","","No","normal","busy","normal","No","",""
"Cop Parish Council Meeting - Youth Club","2002-03-19","19:30:00","2002-03-19","19:30:00","","","","No","normal","busy","normal","No","",""
"stoke radioman intall","2002-03-21","All Day","2002-03-21","All Day","","","","Yes","normal","busy","private","No","",""
"stoke","2002-03-22","All Day","2002-03-22","All Day","","","","Yes","normal","busy","private","No","",""
"Theoretical Appt Architect","2002-03-22","09:00:00","2002-03-22","09:30:00","","","","No","normal","busy","normal","No","",""
"[york]","2002-03-22","12:00:00","2002-03-22","13:00:00","","","","No","normal","busy","normal","No","",""
"wr working weekend","2002-03-23","10:00:00","2002-03-24","16:00:00","","","","No","normal","free","normal","No","",""
"NO Aromatherapy - Easter","2002-03-25","17:00:00","2002-03-25","19:15:00","","","","No","normal","busy","normal","No","",""
"(No Subject)","2002-04-17","22:00:00","2002-04-17","22:00:00","","","","No","normal","busy","normal","No","",""
"Canceled: GNS Genie - Soton trial - Technical","2002-05-31","13:00:00","2002-05-31","15:00:00","TBA","Meeting as per Martin's suggestion  - the location is likely to be White City

Regards

Kevin
","","No","high","tentative","normal","No","",""
"ZSL Event - Night of the Toucan (£14)","2002-06-20","16:00:00","2002-06-20","18:00:00","London Zoo.  Phone 020 7449 6313 to book","","","No","normal","tentative","normal","No","",""
"Gloucester Meeting","2002-07-02","08:30:00","2002-07-02","16:00:00","Hatherley Manor Hotel, Gloucester","","","No","normal","busy","normal","No","",""
"Vicky McGregor's Anniversary (06/07/2002)","2002-07-06","All Day","2002-07-06","All Day","","","","Yes","normal","free","normal","Yes","RRULE;FREQ=YEARLY;INTERVAL=12;BYMONTHDAY=6",""
"Scott & Vicky McGregor's Anniversary (06/07/2002)","2002-07-06","All Day","2002-07-06","All Day","","","","Yes","normal","free","normal","Yes","RRULE;FREQ=YEARLY;INTERVAL=12;BYMONTHDAY=6",""
"FW: Updated: ENPS/Go-Digital Liaison","2002-07-30","10:30:00","2002-07-30","12:00:00","G22 NW","Tom,

 as discussed a moment ago. 

lets talk handover items on friday

> -----Original Appointment-----
>From: 	Anne Melesk  
>Sent:	17 July 2002 16:18
>To:	Anne Melesk; Benny Ammar; John Conway; Peter Duxbury; Theresa Goldband; Ken Skuse; Mike Roscoe-ENPS; Maja Samolov; 'Steve Giles'; John Jordan-W1; Mike Cronk and Assistant; Dave Cooke; Julian Briscoe
>Subject:	Updated: ENPS/Go-Digital Liaison
>When:	30 July 2002 11:30-13:00 (GMT) Greenwich Mean Time : Dublin, Edinburgh, Lisbon, London.
>Where:	G22 NW
>
>I am very sorry but I need to reschedule this appointment.  I hope the new suggestion is convenient and look forward to hearing.
>Thank you.
>
>Anne Melesk
>Project Support Officer
>BBC World Service Go Digital Project 
>
>*	020 755 71236  
>*	Fax:  020 7240 4631
>*  	Room 216SE, Bush House,  PO Box 76, Strand, London WC2B 4PH
>*	mailto:anne.melesk@bbc.co.uk 
>*	http://worldservice.gateway.bbc.co.uk/techres/godigital/homegodigital.htm
>
>
","","No","normal","tentative","normal","No","",""
"Doncaster Dome","2002-08-10","18:00:00","2002-08-10","21:30:00","","","","No","normal","busy","normal","No","",""
"Diabetic Clinic","2002-09-06","14:00:00","2002-09-06","15:00:00","","","","No","normal","busy","normal","No","",""
"Stamp fair","2002-09-07","09:00:00","2002-09-07","15:30:00","","","","No","normal","busy","private","No","",""
"Lucy and Richard in York for Weekend","2002-09-07","18:00:00","2002-09-07","21:00:00","","","","No","normal","busy","private","No","",""
"(No Subject)","2002-09-17","12:00:00","2002-09-17","12:00:00","","","","No","normal","busy","normal","No","",""
"Selby (true)","2002-09-21","17:00:00","2002-09-21","17:30:00","","","","No","normal","busy","normal","No","",""
"David Rule -- London Flying Visit","2002-10-03","16:00:00","2002-10-03","17:30:00","","","","No","normal","busy","normal","No","",""
"Wr - cottage pie","2002-10-05","17:00:00","2002-10-05","20:00:00","","","","No","normal","busy","normal","No","",""
"(No Subject)","2002-10-07","10:30:00","2002-10-07","10:30:00","","","","No","normal","busy","normal","No","",""
"(No Subject)","2002-10-07","10:30:00","2002-10-07","10:30:00","United Kingdom","","","No","normal","busy","normal","No","",""
"(No Subject)","2002-10-07","13:00:00","2002-10-07","13:00:00","","","","No","normal","busy","normal","No","",""
"(No Subject)","2002-10-07","13:00:00","2002-10-07","13:00:00","United Kingdom","","","No","normal","busy","normal","No","",""
"tom meeting ","2002-10-08","09:15:00","2002-10-08","09:45:00","Rm. ","could we make it 10.15?  - Alan has asked me to run a test at 0930 in News24

","","No","normal","tentative","normal","No","",""
"Doncaster Dome","2002-10-12","18:00:00","2002-10-12","21:30:00","","","","No","normal","busy","normal","No","",""
"Jacks Funeral","2002-10-22","09:00:00","2002-10-22","09:00:00","","","","No","normal","busy","normal","No","",""
"Dea Mahone - Museums H&S","2002-10-23","09:00:00","2002-10-23","09:00:00","","","","No","normal","busy","normal","No","",""
"Michael Palin Signing at Borders","2002-10-24","11:00:00","2002-10-24","12:00:00","","","","No","normal","busy","normal","No","",""
"Altiris Demonstration","2002-10-25","11:00:00","2002-10-25","12:00:00","2142 TVC","Please can everyone make every attempt to attend this meeting. I think you'll find it very useful.

PLEASE NOTE THE CHANGE OF ROOM.

Regards, Julia
","","No","normal","busy","normal","No","",""
"Expect timesheets ar end of month","2002-10-25","17:00:00","2002-10-25","18:00:00","","","","No","normal","busy","normal","No","",""
"Tracy to London","2002-10-25","18:00:00","2002-10-25","18:00:00","","","","No","normal","busy","normal","No","",""
"Monthly Management Team Meeting","2002-10-31","09:30:00","2002-10-31","12:00:00","","","","No","normal","busy","normal","No","",""
"Blackpool weekend","2002-11-01","08:30:00","2002-11-03","16:00:00","","","","No","normal","busy","normal","No","",""
"Anne et al to Amsterdam","2002-11-01","10:00:00","2002-11-01","10:00:00","","","","No","normal","busy","normal","No","",""
"Lucy ","2002-11-01","10:30:00","2002-11-01","10:30:00","White city","Sheila's email 

Anniversary preparation 
","","No","normal","busy","normal","No","",""
"[york]","2002-11-01","18:00:00","2002-11-01","19:00:00","","","","No","normal","busy","normal","No","",""
"Stamp fair","2002-11-02","10:00:00","2002-11-02","16:30:00","","","","No","normal","busy","private","No","",""
"Wr- halloween","2002-11-02","17:30:00","2002-11-02","22:30:00","","","","No","normal","busy","normal","No","",""
"Rod and Pam??","2002-11-04","19:00:00","2002-11-04","20:30:00","","","","No","normal","busy","normal","No","",""
"BSC - Birmingham","2002-11-06","09:30:00","2002-11-06","16:00:00","","","","No","normal","busy","normal","No","",""
"Updated: Go-Digital/ENPS Liaison","2002-11-06","12:00:00","2002-11-06","13:30:00","","I'm afraid that I need to move this meeting; is this suggestion any good for you all?
Many thanks.

Anne Melesk
Project Support Officer
BBC World Service Go Digital Project 

(	020 755 71236  
2	Fax:  020 7240 4631
*  	Roo
","","No","normal","busy","normal","No","",""
"Lucy in wc","2002-11-07","12:00:00","2002-11-07","13:00:00","","","","No","normal","busy","normal","No","",""
"Osteopath","2002-11-08","12:30:00","2002-11-08","12:30:00","","","","No","normal","busy","normal","No","",""
"Laurence Culhane (3CR) Luton","2002-11-08","13:30:00","2002-11-08","17:30:00","","","","No","normal","busy","normal","No","",""
"Possible chinese","2002-11-08","19:00:00","2002-11-08","20:00:00","","","","No","normal","busy","normal","No","",""
"chinese","2002-11-08","19:00:00","2002-11-08","20:00:00","","","","No","normal","busy","normal","No","",""
"Hair Cuts","2002-11-09","09:00:00","2002-11-09","09:30:00","","","","No","normal","busy","normal","No","",""
"Workload Meeting","2002-11-12","09:30:00","2002-11-12","11:30:00","","","","No","normal","busy","normal","No","",""
"Polo to Layerthorpe","2002-11-13","08:15:00","2002-11-13","08:15:00","","","","No","normal","busy","normal","No","",""
"(No Subject)","2002-11-15","08:00:00","2002-11-15","08:30:00","","","","No","normal","busy","normal","No","",""
"byke","2002-11-15","09:00:00","2002-11-15","09:00:00","","","","No","normal","busy","normal","No","",""
"Lucy in White City","2002-11-15","10:00:00","2002-11-15","10:30:00","","","","No","normal","busy","normal","No","",""
"Lucy in enps","2002-11-15","12:00:00","2002-11-15","13:00:00","","","","No","normal","busy","normal","No","",""
"Tom & Lucy ","2002-11-20","10:00:00","2002-11-20","13:30:00","Isleworth","Install Sync at Lucy's home. Isleworth

","","No","normal","busy","normal","No","",""
"Tom & Lucy DDT London Office","2002-11-20","10:00:00","2002-11-20","13:30:00","Croydon","","","No","normal","busy","normal","No","",""
"1-1 Maria","2002-11-20","14:00:00","2002-11-20","16:00:00","","","","No","normal","busy","normal","No","",""
"Testing this machine","2002-11-21","11:00:00","2002-11-21","11:30:00","","","","No","normal","busy","normal","No","",""
"Lucy  -  [Harry OCC]","2002-11-21","12:00:00","2002-11-21","13:00:00","","","","No","normal","busy","normal","No","",""
"John meeting radioman","2002-11-25","09:00:00","2002-11-25","09:00:00","","","","No","normal","busy","normal","No","",""
"pick up dry cleaning","2002-11-25","16:00:00","2002-11-25","16:00:00","","","","No","normal","busy","normal","No","",""
"Monthly Management Team Meeting","2002-11-28","09:30:00","2002-11-28","12:00:00","","","","No","normal","busy","normal","No","",""
"Ddt xmas dinner","2002-11-29","19:30:00","2002-11-29","23:30:00","","","","No","normal","busy","normal","No","",""
"lucy  [Harry] ","2002-12-01","12:00:00","2002-12-05","13:00:00","Stanmore hospital","Lucy  - Not sure of op time or when available for work

","","No","normal","out-of-office","normal","No","",""
"Workload Meeting","2002-12-10","09:30:00","2002-12-10","11:30:00","","","","No","normal","busy","normal","No","",""
"Haircut","2002-12-11","14:00:00","2002-12-11","14:30:00","","","","No","normal","busy","normal","No","",""
"Lucy in WC office","2002-12-12","10:30:00","2002-12-12","11:00:00","","","","No","normal","busy","normal","No","",""
"DDT Team meeting","2002-12-12","11:00:00","2002-12-12","11:30:00","room 5162","","","No","normal","busy","normal","No","",""
"ENPS Christmas Party!!","2002-12-12","13:00:00","2002-12-12","15:00:00","Bridge Lounge, TVC","Hi Everyone 

Pretend that this rhymes!

'Twas seven weeks before Christmas, when all through the ENPS house
Not a creature is stirring because we are in the middle of roll-outs;
Now its Quantel testing in Evesham and bashing in Belfast,
I bet you the last thing on everyone's mind is Christmast J

So glad that Alan is back snug by his desk,
But Sheila is still in India and Jenny has escaped to Nice;
We are moving our office in a couple of months,
Just hope that everyone can make it to our ENPS Christmas Lunch!

With our schedules a busy sometimes we want to shout
""Now, RadioMan! now, GoDigital! - Just get out!
Now, Jupiter! now, MOS! - We want to be free!""
From the top of White City! to the top of TVC!

The ENPS Christmas Lunch is on Thursday 12th December from 1pm to 3 
Send me names to invite by Friday 15 November, quickly...please!
'Twill be a buffet in the Bridge Lounge with lots of liquids especially beer,
Looking forward to celebrate a job well done and a well deserved good cheer!

Regards
Jacqui
","","No","normal","tentative","normal","No","",""
"Osteopath","2002-12-13","12:30:00","2002-12-13","12:30:00","","","","No","normal","busy","normal","No","",""
"Lucy  -  school xmas fete","2002-12-13","14:00:00","2002-12-13","18:00:00","","","","No","normal","busy","normal","No","",""
"Doncaster Dome","2002-12-14","19:00:00","2002-12-14","22:30:00","","","","No","normal","busy","normal","No","",""
"Lucy ln WC","2002-12-16","12:00:00","2002-12-16","13:00:00","","","","No","normal","busy","normal","No","",""
"1-1 Maria","2002-12-18","14:00:00","2002-12-18","16:00:00","","","","No","normal","busy","normal","No","",""
"today","2002-12-19","09:00:00","2002-12-19","09:00:00","","","","No","normal","busy","normal","No","",""
"Monthly Management Team Meeting","2002-12-26","09:30:00","2002-12-26","12:00:00","","","","No","normal","busy","normal","No","",""
"[York]","2003-01-03","18:00:00","2003-01-03","18:15:00","","","","No","normal","busy","normal","No","",""
"8","2003-01-10","09:00:00","2003-01-10","09:00:00","","","","No","normal","busy","normal","No","",""
"Dentist","2003-01-13","08:40:00","2003-01-13","09:00:00","","","","No","normal","busy","private","No","",""
"Workload Meeting","2003-01-14","09:30:00","2003-01-14","11:30:00","","","","No","normal","busy","normal","No","",""
"1-1 Maria","2003-01-15","14:00:00","2003-01-15","16:00:00","","","","No","normal","busy","normal","No","",""
"Reni","2003-01-23","09:30:00","2003-01-23","10:30:00","","","","No","normal","busy","normal","No","",""
"Ghurkha - Orpington","2003-01-25","19:00:00","2003-01-25","19:30:00","Gurka","","","No","normal","busy","normal","No","",""
"Sauna nepalese","2003-01-25","19:30:00","2003-01-25","23:00:00","","","","No","normal","busy","normal","No","",""
"Monthly Management Team Meeting","2003-01-30","09:30:00","2003-01-30","12:00:00","","","","No","normal","busy","normal","No","",""
"Expect timesheets ar end of month","2003-01-31","18:00:00","2003-01-31","19:00:00","","","","No","normal","busy","normal","No","",""
"York WaterWorld [True]","2003-02-08","18:00:00","2003-02-08","20:00:00","","","","No","normal","busy","normal","No","",""
"Workload Meeting","2003-02-11","09:30:00","2003-02-11","11:30:00","","","","No","normal","busy","normal","No","",""
"Monthly Management Team Meeting","2003-02-27","09:30:00","2003-02-27","12:00:00","","","","No","normal","busy","normal","No","",""
"Expect timesheets ar end of month","2003-02-28","18:00:00","2003-02-28","19:00:00","","","","No","normal","busy","normal","No","",""
"Facilities Team Meeting","2003-03-05","14:00:00","2003-03-05","15:30:00","","","","No","normal","busy","normal","No","",""
"Workload Meeting","2003-03-11","09:30:00","2003-03-11","11:30:00","","","","No","normal","busy","normal","No","",""
"1-1 Maria","2003-03-19","14:00:00","2003-03-19","16:00:00","","","","No","normal","busy","normal","No","",""
"Monthly Management Team Meeting","2003-03-27","09:30:00","2003-03-27","12:00:00","","","","No","normal","busy","normal","No","",""
"Expect timesheets ar end of month","2003-03-28","18:00:00","2003-03-28","19:00:00","","","","No","normal","busy","normal","No","",""
"Facilities Team Meeting","2003-04-02","13:00:00","2003-04-02","14:30:00","","","","No","normal","busy","normal","No","",""
"Workload Meeting","2003-04-08","08:30:00","2003-04-08","10:30:00","","","","No","normal","busy","normal","No","",""
"York Waterworld [True]","2003-04-12","16:30:00","2003-04-12","17:00:00","","","","No","normal","busy","normal","No","",""
"1-1 Maria","2003-04-16","13:00:00","2003-04-16","15:00:00","","","","No","normal","busy","normal","No","",""
"Monthly Management Team Meeting","2003-04-24","08:30:00","2003-04-24","11:00:00","","","","No","normal","busy","normal","No","",""
"Expect timesheets ar end of month","2003-04-25","17:00:00","2003-04-25","18:00:00","","","","No","normal","busy","normal","No","",""
"Facilities Team Meeting","2003-05-07","13:00:00","2003-05-07","14:30:00","","","","No","normal","busy","normal","No","",""
"Harrogate Turkish Bath","2003-05-10","16:30:00","2003-05-10","17:00:00","","","","No","normal","busy","normal","No","",""
"Workload Meeting","2003-05-13","08:30:00","2003-05-13","10:30:00","","","","No","normal","busy","normal","No","",""
"1-1 Maria","2003-05-21","13:00:00","2003-05-21","15:00:00","","","","No","normal","busy","normal","No","",""
"Monthly Management Team Meeting","2003-05-29","08:30:00","2003-05-29","11:00:00","","","","No","normal","busy","normal","No","",""
"Expect timesheets ar end of month","2003-05-30","17:00:00","2003-05-30","18:00:00","","","","No","normal","busy","normal","No","",""
"Facilities Team Meeting","2003-06-04","13:00:00","2003-06-04","14:30:00","","","","No","normal","busy","normal","No","",""
"Workload Meeting","2003-06-10","08:30:00","2003-06-10","10:30:00","","","","No","normal","busy","normal","No","",""
"York WaterWorld {true]","2003-06-14","16:30:00","2003-06-14","17:00:00","","","","No","normal","busy","normal","No","",""
"1-1 Maria","2003-06-18","13:00:00","2003-06-18","15:00:00","","","","No","normal","busy","normal","No","",""
"Monthly Management Team Meeting","2003-06-26","08:30:00","2003-06-26","11:00:00","","","","No","normal","busy","normal","No","",""
"Expect timesheets ar end of month","2003-06-27","17:00:00","2003-06-27","18:00:00","","","","No","normal","busy","normal","No","",""
"Facilities Team Meeting","2003-07-02","13:00:00","2003-07-02","14:30:00","","","","No","normal","busy","normal","No","",""
"Workload Meeting","2003-07-08","08:30:00","2003-07-08","10:30:00","","","","No","normal","busy","normal","No","",""
"1-1 Maria","2003-07-16","13:00:00","2003-07-16","15:00:00","","","","No","normal","busy","normal","No","",""
"Expect timesheets ar end of month","2003-07-25","17:00:00","2003-07-25","18:00:00","","","","No","normal","busy","normal","No","",""
"Pencil in white rose do.","2003-07-26","18:30:00","2003-07-26","22:00:00","","","","No","normal","busy","normal","No","",""
"Monthly Management Team Meeting","2003-07-31","08:30:00","2003-07-31","11:00:00","","","","No","normal","busy","normal","No","",""
"Facilities Team Meeting","2003-08-06","13:00:00","2003-08-06","14:30:00","","","","No","normal","busy","normal","No","",""
"York Waterworld [True]","2003-08-16","17:00:00","2003-08-16","20:00:00","","","","No","normal","busy","normal","No","",""
"1-1 Maria","2003-08-20","13:00:00","2003-08-20","15:00:00","","","","No","normal","busy","normal","No","",""
"Expect timesheets ar end of month","2003-08-29","17:00:00","2003-08-29","18:00:00","","","","No","normal","busy","normal","No","",""
"Facilities Team Meeting","2003-09-03","13:00:00","2003-09-03","14:30:00","","","","No","normal","busy","normal","No","",""
"Facilities Team Meeting","2003-10-01","13:00:00","2003-10-01","14:30:00","","","","No","normal","busy","normal","No","",""
"York Waterworld [True]","2003-10-11","16:30:00","2003-10-11","17:00:00","","","","No","normal","busy","normal","No","",""
"Facilities Team Meeting","2003-11-05","14:00:00","2003-11-05","15:30:00","","","","No","normal","busy","normal","No","",""
"Harrogate turkish bath","2003-11-08","17:30:00","2003-11-08","18:00:00","","","","No","normal","busy","normal","No","",""
"Monthly Management Team Meeting","2003-11-27","09:30:00","2003-11-27","12:00:00","","","","No","normal","busy","normal","No","",""
"Facilities Team Meeting","2003-12-03","14:00:00","2003-12-03","15:30:00","","","","No","normal","busy","normal","No","",""
"Workload Meeting","2003-12-09","09:30:00","2003-12-09","11:30:00","","","","No","normal","busy","normal","No","",""
"York WaterWorld[true]","2003-12-13","17:30:00","2003-12-13","18:00:00","","","","No","normal","busy","normal","No","",""
"Monthly Management Team Meeting","2003-12-25","09:30:00","2003-12-25","12:00:00","","","","No","normal","busy","normal","No","",""
"Workload Meeting","2004-01-13","09:30:00","2004-01-13","11:30:00","","","","No","normal","busy","normal","No","",""
"Virgin Dundee - York","2004-01-18","13:01:00","2004-01-18","19:02:00","","","","No","normal","busy","normal","No","",""
"Anniversary - Auntie Van died (19/01/2004)","2004-01-19","All Day","2004-01-19","All Day","","","","Yes","normal","free","normal","Yes","RRULE;FREQ=YEARLY;INTERVAL=12;BYMONTHDAY=19",""
"Birthday - Helen Hushon-Brown (19/01/2004)","2004-01-19","All Day","2004-01-19","All Day","","","","Yes","normal","free","normal","Yes","RRULE;FREQ=YEARLY;INTERVAL=12;BYMONTHDAY=19",""
"Anniversary - Helen & Noel (19/01/2004)","2004-01-19","All Day","2004-01-19","All Day","","","","Yes","normal","free","normal","Yes","RRULE;FREQ=YEARLY;INTERVAL=12;BYMONTHDAY=19",""
"Anniversary - Poke died (20/01/2004)","2004-01-20","All Day","2004-01-20","All Day","","","","Yes","normal","free","normal","Yes","RRULE;FREQ=YEARLY;INTERVAL=12;BYMONTHDAY=20",""
"Women In Management - Relaxation Techniques","2004-01-20","19:00:00","2004-01-20","21:30:00","Leeds","","","No","normal","busy","normal","No","",""
"1-1 Maria","2004-01-21","14:00:00","2004-01-21","16:00:00","","","","No","normal","busy","normal","No","",""
"Birthday - Peter Hobson (22/01/2004)","2004-01-22","All Day","2004-01-22","All Day","","","","Yes","normal","free","private","Yes","RRULE;FREQ=YEARLY;INTERVAL=12;BYMONTHDAY=22",""
"Has payroll arrived?","2004-01-24","18:00:00","2004-01-24","19:00:00","","","","No","normal","busy","private","No","",""
"Birthday - Charley Tippets (25/01/2004)","2004-01-25","All Day","2004-01-25","All Day","","","","Yes","normal","free","normal","Yes","RRULE;FREQ=YEARLY;INTERVAL=12;BYMONTHDAY=25",""
"Birthday - Charley Tippets","2004-01-25","All Day","2004-01-25","All Day","","","","Yes","normal","busy","private","No","",""
"Birthday - Paul Akroyd (26/01/2004)","2004-01-26","All Day","2004-01-26","All Day","","","","Yes","normal","busy","private","Yes","RRULE;FREQ=YEARLY;INTERVAL=12;BYMONTHDAY=26",""
"Pay people","2004-01-26","18:00:00","2004-01-26","19:00:00","","","","No","normal","busy","normal","No","",""
"Ensure payroll records updated","2004-01-26","21:00:00","2004-01-26","22:00:00","","","","No","normal","busy","normal","No","",""
"Birthday - Wally Labrom (27/01/2004)","2004-01-27","All Day","2004-01-27","All Day","","","","Yes","normal","free","normal","Yes","RRULE;FREQ=YEARLY;INTERVAL=12;BYMONTHDAY=27",""
"Scout Paper Collection","2004-01-27","08:00:00","2004-01-27","08:00:00","","","","No","normal","busy","private","No","",""
"Guild of Building (Modern Communications) (Swinegate Internet Cafe)","2004-01-27","19:30:00","2004-01-27","22:00:00","","","","No","normal","busy","normal","No","",""
"Guild of Building (Modern Communications)","2004-01-27","19:30:00","2004-01-27","22:00:00","Swinegate Internet Cafe","","","No","normal","busy","normal","No","",""
"Sent invoices yet?","2004-01-28","19:00:00","2004-01-28","20:00:00","","","","No","normal","busy","private","No","",""
"Take The Piss","2004-01-28","21:30:00","2004-01-28","23:00:00","","","","No","normal","busy","normal","No","",""
"Birthday - Sue Humphries (29/01/2004)","2004-01-29","All Day","2004-01-29","All Day","","","","Yes","normal","busy","private","Yes","RRULE;FREQ=YEARLY;INTERVAL=12;BYMONTHDAY=29",""
"Monthly Management Team Meeting","2004-01-29","09:30:00","2004-01-29","12:00:00","","","","No","normal","busy","normal","No","",""
"Anniversary - Jen Dow died (30/01/2004)","2004-01-30","All Day","2004-01-30","All Day","","","","Yes","normal","busy","private","Yes","RRULE;FREQ=YEARLY;INTERVAL=12;BYMONTHDAY=30",""
"Birthday- Margaret McKinlay (30/01/2004)","2004-01-30","All Day","2004-01-30","All Day","","","","Yes","normal","free","normal","Yes","RRULE;FREQ=YEARLY;INTERVAL=12;BYMONTHDAY=30",""
"Anniversary - Jen Dow died (30/01/2004)","2004-01-30","All Day","2004-01-30","All Day","","","","Yes","normal","free","private","Yes","RRULE;FREQ=YEARLY;INTERVAL=12;BYMONTHDAY=30",""
"Birthday Peter Hamilton (30/01/2004)","2004-01-30","All Day","2004-01-30","All Day","","","","Yes","normal","free","normal","Yes","RRULE;FREQ=YEARLY;INTERVAL=12;BYMONTHDAY=30",""
"Copmanthorpe Quiz Night (St Giles Centre)","2004-01-31","19:30:00","2004-01-31","22:00:00","","","","No","normal","busy","normal","No","",""
"Copmanthorpe Quiz Night","2004-01-31","19:30:00","2004-01-31","22:00:00","St Giles Centre","","","No","normal","busy","normal","No","",""
"York - Recycling / Green Bin","2004-02-02","All Day","2004-02-03","All Day","","","","Yes","normal","busy","normal","No","",""
"Anniversary - Birthday of Neil Swayne (02/02/2004)","2004-02-02","All Day","2004-02-02","All Day","","","","Yes","normal","free","private","Yes","RRULE;FREQ=YEARLY;INTERVAL=12;BYMONTHDAY=2",""
"Birthday - Neil Swayne (02/02/2004)","2004-02-02","All Day","2004-02-02","All Day","","","","Yes","normal","busy","private","Yes","RRULE;FREQ=YEARLY;INTERVAL=12;BYMONTHDAY=2",""
"Birthday - Hannah Wilkinson (03/02/2004)","2004-02-03","All Day","2004-02-03","All Day","","","","Yes","normal","free","private","Yes","RRULE;FREQ=YEARLY;INTERVAL=12;BYMONTHDAY=3",""
"Stamp Issue - Occassions","2004-02-03","All Day","2004-02-04","All Day","","","","Yes","normal","free","normal","No","",""
"Birthday - Sam McKinlay (03/02/2004)","2004-02-03","All Day","2004-02-03","All Day","","","","Yes","normal","free","private","Yes","RRULE;FREQ=YEARLY;INTERVAL=12;BYMONTHDAY=3",""
"Guild of Building (Lecture) (Bedern Hall)","2004-02-04","19:00:00","2004-02-04","22:00:00","","","","No","normal","busy","normal","No","",""
"Guild of Building (Lecture)","2004-02-04","19:00:00","2004-02-04","22:00:00","Bedern Hall","","","No","normal","busy","normal","No","",""
"York Rural West Ward Committee Meeting","2004-02-05","19:30:00","2004-02-05","21:30:00","Rufforth School","","","No","normal","busy","normal","No","",""
"Anniversary - George & Lilian (06/02/2004)","2004-02-06","All Day","2004-02-06","All Day","","","","Yes","normal","free","private","Yes","RRULE;FREQ=YEARLY;INTERVAL=12;BYMONTHDAY=6",""
"Birthday - Barbara Brown (06/02/2004)","2004-02-06","All Day","2004-02-06","All Day","","","","Yes","normal","free","private","Yes","RRULE;FREQ=YEARLY;INTERVAL=12;BYMONTHDAY=6",""
"Birthday - Barbara Brown (06/02/2004)","2004-02-06","All Day","2004-02-06","All Day","","","","Yes","normal","free","private","Yes","RRULE;FREQ=YEARLY;INTERVAL=12;BYMONTHDAY=6",""
"[KegWorth (Peng)]","2004-02-06","18:00:00","2004-02-06","18:30:00","","","","No","normal","busy","normal","No","",""
"Birthday - Geoff Prestage (?)","2004-02-09","All Day","2004-02-10","All Day","","","","Yes","normal","free","private","No","",""
"Birthday - Geoff Prestage (?) (10/02/2004)","2004-02-10","All Day","2004-02-10","All Day","","","","Yes","normal","free","private","Yes","RRULE;FREQ=YEARLY;INTERVAL=12;BYMONTHDAY=10",""
"Guild of Building (DDA)","2004-02-10","19:30:00","2004-02-10","22:00:00","Bedern Hall","","","No","normal","busy","normal","No","",""
"CMI - The Stress of Team Dynamics","2004-02-11","18:30:00","2004-02-11","22:00:00","York College","","","No","normal","busy","normal","No","",""
"FW: Reading uni IT","2004-02-12","All Day","2004-02-13","All Day","Reading University"," -----Original Appointment----- 
From:   Liam Proudlock  
Sent:   15 January 2004 12:24 
To:     Liam Proudlock; Paul Balbi; Robert Langford; 'claire jennings'; Claire Jennings-Disability; Gary ODonoghue 
Subject:        Reading uni IT 
When:   12 February 2004 00:00 to 13 February 2004 00:00 (GMT) Greenwich Mean Time : Dublin, Edinburgh, Lisbon, London. 
Where:  Reading University 

<<Reading Uni 12.02.03 IT workshop.doc>> 
Please feel free to attend this. It clashes currently with an ATOM…it seems to be a worthwhile event that may be useful.  I am going and I think Paul is interested so far.

Best wishes, 
Liam 


BBCi at http://www.bbc.co.uk/

This e-mail (and any attachments) is confidential and may contain
personal views which are not the views of the BBC unless specifically
stated.
If you have received it in error, please delete it from your system. 
Do not use, copy or disclose the information in any way nor act in
reliance on it and notify the sender immediately. Please note that the
BBC monitors e-mails sent or received. 
Further communication will signify your consent to this.
","","Yes","normal","tentative","normal","No","",""
"Yorvik Viking Festival","2004-02-13","All Day","2004-02-23","All Day","","","","Yes","normal","free","normal","No","",""
"Osteopath","2004-02-13","12:30:00","2004-02-13","13:30:00","","","","No","normal","busy","normal","No","",""
"[York] Sue and Kevin","2004-02-13","18:00:00","2004-02-13","23:00:00","","","","No","normal","busy","normal","No","",""
"Meal with Sue and Kevin","2004-02-13","19:00:00","2004-02-13","22:00:00","","","","No","normal","busy","normal","No","",""
"Birthday - Nic MacPhail (14/02/2004)","2004-02-14","All Day","2004-02-14","All Day","","","","Yes","normal","free","private","Yes","RRULE;FREQ=YEARLY;INTERVAL=12;BYMONTHDAY=14",""
"Birthday - Nic MacPhail (1978)","2004-02-14","All Day","2004-02-15","All Day","","","","Yes","normal","free","private","No","",""
"Valentines Day","2004-02-14","All Day","2004-02-15","All Day","","","","Yes","normal","free","private","Yes","RRULE;FREQ=YEARLY;INTERVAL=12;BYMONTHDAY=14",""
"Post NI Cheque","2004-02-14","All Day","2004-02-15","All Day","","","","Yes","normal","busy","normal","No","",""
"Copmanthorpe Youth Club Food Fair","2004-02-14","10:00:00","2004-02-14","14:00:00","","","","No","normal","busy","normal","No","",""
"White Rose - Valentines Dinner","2004-02-14","18:00:00","2004-02-14","22:00:00","","","","No","normal","busy","normal","No","",""
"Anniversary - Grandpas Birthday (1901)","2004-02-16","All Day","2004-02-17","All Day","","","","Yes","normal","free","private","No","",""
"Anniversary - Grandpas Birthday (16/02/2004)","2004-02-16","All Day","2004-02-16","All Day","","","","Yes","normal","busy","private","Yes","RRULE;FREQ=YEARLY;INTERVAL=12;BYMONTHDAY=16",""
"ENPS Team Briefing","2004-02-16","12:00:00","2004-02-16","13:30:00","5254 WC","Please let me know if you are not able to make this meeting. 





BBCi at http://www.bbc.co.uk/

This e-mail (and any attachments) is confidential and may contain
personal views which are not the views of the BBC unless specifically
stated.
If you have received it in error, please delete it from your system. 
Do not use, copy or disclose the information in any way nor act in
reliance on it and notify the sender immediately. Please note that the
BBC monitors e-mails sent or received. 
Further communication will signify your consent to this.
","","No","normal","busy","normal","No","",""
"GNS Genie pilot","2004-02-17","10:00:00","2004-02-17","11:00:00","Grafton House","BBCi at http://www.bbc.co.uk/

This e-mail (and any attachments) is confidential and may contain
personal views which are not the views of the BBC unless specifically
stated.
If you have received it in error, please delete it from your system. 
Do not use, copy or disclose the information in any way nor act in
reliance on it and notify the sender immediately. Please note that the
BBC monitors e-mails sent or received. 
Further communication will signify your consent to this.
","","No","normal","busy","normal","No","",""
"Eleanor - Haircut","2004-02-17","12:30:00","2004-02-17","13:30:00","Pure (Jordan)","","","No","normal","busy","normal","No","",""
"Anniversary - Toms Dad died (18/02/2004)","2004-02-18","All Day","2004-02-18","All Day","","","","Yes","normal","free","normal","Yes","RRULE;FREQ=YEARLY;INTERVAL=12;BYMONTHDAY=18",""
"Accept delivery of furniture","2004-02-18","All Day","2004-02-19","All Day","","","","Yes","normal","free","normal","No","",""
"Install Genie TVC","2004-02-18","13:30:00","2004-02-18","16:30:00","","","","No","normal","busy","normal","No","",""
"1-1 Maria","2004-02-18","14:00:00","2004-02-18","16:00:00","","","","No","normal","busy","normal","No","",""
"NO YOGA TONIGHT","2004-02-19","17:30:00","2004-02-19","19:00:00","Askham Bryan","","","No","normal","busy","normal","No","",""
"Women in Management (Art in Business)","2004-02-19","19:00:00","2004-02-19","21:30:00","Tropical World (Leeds)","","","No","normal","busy","normal","No","",""
"Continental Market","2004-02-20","All Day","2004-02-21","All Day","York","","","Yes","normal","free","normal","No","",""
"Birthday - Colin Currie (20/02/2004)","2004-02-20","All Day","2004-02-20","All Day","","","","Yes","normal","free","private","Yes","RRULE;FREQ=YEARLY;INTERVAL=12;BYMONTHDAY=20",""
"Birthday - Eleanor (20/02/2004)","2004-02-20","All Day","2004-02-20","All Day","","","","Yes","normal","busy","private","Yes","RRULE;FREQ=YEARLY;INTERVAL=12;BYMONTHDAY=20",""
"[york]","2004-02-20","18:00:00","2004-02-20","18:30:00","","","","No","normal","busy","normal","No","",""
"Birthday - Colin MacDonald (21/02/2004)","2004-02-21","All Day","2004-02-21","All Day","","","","Yes","normal","free","normal","Yes","RRULE;FREQ=YEARLY;INTERVAL=12;BYMONTHDAY=21",""
"Haircut 4 Tom (Gemma @ Cube)","2004-02-21","09:15:00","2004-02-21","10:00:00","","","","No","normal","busy","normal","No","",""
"Eleanor Clifton Moor First Aid refresher","2004-02-21","10:00:00","2004-02-21","14:00:00","","","","No","normal","busy","normal","No","",""
"Coast & Country - Selby","2004-02-21","19:30:00","2004-02-21","22:00:00","","","","No","normal","busy","normal","No","",""
"Birthday - Peter Atkinson (22/02/2004)","2004-02-22","All Day","2004-02-22","All Day","","","","Yes","normal","free","normal","Yes","RRULE;FREQ=YEARLY;INTERVAL=12;BYMONTHDAY=22",""
"Birthday - Peter Atkinson (22/02/2004)","2004-02-22","All Day","2004-02-22","All Day","","","","Yes","normal","busy","private","Yes","RRULE;FREQ=YEARLY;INTERVAL=12;BYMONTHDAY=22",""
"Has payroll arrived?","2004-02-24","18:00:00","2004-02-24","19:00:00","","","","No","normal","busy","private","No","",""
"Guild of Building (Modern Roofing Practice)","2004-02-24","19:30:00","2004-02-24","22:00:00","Bedern Hall","","","No","normal","busy","normal","No","",""
"Sent invoices yet?","2004-02-25","19:00:00","2004-02-25","20:00:00","","","","No","normal","busy","private","No","",""
"Stamp Issue - Lord of the Rings","2004-02-26","All Day","2004-02-27","All Day","","","","Yes","normal","free","normal","No","",""
"Lucy In BBC","2004-02-26","All Day","2004-02-27","All Day","","","","Yes","normal","free","normal","No","",""
"Kingston uni","2004-02-26","12:00:00","2004-02-26","16:00:00","Kingston","","","No","normal","busy","normal","No","",""
"Dental Hygenist","2004-02-27","14:00:00","2004-02-27","15:00:00","","","","No","normal","busy","normal","No","",""
"[London]","2004-02-27","18:00:00","2004-02-27","18:30:00","","","","No","normal","free","normal","No","",""
"Anne, Steve & Nicola in Croydon","2004-02-27","20:00:00","2004-02-28","18:00:00","","","","No","normal","busy","normal","No","",""
"Birthday - Cath Finney (29th) (28/02/2004)","2004-02-28","All Day","2004-02-28","All Day","","","","Yes","normal","free","private","Yes","RRULE;FREQ=YEARLY;INTERVAL=12;BYMONTHDAY=28",""
"Richard holiday","2004-02-28","10:00:00","2004-03-05","11:00:00","","","","No","normal","busy","normal","No","",""
"barbara and derek tvc","2004-02-29","10:00:00","2004-02-29","11:00:00","","","","No","normal","busy","normal","No","",""
"Toy library with Lucie","2004-03-02","12:30:00","2004-03-02","13:30:00","","","","No","normal","busy","normal","No","",""
"Eleanor to Anne's","2004-03-02","18:00:00","2004-03-02","22:00:00","","","","No","normal","busy","normal","No","",""
"Eleanor to Doctor's","2004-03-03","08:30:00","2004-03-03","09:00:00","YORK","","","No","normal","busy","normal","No","",""
"Guild of Building (Site Visit to Merchant Adventurers Hall)","2004-03-03","19:30:00","2004-03-03","22:00:00","Merchant Adventurers","","","No","normal","busy","normal","No","",""
"[york alison and howard]","2004-03-05","18:00:00","2004-03-05","18:30:00","","","","No","normal","busy","normal","No","",""
"Alison & Howard","2004-03-05","18:00:00","2004-03-08","06:00:00","","","","No","normal","busy","private","No","",""
"Ensure invoice records in","2004-03-05","21:00:00","2004-03-05","22:00:00","","","","No","normal","busy","private","No","",""
"Richard Stephen's Birthday","2004-03-08","All Day","2004-03-09","All Day","","","","Yes","normal","free","private","No","",""
"3CR","2004-03-09","All Day","2004-03-10","All Day","","","","Yes","normal","free","normal","No","",""
"Festival of Discovery","2004-03-09","All Day","2004-03-22","All Day","York","","","Yes","normal","free","normal","No","",""
"Workload Meeting","2004-03-09","09:30:00","2004-03-09","11:30:00","","","","No","normal","busy","normal","No","",""
"Anniversay - Tom & Eleanor (1978)","2004-03-10","All Day","2004-03-11","All Day","","","","Yes","normal","free","normal","Yes","RRULE;FREQ=YEARLY;INTERVAL=12;BYMONTHDAY=10",""
"Discuss QEP Active-X issue (Gloucester Problem)","2004-03-11","12:30:00","2004-03-11","13:30:00","5168 (initially)","
Time's a bit tight on the 11th.  Julie and I are seeing Nigel Kay in the morning and we've got User Group in the afternoon.  So, how about we discuss this over lunch somewhere?


BBCi at http://www.bbc.co.uk/

This e-mail (and any attachments) is confidential and may contain
personal views which are not the views of the BBC unless specifically
stated.
If you have received it in error, please delete it from your system. 
Do not use, copy or disclose the information in any way nor act in
reliance on it and notify the sender immediately. Please note that the
BBC monitors e-mails sent or received. 
Further communication will signify your consent to this.
","","No","normal","busy","normal","No","",""
"Dental hygenist","2004-03-11","14:00:00","2004-03-11","14:30:00","","","","No","normal","busy","normal","No","",""
"Moving Weekend","2004-03-12","All Day","2004-03-16","All Day","","","","Yes","normal","free","normal","No","",""
"[York/London]","2004-03-12","18:00:00","2004-03-12","18:30:00","","","","No","normal","busy","normal","No","",""
"Birthday - Dave Camp (1953)","2004-03-13","All Day","2004-03-14","All Day","","","","Yes","normal","free","private","No","",""
"Birthday - Dave Camp (13/03/2004)","2004-03-13","All Day","2004-03-13","All Day","","","","Yes","normal","busy","private","Yes","RRULE;FREQ=YEARLY;INTERVAL=12;BYMONTHDAY=13",""
"Post NI Cheque","2004-03-14","All Day","2004-03-15","All Day","","","","Yes","normal","busy","normal","No","",""
"Stamp Issue - Northern Ireland","2004-03-16","All Day","2004-03-17","All Day","","","","Yes","normal","free","normal","No","",""
"White city dentist","2004-03-16","11:30:00","2004-03-16","12:30:00","","","","No","normal","busy","normal","No","",""
"ST PATRICK'S DAY","2004-03-17","All Day","2004-03-18","All Day","","","","Yes","normal","free","normal","Yes","RRULE;FREQ=YEARLY;INTERVAL=12;BYMONTHDAY=17",""
"Birthday - Bob Metcalf (17/03/2004)","2004-03-17","All Day","2004-03-17","All Day","","","","Yes","normal","busy","private","Yes","RRULE;FREQ=YEARLY;INTERVAL=12;BYMONTHDAY=17",""
"Birthday - Jill Brown (17/03/2004)","2004-03-17","All Day","2004-03-17","All Day","","","","Yes","normal","free","normal","Yes","RRULE;FREQ=YEARLY;INTERVAL=12;BYMONTHDAY=17",""
"Birthday - Bob Metcalf (17/03/2004)","2004-03-17","All Day","2004-03-17","All Day","","","","Yes","normal","busy","private","Yes","RRULE;FREQ=YEARLY;INTERVAL=12;BYMONTHDAY=17",""
"1-1 Maria","2004-03-17","14:00:00","2004-03-17","16:00:00","","","","No","normal","busy","normal","No","",""
"Birthday - Alastair Fairweather (18/03/2004)","2004-03-18","All Day","2004-03-18","All Day","","","","Yes","high","free","normal","Yes","RRULE;FREQ=YEARLY;INTERVAL=12;BYMONTHDAY=18",""
"Hygenust and d3ntist","2004-03-18","14:30:00","2004-03-18","15:30:00","","","","No","normal","busy","normal","No","",""
"Women in Magement (Time Management) (Tropical World - Leeds)","2004-03-18","19:00:00","2004-03-18","21:30:00","","","","No","normal","busy","normal","No","",""
"Women in Magement (Time Management)","2004-03-18","19:00:00","2004-03-18","21:30:00","Tropical World - Leeds","","","No","normal","busy","normal","No","",""
"[york]","2004-03-19","18:00:00","2004-03-19","18:30:00","","","","No","normal","busy","normal","No","",""
"WR Work weekend","2004-03-20","09:00:00","2004-03-21","18:00:00","","","","No","normal","busy","normal","No","",""
"Coast & Country (York Water World)","2004-03-20","19:30:00","2004-03-20","22:00:00","","","","No","normal","busy","normal","No","",""
"Guild of Building (Spring Dinner)","2004-03-20","19:30:00","2004-03-20","22:00:00","Bedern Hall","","","No","normal","busy","normal","No","",""
"Pot Fayre","2004-03-21","All Day","2004-03-29","All Day","York","","","Yes","normal","free","normal","No","",""
"MOTHERS DAY","2004-03-21","All Day","2004-03-22","All Day","","","","Yes","normal","free","normal","No","",""
"scott","2004-03-21","09:00:00","2004-03-23","09:30:00","","","","No","normal","busy","normal","No","",""
"Anniversary - Grandma's Birthday (1901)","2004-03-22","All Day","2004-03-23","All Day","","","","Yes","normal","free","private","No","",""
"Anniversary - Grandma's Birthday (22/03/2004)","2004-03-22","All Day","2004-03-22","All Day","","","","Yes","normal","busy","private","Yes","RRULE;FREQ=YEARLY;INTERVAL=12;BYMONTHDAY=22",""
"Anniversary - Jen Dow's (Snr) Birthday (1956)","2004-03-23","All Day","2004-03-24","All Day","","","","Yes","normal","free","private","No","",""
"Anniversary - Jen Dow's (Snr) Birthday (23/03/2004)","2004-03-23","All Day","2004-03-23","All Day","","","","Yes","normal","busy","private","Yes","RRULE;FREQ=YEARLY;INTERVAL=12;BYMONTHDAY=23",""
"Toy library","2004-03-23","12:00:00","2004-03-23","13:00:00","","","","No","normal","busy","normal","No","",""
"Has payroll arrived?","2004-03-24","18:00:00","2004-03-24","19:00:00","","","","No","normal","busy","private","No","",""
"CMI - Leadership for 21st Century","2004-03-24","18:00:00","2004-03-24","21:30:00","St Johns College","","","No","normal","busy","normal","No","",""
"Guild of Building (Potterton Boilers)","2004-03-24","19:30:00","2004-03-24","22:00:00","Bedern Hall","","","No","normal","busy","normal","No","",""
"Guild of Building (Potterton Boilers) (Bedern Hall)","2004-03-24","19:30:00","2004-03-24","22:00:00","","","","No","normal","busy","normal","No","",""
"Birthday - Carole D'Souza (25/03/2004)","2004-03-25","All Day","2004-03-25","All Day","","","","Yes","normal","busy","private","Yes","RRULE;FREQ=YEARLY;INTERVAL=12;BYMONTHDAY=25",""
"Birthday - Scott McGregor (26/03/2004)","2004-03-26","All Day","2004-03-26","All Day","","","","Yes","normal","free","normal","Yes","RRULE;FREQ=YEARLY;INTERVAL=12;BYMONTHDAY=26",""
"Report from project track","2004-03-26","12:00:00","2004-03-26","13:00:00","","","","No","normal","busy","normal","No","",""
"[London]","2004-03-26","18:00:00","2004-03-26","18:30:00","","","","No","normal","free","normal","No","",""
"Comic Mart","2004-03-27","All Day","2004-03-28","All Day","Leeds Uni","http://www.goldenorbit.co.uk/Frames2.htm
","","Yes","normal","free","normal","No","",""
"Scout Paper Collection","2004-03-27","08:00:00","2004-03-27","08:00:00","","","","No","normal","busy","private","No","",""
"Farmers Market","2004-03-29","All Day","2004-03-30","All Day","","","","Yes","normal","free","normal","No","",""
"YPO with Gary & Martin","2004-03-30","09:00:00","2004-03-30","13:00:00","","","","No","normal","busy","normal","No","",""
"Another Year Another Beer","2004-03-30","11:30:00","2004-03-30","13:00:00","White City Club","
To help me get over another Birthday! 


BBCi at http://www.bbc.co.uk/

This e-mail (and any attachments) is confidential and may contain
personal views which are not the views of the BBC unless specifically
stated.
If you have received it in error, please delete it from your system. 
Do not use, copy or disclose the information in any way nor act in
reliance on it and notify the sender immediately. Please note that the
BBC monitors e-mails sent or received. 
Further communication will signify your consent to this.
","","No","normal","busy","normal","No","",""
"ENPS Team Briefing","2004-03-30","14:30:00","2004-03-30","16:00:00","5254 WC","To discuss Team issues including feedback from the BBC/AP development conference and additional test servers. 


BBCi at http://www.bbc.co.uk/

This e-mail (and any attachments) is confidential and may contain
personal views which are not the views of the BBC unless specifically
stated.
If you have received it in error, please delete it from your system. 
Do not use, copy or disclose the information in any way nor act in
reliance on it and notify the sender immediately. Please note that the
BBC monitors e-mails sent or received. 
Further communication will signify your consent to this.
","","No","normal","busy","normal","No","",""
"Sent invoices yet?","2004-03-31","18:00:00","2004-03-31","19:00:00","","","","No","normal","busy","private","No","",""
"Mfi delivery","2004-04-02","All Day","2004-04-03","All Day","","","","Yes","normal","free","normal","No","",""
"Elaine and Children for week","2004-04-02","All Day","2004-04-11","All Day","","","","Yes","normal","free","normal","No","",""
"Final individual report from project track.","2004-04-02","11:00:00","2004-04-02","12:00:00","","","","No","normal","busy","normal","No","",""
"[York]","2004-04-02","17:00:00","2004-04-02","17:30:00","","","","No","normal","busy","normal","No","",""
"Birthday - Ken Blackhurst (03/04/2004)","2004-04-03","All Day","2004-04-03","All Day","","","","Yes","normal","free","private","Yes","RRULE;FREQ=YEARLY;INTERVAL=12;BYMONTHDAY=3",""
"Vicki Birthday","2004-04-03","All Day","2004-04-04","All Day","","","","Yes","normal","free","normal","No","",""
"Comic Mart","2004-04-03","All Day","2004-04-04","All Day","Newcastle","http://www.goldenorbit.co.uk/Frames2.htm
","","Yes","normal","free","normal","No","",""
"Ensure invoice records in","2004-04-05","20:00:00","2004-04-05","21:00:00","","","","No","normal","busy","private","No","",""
"Birthday - Alan Thomas (06/04/2004)","2004-04-06","All Day","2004-04-06","All Day","","","","Yes","normal","free","normal","Yes","RRULE;FREQ=YEARLY;INTERVAL=12;BYMONTHDAY=6",""
"Stamp Issue - Entente Cordial","2004-04-06","All Day","2004-04-07","All Day","","","","Yes","normal","free","normal","No","",""
"Lunch - Trainer for ENPS","2004-04-06","11:30:00","2004-04-06","12:30:00","5254 WC","
All: 

Julie, Martin and Tim will be interviewing for the ENPS trainer attachment to the team.  You are all invited to lunch with the candidates.  Because of the tight schedule throughout the day, please adhere strictly to the time slot.

Sheila Acharya | Management Assistant, ENPS Project
BBC News | Room 5168 | White City | London W12 7TS
T: +44 (0)20 875 27121 F: +44 (0)20 875 27600 



BBCi at http://www.bbc.co.uk/

This e-mail (and any attachments) is confidential and may contain
personal views which are not the views of the BBC unless specifically
stated.
If you have received it in error, please delete it from your system. 
Do not use, copy or disclose the information in any way nor act in
reliance on it and notify the sender immediately. Please note that the
BBC monitors e-mails sent or received. 
Further communication will signify your consent to this.
","","No","normal","busy","normal","No","",""
"Birthday - David Hamilton (07/04/2004)","2004-04-07","All Day","2004-04-07","All Day","","","","Yes","normal","free","normal","Yes","RRULE;FREQ=YEARLY;INTERVAL=12;BYMONTHDAY=7",""
"Birthday - Daniel Prestage (07/04/2004)","2004-04-07","All Day","2004-04-07","All Day","","","","Yes","normal","free","normal","Yes","RRULE;FREQ=YEARLY;INTERVAL=12;BYMONTHDAY=7",""
"Birthday - Jenny Dow (08/04/2004)","2004-04-08","All Day","2004-04-08","All Day","","","","Yes","normal","free","normal","Yes","RRULE;FREQ=YEARLY;INTERVAL=12;BYMONTHDAY=8",""
"GOOD FRIDAY","2004-04-09","All Day","2004-04-10","All Day","","","","Yes","normal","busy","normal","No","",""
"EASTER","2004-04-09","All Day","2004-04-13","All Day","","","","Yes","normal","busy","normal","No","",""
"[York]","2004-04-09","17:00:00","2004-04-09","17:30:00","","","","No","normal","busy","normal","No","",""
"Birthday - Tracy LeFevre (1984)","2004-04-11","All Day","2004-04-12","All Day","","","","Yes","normal","free","private","No","",""
"Birthday - Tracy LeFevre (11/04/2004)","2004-04-11","All Day","2004-04-11","All Day","","","","Yes","normal","busy","private","Yes","RRULE;FREQ=YEARLY;INTERVAL=12;BYMONTHDAY=11",""
"Birthday - Roger Spreckley (13/04/2004)","2004-04-13","All Day","2004-04-13","All Day","","","","Yes","normal","free","private","Yes","RRULE;FREQ=YEARLY;INTERVAL=12;BYMONTHDAY=13",""
"Stamp Issue - Ocean Liners","2004-04-13","All Day","2004-04-14","All Day","","","","Yes","normal","free","normal","No","",""
"Birthday - Alison Marshall (1956)","2004-04-13","All Day","2004-04-14","All Day","","","","Yes","normal","free","private","No","",""
"Birthday - Kevin Harman (13/04/2004)","2004-04-13","All Day","2004-04-13","All Day","","","","Yes","normal","busy","private","Yes","RRULE;FREQ=YEARLY;INTERVAL=12;BYMONTHDAY=13",""
"Birthday - Alison Marshall (13/04/2004)","2004-04-13","All Day","2004-04-13","All Day","","","","Yes","normal","busy","private","Yes","RRULE;FREQ=YEARLY;INTERVAL=12;BYMONTHDAY=13",""
"Payroll process begins","2004-04-14","All Day","2004-04-15","All Day","","","","Yes","normal","free","normal","No","",""
"Post NI Cheque","2004-04-14","All Day","2004-04-15","All Day","","","","Yes","normal","free","normal","No","",""
"Updated: Farewell for Gary O'Donoghue","2004-04-14","11:00:00","2004-04-14","14:00:00","W12 Shepherds Bush - Warner Village Cinema","
COULD WE CHANGE THE DATE TO WEDNESDAY THE 14TH OF APRIL. 

We are all gathering at Warner Village Complex in Shepherd's Bush to say thank you to Gary for being part of our team.  There are some restaurants on the 1st floor level - but we may try the AROMA - chinese place.

For those who are on leave but would like to join, you are most welcome. 

Sheila Acharya | Management Assistant, ENPS Project
BBC News | Room 5168 | White City | London W12 7TS
T: +44 (0)20 875 27121 F: +44 (0)20 875 27600 



BBCi at http://www.bbc.co.uk/

This e-mail (and any attachments) is confidential and may contain
personal views which are not the views of the BBC unless specifically
stated.
If you have received it in error, please delete it from your system. 
Do not use, copy or disclose the information in any way nor act in
reliance on it and notify the sender immediately. Please note that the
BBC monitors e-mails sent or received. 
Further communication will signify your consent to this.
","","No","normal","busy","normal","No","",""
"Staging system brainstorm","2004-04-15","09:00:00","2004-04-15","11:00:00","Our office","


BBCi at http://www.bbc.co.uk/

This e-mail (and any attachments) is confidential and may contain
personal views which are not the views of the BBC unless specifically
stated.
If you have received it in error, please delete it from your system. 
Do not use, copy or disclose the information in any way nor act in
reliance on it and notify the sender immediately. Please note that the
BBC monitors e-mails sent or received. 
Further communication will signify your consent to this.
","","No","normal","busy","normal","No","",""
"Anniversary - Rach & Ray (1977)","2004-04-16","All Day","2004-04-17","All Day","","","","Yes","normal","free","private","No","",""
"Anniversary - Rach & Ray (16/04/2004)","2004-04-16","All Day","2004-04-16","All Day","","","","Yes","normal","busy","private","Yes","RRULE;FREQ=YEARLY;INTERVAL=12;BYMONTHDAY=16;UNTIL=16001231",""
"Anniversary - Rach & Ray (16/04/2004)","2004-04-16","All Day","2004-04-16","All Day","","","","Yes","normal","busy","private","Yes","RRULE;FREQ=YEARLY;INTERVAL=12;BYMONTHDAY=16",""
"Good Old Days","2004-04-17","17:30:00","2004-04-17","21:30:00","","","","No","normal","busy","normal","No","",""
"Coast & Country (Doncaster Dome) - TBC","2004-04-17","18:30:00","2004-04-17","21:00:00","","","","No","normal","busy","normal","No","",""
"ENSURE PAYROLL INFO HAS GONE TO BERYL","2004-04-18","All Day","2004-04-19","All Day","","","","Yes","normal","free","normal","No","",""
"White Rose AGM","2004-04-18","13:00:00","2004-04-18","15:00:00","","","","No","normal","busy","normal","No","",""
"Di Blackhurst's Birthday (1944)","2004-04-19","All Day","2004-04-20","All Day","","","","Yes","normal","free","private","No","",""
"April 20th Event:  Making it happen (making a difference)","2004-04-20","11:15:00","2004-04-20","11:30:00","5254 WC","Hi everyone, 

Further to Julie's message with regards to follow on discussion after the televised discussion on the ring-main, could you please join me in our meeting room and share your thoughts and input.  The telecast will take place on the ringmain beginning 1130 hours for a 40 minute duration.

Please find attached documents you will find helpful in formulating ideas on the future of the BBC and thereafter nominate candidate/s for the BBC awards.


<<Team Leader Briefing Pack2.doc>>    <<Awards Criteria agreed.doc>> 
Sheila Acharya | Management Assistant, ENPS Project
BBC News | Room 5168 | White City | London W12 7TS
T: +44 (0)20 875 27121 F: +44 (0)20 875 27600 


BBCi at http://www.bbc.co.uk/

This e-mail (and any attachments) is confidential and may contain
personal views which are not the views of the BBC unless specifically
stated.
If you have received it in error, please delete it from your system. 
Do not use, copy or disclose the information in any way nor act in
reliance on it and notify the sender immediately. Please note that the
BBC monitors e-mails sent or received. 
Further communication will signify your consent to this.
","","No","normal","tentative","normal","No","",""
"Guild of Building (Hospital Fire Precautions) (Bedern Hall)","2004-04-20","18:30:00","2004-04-20","21:00:00","","","","No","normal","busy","normal","No","",""
"[Dletetc]","2004-04-21","08:30:00","2004-04-21","09:30:00","","#AN
","","No","normal","busy","normal","No","",""
"Hair with Gemma","2004-04-22","14:00:00","2004-04-22","14:30:00","","","","No","normal","busy","normal","No","",""
"ST GEORGE'S DAY","2004-04-23","All Day","2004-04-24","All Day","","","","Yes","normal","free","private","Yes","RRULE;FREQ=YEARLY;INTERVAL=12;BYMONTHDAY=23",""
"Birthday - Robyn Hamilton (23/04/2004)","2004-04-23","All Day","2004-04-23","All Day","","","","Yes","normal","free","private","Yes","RRULE;FREQ=YEARLY;INTERVAL=12;BYMONTHDAY=23",""
"ST GEORGE'S DAY","2004-04-23","All Day","2004-04-23","All Day","","","","Yes","normal","busy","private","Yes","RRULE;FREQ=YEARLY;INTERVAL=12;BYMONTHDAY=23",""
"Birthday - Robyn Hamilton (23/04/2004)","2004-04-23","All Day","2004-04-23","All Day","","","","Yes","normal","busy","private","Yes","RRULE;FREQ=YEARLY;INTERVAL=12;BYMONTHDAY=23",""
"Birthday - Robyn Hamilton (23/04/2004)","2004-04-23","All Day","2004-04-23","All Day","","","","Yes","normal","free","private","Yes","RRULE;FREQ=YEARLY;INTERVAL=12;BYMONTHDAY=23",""
"YORK -- ICPUG WEEKEND","2004-04-23","17:00:00","2004-04-23","17:30:00","","","","No","normal","busy","normal","No","",""
"Comic Mart","2004-04-24","All Day","2004-04-25","All Day","Sheffield","http://www.goldenorbit.co.uk/Frames2.htm
","","Yes","normal","free","normal","No","",""
"Has payroll arrived?","2004-04-24","17:00:00","2004-04-24","18:00:00","","","","No","normal","busy","normal","No","",""
"Aniversary - Stuart & Alison (2004)","2004-04-25","All Day","2004-04-26","All Day","","","","Yes","normal","free","normal","Yes","RRULE;FREQ=YEARLY;INTERVAL=12;BYMONTHDAY=25",""
"Stuarts wedding","2004-04-25","13:00:00","2004-04-25","21:00:00","","","","No","normal","busy","normal","No","",""
"Reni at Mayday","2004-04-26","08:30:00","2004-04-26","09:30:00","","","","No","normal","busy","normal","No","",""
"Ensure payroll records updated","2004-04-26","20:00:00","2004-04-26","21:00:00","","","","No","normal","busy","normal","No","",""
"Car to MOT & Service","2004-04-27","07:30:00","2004-04-27","16:30:00","Lexmark in Layerthorpe","","","No","normal","busy","normal","No","",""
"Guild of Building - Lecture, Where have all the wise men gone?","2004-04-27","18:00:00","2004-04-27","18:30:00","Bedern Hall","","","No","normal","busy","normal","No","",""
"Sent invoices yet?","2004-04-28","18:00:00","2004-04-28","19:00:00","","","","No","normal","busy","normal","No","",""
"Guild of Building (AGM)","2004-04-28","18:30:00","2004-04-28","21:00:00","Bedern Hall","","","No","normal","busy","normal","No","",""
"Anniversary - Grandma died (1995)","2004-04-29","All Day","2004-04-30","All Day","","","","Yes","normal","free","private","No","",""
"Birthday - Jennifer Prestage (29/04/2004)","2004-04-29","All Day","2004-04-29","All Day","","","","Yes","normal","free","normal","Yes","RRULE;FREQ=YEARLY;INTERVAL=12;BYMONTHDAY=29",""
"Anniversary - Grandma died Aged 94 (29/04/2004)","2004-04-29","All Day","2004-04-29","All Day","","","","Yes","normal","free","normal","Yes","RRULE;FREQ=YEARLY;INTERVAL=12;BYMONTHDAY=29",""
"Birthday - Jennifer Prestage (1935?)","2004-04-29","All Day","2004-04-30","All Day","","","","Yes","normal","free","private","No","",""
"Birthday - Jennifer Prestage (29/04/2004)","2004-04-29","All Day","2004-04-29","All Day","","","","Yes","normal","busy","private","Yes","RRULE;FREQ=YEARLY;INTERVAL=12;BYMONTHDAY=29",""
"Anniversary - Grandma died (29/04/2004)","2004-04-29","All Day","2004-04-29","All Day","","","","Yes","normal","busy","private","Yes","RRULE;FREQ=YEARLY;INTERVAL=12;BYMONTHDAY=29",""
"Birthday - Richard Stephenson (30/04/2004)","2004-04-30","All Day","2004-04-30","All Day","","","","Yes","normal","free","normal","Yes","RRULE;FREQ=YEARLY;INTERVAL=12;BYMONTHDAY=30",""
"Birthday - Richard Stephenson (30/04/2004)","2004-04-30","All Day","2004-04-30","All Day","","","","Yes","normal","free","private","Yes","RRULE;FREQ=YEARLY;INTERVAL=12;BYMONTHDAY=30",""
"Birthday - Richard Stephenson (30/04/2004)","2004-04-30","All Day","2004-04-30","All Day","","","","Yes","normal","busy","private","Yes","RRULE;FREQ=YEARLY;INTERVAL=12;BYMONTHDAY=30",""
"Osteopath","2004-04-30","11:30:00","2004-04-30","12:30:00","","","","No","normal","busy","normal","No","",""
"White Rose - 50's & 60's Rock & Roll","2004-05-01","18:00:00","2004-05-01","22:00:00","","","","No","normal","busy","normal","No","",""
"Birthday - Harry Broomhall (02/05/2004)","2004-05-02","All Day","2004-05-02","All Day","","","","Yes","normal","free","normal","Yes","RRULE;FREQ=YEARLY;INTERVAL=12;BYMONTHDAY=2",""
"May Day Bank Holiday","2004-05-03","All Day","2004-05-04","All Day","","","","Yes","normal","busy","normal","No","",""
"White Rose - French Breakfast","2004-05-03","08:00:00","2004-05-03","10:00:00","","","","No","normal","busy","normal","No","",""
"Copmanthorpe Street Fair","2004-05-03","11:00:00","2004-05-03","15:00:00","","","","No","normal","busy","normal","No","",""
"Birthday - Lee Armstrong (04/05/2004)","2004-05-04","All Day","2004-05-04","All Day","","","","Yes","normal","free","normal","Yes","RRULE;FREQ=YEARLY;INTERVAL=12;BYMONTHDAY=4",""
"Pre for ENPS Development Day","2004-05-04","09:30:00","2004-05-04","15:30:00","Training room","BBCi at http://www.bbc.co.uk/

This e-mail (and any attachments) is confidential and may contain
personal views which are not the views of the BBC unless specifically
stated.
If you have received it in error, please delete it from your system. 
Do not use, copy or disclose the information in any way nor act in
reliance on it and notify the sender immediately. Please note that the
BBC monitors e-mails sent or received. 
Further communication will signify your consent to this.
","","No","normal","busy","normal","No","",""
"Car to Garage (window)","2004-05-05","07:30:00","2004-05-05","16:00:00","","","","No","normal","free","normal","No","",""
"Anniversary Sue & Kevin (1979)","2004-05-05","08:00:00","2004-05-05","08:00:00","","","","No","normal","busy","normal","No","",""
"Ensure invoice records in","2004-05-05","20:00:00","2004-05-05","21:00:00","","","","No","normal","busy","normal","No","",""
"Anniversary - Colin & Jen (06/05/2004)","2004-05-06","All Day","2004-05-06","All Day","","","","Yes","normal","free","normal","Yes","RRULE;FREQ=YEARLY;INTERVAL=12;BYMONTHDAY=6",""
"Anniversary - Kate & John (07/05/2004)","2004-05-07","All Day","2004-05-07","All Day","","","","Yes","normal","free","normal","Yes","RRULE;FREQ=YEARLY;INTERVAL=12;BYMONTHDAY=7",""
"Birthday - Suzanne Dow (08/05/2004)","2004-05-08","All Day","2004-05-08","All Day","","","","Yes","normal","free","normal","Yes","RRULE;FREQ=YEARLY;INTERVAL=12;BYMONTHDAY=8",""
"Comic Mart","2004-05-08","All Day","2004-05-09","All Day","Leeds","http://www.goldenorbit.co.uk/Frames2.htm
","","Yes","normal","free","normal","No","",""
"sue & kevins silver do","2004-05-08","08:00:00","2004-05-08","08:00:00","","","","No","normal","busy","private","No","",""
"Kevin and Sue Silver Wedding Do","2004-05-08","08:30:00","2004-05-08","21:00:00","","","","No","normal","busy","normal","No","",""
"Copmanthorpe School Spring Fair","2004-05-08","11:00:00","2004-05-08","15:00:00","","","","No","normal","busy","normal","No","",""
"Birthday:  Claire Humpries (09/05/2004)","2004-05-09","All Day","2004-05-09","All Day","","","","Yes","normal","free","normal","Yes","RRULE;FREQ=YEARLY;INTERVAL=12;BYMONTHDAY=9",""
"Anniversary - Top Hat Computing Started (10/05/2004)","2004-05-10","All Day","2004-05-10","All Day","","","","Yes","normal","free","normal","Yes","RRULE;FREQ=YEARLY;INTERVAL=12;BYMONTHDAY=10",""
"Blood Doning","2004-05-11","13:00:00","2004-05-11","18:00:00","Merchant Taylors","","","No","normal","busy","normal","No","",""
"Copmanthorpe Parish AGM","2004-05-11","18:30:00","2004-05-11","21:00:00","Youth Club","","","No","normal","busy","normal","No","",""
"Birthday - Steve May (12/05/2004)","2004-05-12","All Day","2004-05-12","All Day","","","","Yes","normal","free","normal","Yes","RRULE;FREQ=YEARLY;INTERVAL=12;BYMONTHDAY=12",""
"Post NI Cheque","2004-05-14","All Day","2004-05-15","All Day","","","","Yes","normal","free","normal","No","",""
"Coast & Country (York Water World)","2004-05-15","18:30:00","2004-05-15","21:00:00","","","","No","normal","busy","normal","No","",""
"Anniversary  - Birthday - Jim Dennis (16/05/2004)","2004-05-16","All Day","2004-05-16","All Day","","","","Yes","normal","free","normal","Yes","RRULE;FREQ=YEARLY;INTERVAL=12;BYMONTHDAY=16",""
"Birthday - Jim Dennis (16/05/2004)","2004-05-16","All Day","2004-05-16","All Day","","","","Yes","normal","free","normal","Yes","RRULE;FREQ=YEARLY;INTERVAL=12;BYMONTHDAY=16",""
"Updated: Team Briefing - Welcome Jemma Phillips","2004-05-17","09:00:00","2004-05-17","10:30:00","5254 WC","
Please note change in date due to Jemma's new joining date. 


BBCi at http://www.bbc.co.uk/

This e-mail (and any attachments) is confidential and may contain
personal views which are not the views of the BBC unless specifically
stated.
If you have received it in error, please delete it from your system. 
Do not use, copy or disclose the information in any way nor act in
reliance on it and notify the sender immediately. Please note that the
BBC monitors e-mails sent or received. 
Further communication will signify your consent to this.
","","No","normal","tentative","normal","No","",""
"ENPS Dev Day prep and presentation run-through","2004-05-17","13:00:00","2004-05-17","16:00:00","","BBCi at http://www.bbc.co.uk/

This e-mail (and any attachments) is confidential and may contain
personal views which are not the views of the BBC unless specifically
stated.
If you have received it in error, please delete it from your system. 
Do not use, copy or disclose the information in any way nor act in
reliance on it and notify the sender immediately. Please note that the
BBC monitors e-mails sent or received. 
Further communication will signify your consent to this.
","","No","normal","busy","normal","No","",""
"Birthday - Malcolm Jarvis (18/05/2004)","2004-05-18","All Day","2004-05-18","All Day","","","","Yes","normal","free","normal","Yes","RRULE;FREQ=YEARLY;INTERVAL=12;BYMONTHDAY=18",""
"ENSURE PAYROLL INFO HAS GONE TO BERYL","2004-05-18","All Day","2004-05-19","All Day","","","","Yes","normal","free","normal","No","",""
"Blood Doning","2004-05-18","13:00:00","2004-05-18","15:00:00","Acomb","","","No","normal","busy","normal","No","",""
"Blood Doning","2004-05-18","16:00:00","2004-05-18","18:30:00","Acomb","","","No","normal","busy","normal","No","",""
"Guild of Building (Gliding)","2004-05-18","18:30:00","2004-05-18","21:00:00","Rufforth","","","No","normal","busy","normal","No","",""
"ENPS DEVELOPMENT DAY","2004-05-19","09:00:00","2004-05-19","14:30:00","Conference Room 4 & 5 - Broadcast Centre White City (At the main reception - turn right.  At the lifts, take the 2nd floor)","
Dear All: 

You are all invited to attend the ENPS DEVELOPMENT DAY on Wednesday, the 19th of May as referenced above. 

Agenda for the day 
10:00 Welcome, introductions Julie Lamm 
10:15 ENPS Version 4 Rollout - Review Alan Perry 
11:00 Coffee 
11:15 Where are we Now - Integration and Interoperability - Mike Roscoe 
12:00 AP Roadmap for the Future 
12:30 ENPS Project Team Roadmap 
13:00 Lunch 
14:00 BBC Closed Session 
15:00 End 
Could you please let me know if you will attend/decline so I can make required catering arrangements with BBC hospitality.

Sheila Acharya | Management Assistant, ENPS Project
BBC News | Room 5168 | White City | London W12 7TS
T: +44 (0)20 875 27121 F: +44 (0)20 875 27600 





BBCi at http://www.bbc.co.uk/

This e-mail (and any attachments) is confidential and may contain
personal views which are not the views of the BBC unless specifically
stated.
If you have received it in error, please delete it from your system. 
Do not use, copy or disclose the information in any way nor act in
reliance on it and notify the sender immediately. Please note that the
BBC monitors e-mails sent or received. 
Further communication will signify your consent to this.
","","No","normal","busy","normal","No","",""
"Women in Management (Working in the Construction Industry)","2004-05-19","18:00:00","2004-05-19","20:30:00","Tropical World - Leeds","","","No","normal","busy","normal","No","",""
"Brainstorming - Lead User Conference","2004-05-20","10:30:00","2004-05-20","12:30:00","5254 WC","We are keen to roll the planning process for this year's event as soon as possible and would like to organise a lunchtime session to chew over a few ideas.  


BBCi at http://www.bbc.co.uk/

This e-mail (and any attachments) is confidential and may contain
personal views which are not the views of the BBC unless specifically
stated.
If you have received it in error, please delete it from your system. 
Do not use, copy or disclose the information in any way nor act in
reliance on it and notify the sender immediately. Please note that the
BBC monitors e-mails sent or received. 
Further communication will signify your consent to this.
","","No","normal","tentative","normal","No","",""
"Has payroll arrived?","2004-05-24","17:00:00","2004-05-24","18:00:00","","","","No","normal","busy","normal","No","",""
"Birthday - Anne Walker (25/05/2004)","2004-05-25","All Day","2004-05-25","All Day","","","","Yes","normal","free","normal","Yes","RRULE;FREQ=YEARLY;INTERVAL=12;BYMONTHDAY=25",""
"Stamp Issue - RHS","2004-05-25","All Day","2004-05-26","All Day","","","","Yes","normal","free","normal","No","",""
"Anne's Birthday (25/05/2004)","2004-05-25","All Day","2004-05-25","All Day","","","","Yes","normal","free","normal","Yes","RRULE;FREQ=YEARLY;INTERVAL=12;BYMONTHDAY=25",""
"Birthday Anne Walker (25/05/2004)","2004-05-25","All Day","2004-05-25","All Day","","","","Yes","normal","free","normal","Yes","RRULE;FREQ=YEARLY;INTERVAL=12;BYMONTHDAY=25",""
"Guild of Building - Demonstration Arbitration - Ticket Required","2004-05-25","18:00:00","2004-05-25","21:00:00","Bedern Hall","","","No","normal","busy","normal","No","",""
"Sent ENPS invoices yet?","2004-05-26","18:00:00","2004-05-26","19:00:00","","","","No","normal","busy","normal","Yes","RRULE;FREQ=MONTHLY;BYMONTHDAY=26",""
"White Rose - Word Link & Music Quiz (Pie & Peas)","2004-05-29","18:00:00","2004-05-29","21:00:00","","","","No","normal","busy","normal","No","",""
"White Rose - BBQ","2004-05-30","11:00:00","2004-05-30","13:00:00","","","","No","normal","busy","normal","No","",""
"White Rose - English Breakfast","2004-05-31","08:00:00","2004-05-31","10:00:00","","","","No","normal","busy","normal","No","",""
"Send Balance to Malcolm for 26th June","2004-06-01","09:00:00","2004-06-01","09:30:00","","","","No","normal","busy","normal","No","",""
"Eleanor to Doctors (08:30 & 08:40)","2004-06-04","07:30:00","2004-06-04","08:00:00","","","","No","normal","busy","normal","No","",""
"HARRY POTTER","2004-06-04","16:00:00","2004-06-04","19:00:00","","","","No","normal","busy","normal","No","",""
"Nic & Andy's wedding list opens","2004-06-05","07:00:00","2004-06-05","07:30:00","www.johnlewisgiftlist.com","","","No","normal","free","normal","No","",""
"White Rose - Irish Night","2004-06-05","18:00:00","2004-06-05","21:00:00","","","","No","normal","busy","normal","No","",""
"Ensure invoice records in","2004-06-05","20:00:00","2004-06-05","21:00:00","","","","No","normal","busy","normal","No","",""
"Birthday - Mark Howard (07/06/2004)","2004-06-07","All Day","2004-06-07","All Day","","","","Yes","normal","free","normal","Yes","RRULE;FREQ=YEARLY;INTERVAL=12;BYMONTHDAY=7",""
"Radioman devday","2004-06-07","08:30:00","2004-06-07","15:00:00","Rm 841/2, centre block","","","No","normal","busy","normal","No","",""
"Guild of Building - BUPA Hospital Site?","2004-06-08","All Day","2004-06-09","All Day","","","","Yes","normal","free","normal","No","",""
"Payroll process begins","2004-06-14","All Day","2004-06-15","All Day","","","","Yes","normal","free","normal","No","",""
"Post NI Cheque","2004-06-14","All Day","2004-06-15","All Day","","","","Yes","normal","free","normal","No","",""
"Doctor evans","2004-06-14","08:10:00","2004-06-14","08:30:00","","","","No","normal","busy","normal","No","",""
"Practice nurse","2004-06-14","08:30:00","2004-06-14","09:00:00","","","","No","normal","busy","normal","No","",""
"optician","2004-06-14","09:30:00","2004-06-14","10:30:00","","","","No","normal","busy","normal","No","",""
"Stamp Issue - Wales","2004-06-15","All Day","2004-06-16","All Day","","","","Yes","normal","free","normal","No","",""
"Newsvendor martin","2004-06-15","11:00:00","2004-06-15","12:00:00","Wc ","","","No","normal","busy","normal","No","",""
"Women in Management (Life in the Media)","2004-06-15","18:00:00","2004-06-15","20:30:00","Tropical World (Leeds)","","","No","normal","busy","normal","No","",""
"Guild of Building - Trasure Hunt","2004-06-17","17:00:00","2004-06-17","20:00:00","","","","No","normal","busy","normal","No","",""
"ENSURE PAYROLL INFO HAS GONE TO BERYL","2004-06-18","All Day","2004-06-19","All Day","","","","Yes","normal","free","normal","No","",""
"Lucy in croydon","2004-06-18","08:30:00","2004-06-18","16:30:00","","","","No","normal","busy","normal","No","",""
"[London Van Trip]","2004-06-18","17:00:00","2004-06-18","17:30:00","","","","No","normal","busy","normal","No","",""
"ZSL open Evening","2004-06-18","17:00:00","2004-06-18","21:00:00","","","","No","normal","busy","normal","No","",""
"VAN TRIP","2004-06-19","All Day","2004-06-21","All Day","","","","Yes","normal","free","normal","No","",""
"Coast & Country","2004-06-19","18:30:00","2004-06-19","21:00:00","Selby","","","No","normal","busy","normal","No","",""
"Luton 12.00 1900","2004-06-21","11:00:00","2004-06-21","12:00:00","","","","No","normal","busy","normal","No","",""
"RoSPA interview with John Bateman","2004-06-22","08:30:00","2004-06-22","09:30:00","","","","No","normal","busy","normal","No","",""
"Enps general, 5, eve 2","2004-06-22","11:00:00","2004-06-22","12:00:00","","","","No","normal","busy","normal","No","",""
"Eve 4","2004-06-23","11:00:00","2004-06-23","12:00:00","","","","No","normal","busy","normal","No","",""
"TRAVEL TO SCOTLAND","2004-06-23","17:00:00","2004-06-23","17:30:00","","Gatwick --> Glasgow
","","No","normal","busy","normal","No","",""
"Travel To FortWilliam","2004-06-24","08:30:00","2004-06-24","15:00:00","","","","No","normal","busy","normal","No","",""
"Has payroll arrived?","2004-06-24","17:00:00","2004-06-24","18:00:00","","","","No","normal","busy","normal","No","",""
"FW","2004-06-25","09:00:00","2004-06-25","09:30:00","","","","No","normal","busy","normal","No","",""
"Sent payslips yet?","2004-06-25","11:00:00","2004-06-25","12:00:00","","","","No","normal","busy","normal","No","",""
"Travel To Helensburgh","2004-06-25","15:30:00","2004-06-25","18:30:00","","","","No","normal","busy","normal","No","",""
"Cycle Rally, York","2004-06-26","All Day","2004-06-28","All Day","","","","Yes","normal","free","normal","No","",""
"Scott, vicki, One Other","2004-06-26","10:30:00","2004-06-26","12:00:00","","","","No","normal","busy","normal","No","",""
"RE-Union at Hermitage","2004-06-26","16:00:00","2004-06-26","21:30:00","","","","No","normal","busy","normal","No","",""
"Hermitage Reunion","2004-06-26","18:00:00","2004-06-26","21:00:00","","","","No","normal","busy","normal","No","",""
"Ensure payroll records updated","2004-06-26","20:00:00","2004-06-26","21:00:00","","","","No","normal","busy","normal","No","",""
"White Rose Duty Week","2004-06-27","All Day","2004-07-05","All Day","","","","Yes","normal","free","normal","No","",""
"Scout Paper Collection","2004-06-27","07:00:00","2004-06-27","07:00:00","","","","No","normal","busy","normal","No","",""
"Return To York","2004-06-27","10:00:00","2004-06-27","17:00:00","","","","No","normal","busy","normal","No","",""
"Duty Members","2004-06-28","All Day","2004-07-05","All Day","","","","Yes","normal","free","normal","No","",""
"Has timesheet info arrived?","2004-06-30","17:00:00","2004-06-30","18:00:00","","","","No","normal","busy","normal","No","",""
"Sent invoices yet?","2004-06-30","18:00:00","2004-06-30","19:00:00","","","","No","normal","busy","normal","No","",""
"Suppliers day, devsummary","2004-07-01","07:00:00","2004-07-01","15:00:00","","","","No","normal","busy","normal","No","",""
"Shrek2","2004-07-02","11:00:00","2004-07-02","12:00:00","","","","No","normal","busy","normal","No","",""
"? carry on up the khyber?","2004-07-02","23:00:00","2004-07-03","22:00:00","","","","No","normal","busy","private","No","",""
"Copmanthorpe Carnival","2004-07-03","09:00:00","2004-07-03","14:00:00","","","","No","normal","busy","normal","No","",""
"White Rose - Carry on Up the Khyber","2004-07-03","11:00:00","2004-07-03","22:00:00","","","","No","normal","busy","normal","No","",""
"Sue and kevin do wr","2004-07-03","18:00:00","2004-07-03","20:30:00","","","","No","normal","busy","normal","No","",""
"Shrek 2 for Nicola and others","2004-07-04","11:30:00","2004-07-04","13:00:00","","","","No","normal","busy","normal","No","",""
"Maddy French - Work Experience e for two weeks","2004-07-05","08:00:00","2004-07-05","08:30:00","","","","No","normal","busy","normal","No","",""
"Kevin","2004-07-05","11:00:00","2004-07-05","12:00:00","","","","No","normal","busy","normal","No","",""
"Ensure invoice records in","2004-07-05","20:00:00","2004-07-05","21:00:00","","","","No","normal","busy","normal","No","",""
"L191 PNH to Kleen Kar for Valet","2004-07-06","08:00:00","2004-07-06","15:30:00","","","","No","normal","busy","normal","No","",""
"Bloods for Diabetic","2004-07-09","07:00:00","2004-07-09","07:30:00","","","","No","normal","busy","normal","No","",""
"Sian","2004-07-09","09:00:00","2004-07-09","10:30:00","","","","No","normal","busy","normal","No","",""
"Osteopath","2004-07-09","11:30:00","2004-07-09","12:30:00","","","","No","normal","busy","normal","No","",""
"Coast & Country (York Water World)","2004-07-10","18:30:00","2004-07-10","21:00:00","","","","No","normal","busy","normal","No","",""
"1-1 Mark","2004-07-13","08:00:00","2004-07-13","09:30:00","","","","No","normal","busy","normal","No","",""
"Dentist at Boots","2004-07-13","12:00:00","2004-07-13","13:00:00","","","","No","normal","busy","normal","No","",""
"Post NI Cheque","2004-07-14","All Day","2004-07-15","All Day","","","","Yes","normal","free","normal","No","",""
"Payroll process begins","2004-07-14","All Day","2004-07-15","All Day","","","","Yes","normal","free","normal","No","",""
"Race for Life","2004-07-14","17:00:00","2004-07-14","20:00:00","Knavesmire","","","No","normal","busy","normal","No","",""
"Carolin Harris","2004-07-14","18:00:00","2004-07-14","20:30:00","","","","No","normal","busy","normal","No","",""
"IBM Lunch","2004-07-15","11:30:00","2004-07-15","14:00:00","","","","No","normal","busy","normal","No","",""
"Tunbridge Wells","2004-07-16","All Day","2004-07-19","All Day","","","","Yes","normal","free","normal","No","",""
"london","2004-07-16","17:00:00","2004-07-16","18:00:00","","","","No","normal","busy","normal","No","",""
"nic and andy wedding","2004-07-17","All Day","2004-07-18","All Day","","","","Yes","normal","free","normal","No","",""
"nic and andy wedding","2004-07-17","09:00:00","2004-07-17","10:00:00","","","","No","normal","busy","normal","No","",""
"Nic & Andy's Wedding","2004-07-17","14:30:00","2004-07-17","15:30:00","","","","No","normal","busy","normal","No","",""
"White Rose - Beach Party","2004-07-17","18:00:00","2004-07-17","21:00:00","","","","No","normal","busy","normal","No","",""
"ENSURE PAYROLL INFO HAS GONE TO BERYL","2004-07-18","All Day","2004-07-19","All Day","","","","Yes","normal","free","normal","No","",""
"Guild of Building - BBQ","2004-07-18","All Day","2004-07-19","All Day","","","","Yes","normal","free","normal","No","",""
"White Rose - Truckers Breakfast","2004-07-18","08:00:00","2004-07-18","10:00:00","","","","No","normal","busy","normal","No","",""
"Updated: MOS Redirect Demo and Discussion","2004-07-19","10:00:00","2004-07-19","12:00:00","Room 5168, White City","


http://www.bbc.co.uk/ - World Wide Wonderland

This e-mail (and any attachments) is confidential and may contain
personal views which are not the views of the BBC unless specifically
stated.
If you have received it in error, please delete it from your system. 
Do not use, copy or disclose the information in any way nor act in
reliance on it and notify the sender immediately. Please note that the
BBC monitors e-mails sent or received. 
Further communication will signify your consent to this.
","","No","normal","busy","normal","No","",""
"Updated: Development Brainstorm","2004-07-19","13:30:00","2004-07-19","15:00:00","5254 - WC","http://www.bbc.co.uk/ - World Wide Wonderland

This e-mail (and any attachments) is confidential and may contain
personal views which are not the views of the BBC unless specifically
stated.
If you have received it in error, please delete it from your system. 
Do not use, copy or disclose the information in any way nor act in
reliance on it and notify the sender immediately. Please note that the
BBC monitors e-mails sent or received. 
Further communication will signify your consent to this.
","","No","normal","tentative","normal","No","",""
"1-1 Richard","2004-07-20","08:00:00","2004-07-20","09:30:00","","","","No","normal","busy","normal","No","",""
"WC Dentist","2004-07-20","11:00:00","2004-07-20","12:00:00","","","","No","normal","busy","normal","No","",""
"Has payroll arrived?","2004-07-24","17:00:00","2004-07-24","18:00:00","","","","No","normal","busy","normal","No","",""
"Sent payslips yet?","2004-07-25","11:00:00","2004-07-25","12:00:00","","","","No","normal","busy","normal","No","",""
"White Rose - Cream Tea","2004-07-25","14:00:00","2004-07-25","15:00:00","","","","No","normal","busy","normal","No","",""
"Pay people","2004-07-26","17:00:00","2004-07-26","18:00:00","","","","No","normal","busy","normal","No","",""
"Ensure payroll records updated","2004-07-26","20:00:00","2004-07-26","21:00:00","","","","No","normal","busy","normal","No","",""
"Scout Paper Collection","2004-07-27","07:00:00","2004-07-27","07:00:00","","","","No","normal","busy","normal","No","",""
"gemma cube","2004-07-27","08:00:00","2004-07-27","09:00:00","","","","No","normal","busy","normal","No","",""
"Claires Birthday","2004-07-28","All Day","2004-07-28","All Day","","","","Yes","normal","busy","normal","No","",""
"doctor","2004-07-28","08:00:00","2004-07-28","09:00:00","","","","No","normal","busy","normal","No","",""
"Diabetic Clinic York","2004-07-28","10:00:00","2004-07-28","10:30:00","","","","No","normal","busy","normal","No","",""
"Sent invoices yet?","2004-07-28","18:00:00","2004-07-28","19:00:00","","","","No","normal","busy","normal","No","",""
"Hair","2004-08-03","11:15:00","2004-08-03","12:15:00","","","","No","normal","busy","normal","No","",""
"Ensure invoice records in","2004-08-05","20:00:00","2004-08-05","21:00:00","","","","No","normal","busy","normal","No","",""
"Stamp issue - Royal Society of Arts","2004-08-10","All Day","2004-08-11","All Day","","","","Yes","normal","free","normal","No","",""
"Post NI Cheque","2004-08-14","All Day","2004-08-15","All Day","","","","Yes","normal","free","normal","No","",""
"Colin Dow Visit for weekend","2004-08-14","All Day","2004-08-16","All Day","","","","Yes","normal","free","normal","No","",""
"Payroll process begins","2004-08-14","All Day","2004-08-15","All Day","","","","Yes","normal","free","normal","No","",""
"Travel to York","2004-08-17","18:00:00","2004-08-17","19:30:00","","","","No","normal","busy","normal","No","",""
"ENSURE PAYROLL INFO HAS GONE TO BERYL","2004-08-18","All Day","2004-08-19","All Day","","","","Yes","normal","free","normal","No","",""
"York","2004-08-20","17:00:00","2004-08-20","18:00:00","","","","No","normal","busy","normal","No","",""
"Helen and Jo for weekend","2004-08-20","18:00:00","2004-08-22","18:30:00","","","","No","normal","busy","normal","No","",""
"Helen and jo to york","2004-08-21","11:00:00","2004-08-21","12:00:00","","","","No","normal","busy","normal","No","",""
"White Rose - Pearl Party","2004-08-21","18:00:00","2004-08-21","21:00:00","","","","No","normal","busy","normal","No","",""
"Brighton Visit","2004-08-24","12:00:00","2004-08-24","13:00:00","","","","No","normal","busy","normal","No","",""
"Has payroll arrived?","2004-08-24","17:00:00","2004-08-24","18:00:00","","","","No","normal","busy","normal","No","",""
"Sent payslips yet?","2004-08-25","11:00:00","2004-08-25","12:00:00","","","","No","normal","busy","normal","No","",""
"Sent invoices yet?","2004-08-25","18:00:00","2004-08-25","19:00:00","","","","No","normal","busy","normal","No","",""
"Ken And DI","2004-08-26","19:00:00","2004-08-26","21:00:00","","","","No","normal","busy","normal","No","",""
"Ensure payroll records updated","2004-08-26","20:00:00","2004-08-26","21:00:00","","","","No","normal","busy","normal","No","",""
"Scout Paper Collection","2004-08-27","07:00:00","2004-08-27","07:00:00","","","","No","normal","busy","normal","No","",""
"White Rose - Wild West Night","2004-08-28","18:00:00","2004-08-28","21:00:00","","","","No","normal","busy","normal","No","",""
"White Rose - BBQ","2004-08-29","11:00:00","2004-08-29","13:00:00","","","","No","normal","busy","normal","No","",""
"White Rose - English Breakfast","2004-08-30","08:00:00","2004-08-30","10:00:00","","","","No","normal","busy","normal","No","",""
"Genie Trials","2004-08-31","All Day","2004-09-04","All Day","","","","Yes","normal","free","normal","No","",""
"Fly to Scotland","2004-09-03","All Day","2004-09-07","All Day","","","","Yes","normal","free","normal","No","",""
"Dentist @ WC","2004-09-03","09:00:00","2004-09-03","10:00:00","","","","No","normal","busy","normal","No","",""
"Lucy Collins's Anniversary","2004-09-04","All Day","2004-09-05","All Day","","","","Yes","normal","free","normal","No","",""
"Ensure invoice records in","2004-09-05","20:00:00","2004-09-05","21:00:00","","","","No","normal","busy","normal","No","",""
"Scott and Tom for Lunch","2004-09-06","11:00:00","2004-09-06","13:30:00","","","","No","normal","busy","normal","No","",""
"Tom in tvc","2004-09-07","All Day","2004-09-09","All Day","","","","Yes","normal","free","normal","No","",""
"Book into Hull ferry","2004-09-09","18:30:00","2004-09-09","20:00:00","","","","No","normal","busy","normal","No","",""
"Payroll process begins","2004-09-14","All Day","2004-09-15","All Day","","","","Yes","normal","free","normal","No","",""
"Post NI Cheque","2004-09-14","All Day","2004-09-15","All Day","","","","Yes","normal","free","normal","No","",""
"Hair @ Pure","2004-09-14","11:30:00","2004-09-14","12:30:00","","","","No","normal","busy","normal","No","",""
"Women in Manangement (Superworking) (Tropical World (Leeds))","2004-09-15","18:00:00","2004-09-15","20:30:00","","","","No","normal","busy","normal","No","",""
"Stamp Issue - Woodland Animals","2004-09-16","All Day","2004-09-17","All Day","","","","Yes","normal","free","normal","No","",""
"Food Festival for 10 days","2004-09-17","08:00:00","2004-09-17","17:00:00","","","","No","normal","busy","normal","Yes","RRULE;FREQ=YEARLY;INTERVAL=12;BYDAY=3FR",""
"ENSURE PAYROLL INFO HAS GONE TO BERYL","2004-09-18","All Day","2004-09-19","All Day","","","","Yes","normal","free","normal","No","",""
"Lunchtime Nibbles @ WR","2004-09-18","11:00:00","2004-09-18","11:30:00","","","","No","normal","busy","normal","No","",""
"White Rose - Drinks & Nibbles","2004-09-18","11:00:00","2004-09-18","13:00:00","","","","No","normal","busy","normal","No","",""
"Coast & Country","2004-09-18","18:30:00","2004-09-18","21:00:00","York Water World","","","No","normal","busy","normal","No","",""
"eBay Reminder: MINT Canon EOS 300V body + strap + cap + instuctions.","2004-09-19","17:45:00","2004-09-19","19:45:00","","The end time for eBay listing number 3836988735 is scheduled to end soon! Click here to go to the page: http://cgi.ebay.co.uk/ws/eBayISAPI.dll?ViewItem&item=3836988735&sspagename=calrem
","","No","normal","busy","normal","No","",""
"Has payroll arrived?","2004-09-24","17:00:00","2004-09-24","18:00:00","","","","No","normal","busy","normal","No","",""
"Sent payslips yet?","2004-09-25","11:00:00","2004-09-25","12:00:00","","","","No","normal","busy","normal","No","",""
"Wr diamond dinner","2004-09-25","18:00:00","2004-09-25","20:30:00","","","","No","normal","busy","normal","No","",""
"Travel To London","2004-09-26","15:30:00","2004-09-26","17:00:00","","","","No","normal","busy","normal","No","",""
"Ensure payroll records updated","2004-09-26","20:00:00","2004-09-26","21:00:00","","","","No","normal","busy","normal","No","",""
"Scout Paper Collection","2004-09-27","07:00:00","2004-09-27","07:00:00","","","","No","normal","busy","normal","No","",""
"Dentist - Boots","2004-09-28","14:35:00","2004-09-28","16:00:00","","","","No","normal","busy","normal","No","",""
"Return From London","2004-09-28","18:00:00","2004-09-28","20:30:00","","","","No","normal","busy","normal","No","",""
"BBC Hull","2004-09-29","All Day","2004-09-30","All Day","","","","Yes","normal","free","normal","No","",""
"Has timesheet info arrived?","2004-09-29","17:00:00","2004-09-29","18:00:00","","","","No","normal","busy","normal","No","",""
"Sent invoices yet?","2004-09-29","18:00:00","2004-09-29","19:00:00","","","","No","normal","busy","normal","No","",""
"Glasgow","2004-09-30","All Day","2004-10-05","All Day","","","","Yes","normal","free","normal","No","",""
"York Hospital","2004-09-30","14:00:00","2004-09-30","15:00:00","","","","No","normal","busy","normal","No","",""
"Travel To GW","2004-09-30","15:45:00","2004-09-30","20:45:00","","","","No","normal","busy","normal","No","",""
"Largs","2004-10-01","08:00:00","2004-10-01","16:30:00","","","","No","normal","busy","normal","No","",""
"White Rose - Arabian Nights","2004-10-02","18:00:00","2004-10-02","21:00:00","","","","No","normal","busy","normal","No","",""
"Gns genie","2004-10-04","13:00:00","2004-10-04","14:00:00","foodcourt in glasgow","
Hi.  Stewart Easton has kindly agreed to nominate one of his hard working news SBJs to pop along to assist by actually knowing what's wanted here. 

  


http://www.bbc.co.uk/ - World Wide Wonderland

This e-mail (and any attachments) is confidential and may contain
personal views which are not the views of the BBC unless specifically
stated.
If you have received it in error, please delete it from your system. 
Do not use, copy or disclose the information in any way nor act in
reliance on it and notify the sender immediately. Please note that the
BBC monitors e-mails sent or received. 
Further communication will signify your consent to this.
","","No","normal","busy","normal","No","",""
"Return from Glasgow","2004-10-04","17:00:00","2004-10-04","19:30:00","","","","No","normal","busy","normal","No","",""
"Mum and Lilien in Thirsk","2004-10-05","All Day","2004-10-11","All Day","","","","Yes","normal","free","normal","No","",""
"New address","2004-10-05","11:00:00","2004-10-05","12:00:00","","","","No","normal","busy","normal","No","",""
"Dentist","2004-10-05","15:35:00","2004-10-05","16:05:00","Boots","","","No","normal","busy","normal","No","",""
"Ensure invoice records in","2004-10-05","20:00:00","2004-10-05","21:00:00","","","","No","normal","busy","normal","No","",""
"ENPS","2004-10-07","09:00:00","2004-10-07","12:00:00","Tom Cranstoun","http://www.bbc.co.uk/ - World Wide Wonderland

This e-mail (and any attachments) is confidential and may contain
personal views which are not the views of the BBC unless specifically
stated.
If you have received it in error, please delete it from your system. 
Do not use, copy or disclose the information in any way nor act in
reliance on it and notify the sender immediately. Please note that the
BBC monitors e-mails sent or received. 
Further communication will signify your consent to this.
","","No","normal","busy","normal","No","",""
"Eleanor to London","2004-10-08","17:00:00","2004-10-08","19:00:00","","","","No","normal","busy","normal","No","",""
"Need Hotel For DrDavid Party","2004-10-09","All Day","2004-10-11","All Day","","","","Yes","normal","free","normal","No","",""
"Dr David Party","2004-10-09","18:45:00","2004-10-09","21:45:00","","","","No","normal","busy","normal","No","",""
"Stamp Issue - The Crimean War","2004-10-12","All Day","2004-10-13","All Day","","","","Yes","normal","free","normal","No","",""
"Payroll process begins","2004-10-14","All Day","2004-10-15","All Day","","","","Yes","normal","free","normal","No","",""
"Post NI Cheque","2004-10-14","All Day","2004-10-15","All Day","","","","Yes","normal","free","normal","No","",""
"SightSonic Festival of Digital Arts","2004-10-14","08:00:00","2004-10-14","16:00:00","","","","No","normal","busy","normal","Yes","RRULE;FREQ=MONTHLY;INTERVAL=12;BYDAY=2TH",""
"Phone kathy","2004-10-14","18:30:00","2004-10-14","20:00:00","","","","No","normal","busy","normal","No","",""
"Amy Travelling To York","2004-10-16","All Day","2004-10-17","All Day","","Arrives York @ 16.30
","","Yes","normal","free","normal","No","",""
"Phil Barber's Birthday","2004-10-16","All Day","2004-10-17","All Day","","","","Yes","normal","free","normal","No","",""
"Work Weeken WR","2004-10-16","All Day","2004-10-18","All Day","","","","Yes","normal","free","normal","No","",""
"Birthday - Jean Fulton (1951)","2004-10-16","06:59:00","2004-10-16","06:59:00","","","","No","normal","busy","normal","No","",""
"Amy Arrives","2004-10-16","15:30:00","2004-10-16","16:30:00","","","","No","normal","busy","normal","No","",""
"Coast & Country","2004-10-16","18:30:00","2004-10-16","21:00:00","Doncaster Dome - TBC","","","No","normal","busy","normal","No","",""
"ENSURE PAYROLL INFO HAS GONE TO BERYL","2004-10-18","All Day","2004-10-19","All Day","","","","Yes","normal","free","normal","No","",""
"Eye examination in York","2004-10-19","11:00:00","2004-10-19","12:00:00","","","","No","normal","busy","normal","No","",""
"Women in Management (IoD)","2004-10-20","18:00:00","2004-10-20","20:30:00","Tropical World (Leeds)","","","No","normal","busy","normal","No","",""
"blackpool","2004-10-21","All Day","2004-10-25","All Day","","","","Yes","normal","free","normal","No","",""
"Birthday - Jo Dean (Millionaire Card)","2004-10-23","All Day","2004-10-24","All Day","","","","Yes","normal","free","normal","No","",""
"Amy Goes Back to Glasgow","2004-10-23","13:15:00","2004-10-23","13:45:00","Lonsdale Coach Park","","","No","normal","busy","normal","No","",""
"Sent payslips yet?","2004-10-25","08:30:00","2004-10-25","09:30:00","","","","No","normal","busy","normal","No","",""
"Future - lunch away from the office","2004-10-25","11:30:00","2004-10-25","13:30:00","","http://www.bbc.co.uk/ - World Wide Wonderland

This e-mail (and any attachments) is confidential and may contain
personal views which are not the views of the BBC unless specifically
stated.
If you have received it in error, please delete it from your system. 
Do not use, copy or disclose the information in any way nor act in
reliance on it and notify the sender immediately. Please note that the
BBC monitors e-mails sent or received. 
Further communication will signify your consent to this.
","","No","normal","busy","normal","No","",""
"Ensure payroll records updated","2004-10-26","20:00:00","2004-10-26","21:00:00","","","","No","normal","busy","normal","No","",""
"Scout Paper Collection","2004-10-27","07:00:00","2004-10-27","07:00:00","","","","No","normal","busy","normal","No","",""
"Sent invoices yet?","2004-10-27","18:00:00","2004-10-27","19:00:00","","","","No","normal","busy","normal","No","",""
"Glasgow Weekend","2004-10-28","All Day","2004-11-02","All Day","","","","Yes","normal","free","normal","No","",""
"Train To Glasgow","2004-10-28","16:36:00","2004-10-28","23:51:00","","","","No","normal","busy","normal","No","",""
"Largs","2004-10-29","All Day","2004-10-30","All Day","","","","Yes","normal","free","normal","No","",""
"Pictures","2004-10-30","10:00:00","2004-10-30","15:00:00","","","","No","normal","busy","normal","No","",""
"Elaine re printer","2004-10-30","15:00:00","2004-10-30","16:00:00","","","","No","normal","busy","normal","No","",""
"White Rose - Halloween","2004-10-30","18:00:00","2004-10-30","21:00:00","","","","No","normal","busy","normal","No","",""
"Lunch","2004-10-31","12:00:00","2004-10-31","14:00:00","","","","No","normal","busy","normal","No","",""
"Scott and vicky","2004-10-31","16:00:00","2004-10-31","22:00:00","Largs","","","No","normal","busy","normal","No","",""
"Shopping with mum c","2004-11-01","11:00:00","2004-11-01","14:00:00","¿where","","","No","normal","busy","normal","No","",""
"Return from Glasgow","2004-11-01","18:00:00","2004-11-01","22:00:00","","","","No","normal","busy","normal","No","",""
"Stamp Issue - Christmas","2004-11-02","All Day","2004-11-03","All Day","","","","Yes","normal","free","normal","No","",""
"Dentist","2004-11-02","09:00:00","2004-11-02","10:00:00","","","","No","normal","busy","normal","No","",""
"hair @ Pure","2004-11-02","12:30:00","2004-11-02","12:30:00","","","","No","normal","busy","normal","No","",""
"Genie filetransfer, wanting a bwav","2004-11-02","13:00:00","2004-11-02","14:00:00","","","","No","normal","busy","normal","No","",""
"Enps rollout in glasgow","2004-11-03","18:00:00","2004-11-03","19:00:00","","","","No","normal","busy","normal","No","",""
"Dentist - Boots","2004-11-04","08:45:00","2004-11-04","09:15:00","","","","No","normal","busy","normal","No","",""
"Blood Doning at Copmanthorpe","2004-11-04","14:00:00","2004-11-04","19:30:00","","","","No","normal","busy","normal","No","",""
"chicago","2004-11-05","20:30:00","2004-11-05","23:30:00","","","","No","normal","busy","normal","No","",""
"Ensure invoice records in","2004-11-05","21:00:00","2004-11-05","22:00:00","","","","No","normal","busy","normal","No","",""
"Birthday - Ian Foster (06/11/2004)","2004-11-06","All Day","2004-11-06","All Day","","false
false
false

EN-GB
X-NONE
X-NONE


















































































































































































































































































































































































































/* Style Definitions */
table.MsoNormalTable
	{mso-style-name:""Table Normal"";
	mso-tstyle-rowband-size:0;
	mso-tstyle-colband-size:0;
	mso-style-noshow:yes;
	mso-style-priority:99;
	mso-style-parent:"""";
	mso-padding-alt:0cm 5.4pt 0cm 5.4pt;
	mso-para-margin:0cm;
	mso-para-margin-bottom:.0001pt;
	mso-pagination:widow-orphan;
	font-size:11.0pt;
	font-family:""Calibri"",sans-serif;
	mso-ascii-font-family:Calibri;
	mso-hansi-font-family:Calibri;
	mso-bidi-font-family:""Times New Roman"";
	mso-fareast-language:EN-US;}","","Yes","normal","free","normal","Yes","RRULE;FREQ=YEARLY;INTERVAL=12;BYMONTHDAY=6",""
"Birthday - Ian Foster (06/11/2004)","2004-11-06","All Day","2004-11-06","All Day","","","","Yes","normal","busy","normal","Yes","RRULE;FREQ=YEARLY;INTERVAL=12;BYMONTHDAY=6",""
"Blood Doning at Cop","2004-11-08","All Day","2004-11-08","All Day","","","","Yes","normal","busy","private","No","",""
"Holiday -- Fuerteventura","2004-11-10","All Day","2004-11-18","All Day","","","","Yes","normal","free","normal","No","",""
"Birthday - Kelani Ajisafe (1949)","2004-11-11","All Day","2004-11-12","All Day","","","","Yes","normal","free","normal","No","",""
"Payroll process begins","2004-11-14","All Day","2004-11-15","All Day","","","","Yes","normal","free","normal","No","",""
"ENSURE PAYROLL INFO HAS GONE TO BERYL","2004-11-18","All Day","2004-11-19","All Day","","","","Yes","normal","free","normal","No","",""
"Osteo","2004-11-19","12:30:00","2004-11-19","13:30:00","","","","No","normal","busy","normal","No","",""
"Coast & Country","2004-11-20","19:00:00","2004-11-20","21:30:00","York Water World","","","No","normal","busy","normal","No","",""
"Christmas at Thirsk","2004-11-21","15:00:00","2004-11-21","22:00:00","","","","No","normal","busy","normal","No","",""
"Letter from Hertz re accident yet?","2004-11-22","All Day","2004-11-23","All Day","","","","Yes","normal","free","normal","No","",""
"Has payroll arrived?","2004-11-24","18:00:00","2004-11-24","19:00:00","","","","No","normal","busy","normal","No","",""
"Sent invoices yet?","2004-11-24","19:00:00","2004-11-24","20:00:00","","","","No","normal","busy","normal","No","",""
"St Nicholas Fayre","2004-11-25","09:00:00","2004-11-28","19:00:00","","","","No","normal","busy","normal","No","",""
"Sent payslips yet?","2004-11-25","12:00:00","2004-11-25","13:00:00","","","","No","normal","busy","normal","No","",""
"Look after nicola","2004-11-26","12:00:00","2004-11-28","13:00:00","","","","No","normal","busy","normal","No","",""
"Pay people","2004-11-26","18:00:00","2004-11-26","19:00:00","","","","No","normal","busy","normal","No","",""
"Ensure payroll records updated","2004-11-26","21:00:00","2004-11-26","22:00:00","","","","No","normal","busy","normal","No","",""
"Alex' wedding","2004-11-27","All Day","2004-11-28","All Day","","","","Yes","normal","free","normal","No","",""
"Scout Paper Collection","2004-11-27","08:00:00","2004-11-27","08:00:00","","","","No","normal","busy","normal","No","",""
"Dentist","2004-11-30","09:30:00","2004-11-30","10:00:00","","","","No","normal","busy","normal","No","",""
"Love's Labours Lost - YSP","2004-12-01","All Day","2004-12-12","All Day","Friargate Theatre","","","Yes","normal","free","normal","No","",""
"Tom and eleanor in scotland","2004-12-02","12:00:00","2004-12-06","13:00:00","","","","No","normal","busy","normal","No","",""
"Jean returns from SA","2004-12-03","08:00:00","2004-12-03","08:30:00","","","","No","normal","busy","normal","No","",""
"[Scotland]","2004-12-03","18:00:00","2004-12-03","19:00:00","","","","No","normal","busy","normal","No","",""
"Ensure invoice records in","2004-12-05","21:00:00","2004-12-05","22:00:00","","","","No","normal","busy","normal","No","",""
"Updated: Christmas Lunch","2004-12-09","12:30:00","2004-12-09","15:30:00","tba","


http://www.bbc.co.uk/

This e-mail (and any attachments) is confidential and may contain
personal views which are not the views of the BBC unless specifically
stated.
If you have received it in error, please delete it from your system. 
Do not use, copy or disclose the information in any way nor act in
reliance on it and notify the sender immediately. Please note that the
BBC monitors e-mails sent or received. 
Further communication will signify your consent to this.
","","No","normal","busy","normal","No","",""
"Hair @ Pure","2004-12-10","12:30:00","2004-12-10","13:30:00","","","","No","normal","busy","normal","No","",""
"Festival of Angels","2004-12-11","09:00:00","2004-12-12","20:00:00","","","","No","normal","busy","private","No","",""
"Club xmas party wr","2004-12-11","14:00:00","2004-12-11","23:00:00","","","","No","normal","busy","normal","No","",""
"White Rose - Christmas Dinner","2004-12-11","19:00:00","2004-12-11","22:00:00","","","","No","normal","busy","normal","No","",""
"Coast & Country","2004-12-11","19:30:00","2004-12-11","22:00:00","TBC","","","No","normal","busy","normal","No","",""
"Post NI Cheque","2004-12-14","All Day","2004-12-15","All Day","","","","Yes","normal","free","normal","No","",""
"Late Birthday Drink","2004-12-17","12:30:00","2004-12-17","14:30:00","BBC Club White City","
Dear All: 

Thanks ever so much for the lovely card and the much needed massage gift for my birthday.  I would like you all to join me for a drink at the BBC Club.  


http://www.bbc.co.uk/

This e-mail (and any attachments) is confidential and may contain
personal views which are not the views of the BBC unless specifically
stated.
If you have received it in error, please delete it from your system. 
Do not use, copy or disclose the information in any way nor act in
reliance on it and notify the sender immediately. Please note that the
BBC monitors e-mails sent or received. 
Further communication will signify your consent to this.
","","No","normal","tentative","normal","No","",""
"Doctor","2004-12-17","14:00:00","2004-12-17","15:00:00","","","","No","normal","busy","normal","No","",""
"Holiday ??","2004-12-20","All Day","2004-12-31","All Day","","","","Yes","normal","free","normal","No","",""
"Sent payslips yet?","2004-12-25","12:00:00","2004-12-25","13:00:00","","","","No","normal","busy","normal","No","",""
"Pay people","2004-12-26","18:00:00","2004-12-26","19:00:00","","","","No","normal","busy","normal","No","",""
"Has timesheet info arrived?","2004-12-29","18:00:00","2004-12-29","19:00:00","","","","No","normal","busy","normal","No","",""
"Sent invoices yet?","2004-12-29","19:00:00","2004-12-29","20:00:00","","","","No","normal","busy","normal","No","",""
"Return to bbc","2005-01-04","08:00:00","2005-01-04","09:00:00","","","","No","normal","busy","normal","No","",""
"Ensure invoice records in","2005-01-05","21:00:00","2005-01-05","22:00:00","","","","No","normal","busy","normal","No","",""
"News Search/ENPS","2005-01-06","10:30:00","2005-01-06","11:30:00","WC 1572","


http://www.bbc.co.uk/

This e-mail (and any attachments) is confidential and may contain
personal views which are not the views of the BBC unless specifically
stated.
If you have received it in error, please delete it from your system. 
Do not use, copy or disclose the information in any way nor act in
reliance on it and notify the sender immediately. Please note that the
BBC monitors e-mails sent or received. 
Further communication will signify your consent to this.
","","No","normal","busy","normal","No","",""
"Pix, anne and nicola.","2005-01-08","12:00:00","2005-01-08","16:00:00","","","","No","normal","busy","normal","No","",""
"Mr, kevin price","2005-01-10","11:00:00","2005-01-10","15:00:00","","","","No","normal","busy","normal","No","",""
"Dentist (adjust mouth guard)","2005-01-10","16:30:00","2005-01-10","17:00:00","","","","No","normal","busy","normal","No","",""
"Post NI Cheque","2005-01-14","All Day","2005-01-15","All Day","","","","Yes","normal","free","normal","No","",""
"Payroll process begins","2005-01-14","All Day","2005-01-15","All Day","","","","Yes","normal","free","normal","No","",""
"Osteopath","2005-01-14","12:30:00","2005-01-14","13:30:00","","","","No","normal","busy","normal","No","",""
"DDT Party","2005-01-15","19:00:00","2005-01-15","22:30:00","","DDT XMAS Party
","","No","normal","busy","normal","No","",""
"Lunchg with Jerry et al.","2005-01-16","12:15:00","2005-01-16","15:15:00","","","","No","normal","busy","normal","No","",""
"GNS Genie - Automation options","2005-01-17","10:30:00","2005-01-17","12:00:00","Room 5254 (near ENPS project office) - White City","After a two year gestation period (GNS Elephant?) GNS Genie is on the brink of financial approval. Associated with this, the automatic sending of GNS stories is being considered. This meeting is to try and identify the technical requirement and implications of this.


http://www.bbc.co.uk/

This e-mail (and any attachments) is confidential and may contain
personal views which are not the views of the BBC unless specifically
stated.
If you have received it in error, please delete it from your system. 
Do not use, copy or disclose the information in any way nor act in
reliance on it and notify the sender immediately. Please note that the
BBC monitors e-mails sent or received. 
Further communication will signify your consent to this.
","","No","normal","busy","normal","No","",""
"Forum De-brief","2005-01-17","14:00:00","2005-01-17","15:30:00","5252 White City","


http://www.bbc.co.uk/

This e-mail (and any attachments) is confidential and may contain
personal views which are not the views of the BBC unless specifically
stated.
If you have received it in error, please delete it from your system. 
Do not use, copy or disclose the information in any way nor act in
reliance on it and notify the sender immediately. Please note that the
BBC monitors e-mails sent or received. 
Further communication will signify your consent to this.
","","No","normal","busy","normal","No","",""
"ENSURE PAYROLL INFO HAS GONE TO BERYL","2005-01-18","All Day","2005-01-19","All Day","","","","Yes","normal","free","normal","No","",""
"Genie meeting","2005-01-18","10:00:00","2005-01-18","14:30:00","","","","No","normal","busy","normal","No","",""
"Hair","2005-01-18","12:30:00","2005-01-18","13:30:00","Pure","","","No","normal","busy","normal","No","",""
"kev n sue","2005-01-22","17:00:00","2005-01-22","22:00:00","","","","No","normal","busy","normal","No","",""
"Has payroll arrived?","2005-01-24","18:00:00","2005-01-24","19:00:00","","","","No","normal","busy","normal","No","",""
"9am Appointment","2005-01-25","09:00:00","2005-01-25","09:00:00","","","","No","normal","busy","normal","No","",""
"Claire grad","2005-01-25","12:00:00","2005-01-25","13:00:00","","","","No","normal","busy","normal","No","",""
"Sent payslips yet?","2005-01-25","12:00:00","2005-01-25","13:00:00","","","","No","normal","busy","normal","No","",""
"Pay people","2005-01-26","18:00:00","2005-01-26","19:00:00","","","","No","normal","busy","normal","No","",""
"Has timesheet info arrived?","2005-01-26","18:00:00","2005-01-26","19:00:00","","","","No","normal","busy","normal","No","",""
"Sent invoices yet?","2005-01-26","19:00:00","2005-01-26","20:00:00","","","","No","normal","busy","normal","No","",""
"Ensure payroll records updated","2005-01-26","21:00:00","2005-01-26","22:00:00","","","","No","normal","busy","normal","No","",""
"Scout Paper Collection","2005-01-27","08:00:00","2005-01-27","08:00:00","","","","No","normal","busy","normal","No","",""
"Scotland -- Birthdays","2005-01-28","All Day","2005-02-01","All Day","","","","Yes","normal","free","normal","No","",""
"Residents First Weekend","2005-01-29","All Day","2005-01-31","All Day","","","","Yes","normal","busy","normal","No","",""
"York Residents First Weekend?","2005-01-29","All Day","2005-01-31","All Day","","","","Yes","normal","free","normal","Yes","RRULE;FREQ=YEARLY;INTERVAL=12;BYDAY=-1SA",""
"York Residents First Weekend?","2005-01-29","All Day","2005-01-30","All Day","","","","Yes","normal","free","normal","Yes","RRULE;FREQ=YEARLY;INTERVAL=12;BYDAY=-1SA",""
"No Subject","2005-01-30","18:00:00","2005-01-30","19:00:00","","","","No","normal","busy","normal","No","",""
"Diabetic checkup","2005-02-01","13:30:00","2005-02-01","14:30:00","","","","No","normal","busy","normal","No","",""
"SURPRISE","2005-02-02","12:30:00","2005-02-02","15:30:00","tba","Mike will have completed 25 years' service at the BBC on this day. I think it would be nice to surprise him with a few drinks to mark this momentous occasion. Please keep the time free in your diaries. Thanks. More details nearer the time. 

Cheers 
Julie 


http://www.bbc.co.uk/

This e-mail (and any attachments) is confidential and may contain
personal views which are not the views of the BBC unless specifically
stated.
If you have received it in error, please delete it from your system. 
Do not use, copy or disclose the information in any way nor act in
reliance on it and notify the sender immediately. Please note that the
BBC monitors e-mails sent or received. 
Further communication will signify your consent to this.
","","No","normal","busy","normal","No","",""
"Discuss a pilot for ENPS on handhelds","2005-02-02","13:30:00","2005-02-02","14:30:00","Media Centre 4th Floor (TBC)","


http://www.bbc.co.uk/

This e-mail (and any attachments) is confidential and may contain
personal views which are not the views of the BBC unless specifically
stated.
If you have received it in error, please delete it from your system. 
Do not use, copy or disclose the information in any way nor act in
reliance on it and notify the sender immediately. Please note that the
BBC monitors e-mails sent or received. 
Further communication will signify your consent to this.
","","No","normal","busy","normal","No","",""
"viking festival","2005-02-04","12:00:00","2005-02-20","12:00:00","","","","No","normal","busy","normal","No","",""
"Haircut","2005-02-05","11:00:00","2005-02-05","12:00:00","","","","No","normal","busy","normal","No","",""
"Leeds Comic Mart","2005-02-05","12:30:00","2005-02-05","13:00:00","","","","No","normal","busy","normal","No","",""
"Ensure invoice records in","2005-02-05","21:00:00","2005-02-05","22:00:00","","","","No","normal","busy","normal","No","",""
"Birthday - Jamie Hulme (9/2/55)","2005-02-09","All Day","2005-02-10","All Day","","","","Yes","normal","free","normal","No","",""
"emt workshop","2005-02-10","14:00:00","2005-02-10","17:00:00","","","","No","normal","busy","normal","No","",""
"Osteopath","2005-02-11","12:30:00","2005-02-11","13:30:00","","","","No","normal","busy","normal","No","",""
"Osteo","2005-02-11","12:30:00","2005-02-11","13:30:00","","","","No","normal","busy","normal","No","",""
"WR - Valentines Night","2005-02-12","17:00:00","2005-02-12","21:00:00","","","","No","normal","busy","normal","No","",""
"CC Selby Abbey Leisure Centre","2005-02-12","18:00:00","2005-02-12","21:00:00","","","","No","normal","busy","normal","No","",""
"valentines","2005-02-12","19:00:00","2005-02-12","22:00:00","","","","No","normal","busy","normal","No","",""
"Payroll process begins","2005-02-14","All Day","2005-02-15","All Day","","","","Yes","normal","free","normal","No","",""
"WC","2005-02-15","09:00:00","2005-02-15","09:30:00","","","","No","normal","busy","normal","No","",""
"WC","2005-02-16","09:00:00","2005-02-16","09:30:00","","","","No","normal","busy","normal","No","",""
"Scott and vicky and faith","2005-02-18","08:00:00","2005-02-21","09:00:00","","","","No","normal","busy","normal","No","",""
"Cats 2 vet","2005-02-18","08:30:00","2005-02-18","09:00:00","minster vets","","","No","normal","busy","normal","No","",""
"scott & vicky","2005-02-18","18:00:00","2005-02-20","18:00:00","","","","No","normal","busy","normal","No","",""
"lunch at annes","2005-02-20","00:00:00","2005-02-20","14:00:00","","","","No","normal","busy","normal","No","",""
"Birthday - Derek Currie (12/2/52)","2005-02-22","All Day","2005-02-23","All Day","","","","Yes","normal","free","normal","No","",""
"Hair","2005-02-22","12:30:00","2005-02-22","13:30:00","Pure","","","No","normal","busy","normal","No","",""
"WC","2005-02-24","09:00:00","2005-02-24","09:30:00","","","","No","normal","busy","normal","No","",""
"WC","2005-02-25","09:00:00","2005-02-25","09:30:00","","","","No","normal","busy","normal","No","",""
"Sent payslips yet?","2005-02-25","12:00:00","2005-02-25","13:00:00","","","","No","normal","busy","normal","No","",""
"Heather?","2005-02-25","18:00:00","2005-02-28","18:00:00","","","","No","normal","busy","normal","No","",""
"Pay people","2005-02-26","18:00:00","2005-02-26","19:00:00","","","","No","normal","busy","normal","No","",""
"Scout Paper Collection","2005-02-27","08:00:00","2005-02-27","08:00:00","","","","No","normal","busy","normal","No","",""
"REMINDER - Annual Travel Policy Expires 22/3","2005-03-01","All Day","2005-03-02","All Day","","","","Yes","normal","free","normal","No","",""
"Wc","2005-03-01","09:00:00","2005-03-01","09:30:00","","","","No","normal","busy","normal","No","",""
"WC","2005-03-02","09:00:00","2005-03-02","09:30:00","","","","No","normal","busy","normal","No","",""
"WC","2005-03-03","10:00:00","2005-03-03","10:30:00","","","","No","normal","busy","normal","No","",""
"Firework makers daughter weekend","2005-03-04","08:00:00","2005-03-06","09:00:00","","","","No","normal","busy","normal","No","",""
"Reese goto disney","2005-03-05","12:00:00","2005-03-05","13:00:00","","","","No","normal","busy","normal","No","",""
"York Waterworld","2005-03-05","18:00:00","2005-03-05","21:00:00","","","","No","normal","busy","normal","No","",""
"DDT Insurance expires in three weeks","2005-03-07","All Day","2005-03-08","All Day","","","","Yes","normal","free","normal","Yes","RRULE;FREQ=YEARLY;INTERVAL=12;BYMONTHDAY=7",""
"Blood Doning @ Copmanthorpe","2005-03-07","14:00:00","2005-03-07","16:00:00","","","","No","normal","busy","normal","No","",""
"Blood Doning","2005-03-07","17:00:00","2005-03-07","19:30:00","Copmanthorpe","","","No","normal","busy","normal","No","",""
"WC","2005-03-08","09:00:00","2005-03-08","09:30:00","","","","No","normal","busy","normal","No","",""
"WC","2005-03-09","09:00:00","2005-03-09","09:30:00","","","","No","normal","busy","normal","No","",""
"Pay White Rose by 31/3","2005-03-10","All Day","2005-03-11","All Day","","","","Yes","normal","free","normal","Yes","RRULE;FREQ=YEARLY;INTERVAL=12;BYMONTHDAY=10",""
"osteo","2005-03-11","12:30:00","2005-03-12","01:30:00","","","","No","normal","busy","normal","No","",""
"Work Weekend - WR","2005-03-12","All Day","2005-03-14","All Day","","","","Yes","normal","free","normal","No","",""
"work weekend","2005-03-12","10:00:00","2005-03-13","18:00:00","","","","No","normal","busy","normal","No","",""
"Payroll process begins","2005-03-14","All Day","2005-03-15","All Day","","","","Yes","normal","free","normal","No","",""
"Post NI Cheque","2005-03-14","All Day","2005-03-15","All Day","","","","Yes","normal","free","normal","No","",""
"PSP On Sale From Today","2005-03-18","All Day","2005-03-19","All Day","","","","Yes","normal","free","normal","No","",""
"Has payroll arrived?","2005-03-24","18:00:00","2005-03-24","19:00:00","","","","No","normal","busy","normal","No","",""
"Easter Weekend","2005-03-25","All Day","2005-03-29","All Day","","","","Yes","normal","free","normal","No","",""
"Sent payslips yet?","2005-03-25","12:00:00","2005-03-25","13:00:00","","","","No","normal","busy","normal","No","",""
"Scott McGregors Birthday (26/03/71)","2005-03-26","00:00:00","2005-03-26","23:00:00","","","","No","normal","busy","normal","No","",""
"Pay people","2005-03-26","18:00:00","2005-03-26","19:00:00","","","","No","normal","busy","normal","No","",""
"Ensure payroll records updated","2005-03-26","21:00:00","2005-03-26","22:00:00","","","","No","normal","busy","normal","No","",""
"Scout Paper Collection","2005-03-27","07:00:00","2005-03-27","07:00:00","","","","No","normal","busy","normal","No","",""
"Dentist ","2005-03-30","15:30:00","2005-03-30","15:45:00","Optical Express","","","No","normal","busy","normal","No","",""
"steve & julie","2005-04-02","08:00:00","2005-04-02","08:00:00","","","","No","normal","busy","normal","No","",""
"Leeds Comic Mart","2005-04-02","11:30:00","2005-04-02","12:00:00","","","","No","normal","busy","normal","No","",""
"Vicki Birthday","2005-04-03","All Day","2005-04-04","All Day","","","","Yes","normal","free","normal","No","",""
"Hygienist","2005-04-04","11:15:00","2005-04-04","12:00:00","Dental Express","","","No","normal","busy","normal","No","",""
"Hair","2005-04-05","11:30:00","2005-04-05","12:30:00","Pure","","","No","normal","busy","normal","No","",""
"Work Weekend WR","2005-04-09","All Day","2005-04-11","All Day","","","","Yes","normal","free","normal","No","",""
"CC Selby","2005-04-09","17:00:00","2005-04-09","20:00:00","","","","No","normal","busy","normal","No","",""
"Birthday - Tracy Lefevre (1984)","2005-04-11","All Day","2005-04-12","All Day","","","","Yes","normal","busy","normal","No","",""
"Post NI Cheque","2005-04-14","All Day","2005-04-15","All Day","","","","Yes","normal","free","normal","No","",""
"Payroll process begins","2005-04-14","All Day","2005-04-15","All Day","","","","Yes","normal","free","normal","No","",""
"Birthday - Iona Debara Currie (15/04/1993)","2005-04-15","All Day","2005-04-16","All Day","","","","Yes","normal","free","normal","No","",""
"WR - Elizabethean Night","2005-04-16","16:00:00","2005-04-16","23:00:00","","","","No","normal","busy","normal","No","",""
"CC Harrogate Turkish","2005-04-16","17:00:00","2005-04-16","20:00:00","","","","No","normal","busy","normal","No","",""
"Birthday - Robyn Hamilton (1997)","2005-04-23","All Day","2005-04-23","All Day","","","","Yes","normal","busy","private","No","",""
"steve & julie?","2005-04-23","08:00:00","2005-04-23","08:00:00","","","","No","normal","busy","normal","No","",""
"Scout Paper Collection","2005-04-27","07:00:00","2005-04-27","07:00:00","","","","No","normal","busy","normal","No","",""
"Leeds Comic Mart","2005-04-30","11:30:00","2005-04-30","12:00:00","","","","No","normal","busy","normal","No","",""
"Charmouth Weekend","2005-05-13","All Day","2005-05-16","All Day","","","","Yes","normal","free","normal","No","",""
"Payroll process begins","2005-05-14","All Day","2005-05-15","All Day","","","","Yes","normal","free","normal","No","",""
"Post NI Cheque","2005-05-14","All Day","2005-05-15","All Day","","","","Yes","normal","free","normal","No","",""
"Loch Lomond Quilt Exhibition","2005-05-18","All Day","2005-05-22","All Day","","","","Yes","normal","free","normal","No","",""
"ENSURE PAYROLL INFO HAS GONE TO BERYL","2005-05-18","All Day","2005-05-19","All Day","","","","Yes","normal","free","normal","No","",""
"Has payroll arrived?","2005-05-24","17:00:00","2005-05-24","18:00:00","","","","No","normal","busy","normal","No","",""
"Sent payslips yet?","2005-05-25","11:00:00","2005-05-25","12:00:00","","","","No","normal","busy","normal","No","",""
"Has timesheet info arrived?","2005-05-25","17:00:00","2005-05-25","18:00:00","","","","No","normal","busy","normal","No","",""
"Sent invoices yet?","2005-05-25","18:00:00","2005-05-25","19:00:00","","","","No","normal","busy","normal","No","",""
"Pay people","2005-05-26","17:00:00","2005-05-26","18:00:00","","","","No","normal","busy","normal","No","",""
"Ensure payroll records updated","2005-05-26","20:00:00","2005-05-26","21:00:00","","","","No","normal","busy","normal","No","",""
"Scout Paper Collection","2005-05-27","07:00:00","2005-05-27","07:00:00","","","","No","normal","busy","normal","No","",""
"Lucy Collins's Birthday","2005-05-28","All Day","2005-05-29","All Day","","","","Yes","normal","free","normal","No","",""
"Ensure invoice records in","2005-06-05","20:00:00","2005-06-05","21:00:00","","","","No","normal","busy","normal","No","",""
"Post NI Cheque","2005-06-14","All Day","2005-06-15","All Day","","","","Yes","normal","free","normal","No","",""
"Payroll process begins","2005-06-14","All Day","2005-06-15","All Day","","","","Yes","normal","free","normal","No","",""
"Back-up tonight 1am  - leave computer on overnight & turn on ext drive","2005-06-15","17:00:00","2005-06-15","17:00:00","","","","No","normal","busy","normal","Yes","RRULE;FREQ=WEEKLY;BYDAY=WE",""
"ICPUGSE 25th Party","2005-06-16","All Day","2005-06-17","All Day","","","","Yes","normal","free","normal","No","",""
"ENSURE PAYROLL INFO HAS GONE TO BERYL","2005-06-18","All Day","2005-06-19","All Day","","","","Yes","normal","free","normal","No","",""
"CC Selby","2005-06-18","17:00:00","2005-06-18","20:00:00","","","","No","normal","busy","normal","No","",""
"Malton Swim","2005-06-19","15:00:00","2005-06-19","17:00:00","","","","No","normal","busy","normal","Yes","RRULE;FREQ=WEEKLY;INTERVAL=2;BYDAY=SU",""
"Birthday - Barbie Currie (22/06/1956)","2005-06-22","All Day","2005-06-23","All Day","","","","Yes","normal","free","normal","No","",""
"Has payroll arrived?","2005-06-24","17:00:00","2005-06-24","18:00:00","","","","No","normal","busy","normal","No","",""
"Rollercoast scotland??????","2005-06-25","07:00:00","2005-06-25","08:00:00","","","","No","normal","busy","normal","No","",""
"Sent payslips yet?","2005-06-25","11:00:00","2005-06-25","12:00:00","","","","No","normal","busy","normal","No","",""
"Pay people","2005-06-26","17:00:00","2005-06-26","18:00:00","","","","No","normal","busy","normal","No","",""
"Ensure payroll records updated","2005-06-26","20:00:00","2005-06-26","21:00:00","","","","No","normal","busy","normal","No","",""
"Scout Paper Collection","2005-06-27","07:00:00","2005-06-27","07:00:00","","","","No","normal","busy","normal","No","",""
"Tom's 50th Birthday","2005-06-29","All Day","2005-06-30","All Day","","","","Yes","normal","free","normal","No","",""
"Has timesheet info arrived?","2005-06-29","17:00:00","2005-06-29","18:00:00","","","","No","normal","busy","normal","No","",""
"Sent invoices yet?","2005-06-29","18:00:00","2005-06-29","19:00:00","","","","No","normal","busy","normal","No","",""
"One month to end of standard life early repayment penalty for 33 mortgage","2005-06-30","All Day","2005-07-01","All Day","","","","Yes","normal","free","normal","No","",""
"Birthday - Bill Bray 1/7 (01/07/2005)","2005-07-01","All Day","2005-07-01","All Day","","","","Yes","normal","busy","normal","Yes","RRULE;FREQ=YEARLY;INTERVAL=12;BYMONTHDAY=1",""
"Birthday - Bill Bray (01/07/2005)","2005-07-01","All Day","2005-07-01","All Day","","","","Yes","normal","busy","normal","Yes","RRULE;FREQ=YEARLY;INTERVAL=12;BYMONTHDAY=1",""
"Holiday -- Amsterdam","2005-07-02","All Day","2005-07-11","All Day","","","","Yes","normal","free","normal","No","",""
"Leeds Comic Mart","2005-07-02","11:30:00","2005-07-02","12:00:00","","","","No","normal","busy","normal","No","",""
"Tech Ed , Amsterdam","2005-07-05","All Day","2005-07-08","All Day","","","","Yes","normal","free","normal","No","",""
"Ensure invoice records in","2005-07-05","20:00:00","2005-07-05","21:00:00","","","","No","normal","busy","normal","No","",""
"CC York WaterWorld","2005-07-09","17:00:00","2005-07-09","20:00:00","","","","No","normal","busy","normal","No","",""
"Payroll process begins","2005-07-14","All Day","2005-07-15","All Day","","","","Yes","normal","free","normal","No","",""
"Post NI Cheque","2005-07-14","All Day","2005-07-15","All Day","","","","Yes","normal","free","normal","No","",""
"VAT DUE IN TWO WEEKS","2005-07-15","All Day","2005-07-16","All Day","","","","Yes","normal","free","normal","Yes","RRULE;FREQ=MONTHLY;INTERVAL=3;BYMONTHDAY=15",""
"WR Our Do @School Days@","2005-07-16","07:00:00","2005-07-16","22:00:00","","","","No","normal","busy","normal","No","",""
"ENSURE PAYROLL INFO HAS GONE TO BERYL","2005-07-18","All Day","2005-07-19","All Day","","","","Yes","normal","free","normal","No","",""
"Has payroll arrived?","2005-07-24","17:00:00","2005-07-24","18:00:00","","","","No","normal","busy","normal","No","",""
"Sent payslips yet?","2005-07-25","11:00:00","2005-07-25","12:00:00","","","","No","normal","busy","normal","No","",""
"Eleanor to Dentist for Checkup","2005-07-26","08:00:00","2005-07-26","08:30:00","","","","No","normal","busy","normal","No","",""
"Pay people","2005-07-26","17:00:00","2005-07-26","18:00:00","","","","No","normal","busy","normal","No","",""
"Ensure payroll records updated","2005-07-26","20:00:00","2005-07-26","21:00:00","","","","No","normal","busy","normal","No","",""
"Scout Paper Collection","2005-07-27","07:00:00","2005-07-27","07:00:00","","","","No","normal","busy","normal","No","",""
"Has timesheet info arrived?","2005-07-27","17:00:00","2005-07-27","18:00:00","","","","No","normal","busy","normal","No","",""
"Sent invoices yet?","2005-07-27","18:00:00","2005-07-27","19:00:00","","","","No","normal","busy","normal","No","",""
"VAT RETURN DUE 31/07","2005-07-31","All Day","2005-08-01","All Day","","","","Yes","normal","free","normal","Yes","RRULE;FREQ=YEARLY;INTERVAL=12;BYMONTHDAY=31",""
"Ensure invoice records in","2005-08-05","20:00:00","2005-08-05","21:00:00","","","","No","normal","busy","normal","No","",""
"Payroll process begins","2005-08-14","All Day","2005-08-15","All Day","","","","Yes","normal","free","normal","No","",""
"Post NI Cheque","2005-08-14","All Day","2005-08-15","All Day","","","","Yes","normal","free","normal","No","",""
"Repay HFC credit (washing machine) £220ish by 15th September","2005-08-15","All Day","2005-09-09","All Day","","","","Yes","normal","free","normal","No","",""
"ENSURE PAYROLL INFO HAS GONE TO BERYL","2005-08-18","All Day","2005-08-19","All Day","","","","Yes","normal","free","normal","No","",""
"Has payroll arrived?","2005-08-24","17:00:00","2005-08-24","18:00:00","","","","No","normal","busy","normal","No","",""
"Sent payslips yet?","2005-08-25","11:00:00","2005-08-25","12:00:00","","","","No","normal","busy","normal","No","",""
"Pay people","2005-08-26","17:00:00","2005-08-26","18:00:00","","","","No","normal","busy","normal","No","",""
"Ensure payroll records updated","2005-08-26","20:00:00","2005-08-26","21:00:00","","","","No","normal","busy","normal","No","",""
"Scout Paper Collection","2005-08-27","07:00:00","2005-08-27","07:00:00","","","","No","normal","busy","normal","No","",""
"Glenna Hamilton (1994)","2005-08-31","All Day","2005-09-01","All Day","","","","Yes","normal","free","normal","Yes","RRULE;FREQ=YEARLY;INTERVAL=12;BYMONTHDAY=31",""
"Birthday Glenna Hamilton (31/08/2005)","2005-08-31","All Day","2005-08-31","All Day","","","","Yes","normal","free","normal","Yes","RRULE;FREQ=YEARLY;INTERVAL=12;BYMONTHDAY=31",""
"Has timesheet info arrived?","2005-08-31","17:00:00","2005-08-31","18:00:00","","","","No","normal","busy","normal","No","",""
"Sent invoices yet?","2005-08-31","18:00:00","2005-08-31","19:00:00","","","","No","normal","busy","normal","No","",""
"CC York waterworld","2005-09-03","17:00:00","2005-09-03","20:00:00","","","","No","normal","busy","normal","No","",""
"Ensure invoice records in","2005-09-05","20:00:00","2005-09-05","21:00:00","","","","No","normal","busy","normal","No","",""
"Birthday - Jill Barbara Currie (10/9/85)","2005-09-10","All Day","2005-09-11","All Day","","","","Yes","normal","free","normal","No","",""
"Payroll process begins","2005-09-14","All Day","2005-09-15","All Day","","","","Yes","normal","free","normal","No","",""
"Post NI Cheque","2005-09-14","All Day","2005-09-15","All Day","","","","Yes","normal","free","normal","No","",""
"ENSURE PAYROLL INFO HAS GONE TO BERYL","2005-09-18","All Day","2005-09-19","All Day","","","","Yes","normal","free","normal","No","",""
"CC Harrogate Spa","2005-09-24","16:30:00","2005-09-24","19:30:00","","","","No","normal","busy","normal","No","",""
"Has payroll arrived?","2005-09-24","17:00:00","2005-09-24","18:00:00","","","","No","normal","busy","normal","No","",""
"Sent payslips yet?","2005-09-25","11:00:00","2005-09-25","12:00:00","","","","No","normal","busy","normal","No","",""
"Pay people","2005-09-26","17:00:00","2005-09-26","18:00:00","","","","No","normal","busy","normal","No","",""
"Ensure payroll records updated","2005-09-26","20:00:00","2005-09-26","21:00:00","","","","No","normal","busy","normal","No","",""
"Scout Paper Collection","2005-09-27","07:00:00","2005-09-27","07:00:00","","","","No","normal","busy","normal","No","",""
"Has timesheet info arrived?","2005-09-28","17:00:00","2005-09-28","18:00:00","","","","No","normal","busy","normal","No","",""
"Sent invoices yet?","2005-09-28","18:00:00","2005-09-28","19:00:00","","","","No","normal","busy","normal","No","",""
"Green Bin & Recycling Today","2005-10-03","All Day","2005-10-04","All Day","","","","Yes","normal","free","normal","Yes","RRULE;FREQ=WEEKLY;INTERVAL=2;BYDAY=MO;UNTIL=16001231",""
"Ensure invoice records in","2005-10-05","20:00:00","2005-10-05","21:00:00","","","","No","normal","busy","normal","No","",""
"Birthday - Ailie Hulme Currie (11/10/1989)","2005-10-11","All Day","2005-10-12","All Day","","","","Yes","normal","free","normal","No","",""
"Post NI Cheque","2005-10-14","All Day","2005-10-15","All Day","","","","Yes","normal","free","normal","No","",""
"Payroll process begins","2005-10-14","All Day","2005-10-15","All Day","","","","Yes","normal","free","normal","No","",""
"CC Selby Leisure Centre","2005-10-15","17:00:00","2005-10-15","20:00:00","","","","No","normal","busy","normal","No","",""
"Companies House Return due by 13th November","2005-10-16","All Day","2005-10-17","All Day","","","","Yes","normal","free","normal","No","",""
"ENSURE PAYROLL INFO HAS GONE TO BERYL","2005-10-18","All Day","2005-10-19","All Day","","","","Yes","normal","free","normal","No","",""
"Has payroll arrived?","2005-10-24","17:00:00","2005-10-24","18:00:00","","","","No","normal","busy","normal","No","",""
"Sent payslips yet?","2005-10-25","11:00:00","2005-10-25","12:00:00","","","","No","normal","busy","normal","No","",""
"Has timesheet info arrived?","2005-10-26","17:00:00","2005-10-26","18:00:00","","","","No","normal","busy","normal","No","",""
"Pay people","2005-10-26","17:00:00","2005-10-26","18:00:00","","","","No","normal","busy","normal","No","",""
"Sent invoices yet?","2005-10-26","18:00:00","2005-10-26","19:00:00","","","","No","normal","busy","normal","No","",""
"Ensure payroll records updated","2005-10-26","20:00:00","2005-10-26","21:00:00","","","","No","normal","busy","normal","No","",""
"Scout Paper Collection","2005-10-27","07:00:00","2005-10-27","07:00:00","","","","No","normal","busy","normal","No","",""
"VAT RETURN DUE 31/10","2005-10-31","All Day","2005-11-01","All Day","","","","Yes","normal","free","normal","Yes","RRULE;FREQ=YEARLY;INTERVAL=12;BYMONTHDAY=31",""
"VAT RETRN DUE 31/10","2005-10-31","All Day","2005-11-01","All Day","","","","Yes","normal","free","normal","Yes","RRULE;FREQ=YEARLY;INTERVAL=12;BYMONTHDAY=31",""
"Birthday - Maria Wood (04/11/2005)","2005-11-04","All Day","2005-11-04","All Day","","","","Yes","normal","free","normal","Yes","RRULE;FREQ=YEARLY;INTERVAL=12;BYMONTHDAY=4",""
"Kevin Humphrey Birthday (05/11/2005)","2005-11-05","All Day","2005-11-05","All Day","","","","Yes","normal","busy","normal","Yes","RRULE;FREQ=YEARLY;INTERVAL=12;BYMONTHDAY=5",""
"Ensure invoice records in","2005-11-05","21:00:00","2005-11-05","22:00:00","","","","No","normal","busy","normal","No","",""
"Birthday - Elaine (10/11/2005)","2005-11-10","All Day","2005-11-10","All Day","","","","Yes","normal","free","normal","Yes","RRULE;FREQ=YEARLY;INTERVAL=12;BYMONTHDAY=10",""
"Birthday - Kelani Ajisafe (1949)","2005-11-11","All Day","2005-11-12","All Day","","","","Yes","normal","free","normal","No","",""
"CC York Waterworld","2005-11-12","18:00:00","2005-11-12","21:00:00","","","","No","normal","busy","normal","No","",""
"Post NI Cheque","2005-11-14","All Day","2005-11-15","All Day","","","","Yes","normal","free","normal","No","",""
"Payroll process begins","2005-11-14","All Day","2005-11-15","All Day","","","","Yes","normal","free","normal","No","",""
"ENSURE PAYROLL INFO HAS GONE TO BERYL","2005-11-18","All Day","2005-11-19","All Day","","","","Yes","normal","free","normal","No","",""
"Has payroll arrived?","2005-11-24","18:00:00","2005-11-24","19:00:00","","","","No","normal","busy","normal","No","",""
"Sent payslips yet?","2005-11-25","12:00:00","2005-11-25","13:00:00","","","","No","normal","busy","normal","No","",""
"Pay people","2005-11-26","18:00:00","2005-11-26","19:00:00","","","","No","normal","busy","normal","No","",""
"Ensure payroll records updated","2005-11-26","21:00:00","2005-11-26","22:00:00","","","","No","normal","busy","normal","No","",""
"Scout Paper Collection","2005-11-27","08:00:00","2005-11-27","08:00:00","","","","No","normal","busy","normal","No","",""
"Has timesheet info arrived?","2005-11-30","18:00:00","2005-11-30","19:00:00","","","","No","normal","busy","normal","No","",""
"Sent invoices yet?","2005-11-30","19:00:00","2005-11-30","20:00:00","","","","No","normal","busy","normal","No","",""
"Cc Harrogate","2005-12-03","18:00:00","2005-12-03","21:00:00","","","","No","normal","busy","normal","No","",""
"Ensure invoice records in","2005-12-05","21:00:00","2005-12-05","22:00:00","","","","No","normal","busy","normal","No","",""
"Birthday - Mark Ellis (09/12/2005)","2005-12-09","All Day","2005-12-09","All Day","","","","Yes","normal","busy","normal","Yes","RRULE;FREQ=YEARLY;INTERVAL=12;BYMONTHDAY=9",""
"Payroll process begins","2005-12-14","All Day","2005-12-15","All Day","","","","Yes","normal","free","normal","No","",""
"Post NI Cheque","2005-12-14","All Day","2005-12-15","All Day","","","","Yes","normal","free","normal","No","",""
"ENSURE PAYROLL INFO HAS GONE TO BERYL","2005-12-18","All Day","2005-12-19","All Day","","","","Yes","normal","free","normal","No","",""
"Birthday - Anjeli Gurung (1977)","2005-12-21","All Day","2005-12-22","All Day","","","","Yes","normal","free","normal","No","",""
"Has payroll arrived?","2005-12-24","18:00:00","2005-12-24","19:00:00","","","","No","normal","busy","normal","No","",""
"Sent payslips yet?","2005-12-25","12:00:00","2005-12-25","13:00:00","","","","No","normal","busy","normal","No","",""
"Pay people","2005-12-26","18:00:00","2005-12-26","19:00:00","","","","No","normal","busy","normal","No","",""
"Ensure payroll records updated","2005-12-26","21:00:00","2005-12-26","22:00:00","","","","No","normal","busy","normal","No","",""
"Scout Paper Collection","2005-12-27","08:00:00","2005-12-27","08:00:00","","","","No","normal","busy","normal","No","",""
"Has timesheet info arrived?","2005-12-28","18:00:00","2005-12-28","19:00:00","","","","No","normal","busy","normal","No","",""
"Sent invoices yet?","2005-12-28","19:00:00","2005-12-28","20:00:00","","","","No","normal","busy","normal","No","",""
"Birthday - Ian Asher","2006-01-05","00:00:00","2006-01-05","12:00:00","","","","No","normal","busy","normal","Yes","RRULE;FREQ=YEARLY;INTERVAL=12;BYDAY=1TH",""
"Birthday - Ian Grant (13/01/2006)","2006-01-13","All Day","2006-01-13","All Day","","","","Yes","normal","busy","normal","Yes","RRULE;FREQ=YEARLY;INTERVAL=12;BYMONTHDAY=13",""
"VAT RETURN DUE 31/01","2006-01-31","All Day","2006-02-01","All Day","","","","Yes","normal","free","normal","Yes","RRULE;FREQ=YEARLY;INTERVAL=12;BYMONTHDAY=31",""
"Birthday - Vicky McGregor (03/04/2006)","2006-04-03","All Day","2006-04-03","All Day","","","","Yes","normal","free","normal","Yes","RRULE;FREQ=YEARLY;INTERVAL=12;BYMONTHDAY=3",""
"Birthday - Iona Currie (13/04/2006)","2006-04-13","All Day","2006-04-13","All Day","","","","Yes","normal","free","normal","Yes","RRULE;FREQ=YEARLY;INTERVAL=12;BYMONTHDAY=13",""
"Birthday - Di Blackhurst (19/04/2006)","2006-04-19","All Day","2006-04-19","All Day","","","","Yes","normal","free","normal","Yes","RRULE;FREQ=YEARLY;INTERVAL=12;BYMONTHDAY=19",""
"VAT RETURN DUE 30/04","2006-04-30","All Day","2006-05-01","All Day","","","","Yes","normal","free","normal","Yes","RRULE;FREQ=YEARLY;INTERVAL=12;BYMONTHDAY=30",""
"MOT for NY 03 DNJ due 30/06","2006-06-30","All Day","2006-07-01","All Day","","","","Yes","normal","free","normal","Yes","RRULE;FREQ=YEARLY;INTERVAL=12;BYMONTHDAY=30",""
"Birthday - Rachel Wilkinson (17/07/2006)","2006-07-17","All Day","2006-07-17","All Day","","","","Yes","normal","free","normal","Yes","RRULE;FREQ=YEARLY;INTERVAL=12;BYMONTHDAY=17",""
"Birthday - Barbie Currie (22/07/2006)","2006-07-22","All Day","2006-07-22","All Day","","","","Yes","normal","free","normal","Yes","RRULE;FREQ=YEARLY;INTERVAL=12;BYMONTHDAY=22",""
"Birthday - Esther McGregor (03/08/2006)","2006-08-03","All Day","2006-08-03","All Day","","","","Yes","normal","free","normal","Yes","RRULE;FREQ=YEARLY;INTERVAL=12;BYMONTHDAY=3",""
"Birthday - Les Turnbull (04/08/2006)","2006-08-04","All Day","2006-08-04","All Day","","","","Yes","normal","free","normal","Yes","RRULE;FREQ=YEARLY;INTERVAL=12;BYMONTHDAY=4",""
"Birthday - Steve Owen (11/08/2006)","2006-08-11","All Day","2006-08-11","All Day","","","","Yes","normal","free","normal","Yes","RRULE;FREQ=YEARLY;INTERVAL=12;BYMONTHDAY=11",""
"Birthday - Jill Currie (10/09/2006)","2006-09-10","All Day","2006-09-10","All Day","","","","Yes","normal","free","normal","Yes","RRULE;FREQ=YEARLY;INTERVAL=12;BYMONTHDAY=10",""
"Cancel Hygienist","2006-10-04","06:00:00","2006-10-04","06:00:00","","","","No","normal","busy","normal","No","",""
"Property Away Day","2006-10-04","08:00:00","2006-10-04","11:05:00","","","","No","normal","busy","normal","No","",""
"Dentist Aldwark","2006-10-10","16:00:00","2006-10-10","16:15:00","","","","No","normal","busy","normal","No","",""
"Dentist (Parliament St)","2006-10-17","11:40:00","2006-10-17","12:10:00","","","","No","normal","busy","normal","No","",""
"Osteo","2006-10-20","11:30:00","2006-10-20","12:30:00","","","","No","normal","busy","normal","No","",""
"Hair","2006-11-02","16:15:00","2006-11-02","17:15:00","pure","","","No","normal","busy","normal","No","",""
"Sauna","2006-11-09","19:00:00","2006-11-09","21:00:00","","","","No","normal","busy","normal","No","",""
"Sauna","2006-11-16","19:00:00","2006-11-16","21:00:00","","","","No","normal","busy","normal","Yes","RRULE;FREQ=WEEKLY;BYDAY=TH",""
"osteo","2006-11-17","12:30:00","2006-11-17","13:30:00","","","","No","normal","busy","normal","No","",""
"Christmas Fair at Racecourse","2006-11-21","10:00:00","2006-11-22","16:00:00","","","","No","normal","busy","normal","No","",""
"Blood Doning","2006-11-24","17:00:00","2006-11-24","19:30:00","Copmanthorpe","","","No","normal","busy","normal","No","",""
"Black Bin Today","2006-12-04","All Day","2006-12-05","All Day","","","","Yes","normal","free","normal","Yes","RRULE;FREQ=WEEKLY;INTERVAL=2;BYDAY=MO;UNTIL=16001231",""
"Hair","2006-12-12","12:30:00","2006-12-12","13:30:00","pure","","","No","normal","busy","normal","No","",""
"Osteo","2006-12-15","12:30:00","2006-12-15","13:30:00","","","","No","normal","busy","normal","No","",""
"Dentist","2007-04-11","16:00:00","2007-04-11","16:15:00","Aldwark","","","No","normal","busy","normal","No","",""
"Remind Mum to read meters by 5th","2007-07-01","All Day","2007-07-02","All Day","","","","Yes","normal","free","normal","Yes","RRULE;FREQ=MONTHLY;INTERVAL=3;BYDAY=1SU,1MO,1TU,1WE,1TH,1FR,1SA",""
"Mum's Grass","2007-09-22","All Day","2007-09-23","All Day","","","","Yes","normal","free","normal","Yes","RRULE;FREQ=WEEKLY;INTERVAL=2;BYDAY=SA",""
"Start to prepare VAT return info for Geoff","2007-10-01","All Day","2007-10-02","All Day","21st - EC Sales list required","","","Yes","normal","free","normal","Yes","RRULE;FREQ=MONTHLY;INTERVAL=3;BYMONTHDAY=1",""
"Start to prepare VAT return info for Geoff","2007-10-01","All Day","2007-10-02","All Day","","","","Yes","normal","free","normal","Yes","RRULE;FREQ=MONTHLY;INTERVAL=3;BYMONTHDAY=1",""
"Sent VAT Return info to Geoff","2007-10-08","All Day","2007-10-09","All Day","","","","Yes","normal","free","normal","Yes","RRULE;FREQ=MONTHLY;INTERVAL=3;BYMONTHDAY=8",""
"Arrange Tesco Credit Card Payment (CL £9k)","2007-12-14","All Day","2007-12-15","All Day","","","","Yes","normal","free","normal","Yes","RRULE;FREQ=MONTHLY;BYMONTHDAY=14",""
"Blood Doning","2008-05-21","16:30:00","2008-05-21","17:30:00","Merchant Taylors","","","No","normal","busy","normal","No","",""
"Chris re building work","2008-06-02","17:30:00","2008-06-02","18:00:00","here","","","No","normal","busy","normal","No","",""
"Copmanthorpe School IT Suite","2008-06-04","08:00:00","2008-06-04","08:30:00","","","","No","normal","busy","normal","No","",""
"New Stamps - Films","2008-06-10","All Day","2008-06-11","All Day","","","","Yes","normal","free","normal","No","",""
"New Stamps - Airshows","2008-07-17","All Day","2008-07-18","All Day","","","","Yes","normal","free","normal","No","",""
"BOOK Tech Ed - Barcelona","2008-07-17","07:30:00","2008-07-17","08:00:00","By 31st July","","","No","normal","busy","normal","No","",""
"PAY Cyprus Holiday balance","2008-07-19","07:00:00","2008-07-19","07:30:00","by 26th July","","","No","normal","free","normal","No","",""
"Pay HMRC Tom's self-assessment tax on account for 07/08 - £1,449.11-  account ref 2998640285K","2008-07-31","All Day","2008-08-01","All Day","","","","Yes","normal","free","normal","No","",""
"Copmanthorpe - Progress Meeting","2008-08-21","08:30:00","2008-08-21","09:30:00","","","","No","normal","busy","normal","No","",""
"New Stamps - Olympics","2008-08-26","All Day","2008-08-27","All Day","","","","Yes","normal","free","normal","No","",""
"Blood Doning","2008-09-11","16:00:00","2008-09-11","17:00:00","merchant taylors","","","No","normal","busy","normal","No","",""
"New Stamps - RAF","2008-09-18","All Day","2008-09-19","All Day","","","","Yes","normal","free","normal","No","",""
"CYPRUS","2008-09-24","All Day","2008-10-02","All Day","","","","Yes","normal","out-of-office","normal","No","",""
"New Stamps - Contry Definatives are 50","2008-09-29","All Day","2008-09-30","All Day","","","","Yes","normal","free","normal","No","",""
"New Stamps - Women","2008-10-14","All Day","2008-10-15","All Day","","","","Yes","normal","free","normal","No","",""
"Hygienist","2008-10-23","11:40:00","2008-10-23","12:10:00","Parliament Street","","","No","normal","busy","normal","No","",""
"Christmas Stamps (More new stamps on Thursday!)","2008-11-04","All Day","2008-11-05","All Day","","","","Yes","normal","free","normal","No","",""
"Tech-Ed","2008-11-08","All Day","2008-11-16","All Day","Barcelona","","","Yes","normal","out-of-office","normal","No","",""
"Birthday - Steve Walker (28/11/2008)","2008-11-28","All Day","2008-11-28","All Day","","","","Yes","normal","free","normal","Yes","RRULE;FREQ=YEARLY;INTERVAL=12;BYMONTHDAY=28",""
"New Stamps - Lest we Forget","2008-12-06","All Day","2008-12-07","All Day","","","","Yes","normal","free","normal","No","",""
"Caravan Insurance - Has Renewal Notice Arrived ","2008-12-07","All Day","2008-12-08","All Day","RS Thom 01438 316651","","","Yes","normal","free","normal","Yes","RRULE;FREQ=YEARLY;INTERVAL=12;BYMONTHDAY=7",""
"Hair @ pure","2009-01-06","21:00:00","2009-01-06","22:00:00","","","","No","normal","busy","normal","No","",""
"Caravan Insurance Due 10th Jan - Has Renewal Notice Arrived?","2009-01-10","All Day","2009-01-11","All Day","My Holiday Home Insurance - 01604 946 771","","","Yes","normal","free","normal","Yes","RRULE;FREQ=YEARLY;INTERVAL=12;BYMONTHDAY=10",""
"Raise red bee invoice for 3rd quarter support","2009-01-14","All Day","2009-01-15","All Day","","","","Yes","normal","free","normal","No","",""
"ALLIANCE & Leicester, Coppergate - ID +NI #","2009-02-16","12:00:00","2009-02-16","12:30:00","","","","No","normal","busy","normal","No","",""
"STAMPS - Wales","2009-02-26","All Day","2009-02-27","All Day","","","","Yes","normal","free","normal","No","",""
"Raise Annual Genie Invoice","2009-03-01","All Day","2009-03-02","All Day","","","","Yes","normal","free","normal","Yes","RRULE;FREQ=YEARLY;INTERVAL=12;BYMONTHDAY=1",""
"STAMPS - Pioneers","2009-03-10","All Day","2009-03-11","All Day","","","","Yes","normal","free","normal","No","",""
"Unison AGM","2009-03-11","19:00:00","2009-03-11","21:00:00","","","","No","normal","busy","normal","No","",""
"Rufforth - Progress Meeting","2009-03-30","08:30:00","2009-03-30","10:00:00","","","","No","normal","busy","normal","No","",""
"Raise red bee invoice for 4th quarter support","2009-04-14","All Day","2009-04-15","All Day","","","","Yes","normal","free","normal","No","",""
"Think about next support contract for red bee (expires 14th july)","2009-04-14","All Day","2009-04-15","All Day","","","","Yes","normal","free","normal","No","",""
"Dentist","2009-04-14","11:00:00","2009-04-14","11:30:00","Parliament St","","","No","normal","busy","normal","No","",""
"Doctor","2009-04-20","08:10:00","2009-04-20","08:40:00","Stonebow","","","No","normal","busy","normal","No","",""
"SMG","2009-04-20","09:45:00","2009-04-20","10:45:00","Merchant Taylors","","","No","normal","busy","normal","No","",""
"STAMPS - House of Tudor","2009-04-21","All Day","2009-04-22","All Day","","","","Yes","normal","free","normal","No","",""
"Car Service - Nationwide","2009-04-21","07:30:00","2009-04-21","08:00:00","","","","No","normal","busy","normal","No","",""
"Birthday - Carolyn Towse (26/04/2009)","2009-04-26","All Day","2009-04-26","All Day","","","","Yes","normal","free","normal","Yes","RRULE;FREQ=YEARLY;INTERVAL=12;BYMONTHDAY=26",""
"Birthday - Julie Wright (29/04/2009)","2009-04-29","All Day","2009-04-29","All Day","","","","Yes","normal","free","normal","Yes","RRULE;FREQ=YEARLY;INTERVAL=12;BYMONTHDAY=29",""
"Hygienist","2009-05-07","11:00:00","2009-05-07","11:30:00","Parliament Street","","","No","normal","busy","normal","No","",""
"Dentist","2009-05-13","08:00:00","2009-05-13","08:30:00","Parliament Street","","","No","normal","busy","normal","No","",""
"STAMPS - Plants","2009-05-19","All Day","2009-05-20","All Day","","","","Yes","normal","free","normal","No","",""
"Tom to Hygienist - Thursday 21st","2009-05-21","08:00:00","2009-05-21","08:30:00","","","","No","normal","busy","normal","No","",""
"Asbestos Course","2009-05-22","08:00:00","2009-05-22","11:00:00","9am start","","","No","normal","busy","normal","No","",""
"Chris Clint","2009-06-01","17:00:00","2009-06-01","17:30:00","here","","","No","normal","busy","normal","No","",""
"STAMPS - Mythical Creatures","2009-06-16","All Day","2009-06-17","All Day","","","","Yes","normal","free","normal","No","",""
"Hair","2009-06-16","11:30:00","2009-06-16","12:30:00","Pure","","","No","normal","busy","normal","No","",""
"Landlord Gas Safety Cert Expires 18/6 - Baird Avenue","2009-06-18","All Day","2009-06-19","All Day","","","","Yes","normal","free","normal","No","",""
"Landlords Gas Certificate Expires 3/7 - Dalmally Road","2009-07-03","All Day","2009-07-04","All Day","","","","Yes","normal","free","normal","No","",""
"18:55 - Bloood Doning","2009-07-22","17:30:00","2009-07-22","18:00:00","Merchant Taylors","","","No","normal","busy","normal","No","",""
"STAMPS - Post Boxes","2009-08-18","All Day","2009-08-19","All Day","","","","Yes","normal","free","normal","No","",""
"Review Bank Account Income (esp letting account) and top-up as necessary (min £1,000 over month)","2009-08-24","06:00:00","2009-08-24","06:30:00","","","","No","normal","busy","normal","Yes","RRULE;FREQ=MONTHLY;BYMONTHDAY=24",""
"Review Bank Account Income (esp letting account) and top-up as necessary (min £1,000 over month)","2009-08-24","08:00:00","2009-08-24","08:30:00","","","","No","normal","busy","normal","Yes","RRULE;FREQ=MONTHLY;BYMONTHDAY=24",""
"Education Liaison at 08:30 (Mill House), followed by Oaklands SC at 11:00","2009-08-26","07:30:00","2009-08-26","11:00:00","","","","No","normal","busy","normal","No","",""
"STAMPS - Fire & Rescue","2009-09-01","All Day","2009-09-02","All Day","","","","Yes","normal","free","normal","No","",""
"STAMPS - RN Uniforms","2009-09-17","All Day","2009-09-18","All Day","","","","Yes","normal","free","normal","No","",""
"Payroll - Complete Spreadsheet","2009-09-18","All Day","2009-09-19","All Day","","","","Yes","normal","free","normal","Yes","RRULE;FREQ=MONTHLY;BYMONTHDAY=18;UNTIL=16001231",""
"Payroll - Returned by Geoff?","2009-09-22","All Day","2009-09-23","All Day","","","","Yes","normal","free","normal","Yes","RRULE;FREQ=MONTHLY;BYMONTHDAY=22;UNTIL=16001231",""
"Payroll - Set up Payments","2009-09-25","All Day","2009-09-26","All Day","","","","Yes","normal","free","normal","Yes","RRULE;FREQ=MONTHLY;BYMONTHDAY=25;UNTIL=16001231",""
"Ask Sheila re new PO for ENPS October onwards","2009-10-02","All Day","2009-10-03","All Day","","","","Yes","normal","free","normal","No","",""
"STAMPS - Britons","2009-10-08","All Day","2009-10-09","All Day","","","","Yes","normal","free","normal","No","",""
"STAMPS - Christmas","2009-11-03","All Day","2009-11-04","All Day","","","","Yes","normal","free","normal","No","",""
"Dentist","2009-11-05","09:25:00","2009-11-05","09:55:00","Parliament Street","","","No","normal","busy","normal","No","",""
"Come Dine with me with Claire Baron","2009-11-08","20:00:00","2009-11-08","20:30:00","Channel 4","","","No","normal","busy","normal","No","",""
"Blood","2009-11-11","18:45:00","2009-11-11","19:45:00","Merchant Taylors","","","No","normal","busy","normal","No","",""
"Meeting invitation: FM easy webinar","2009-11-19","10:00:00","2009-11-19","11:00:00","https://sercoevents.webex.com/sercoevents","Hello ,

Julian Griffith invites you to attend this online meeting.

Topic: FM easy webinar
Date: Thursday, 19 November 2009
Time: 10:00, GMT Standard Time (GMT -00:00, London)
Meeting Number: 847 403 177
Meeting Password: FMeasy123

Please click the link below to see more information, or to join the meeting.

-------------------------------------------------------
To join the online meeting (Now from iPhones too!)
-------------------------------------------------------
1. Go to https://sercoevents.webex.com/sercoevents/j.php?ED=131236042&UID=0&PW=7b1f136f512561080f4815504157
2. Enter your name and email address.
3. Enter the meeting password: FMeasy123
4. Click ""Join Now"".

-------------------------------------------------------
To join the teleconference only 
-------------------------------------------------------
Welcome to the FM easy webinar.

Please dial 0203 308 2206 to take part and click on the link shown to see the screens. 

-------------------------------------------------------
For assistance
-------------------------------------------------------
1. Go to https://sercoevents.webex.com/sercoevents/mc
2. On the left navigation bar, click ""Support"".

You can contact me at:
julian.griffith@serco.com
44-01332 826872

To add this meeting to your calendar program (for example Microsoft Outlook), click this link:
https://sercoevents.webex.com/sercoevents/j.php?ED=131236042&UID=1093022342&ICS=MI&LD=1&RD=18&ST=1&SHA2=gZ8e5gJPUPyba48Q6pRhEdsL6WyuCOUoTAJiPwIzpyQ=

The playback of UCF (Universal Communications Format) rich media files requires appropriate players. To view this type of rich media files in the meeting, please check whether you have the players installed on your computer by going to https://sercoevents.webex.com/sercoevents/systemdiagnosis.php

Sign up for a free trial of WebEx
http://www.webex.com/go/mcemfreetrial

http://www.webex.com 
We've got to start meeting like this(TM)

IMPORTANT NOTICE: This WebEx service includes a feature that allows audio and any documents and other materials exchanged or viewed during the session to be recorded. By joining this session, you automatically consent to such recordings. If you do not consent to the recording, do not join the session.
","","No","normal","tentative","normal","No","",""
"Hair","2009-11-24","12:30:00","2009-11-24","13:30:00","Pure","","","No","normal","busy","normal","No","",""
"Hygienist","2009-11-26","12:30:00","2009-11-26","13:00:00","Parliament Street","","","No","normal","busy","normal","No","",""
"Dentist - Aldwark","2010-01-18","17:00:00","2010-01-18","17:30:00","","","","No","normal","busy","normal","No","",""
"DOCTORS","2010-02-22","09:00:00","2010-02-22","10:00:00","FASTING BLOOD TESTS","","","No","normal","busy","normal","No","",""
"STAMPS - Royal Society","2010-02-25","All Day","2010-02-26","All Day","","","","Yes","normal","free","normal","No","",""
"Opt out of ""The Week"" subscription?   Cancel DD (DDT) 0808 1783 970 Dennis Publishing","2010-02-27","08:00:00","2010-02-27","08:30:00","","","","No","normal","busy","normal","No","",""
"STAMPS - Battersea Dogs","2010-03-11","All Day","2010-03-12","All Day","","","","Yes","normal","free","normal","No","",""
"ST PATRICK'S DAY","2010-03-17","All Day","2010-03-17","All Day","","","","Yes","normal","busy","private","No","",""
"STAMPS - House of Stewarts","2010-03-23","All Day","2010-03-24","All Day","","","","Yes","normal","free","normal","No","",""
"Ask Sheila for new PO (April onwards)","2010-03-31","All Day","2010-04-01","All Day","","","","Yes","normal","free","normal","No","",""
"Phoebe @ Y2","2010-04-07","15:00:00","2010-04-07","17:00:00","","","","No","normal","busy","normal","No","",""
"STAMPS - Mammals","2010-04-13","All Day","2010-04-14","All Day","","","","Yes","normal","free","normal","No","",""
"Test Smoke Alarm","2010-04-14","All Day","2010-04-15","All Day","","","","Yes","normal","free","normal","Yes","RRULE;FREQ=WEEKLY;BYDAY=WE",""
"ENT Appt","2010-04-19","08:10:00","2010-04-19","10:10:00","York Hosp","","","No","normal","busy","normal","No","",""
"Phoebe","2010-04-19","15:00:00","2010-04-19","17:00:00","Y2","","","No","normal","busy","normal","No","",""
"Dentist - Check up","2010-05-05","08:00:00","2010-05-05","08:30:00","Parliament Street","","","No","normal","busy","normal","No","",""
"Julia","2010-05-05","15:00:00","2010-05-05","17:00:00","Y2","","","No","normal","busy","normal","No","",""
"STAMPS - London 2010","2010-05-06","All Day","2010-05-07","All Day","also something on 8th?","","","Yes","normal","free","normal","No","",""
"STAMPS - Britain Alone","2010-05-13","All Day","2010-05-14","All Day","","","","Yes","normal","free","normal","No","",""
"Apply for Tesco MOT vouchers for Corsa","2010-05-18","All Day","2010-05-19","All Day","","","","Yes","normal","free","normal","No","",""
"Book MOT Appointment for Corsa next week (after 1st June)","2010-05-25","08:00:00","2010-05-25","08:30:00","","","","No","normal","busy","normal","No","",""
"Paperwork for Motorhome hire is in LHS bottom desk drawer","2010-05-28","All Day","2010-05-29","All Day","","","","Yes","normal","free","normal","No","",""
"Alliance and Leicester 12 month bond expires on 1st July - find new home for £50k","2010-06-01","All Day","2010-06-02","All Day","","","","Yes","normal","free","normal","No","",""
"19a gas cert due this month (expires 30th June)","2010-06-01","All Day","2010-06-02","All Day","","","","Yes","normal","free","normal","Yes","RRULE;FREQ=YEARLY;INTERVAL=12;BYMONTHDAY=1",""
"STAMPS - House of Stewarts","2010-06-15","All Day","2010-06-16","All Day","","","","Yes","normal","free","normal","No","",""
"Corsa MOT & Service - Tesco Vouchers","2010-06-16","08:00:00","2010-06-16","08:30:00","Layerthorpe","","","No","normal","busy","normal","No","",""
"Hygienist","2010-06-17","11:30:00","2010-06-17","12:00:00","Parliament Street","","","No","normal","busy","normal","No","",""
"CE Briefing at Guildhall","2010-06-24","07:30:00","2010-06-24","08:30:00","","","","No","normal","busy","normal","No","",""
"STAMPS - Olympics","2010-07-27","All Day","2010-07-28","All Day","","","","Yes","normal","free","normal","No","",""
"Library Book due back","2010-08-11","07:00:00","2010-08-11","07:30:00","","","","No","normal","busy","normal","No","",""
"Hospital Appointment 11:10","2010-08-11","10:00:00","2010-08-11","10:30:00","","","","No","normal","busy","normal","No","",""
"STAMPS - Musicals","2010-08-19","All Day","2010-08-20","All Day","","","","Yes","normal","free","normal","No","",""
"EMT - Tuesday morning","2010-08-24","08:00:00","2010-08-24","10:00:00","","","","No","normal","busy","normal","No","",""
"STAMPS - Railways","2010-09-16","All Day","2010-09-17","All Day","","","","Yes","normal","free","normal","No","",""
"Jeans for Genes Day","2010-10-01","All Day","2010-10-02","All Day","","","","Yes","normal","free","normal","No","",""
"STAMPS - Childrens Books","2010-10-12","All Day","2010-10-13","All Day","","","","Yes","normal","free","normal","No","",""
"9am meeting","2010-10-26","08:00:00","2010-10-26","08:30:00","","","","No","normal","busy","normal","No","",""
"STAMPS - Christmas","2010-11-02","All Day","2010-11-03","All Day","","","","Yes","normal","free","normal","No","",""
"9am meeting","2010-11-04","09:00:00","2010-11-04","09:30:00","","","","No","normal","busy","normal","No","",""
"9am meeting 20 GHS","2010-11-05","08:00:00","2010-11-05","08:30:00","","","","No","normal","busy","normal","No","",""
"Birthday - Shirley Miller (11/11/2010)","2010-11-11","All Day","2010-11-11","All Day","","","","Yes","normal","busy","normal","Yes","RRULE;FREQ=YEARLY;INTERVAL=12;BYMONTHDAY=11",""
"Tax returns Info - Gather up bits n bobs","2010-11-16","17:00:00","2010-11-16","17:30:00","","","","No","normal","busy","normal","No","",""
"Jet2 Check-in opens","2010-11-19","08:30:00","2010-11-19","09:00:00","Booking Ref: 2D258G","","","No","normal","busy","normal","No","",""
"18:00 Calender - Vote for Holgate Windmill","2010-11-22","16:30:00","2010-11-22","17:00:00","","","","No","normal","busy","normal","No","",""
"LEAVE","2010-11-26","All Day","2010-11-27","All Day","","","","Yes","normal","free","normal","No","",""
"Birthday - Ed Affleck (29/11/2010)","2010-11-29","All Day","2010-11-29","All Day","","","","Yes","normal","free","normal","Yes","RRULE;FREQ=YEARLY;INTERVAL=12;BYMONTHDAY=29",""
"AM - Leave","2010-12-01","All Day","2010-12-02","All Day","","","","Yes","normal","free","normal","No","",""
"Renew Library Books","2010-12-03","08:00:00","2010-12-03","08:30:00","","","","No","normal","busy","normal","No","",""
"Finalise tax info for geoff","2010-12-03","09:00:00","2010-12-03","09:30:00","","","","No","normal","busy","normal","No","",""
"Send tax info to geoff","2010-12-07","08:00:00","2010-12-07","08:30:00","","","","No","normal","busy","normal","No","",""
"Set up payment to HMRC for December tax + NI = £2,986.71 to reach them by 17th January","2010-12-29","08:00:00","2010-12-29","08:30:00","","","","No","normal","busy","normal","No","",""
"European Health Insurance Card Expires Today","2011-01-01","All Day","2011-01-02","All Day","","","","Yes","normal","free","normal","No","",""
"wednesday 9am meeting","2011-01-05","09:00:00","2011-01-05","09:30:00","","","","No","normal","busy","normal","No","",""
"STAMPS - Thunderbirds","2011-01-11","All Day","2011-01-12","All Day","Tuesday 1th","","","Yes","normal","free","normal","No","",""
"9am meeting - 1-1 with Ian","2011-01-11","09:00:00","2011-01-11","09:30:00","","","","No","normal","busy","normal","No","",""
"Blood Doning","2011-01-11","18:30:00","2011-01-11","19:30:00","Acomb","","","No","normal","busy","normal","No","",""
"9am training course at 20 GHS","2011-01-12","09:00:00","2011-01-12","09:30:00","","","","No","normal","busy","normal","No","",""
"09:30 Training course at GHS","2011-01-13","09:30:00","2011-01-13","10:00:00","","","","No","normal","busy","normal","No","",""
"Birthday - Pam Drake 14th January 1951 (14/01/2011)","2011-01-14","All Day","2011-01-14","All Day","","","","Yes","normal","free","normal","Yes","RRULE;FREQ=YEARLY;INTERVAL=12;BYMONTHDAY=14",""
"STAMPS - Birds of Britain","2011-01-24","All Day","2011-01-25","All Day","Mon 24th","","","Yes","normal","free","normal","No","",""
"Set up Record for Beauty and the Beast on Tuesday 2nd Feb Channel 4","2011-01-26","All Day","2011-01-27","All Day","","","","Yes","normal","free","normal","No","",""
"STAMPS - Classic Locomotives","2011-02-01","All Day","2011-02-02","All Day","Tues 1st","","","Yes","normal","free","normal","No","",""
"Sauna","2011-02-03","19:00:00","2011-02-03","21:00:00","","","","No","normal","busy","normal","No","",""
"Review Mums Phanton Tesco Order - due for delivery 15th Feb!!","2011-02-07","09:30:00","2011-02-07","10:00:00","","","","No","normal","busy","normal","No","",""
"(No Subject)","2011-02-08","22:30:00","2011-02-08","22:30:00","","","","No","normal","free","normal","No","",""
"(No Subject)","2011-02-08","22:30:00","2011-02-08","22:30:00","United Kingdom","","","No","normal","free","normal","No","",""
"(No Subject)","2011-02-08","23:00:00","2011-02-08","23:00:00","","","","No","normal","free","normal","No","",""
"(No Subject)","2011-02-08","23:00:00","2011-02-08","23:00:00","United Kingdom","","","No","normal","free","normal","No","",""
"Library Book - Renew","2011-02-09","All Day","2011-02-10","All Day","","","","Yes","normal","free","normal","No","",""
"(No Subject)","2011-02-11","20:30:00","2011-02-11","20:30:00","","","","No","normal","free","normal","No","",""
"(No Subject)","2011-02-11","20:30:00","2011-02-11","20:30:00","United Kingdom","","","No","normal","free","normal","No","",""
"(No Subject)","2011-02-12","09:00:00","2011-02-12","09:00:00","","","","No","normal","free","normal","No","",""
"(No Subject)","2011-02-12","09:00:00","2011-02-12","09:00:00","United Kingdom","","","No","normal","free","normal","No","",""
"(No Subject)","2011-02-12","09:30:00","2011-02-12","09:30:00","","","","No","normal","free","normal","No","",""
"(No Subject)","2011-02-12","09:30:00","2011-02-12","09:30:00","United Kingdom","","","No","normal","free","normal","No","",""
"(No Subject)","2011-02-12","10:30:00","2011-02-12","10:30:00","","","","No","normal","free","normal","No","",""
"(No Subject)","2011-02-12","10:30:00","2011-02-12","10:30:00","United Kingdom","","","No","normal","free","normal","No","",""
"(No Subject)","2011-02-13","10:00:00","2011-02-13","10:00:00","","","","No","normal","free","normal","No","",""
"(No Subject)","2011-02-13","10:00:00","2011-02-13","10:00:00","United Kingdom","","","No","normal","free","normal","No","",""
"(No Subject)","2011-02-13","19:00:00","2011-02-13","19:00:00","","","","No","normal","free","normal","No","",""
"Park & Ride Pass expires this week","2011-02-14","All Day","2011-02-15","All Day"," before 16/02","","","Yes","normal","free","normal","Yes","RRULE;FREQ=WEEKLY;BYDAY=MO;COUNT=7",""
"Birthday - Derek Currie 22nd Feb 1952 (22/02/2011)","2011-02-22","All Day","2011-02-22","All Day","","","","Yes","normal","free","normal","Yes","RRULE;FREQ=YEARLY;INTERVAL=12;BYMONTHDAY=22",""
"STAMPS - Musicals","2011-02-24","All Day","2011-02-25","All Day","Thurs 24th","","","Yes","normal","free","normal","No","",""
"Read Meters","2011-02-28","All Day","2011-03-01","All Day","","","","Yes","normal","free","normal","Yes","RRULE;FREQ=MONTHLY;BYDAY=-1SU,-1MO,-1TU,-1WE,-1TH,-1FR,-1SA",""
"STAMPS - Magical Realms","2011-03-08","All Day","2011-03-09","All Day","Tues 8th ","","","Yes","normal","free","normal","No","",""
"Read Meters","2011-03-10","All Day","2011-03-11","All Day","","","","Yes","normal","free","normal","Yes","RRULE;FREQ=MONTHLY;BYMONTHDAY=10",""
"Payroll - Review Helens Total Pay over past 12 months and make up to match Tom's salary if necessary","2011-03-14","All Day","2011-03-15","All Day","","","","Yes","normal","free","normal","Yes","RRULE;FREQ=YEARLY;INTERVAL=12;BYMONTHDAY=14",""
"STAMPS - WWF","2011-03-22","All Day","2011-03-23","All Day","Tues 22nd","","","Yes","normal","free","normal","No","",""
"Anniversary - Dad died 2010","2011-03-22","All Day","2011-03-23","All Day","","","","Yes","normal","free","normal","No","",""
"Renew Library Books","2011-03-22","08:00:00","2011-03-22","08:30:00","","","","No","normal","busy","normal","No","",""
"CENSUS 2011","2011-03-27","All Day","2011-03-28","All Day","","","","Yes","normal","free","normal","No","",""
"All Saints Upper","2011-03-28","09:00:00","2011-03-28","09:30:00","","","","No","normal","busy","normal","No","",""
"Anniversary - Barbie & Derek (29/03/2011)","2011-03-29","All Day","2011-03-29","All Day","","","","Yes","normal","free","normal","Yes","RRULE;FREQ=YEARLY;INTERVAL=12;BYMONTHDAY=29",""
"Ray's Presentation","2011-03-30","08:00:00","2011-03-30","08:30:00","9am","","","No","normal","busy","normal","No","",""
"Hygienist","2011-04-01","11:00:00","2011-04-01","11:40:00","Parliament St","","","No","normal","busy","normal","No","",""
"(No Subject)","2011-04-02","07:30:00","2011-04-02","07:30:00","","","","No","normal","free","normal","No","",""
"(No Subject)","2011-04-02","07:30:00","2011-04-02","07:30:00","United Kingdom","","","No","normal","free","normal","No","",""
"(No Subject)","2011-04-02","08:00:00","2011-04-02","08:00:00","","","","No","normal","free","normal","No","",""
"(No Subject)","2011-04-02","08:00:00","2011-04-02","08:00:00","United Kingdom","","","No","normal","free","normal","No","",""
"(No Subject)","2011-04-02","08:30:00","2011-04-02","08:30:00","","","","No","normal","free","normal","No","",""
"(No Subject)","2011-04-02","08:30:00","2011-04-02","08:30:00","United Kingdom","","","No","normal","free","normal","No","",""
"Birthday - Alfie Parry (03/04/2011)","2011-04-03","All Day","2011-04-03","All Day","","","","Yes","normal","free","normal","Yes","RRULE;FREQ=YEARLY;INTERVAL=12;BYMONTHDAY=3",""
"(No Subject)","2011-04-04","18:30:00","2011-04-04","18:30:00","","","","No","normal","free","normal","No","",""
"(No Subject)","2011-04-05","19:30:00","2011-04-05","19:30:00","","","","No","normal","free","normal","No","",""
"(No Subject)","2011-04-06","19:30:00","2011-04-06","19:30:00","","","","No","normal","free","normal","No","",""
"(No Subject)","2011-04-06","19:30:00","2011-04-06","19:30:00","United Kingdom","","","No","normal","free","normal","No","",""
"(No Subject)","2011-04-07","21:30:00","2011-04-07","21:30:00","","","","No","normal","free","normal","No","",""
"(No Subject)","2011-04-08","22:00:00","2011-04-08","22:00:00","","","","No","normal","free","normal","No","",""
"VETS","2011-04-09","08:00:00","2011-04-09","08:30:00","Cop","","","No","normal","busy","normal","No","",""
"Renew Library Books","2011-04-10","All Day","2011-04-11","All Day","","","","Yes","normal","free","normal","No","",""
"(No Subject)","2011-04-10","16:00:00","2011-04-10","17:00:00","Home","Send text to Stuart
","","No","normal","tentative","normal","No","",""
"(No Subject)","2011-04-10","19:00:00","2011-04-10","19:00:00","","","","No","normal","free","normal","No","",""
"STAMPS - Shakespeare","2011-04-12","All Day","2011-04-13","All Day","Tues 12th","","","Yes","normal","free","normal","No","",""
"Blood Doning","2011-04-12","17:50:00","2011-04-12","18:20:00","Acomb","","","No","normal","busy","normal","No","",""
"(No Subject)","2011-04-12","20:30:00","2011-04-12","20:30:00","","","","No","normal","free","normal","No","",""
"(No Subject)","2011-04-13","19:00:00","2011-04-13","19:00:00","","","","No","normal","free","normal","No","",""
"(No Subject)","2011-04-16","07:00:00","2011-04-16","07:00:00","","","","No","normal","free","normal","No","",""
"(No Subject)","2011-04-17","19:00:00","2011-04-17","19:00:00","","","","No","normal","free","normal","No","",""
"Renew Library Books","2011-04-20","All Day","2011-04-21","All Day","","","","Yes","normal","free","normal","No","",""
"Hair","2011-04-20","11:30:00","2011-04-20","12:30:00","Pure","","","No","normal","busy","normal","No","",""
"(No Subject)","2011-04-23","10:30:00","2011-04-23","10:30:00","","","","No","normal","free","normal","No","",""
"(No Subject)","2011-04-25","19:30:00","2011-04-25","19:30:00","","","","No","normal","free","normal","No","",""
"Eleanor - Alliance & Leister Savings Account is 1 year old on 1st June and interest rate will drop - check out best deals and move money!","2011-05-01","07:00:00","2011-05-01","07:30:00","","","","No","normal","busy","normal","No","",""
"Renew Library Books (11/5)","2011-05-09","All Day","2011-05-10","All Day","","","","Yes","normal","free","normal","No","",""
"Dentist Check-up","2011-05-10","15:40:00","2011-05-10","16:10:00","Aldwark","","","No","normal","busy","normal","No","",""
"(No Subject)","2011-05-11","06:30:00","2011-05-11","06:30:00","","","","No","normal","free","normal","No","",""
"(No Subject)","2011-05-11","06:30:00","2011-05-11","06:30:00","United Kingdom","","","No","normal","free","normal","No","",""
"(No Subject)","2011-05-11","07:00:00","2011-05-11","07:00:00","","","","No","normal","free","normal","No","",""
"(No Subject)","2011-05-11","07:00:00","2011-05-11","07:00:00","United Kingdom","","","No","normal","free","normal","No","",""
"Corsa Insrance Expires Noon Saturday 14th May","2011-05-14","All Day","2011-05-15","All Day","","","","Yes","normal","free","normal","No","",""
"(No Subject)","2011-05-15","10:30:00","2011-05-15","10:30:00","","","","No","normal","free","normal","No","",""
"(No Subject)","2011-05-15","10:30:00","2011-05-15","10:30:00","United Kingdom","","","No","normal","free","normal","No","",""
"(No Subject)","2011-05-15","11:00:00","2011-05-15","11:00:00","","","","No","normal","free","normal","No","",""
"(No Subject)","2011-05-15","11:00:00","2011-05-15","11:00:00","United Kingdom","","","No","normal","free","normal","No","",""
"(No Subject)","2011-05-15","11:30:00","2011-05-15","11:30:00","","","","No","normal","free","normal","No","",""
"(No Subject)","2011-05-15","11:30:00","2011-05-15","11:30:00","United Kingdom","","","No","normal","free","normal","No","",""
"(No Subject)","2011-05-15","12:00:00","2011-05-15","12:00:00","","","","No","normal","free","normal","No","",""
"(No Subject)","2011-05-15","12:00:00","2011-05-15","12:00:00","United Kingdom","","","No","normal","free","normal","No","",""
"(No Subject)","2011-05-16","18:30:00","2011-05-16","18:30:00","","","","No","normal","free","normal","No","",""
"(No Subject)","2011-05-16","18:30:00","2011-05-16","18:30:00","United Kingdom","","","No","normal","free","normal","No","",""
"(No Subject)","2011-05-18","19:00:00","2011-05-18","19:00:00","","","","No","normal","free","normal","No","",""
"(No Subject)","2011-05-18","19:30:00","2011-05-18","19:30:00","","","","No","normal","free","normal","No","",""
"107 - Review position with Gas Care contract as new boiler 1 year old","2011-05-20","All Day","2011-05-21","All Day","Former Home Care 200 agreement ref 120077714495853 cancelled 23/06/10","","","Yes","normal","free","normal","No","",""
"(No Subject)","2011-05-22","21:30:00","2011-05-22","21:30:00","","","","No","normal","free","normal","No","",""
"(No Subject)","2011-05-22","21:30:00","2011-05-22","21:30:00","United Kingdom","","","No","normal","free","normal","No","",""
"Check in for Pula (up to 4 hours before flight)","2011-05-23","All Day","2011-05-24","All Day","","","","Yes","normal","free","normal","No","",""
"(No Subject)","2011-05-23","18:30:00","2011-05-23","18:30:00","","","","No","normal","free","normal","No","",""
"Anniversary - Julie Affleck's Birthday (24/05/2011)","2011-05-24","All Day","2011-05-24","All Day","","","","Yes","normal","free","normal","Yes","RRULE;FREQ=YEARLY;INTERVAL=12;BYMONTHDAY=24",""
"Birthday - Julie Affleck (24/05/2011)","2011-05-24","All Day","2011-05-24","All Day","","","","Yes","normal","free","normal","Yes","RRULE;FREQ=YEARLY;INTERVAL=12;BYMONTHDAY=24",""
"(No Subject)","2011-05-24","20:30:00","2011-05-24","20:30:00","","","","No","normal","free","normal","No","",""
"TSB internet savings account is 1 year old on 25th June and interest will drop!","2011-05-25","All Day","2011-05-26","All Day","","","","Yes","normal","free","normal","No","",""
"Eleanor - Leave","2011-05-25","All Day","2011-05-26","All Day","","","","Yes","normal","free","normal","No","",""
"Osteo","2011-05-27","11:30:00","2011-05-27","12:30:00","Stonebow","","","No","normal","tentative","normal","No","",""
"(No Subject)","2011-05-30","11:30:00","2011-05-30","11:30:00","","","","No","normal","free","normal","No","",""
"York High re CARE","2011-05-31","09:00:00","2011-05-31","10:00:00","","","","No","normal","busy","normal","No","",""
"(No Subject)","2011-05-31","20:00:00","2011-05-31","20:00:00","","","","No","normal","free","normal","No","",""
"Hair","2011-06-01","11:15:00","2011-06-01","12:15:00","Pure","","","No","normal","busy","normal","No","",""
"(No Subject)","2011-06-01","11:30:00","2011-06-01","12:30:00","Pure","Hair
","","No","normal","tentative","normal","No","",""
"(No Subject)","2011-06-01","19:00:00","2011-06-01","19:00:00","","","","No","normal","free","normal","No","",""
"Eleanor - LEAVE","2011-06-03","All Day","2011-06-14","All Day","","","","Yes","normal","free","normal","No","",""
"STAMPS - Thomas the Tank Engine","2011-06-14","All Day","2011-06-15","All Day","","","","Yes","normal","free","normal","No","",""
"Eleanor - Leave","2011-06-22","All Day","2011-06-23","All Day","","","","Yes","normal","free","normal","No","",""
"Hygienist","2011-06-23","11:40:00","2011-06-23","12:10:00","OE - Parliament St","","","No","normal","busy","normal","No","",""
"Building Magazine","2011-06-24","All Day","2011-06-25","All Day","","","","Yes","normal","free","normal","Yes","RRULE;FREQ=WEEKLY;BYDAY=FR",""
"Vantage Interest Rates Change from Mon 27th June - Reduce Balances to £5k","2011-06-27","All Day","2011-06-28","All Day","","","","Yes","normal","free","normal","No","",""
"Eleanor - Leave","2011-07-01","All Day","2011-07-02","All Day","","","","Yes","normal","free","normal","No","",""
"Alliance & Leicester e savings has £1.60 in it - Find out how to close it!","2011-07-01","All Day","2011-07-02","All Day","","","","Yes","normal","free","normal","No","",""
"Olympic Tickets free for all until 6pm 17th July","2011-07-08","All Day","2011-07-09","All Day","6am Friday 8th","","","Yes","normal","free","normal","No","",""
"Reminder to Pay Tom's advance Tax - £1,521.55 by 31st July.","2011-07-10","07:00:00","2011-07-10","07:30:00","","","","No","normal","busy","normal","No","",""
"Raise Web Briefing Invoice for next year ","2011-07-14","All Day","2011-07-15","All Day","See invoice 1289 - September 2010","","","Yes","normal","free","normal","Yes","RRULE;FREQ=YEARLY;INTERVAL=12;BYMONTHDAY=14",""
"Birthday - Lyla Parry (14/07/2011)","2011-07-14","All Day","2011-07-14","All Day","","","","Yes","normal","free","normal","Yes","RRULE;FREQ=YEARLY;INTERVAL=12;BYMONTHDAY=14",""
"STAMPS","2011-07-27","All Day","2011-07-28","All Day","Olympica","","","Yes","normal","free","normal","No","",""
"one year until our olympic trip - try to book accommodation","2011-07-30","All Day","2011-07-31","All Day","","","","Yes","normal","free","normal","No","",""
"Blood Doning 18:45","2011-08-09","17:45:00","2011-08-09","18:15:00","Acomb","","","No","normal","busy","normal","No","",""
"Hair 12:45","2011-08-17","11:45:00","2011-08-17","12:45:00","Pure","","","No","normal","busy","normal","No","",""
"STAMPS","2011-08-23","All Day","2011-08-24","All Day","Crown Jewels","","","Yes","normal","free","normal","No","",""
"Osteo","2011-08-26","11:30:00","2011-08-26","12:30:00","Stonebow","","","No","normal","busy","normal","No","",""
"Enter wine competion","2011-09-01","All Day","2011-09-02","All Day","open this for link","http://www.cork1point.co.uk/competitions/9000058/detail/
","","Yes","normal","free","normal","Yes","RRULE;FREQ=MONTHLY;BYMONTHDAY=1;COUNT=4",""
"STAMPS","2011-09-09","All Day","2011-09-10","All Day","Aerial Post","","","Yes","normal","free","normal","No","",""
"STAMPS","2011-09-15","All Day","2011-09-16","All Day","House of Hanover","","","Yes","normal","free","normal","No","",""
"STAMPS","2011-09-16","All Day","2011-09-17","All Day","Birds","","","Yes","normal","free","normal","No","",""
"Barbie & Derek in London","2011-09-22","23:00:00","2011-09-25","00:00:00","London","","","No","normal","tentative","normal","No","",""
"Do annual off-site back-up","2011-10-01","07:00:00","2011-10-01","07:30:00","","","","No","normal","busy","normal","Yes","RRULE;FREQ=YEARLY;INTERVAL=12;BYMONTHDAY=1",""
"Birthday - Frankie Sewell (10th October)","2011-10-10","All Day","2011-10-11","All Day","","","","Yes","normal","free","normal","No","",""
"Dentist","2011-10-11","09:00:00","2011-10-11","09:30:00","Aldwark","","","No","normal","busy","normal","No","",""
"STAMPS","2011-10-13","All Day","2011-10-14","All Day","UK A-Z","","","Yes","normal","free","normal","No","",""
"Osteo","2011-10-28","11:30:00","2011-10-28","12:30:00","","","","No","normal","busy","normal","No","",""
"30 Carron Crescent: Gas Safety Cert Expires","2011-10-29","All Day","2011-10-30","All Day","","","","Yes","normal","free","normal","Yes","RRULE;FREQ=YEARLY;INTERVAL=12;BYMONTHDAY=29",""
"STAMPS","2011-11-08","All Day","2011-11-09","All Day","Christmas","","","Yes","normal","free","normal","No","",""
"STAMPS","2011-11-09","All Day","2011-11-10","All Day","Check next tranche of Stamps for 2012","","","Yes","normal","free","normal","No","",""
"hair","2011-11-09","12:30:00","2011-11-09","13:30:00","pure","","","No","normal","busy","normal","No","",""
"hygienist","2011-11-10","12:30:00","2011-11-10","13:00:00","aldwark","","","No","normal","busy","normal","No","",""
"Mars and Regulus Fri at 05:30 - South","2011-11-11","05:30:00","2011-11-11","05:30:00","","","","No","normal","busy","normal","No","",""
"Jet2 check in opens","2011-11-18","All Day","2011-11-19","All Day","","","","Yes","normal","free","normal","No","",""
"dentist ","2011-11-21","16:50:00","2011-11-21","17:20:00","aldwark","","","No","normal","busy","normal","No","",""
"St Nicholas Fayre","2011-11-24","All Day","2011-11-28","All Day","york","","","Yes","normal","free","normal","No","",""
"Write to Jardin Tecina re kettles","2011-12-09","All Day","2011-12-10","All Day","","Write to guest relations re kettles in rooms
","","Yes","normal","free","normal","No","",""
"Festival of Angels","2011-12-10","All Day","2011-12-12","All Day","york","","","Yes","normal","free","normal","No","",""
"Hair","2011-12-13","12:45:00","2011-12-13","13:45:00","Pure","","","No","normal","busy","normal","No","",""
"Peugeot Insurance Renewal 9th January","2012-01-09","All Day","2012-01-10","All Day","","","","Yes","normal","free","normal","No","",""
"STAMPS","2012-01-10","08:00:00","2012-01-10","08:30:00","","","","No","normal","busy","normal","No","",""
"Birthday - Connor Urquhart (14/01/2012)","2012-01-14","All Day","2012-01-14","All Day","","","","Yes","normal","free","normal","Yes","RRULE;FREQ=YEARLY;INTERVAL=12;BYMONTHDAY=14",""
"Green Bin Tody","2012-01-16","All Day","2012-01-17","All Day","","","","Yes","normal","free","normal","No","",""
"09:30 meeting (Natalie)","2012-01-19","09:00:00","2012-01-19","09:30:00","","","","No","normal","busy","normal","No","",""
"10:00 Meeting (Terry Frank) / M4U / Hair at lunchtim","2012-01-24","09:30:00","2012-01-24","10:00:00","","","","No","normal","busy","normal","No","",""
"Hair","2012-01-24","13:00:00","2012-01-24","14:00:00","Pure","","","No","normal","busy","normal","No","",""
"09:30 Meeting (EMT)","2012-01-26","09:30:00","2012-01-26","10:00:00","","","","No","normal","busy","normal","No","",""
"09:30 Training Course 20GHS","2012-02-01","08:30:00","2012-02-01","09:00:00","","","","No","normal","busy","normal","No","",""
"STAMPS","2012-02-02","08:30:00","2012-02-02","09:00:00","","","","No","normal","busy","normal","No","",""
"STAMPS","2012-02-06","08:00:00","2012-02-06","08:30:00","","","","No","normal","busy","normal","No","",""
"09:30 Meeting (Manor School)","2012-02-09","09:00:00","2012-02-09","09:30:00","","","","No","normal","busy","normal","No","",""
"Osteopath","2012-02-10","12:30:00","2012-02-10","13:30:00","Stonebow","","","No","normal","busy","normal","No","",""
"Jorvik Viking Festival","2012-02-11","All Day","2012-02-19","All Day","York","","","Yes","normal","free","normal","No","",""
"Birthday - Sandra Turnbull (12/02/2012)","2012-02-12","All Day","2012-02-12","All Day","","","","Yes","normal","free","normal","Yes","RRULE;FREQ=YEARLY;INTERVAL=12;BYMONTHDAY=12",""
"Green Bin Today","2012-02-13","All Day","2012-02-14","All Day","","","","Yes","normal","free","normal","Yes","RRULE;FREQ=MONTHLY;BYDAY=2MO;COUNT=2",""
"OPerations meeting at Depot","2012-02-21","09:00:00","2012-02-21","09:30:00","","","","No","normal","busy","normal","No","",""
"St Pauls re CARE etc","2012-02-22","09:00:00","2012-02-22","09:30:00","","","","No","normal","busy","normal","No","",""
"STAMPS","2012-02-23","08:00:00","2012-02-23","08:30:00","","","","No","normal","busy","normal","No","",""
"Blood Doning - Tuesday","2012-02-28","18:00:00","2012-02-28","19:00:00","Acomb","","","No","normal","busy","normal","No","",""
"Hair","2012-02-29","12:45:00","2012-02-29","13:45:00","Pure","","","No","normal","busy","normal","No","",""
"49 Sutherland Street - Gas Safety Cert expires this month","2012-03-01","All Day","2012-03-02","All Day","","","","Yes","normal","free","normal","Yes","RRULE;FREQ=YEARLY;INTERVAL=12;BYMONTHDAY=1",""
"9am meeting - EMT","2012-03-01","09:00:00","2012-03-01","09:30:00","","","","No","normal","busy","normal","No","",""
"STAMPS","2012-03-08","All Day","2012-03-09","All Day","Classic locomotives of scotland","","","Yes","normal","free","normal","No","",""
"STAMPS","2012-03-20","All Day","2012-03-21","All Day","Comics","","","Yes","normal","free","normal","No","",""
"49 Sutherland Street - Gas Safety Cert expires 25/4","2012-04-01","All Day","2012-04-02","All Day","","","","Yes","normal","free","normal","Yes","RRULE;FREQ=YEARLY;INTERVAL=12;BYMONTHDAY=1",""
"Has £50 cahback arrived from Swinton","2012-04-07","All Day","2012-04-08","All Day",", chased up with michaela 17/11/12","","","Yes","normal","free","normal","No","",""
"COMICS","2012-04-10","All Day","2012-04-11","All Day","A-Z of Britain part 2","","","Yes","normal","free","normal","No","",""
"Hair","2012-04-25","11:30:00","2012-04-25","12:30:00","Pure","","","No","normal","busy","normal","No","",""
"Osteo","2012-04-27","11:30:00","2012-04-27","12:30:00","Stonebow","","","No","normal","busy","normal","No","",""
"Anniversary - Paul & Carol Z (11/05/2012)","2012-05-11","All Day","2012-05-11","All Day","","","","Yes","normal","free","normal","Yes","RRULE;FREQ=YEARLY;INTERVAL=12;BYMONTHDAY=11",""
"STAMPS","2012-05-15","All Day","2012-05-16","All Day","Great British Fashion","","","Yes","normal","free","normal","No","",""
"Lunch with Maria & Malcom","2012-05-23","11:30:00","2012-05-23","13:00:00","Cafe Rouge","","","No","normal","busy","normal","No","",""
"Bank Sauna Money","2012-05-23","19:00:00","2012-05-23","19:00:00","","","","No","normal","busy","normal","Yes","RRULE;FREQ=WEEKLY;BYDAY=WE",""
"Mary?","2012-05-28","07:00:00","2012-05-29","07:00:00","","","","No","normal","busy","normal","No","",""
"Bank Sauna Money","2012-05-29","19:00:00","2012-05-29","19:00:00","","","","No","normal","busy","normal","Yes","RRULE;FREQ=WEEKLY;BYDAY=TU",""
"Hair","2012-05-30","11:30:00","2012-05-30","12:30:00","Pure","","","No","normal","busy","normal","No","",""
"STAMPS","2012-05-31","All Day","2012-06-01","All Day","Diamond Jubilee","","","Yes","normal","free","normal","No","",""
"STAMPS","2012-05-31","07:30:00","2012-05-31","08:00:00","","","","No","normal","busy","normal","No","",""
"Enter Berberana monthly competition - see passwords 19/07/11","2012-06-01","All Day","2012-06-02","All Day","","","","Yes","normal","free","normal","Yes","RRULE;FREQ=MONTHLY;BYMONTHDAY=1",""
"Osteo","2012-06-01","11:30:00","2012-06-01","12:30:00","Stonebow","","","No","normal","busy","normal","No","",""
"Ring Jean re August / Travel","2012-06-13","17:30:00","2012-06-13","18:00:00","","","","No","normal","busy","normal","No","",""
"STAMPS","2012-06-19","All Day","2012-06-20","All Day","Charles Dickens","","","Yes","normal","free","normal","No","",""
"CHECK BANK ACCOUNT - £2k goes out to Tesco on 26th","2012-06-25","All Day","2012-06-26","All Day","","","","Yes","normal","free","normal","No","",""
"IMPORTANT - Send copy of lettings insurance policy to Platform.","2012-06-25","All Day","2012-06-26","All Day","No later than 15th July","","","Yes","normal","free","normal","No","",""
"Web Briefing renewal due 1st August (£20k)","2012-07-02","All Day","2012-07-03","All Day","REMINDER","","","Yes","normal","free","normal","Yes","RRULE;FREQ=YEARLY;INTERVAL=12;BYDAY=1MO",""
"Tom to Dentist","2012-07-02","09:20:00","2012-07-02","09:50:00","Copmanthorpe","","","No","normal","busy","normal","No","",""
"LTSB e-saving account - Bonus has ended (6/7/12)","2012-07-09","07:00:00","2012-07-09","07:30:00","","Close this account and open a new one!
","","No","normal","busy","normal","No","",""
"Hair","2012-07-11","11:30:00","2012-07-11","12:30:00","Pure","","","No","normal","busy","normal","No","",""
"Blood Doning Tuesday 27th - 18:20","2012-07-24","17:30:00","2012-07-24","18:00:00","Acomb","","","No","normal","busy","normal","No","",""
"STAMPS","2012-07-27","All Day","2012-07-28","All Day","Welcome to the Olympics","","","Yes","normal","free","normal","No","",""
"OLYMPICS","2012-07-28","All Day","2012-07-30","All Day","","","","Yes","normal","free","normal","No","",""
"REMINDER - Pay Tom's Tax on account for 2012-13 on 31st July 2012","2012-07-31","All Day","2012-08-01","All Day","£3,418.85","","","Yes","normal","free","normal","No","",""
"Eleanor's Nationwide e-isa - bonus rate expires 31/08/12","2012-08-12","All Day","2012-08-13","All Day","","","","Yes","normal","free","normal","No","",""
"Osteo","2012-08-24","11:30:00","2012-08-24","12:30:00","Stonebow","","","No","normal","busy","normal","No","",""
"STAMPS","2012-08-29","All Day","2012-08-30","All Day","Welcome to the Paralympics","","","Yes","normal","free","normal","No","",""
"Farmers Market - York","2012-08-31","All Day","2012-09-01","All Day","Last Friday in Month","","","Yes","normal","free","normal","Yes","RRULE;FREQ=MONTHLY;BYDAY=-1FR",""
"Vikings","2012-09-11","All Day","2012-09-12","All Day","Tues 11th Sept 9pm BBC2","","","Yes","normal","free","normal","No","",""
"hair","2012-09-26","11:30:00","2012-09-26","12:30:00","pure","","","No","normal","busy","normal","No","",""
"STAMPS","2012-09-27","All Day","2012-09-28","All Day","Memories of London 2012","","","Yes","normal","free","normal","No","",""
"osteo","2012-09-28","11:30:00","2012-09-28","12:30:00","","","","No","normal","busy","normal","No","",""
"Has Tom got an NHS Dentist yet?","2012-09-30","All Day","2012-10-01","All Day","Tel: 0300 303 8010 to chase","Put on list 25th May 2011 – estimated 10 months to allocation.

Chased 2/4/12 – expected to be allocated in June

9/7/12 - Now on list for “Perfect Smile” in Boroughbridge Road.  Asked if they had anything local or Town Centre.

Copmanthopre / Woodthorpe are shedding NHS patients so no chance but Aldwark may have vacancies in next few months.

Asked to be kept on list for Aldwark rather than be allocated to Perfect Smile
","","Yes","normal","free","normal","No","",""
"Review prescription requirements and order","2012-10-14","All Day","2012-10-15","All Day","","","","Yes","normal","free","normal","Yes","RRULE;FREQ=MONTHLY;INTERVAL=2;BYMONTHDAY=14",""
"STAMPS","2012-10-16","All Day","2012-10-17","All Day","Dinosaurs","","","Yes","normal","free","normal","No","",""
"YBS re ISAs","2012-10-20","08:30:00","2012-10-20","09:00:00","Leannne","","","No","normal","busy","normal","No","",""
"Doctors (Alison) - 09:10, Wed 24th","2012-10-24","08:10:00","2012-10-24","08:40:00","Woolpack House","","","No","normal","busy","normal","No","",""
"STAMPS","2012-10-30","All Day","2012-10-31","All Day","Space Science","","","Yes","normal","free","normal","No","",""
"STAMPS","2012-11-06","All Day","2012-11-07","All Day","Christmas","","","Yes","normal","free","normal","No","",""
"Eleanor to Dentist - Wed 21st 08:40","2012-11-21","08:40:00","2012-11-21","09:10:00","Aldwark","","","No","normal","busy","normal","No","",""
"Birthday - Pam Towning / Smart (25/11/2012)","2012-11-25","All Day","2012-11-25","All Day","","","","Yes","normal","free","normal","Yes","RRULE;FREQ=YEARLY;INTERVAL=12;BYMONTHDAY=25",""
"Birthday - Pam Towning / Smart (25/11/2012)","2012-11-25","All Day","2012-11-25","All Day","","","","Yes","normal","free","normal","Yes","RRULE;FREQ=YEARLY;INTERVAL=12;BYMONTHDAY=25",""
"Andrew Garland - Elvington Flooring","2012-11-26","09:30:00","2012-11-26","10:00:00","HCED","When: 26 November 2012 09:30-10:00 (UTC) Dublin, Edinburgh, Lisbon, London.
Where: HCED
 
Note: The GMT offset above does not reflect daylight saving time adjustments.
 
*~*~*~*~*~*~*~*~*~*
 
 
* * * * * * * * * * * * * * * * * * * * * * * * * * * * * * * * * * * * * * * * * * * * * * 
Help protect the environment! - please don't print this email unless you really need to. 
* * * * * * * * * * * * * * * * * * * * * * * * * * * * * * * * * * * * * * * * * * * * * 

This communication is from City of York Council. 

The information contained within, and in any attachment(s), is confidential and legally privileged. It is for the exclusive use of the intended recipient(s). If you are not the intended recipient(s), please note that any form of distribution, copying or use of this communication, or the information within, is strictly prohibited and may be unlawful. Equally, you must not disclose all, or part, of its contents to any other person. 

If you have received this communication in error, please return it immediately to the sender, then delete and destroy any copies of it. 

City of York Council disclaims any liability for action taken in reliance on the content of this communication. 
","","No","normal","busy","normal","No","",""
"Blood Doning - 18:20","2012-11-27","18:00:00","2012-11-27","18:30:00","Acomb","","","No","normal","busy","normal","No","",""
"Osteo","2012-12-14","12:30:00","2012-12-14","13:30:00","Stonebow","","","No","normal","busy","normal","No","",""
"Hair","2012-12-17","13:15:00","2012-12-17","14:15:00","Pure","","","No","normal","busy","normal","No","",""
"Hair - 16:15","2012-12-17","15:45:00","2012-12-17","17:15:00","Pure","When: 17 December 2012 15:45-17:15 (UTC) Dublin, Edinburgh, Lisbon, London.
Where: Pure
 
Note: The GMT offset above does not reflect daylight saving time adjustments.
 
*~*~*~*~*~*~*~*~*~*
 
 
* * * * * * * * * * * * * * * * * * * * * * * * * * * * * * * * * * * * * * * * * * * * * * 
Help protect the environment! - please don't print this email unless you really need to. 
* * * * * * * * * * * * * * * * * * * * * * * * * * * * * * * * * * * * * * * * * * * * * 

This communication is from City of York Council. 

The information contained within, and in any attachment(s), is confidential and legally privileged. It is for the exclusive use of the intended recipient(s). If you are not the intended recipient(s), please note that any form of distribution, copying or use of this communication, or the information within, is strictly prohibited and may be unlawful. Equally, you must not disclose all, or part, of its contents to any other person. 

If you have received this communication in error, please return it immediately to the sender, then delete and destroy any copies of it. 

City of York Council disclaims any liability for action taken in reliance on the content of this communication. 
","","No","normal","tentative","private","No","",""
"Eye Test","2012-12-21","08:50:00","2012-12-21","09:50:00","Spec Savers","When: 21 December 2012 08:50-09:50 (UTC) Dublin, Edinburgh, Lisbon, London.
Where: Spec Savers
 
Note: The GMT offset above does not reflect daylight saving time adjustments.
 
*~*~*~*~*~*~*~*~*~*
 
 
* * * * * * * * * * * * * * * * * * * * * * * * * * * * * * * * * * * * * * * * * * * * * * 
Help protect the environment! - please don't print this email unless you really need to. 
* * * * * * * * * * * * * * * * * * * * * * * * * * * * * * * * * * * * * * * * * * * * * 

This communication is from City of York Council. 

The information contained within, and in any attachment(s), is confidential and legally privileged. It is for the exclusive use of the intended recipient(s). If you are not the intended recipient(s), please note that any form of distribution, copying or use of this communication, or the information within, is strictly prohibited and may be unlawful. Equally, you must not disclose all, or part, of its contents to any other person. 

If you have received this communication in error, please return it immediately to the sender, then delete and destroy any copies of it. 

City of York Council disclaims any liability for action taken in reliance on the content of this communication. 
","","No","normal","tentative","normal","No","",""
"East Coast YP offer opens 9am Monday 7th","2013-01-07","09:00:00","2013-01-07","09:30:00","","www.yorkshirepost.co.uk

East Coast Reader Offer
","","No","normal","busy","normal","No","",""
"osteo","2013-01-18","12:30:00","2013-01-18","13:30:00","","","","No","normal","busy","normal","No","",""
"hair","2013-01-21","11:00:00","2013-01-21","12:00:00","pure","","","No","normal","busy","normal","No","",""
"Meeting at WO - Wed 09:30","2013-01-30","09:30:00","2013-01-30","10:00:00","","","","No","normal","busy","normal","No","",""
"Canceled: P2P Update Training","2013-02-07","10:00:00","2013-02-07","11:30:00","Guildhall","When: 07 February 2013 10:00-11:30 (UTC) Dublin, Edinburgh, Lisbon, London.
Where: Guildhall
 
Note: The GMT offset above does not reflect daylight saving time adjustments.
 
*~*~*~*~*~*~*~*~*~*
 
 
* * * * * * * * * * * * * * * * * * * * * * * * * * * * * * * * * * * * * * * * * * * * * * 
Help protect the environment! - please don't print this email unless you really need to. 
* * * * * * * * * * * * * * * * * * * * * * * * * * * * * * * * * * * * * * * * * * * * * 

This communication is from City of York Council. 

The information contained within, and in any attachment(s), is confidential and legally privileged. It is for the exclusive use of the intended recipient(s). If you are not the intended recipient(s), please note that any form of distribution, copying or use of this communication, or the information within, is strictly prohibited and may be unlawful. Equally, you must not disclose all, or part, of its contents to any other person. 

If you have received this communication in error, please return it immediately to the sender, then delete and destroy any copies of it. 

City of York Council disclaims any liability for action taken in reliance on the content of this communication. 
","","No","high","free","normal","No","",""
"Have we received Tom's Tax refund? £3,529.21? ","2013-02-08","08:00:00","2013-02-08","08:30:00","","If not email Geoff to chase.
","","No","normal","busy","normal","No","",""
"Osteo","2013-02-22","12:30:00","2013-02-22","13:00:00","","","","No","normal","busy","normal","No","",""
"Spec Savers (Sat 10:20)","2013-02-23","10:30:00","2013-02-23","11:00:00","Low Ousegate","","","No","normal","busy","normal","No","",""
"pay £1,000 to each Nationwide Regular Saver","2013-03-01","All Day","2013-03-02","All Day","","","","Yes","normal","free","normal","Yes","RRULE;FREQ=MONTHLY;BYMONTHDAY=1;UNTIL=16001231",""
"Tom to Dentist - Thursday 7th 9am","2013-03-07","09:00:00","2013-03-07","09:30:00","Cop","","","No","normal","busy","normal","No","",""
"move funds from saving to eleanor to cover £1750 SO and regular saver","2013-04-01","All Day","2013-04-02","All Day","","","","Yes","normal","free","normal","No","",""
"Osteo","2013-04-05","11:30:00","2013-04-05","12:30:00","","","","No","normal","busy","normal","No","",""
"Tom to Hygienist - Tuesday 9th 9am","2013-04-09","08:00:00","2013-04-09","09:00:00","Cop","","","No","normal","busy","normal","No","",""
"Birthday - Tracy Sewell (11/04/2013)","2013-04-11","All Day","2013-04-11","All Day","","","","Yes","normal","free","normal","Yes","RRULE;FREQ=YEARLY;INTERVAL=12;BYMONTHDAY=11",""
"Birthday - Sam Judd (16/04/2013)","2013-04-16","All Day","2013-04-16","All Day","","","","Yes","normal","free","normal","Yes","RRULE;FREQ=YEARLY;INTERVAL=12;BYMONTHDAY=16",""
"Cat Boosters Due 19th April","2013-04-19","All Day","2013-04-20","All Day","","","","Yes","normal","free","normal","Yes","RRULE;FREQ=YEARLY;INTERVAL=12;BYMONTHDAY=19;UNTIL=16001231",""
"Check In on line for Dublin from today","2013-05-02","All Day","2013-05-03","All Day","MHINNWG","","","Yes","normal","free","normal","No","",""
"Osteo 12:30","2013-05-15","11:15:00","2013-05-15","12:45:00","Stonebow","When: 15 May 2013 12:15-13:45 (UTC) Dublin, Edinburgh, Lisbon, London.
Where: Stonebow
 
Note: The GMT offset above does not reflect daylight saving time adjustments.
 
*~*~*~*~*~*~*~*~*~*
 
 
* * * * * * * * * * * * * * * * * * * * * * * * * * * * * * * * * * * * * * * * * * * * * * 
Help protect the environment! - please don't print this email unless you really need to. 
* * * * * * * * * * * * * * * * * * * * * * * * * * * * * * * * * * * * * * * * * * * * * 

This communication is from City of York Council. 

The information contained within, and in any attachment(s), is confidential and legally privileged. It is for the exclusive use of the intended recipient(s). If you are not the intended recipient(s), please note that any form of distribution, copying or use of this communication, or the information within, is strictly prohibited and may be unlawful. Equally, you must not disclose all, or part, of its contents to any other person. 

If you have received this communication in error, please return it immediately to the sender, then delete and destroy any copies of it. 

City of York Council disclaims any liability for action taken in reliance on the content of this communication. 
","","No","normal","out-of-office","private","No","",""
"Hair","2013-05-29","11:30:00","2013-05-29","12:00:00","","","","No","normal","busy","normal","No","",""
"Dentist 08:30 Wed 30th May","2013-05-30","07:30:00","2013-05-30","08:00:00","Aldwark","When: 30 May 2013 08:30-09:00 (UTC) Dublin, Edinburgh, Lisbon, London.
Where: Aldwark
 
Note: The GMT offset above does not reflect daylight saving time adjustments.
 
*~*~*~*~*~*~*~*~*~*
 
 
* * * * * * * * * * * * * * * * * * * * * * * * * * * * * * * * * * * * * * * * * * * * * * 
Help protect the environment! - please don't print this email unless you really need to. 
* * * * * * * * * * * * * * * * * * * * * * * * * * * * * * * * * * * * * * * * * * * * * 

This communication is from City of York Council. 

The information contained within, and in any attachment(s), is confidential and legally privileged. It is for the exclusive use of the intended recipient(s). If you are not the intended recipient(s), please note that any form of distribution, copying or use of this communication, or the information within, is strictly prohibited and may be unlawful. Equally, you must not disclose all, or part, of its contents to any other person. 

If you have received this communication in error, please return it immediately to the sender, then delete and destroy any copies of it. 

City of York Council disclaims any liability for action taken in reliance on the content of this communication. 
","","No","normal","busy","normal","No","",""
"Blood Doning - 18:10","2013-06-06","17:00:00","2013-06-06","17:30:00","LEEDS","","","No","normal","busy","normal","No","",""
"Peer Challenge Review - 09:00 -10:00","2013-06-13","08:00:00","2013-06-13","09:00:00","","","","No","normal","busy","normal","No","",""
"CORSA MOT at Halfords Tuesday","2013-06-18","06:00:00","2013-06-18","06:30:00","","","","No","normal","busy","normal","No","",""
"Generator Meeting -07:30 Tuesday","2013-06-18","06:30:00","2013-06-18","07:00:00","HCED","","","No","normal","busy","normal","No","",""
"1-1 Natalie 09:00 Tuesday 18th","2013-06-18","08:00:00","2013-06-18","09:00:00","WO","","","No","normal","busy","normal","No","",""
"Osteo","2013-06-21","11:30:00","2013-06-21","12:30:00","","","","No","normal","busy","normal","No","",""
"Birthday - Lara Anne Sewell (23/06/2013)","2013-06-23","All Day","2013-06-23","All Day","","","","Yes","normal","free","normal","Yes","RRULE;FREQ=YEARLY;INTERVAL=12;BYMONTHDAY=23",""
"LTSB e savings account 1 year old 10th July ","2013-07-10","All Day","2013-07-11","All Day","transfer out and close then open new","","","Yes","normal","free","normal","No","",""
"Osteo 12:30 Friday 26th","2013-07-26","11:30:00","2013-07-26","12:30:00","","","","No","normal","busy","normal","No","",""
"Cancel the SOs on Toms account and Eleanor's Account for the Monthly Saver dated 27th of month","2013-07-30","07:00:00","2013-07-30","07:30:00","","","","No","normal","busy","normal","No","",""
"PaY Tax on Account for Tom by 31st July","2013-07-31","All Day","2013-08-01","All Day","£1,102.83","","","Yes","normal","free","normal","No","",""
"Check In on line for Pula - Sunday 4th AUG","2013-08-04","07:00:00","2013-08-04","07:30:00","","","","No","normal","busy","normal","No","",""
"Hair 12:30 Wed 14th","2013-08-14","11:30:00","2013-08-14","12:30:00","","","","No","normal","busy","normal","No","",""
"Osteo 12:30","2013-08-23","11:30:00","2013-08-23","12:30:00","","","","No","normal","busy","normal","No","",""
"Blood Doning 18:10","2013-09-16","16:00:00","2013-09-16","18:00:00","Leeds","","","No","normal","busy","normal","No","",""
"Osteo","2013-10-04","11:30:00","2013-10-04","12:30:00","","","","No","normal","busy","normal","No","",""
"Birthday - Frankie Sewell (10/10/2013)","2013-10-10","All Day","2013-10-10","All Day","","","","Yes","normal","free","normal","Yes","RRULE;FREQ=YEARLY;INTERVAL=12;BYMONTHDAY=10",""
"Birthday - Frankie Sewell (19??) (10/10/2013)","2013-10-10","All Day","2013-10-10","All Day","","","","Yes","normal","free","normal","Yes","RRULE;FREQ=YEARLY;INTERVAL=12;BYMONTHDAY=10",""
"Birthday - Rob Smart (16/10/2013)","2013-10-16","All Day","2013-10-16","All Day","","","","Yes","normal","free","normal","Yes","RRULE;FREQ=YEARLY;INTERVAL=12;BYMONTHDAY=16",""
"Recycling Only Today (no green bins)","2013-11-04","All Day","2013-11-05","All Day","","","","Yes","normal","free","normal","Yes","RRULE;FREQ=WEEKLY;INTERVAL=2;BYDAY=MO;UNTIL=16001231",""
"CITB Test: Tuesday 5th 08:45","2013-11-05","08:30:00","2013-11-05","10:00:00","Holgate Road","","","No","normal","busy","normal","No","",""
"Hair - Wed 6th 12:30","2013-11-06","12:30:00","2013-11-06","13:30:00","","","","No","normal","busy","normal","No","",""
"Osteo - Fri 8th 12:30","2013-11-08","12:30:00","2013-11-08","13:30:00","","","","No","normal","busy","normal","No","",""
"Review both Nationwide Regular Savers - Limit of £12k reached","2013-12-02","09:00:00","2013-12-02","09:00:00","","","","No","normal","busy","normal","No","",""
"Dentist - Wed 09:00","2013-12-11","09:00:00","2013-12-11","09:30:00","Aldwark","","","No","normal","busy","normal","No","",""
"08:30 - Dearnleys","2013-12-12","08:00:00","2013-12-12","08:30:00","","","","No","normal","busy","normal","No","",""
"Meeting 9am","2013-12-13","09:00:00","2013-12-13","09:30:00","G/F (Auden) WO","","","No","normal","busy","normal","No","",""
"Bins - ???","2013-12-23","All Day","2013-12-24","All Day","","","","Yes","normal","free","normal","Yes","RRULE;FREQ=WEEKLY;BYDAY=MO;UNTIL=16001231",""
"Bins - ???","2013-12-30","All Day","2013-12-31","All Day","","","","Yes","normal","free","normal","Yes","RRULE;FREQ=WEEKLY;BYDAY=MO;COUNT=1",""
"Read Meters","2013-12-31","All Day","2014-01-01","All Day","","","","Yes","normal","free","normal","Yes","RRULE;FREQ=MONTHLY;BYDAY=-1SU,-1MO,-1TU,-1WE,-1TH,-1FR,-1SA;COUNT=15",""
"Remind Mum to read meters by 5th","2014-01-01","All Day","2014-01-02","All Day","","","","Yes","normal","free","normal","Yes","RRULE;FREQ=MONTHLY;INTERVAL=3;BYDAY=1SU,1MO,1TU,1WE,1TH,1FR,1SA;COUNT=5",""
"Start to prepare VAT return info for Geoff","2014-01-01","All Day","2014-01-02","All Day","","","","Yes","normal","free","normal","Yes","RRULE;FREQ=MONTHLY;INTERVAL=3;BYMONTHDAY=1;COUNT=5",""
"Test Smoke Alarm","2014-01-01","All Day","2014-01-02","All Day","","","","Yes","normal","free","normal","Yes","RRULE;FREQ=WEEKLY;BYDAY=WE;COUNT=65",""
"Enter Berberana monthly competition - see passwords 19/07/11","2014-01-01","All Day","2014-01-02","All Day","","","","Yes","normal","free","normal","Yes","RRULE;FREQ=MONTHLY;BYMONTHDAY=1;COUNT=15",""
"Back-up tonight 1am  - leave computer on overnight & turn on ext drive","2014-01-01","18:00:00","2014-01-01","18:00:00","","","","No","normal","busy","normal","Yes","RRULE;FREQ=WEEKLY;BYDAY=WE;COUNT=65",""
"Bank Sauna Money","2014-01-01","20:00:00","2014-01-01","20:00:00","","","","No","normal","busy","normal","Yes","RRULE;FREQ=WEEKLY;BYDAY=WE;COUNT=65",""
"Birthday - Ian Asher","2014-01-02","00:00:00","2014-01-02","12:00:00","","","","No","normal","busy","normal","Yes","RRULE;FREQ=YEARLY;INTERVAL=12;BYDAY=1TH;COUNT=2",""
"Building Magazine","2014-01-03","All Day","2014-01-04","All Day","","","","Yes","normal","free","normal","Yes","RRULE;FREQ=WEEKLY;BYDAY=FR;COUNT=65",""
"Malton Swim","2014-01-05","16:00:00","2014-01-05","18:00:00","","","","No","normal","busy","normal","Yes","RRULE;FREQ=WEEKLY;INTERVAL=2;BYDAY=SU;COUNT=33",""
"Black Bin Today","2014-01-06","All Day","2014-01-07","All Day","","","","Yes","normal","free","normal","Yes","RRULE;FREQ=WEEKLY;INTERVAL=2;BYDAY=MO;UNTIL=16001231",""
"Sent VAT Return info to Geoff","2014-01-08","All Day","2014-01-09","All Day","","","","Yes","normal","free","normal","Yes","RRULE;FREQ=MONTHLY;INTERVAL=3;BYMONTHDAY=8;COUNT=5",""
"Recycling Only","2014-01-13","All Day","2014-01-14","All Day","","","","Yes","normal","free","normal","Yes","RRULE;FREQ=WEEKLY;INTERVAL=2;BYDAY=MO;UNTIL=16001231",""
"Birthday - Ian Grant (13/01/2014)","2014-01-13","All Day","2014-01-13","All Day","","","","Yes","normal","busy","normal","Yes","RRULE;FREQ=YEARLY;INTERVAL=12;BYMONTHDAY=13;COUNT=2",""
"Arrange Tesco Credit Card Payment (CL £9k)","2014-01-14","All Day","2014-01-15","All Day","","","","Yes","normal","free","normal","Yes","RRULE;FREQ=MONTHLY;BYMONTHDAY=14;COUNT=15",""
"Birthday - Pam Drake 14th January 1951 (14/01/2014)","2014-01-14","All Day","2014-01-14","All Day","","","","Yes","normal","free","normal","Yes","RRULE;FREQ=YEARLY;INTERVAL=12;BYMONTHDAY=14;COUNT=2",""
"Birthday - Connor Urquhart (14/01/2014)","2014-01-14","All Day","2014-01-14","All Day","","","","Yes","normal","free","normal","Yes","RRULE;FREQ=YEARLY;INTERVAL=12;BYMONTHDAY=14;COUNT=2",""
"VAT DUE IN TWO WEEKS","2014-01-15","All Day","2014-01-16","All Day","","","","Yes","normal","free","normal","Yes","RRULE;FREQ=MONTHLY;INTERVAL=3;BYMONTHDAY=15;COUNT=5",""
"Anniversary - Helen & Noel (19/01/2014)","2014-01-19","All Day","2014-01-19","All Day","","","","Yes","normal","free","normal","Yes","RRULE;FREQ=YEARLY;INTERVAL=12;BYMONTHDAY=19;COUNT=2",""
"Birthday - Helen Hushon-Brown (19/01/2014)","2014-01-19","All Day","2014-01-19","All Day","","","","Yes","normal","free","normal","Yes","RRULE;FREQ=YEARLY;INTERVAL=12;BYMONTHDAY=19;COUNT=2",""
"Anniversary - Auntie Van died (19/01/2014)","2014-01-19","All Day","2014-01-19","All Day","","","","Yes","normal","free","normal","Yes","RRULE;FREQ=YEARLY;INTERVAL=12;BYMONTHDAY=19;COUNT=2",""
"Anniversary - Poke died (20/01/2014)","2014-01-20","All Day","2014-01-20","All Day","","","","Yes","normal","free","normal","Yes","RRULE;FREQ=YEARLY;INTERVAL=12;BYMONTHDAY=20;COUNT=2",""
"Private Appointment","2014-01-22","All Day","2014-01-23","All Day","","","","Yes","normal","free","private","Yes","RRULE;FREQ=YEARLY;INTERVAL=12;BYMONTHDAY=22;COUNT=2",""
"Review Bank Account Income (esp letting account) and top-up as necessary (min £1,000 over month)","2014-01-24","09:00:00","2014-01-24","09:30:00","","","","No","normal","busy","normal","Yes","RRULE;FREQ=MONTHLY;BYMONTHDAY=24;COUNT=15",""
"York Residents First Weekend?","2014-01-25","All Day","2014-01-27","All Day","","","","Yes","normal","free","normal","Yes","RRULE;FREQ=YEARLY;INTERVAL=12;BYDAY=-1SA;COUNT=2",""
"Birthday - Charley Tippets (25/01/2014)","2014-01-25","All Day","2014-01-25","All Day","","","","Yes","normal","free","normal","Yes","RRULE;FREQ=YEARLY;INTERVAL=12;BYMONTHDAY=25;COUNT=2",""
"FW: Residents Festival - 25 January 2014","2014-01-25","09:30:00","2014-01-25","16:30:00","West Offices","When: 25 January 2014 09:30-16:30 (UTC) Dublin, Edinburgh, Lisbon, London.
Where: West Offices
 
Note: The GMT offset above does not reflect daylight saving time adjustments.
 
*~*~*~*~*~*~*~*~*~*
 
 
 
-----Original Appointment-----
From: Herbert, Sandra 
Sent: 14 January 2014 15:36
To: Herbert, Sandra; Lowman, Ruth; Carter, Tracey; Moss, Marie; Goulden, Vicky; Cranstoun, Eleanor; Hindle, Andy; Weeks, Fred
Subject: Residents Festival - 25 January 2014
When: 25 January 2014 09:30-16:30 (UTC) Dublin, Edinburgh, Lisbon, London.
Where: West Offices
 
 
When: 25 January 2014 09:30-16:30 (UTC) Dublin, Edinburgh, Lisbon, London.
Where: West Offices
 
Note: The GMT offset above does not reflect daylight saving time adjustments.
 
*~*~*~*~*~*~*~*~*~*
 
Hi everyone
 
Thanks for volunteering to be a guide / steward.
 
I’ll send further details in due course, but just wanted to get this in your diary and give you an outline of activities, see below:
 
A 'market place' of stalls/stands will greet visitors on the ground floor in the customer centre area. Visitors can find out about various services (cycling related) by chatting with council staff on the various stalls themed on cycling with links to the forthcoming Tour de France.
 

	
*	Stalls to be made up of:

	
*	Information on Tour de France (TdF) route, timings, etc.
*	Planned activities surrounding the event – what’s on, festival atmosphere, street parties, etc.
*	Cycling safety what work is carried out in schools, advice on cycling safety (lights, visibility, etc).
*	City cycling routes around York.
*	Health benefits of cycling - Sport & Active Leisure - information and a cycling activity which links a static cycle to an actual route of the TdF.

 

	
*	Tours around West Offices will stop at the Hudson Board room where historic character actor George Hudson provides a railway connection to celebrate the historic origins of West Offices who using the, “mak all t’ railways cum t’ York” – “mak all t’ world cum t’ York” theme creates a link to how in 2014 CYC will “mak all cycles cum t’ York” with the forthcoming TdF.

 

	
*	A second historic character actor in the form of an edwardian lady cyclist, will play a part commenting on the place of cycling in the women’s emancipation movement of the time.

 

	
*	The promotion video for La Tour will then be shown before moving on a tour around the rest of West Offices which will explain how the various services working behind the scenes at West Offices enable events like TdF to take part.

 

	
*	CANsing choir on level 3.

 

	
*	Ending with York’s most historic cycle shelter – the railway canopy and/or back into the stalls area.

 
Marie – I have noted you will be leaving at 2pm.
 
Kind Regards
Sandra
 
Sandra Herbert | Project Manager, Accommodation Project   
t: 01904 553384 | e: sandra.herbert@york.gov.uk
 
City of York Council  |  Property Services, CBSS 
West Offices  | York | Y01 6GA
 <http://www.york.gov.uk/> www.york.gov.uk |  <http://www.facebook.com/cityofyork> facebook.com/cityofyork |  <http://twitter.com/cityofyork> @CityofYork
 
 
 
* * * * * * * * * * * * * * * * * * * * * * * * * * * * * * * * * * * * * * * * * * * * * * 
Help protect the environment! - please don't print this email unless you really need to. 
* * * * * * * * * * * * * * * * * * * * * * * * * * * * * * * * * * * * * * * * * * * * * 

This communication is from City of York Council. 

The information contained within, and in any attachment(s), is confidential and legally privileged. It is for the exclusive use of the intended recipient(s). If you are not the intended recipient(s), please note that any form of distribution, copying or use of this communication, or the information within, is strictly prohibited and may be unlawful. Equally, you must not disclose all, or part, of its contents to any other person. 

If you have received this communication in error, please return it immediately to the sender, then delete and destroy any copies of it. 

City of York Council disclaims any liability for action taken in reliance on the content of this communication. 
","","No","normal","tentative","normal","No","",""
"Private Appointment","2014-01-26","All Day","2014-01-26","All Day","","","","Yes","normal","busy","private","Yes","RRULE;FREQ=YEARLY;INTERVAL=12;BYMONTHDAY=26;COUNT=2",""
"Sent ENPS invoices yet?","2014-01-26","19:00:00","2014-01-26","20:00:00","","","","No","normal","busy","normal","Yes","RRULE;FREQ=MONTHLY;BYMONTHDAY=26;COUNT=15",""
"Birthday - Wally Labrom (27/01/2014)","2014-01-27","All Day","2014-01-27","All Day","","","","Yes","normal","free","normal","Yes","RRULE;FREQ=YEARLY;INTERVAL=12;BYMONTHDAY=27;COUNT=2",""
"Private Appointment","2014-01-29","All Day","2014-01-29","All Day","","","","Yes","normal","busy","private","Yes","RRULE;FREQ=YEARLY;INTERVAL=12;BYMONTHDAY=29;COUNT=2",""
"Private Appointment","2014-01-30","All Day","2014-01-31","All Day","","","","Yes","normal","free","private","Yes","RRULE;FREQ=YEARLY;INTERVAL=12;BYMONTHDAY=30;COUNT=2",""
"Birthday Peter Hamilton (30/01/2014)","2014-01-30","All Day","2014-01-30","All Day","","","","Yes","normal","free","normal","Yes","RRULE;FREQ=YEARLY;INTERVAL=12;BYMONTHDAY=30;COUNT=2",""
"Private Appointment","2014-01-30","All Day","2014-01-30","All Day","","","","Yes","normal","busy","private","Yes","RRULE;FREQ=YEARLY;INTERVAL=12;BYMONTHDAY=30;COUNT=2",""
"Birthday- Margaret McKinlay (30/01/2014)","2014-01-30","All Day","2014-01-30","All Day","","","","Yes","normal","free","normal","Yes","RRULE;FREQ=YEARLY;INTERVAL=12;BYMONTHDAY=30;COUNT=2",""
"VAT RETURN DUE 31/01","2014-01-31","All Day","2014-02-01","All Day","","","","Yes","normal","free","normal","Yes","RRULE;FREQ=YEARLY;INTERVAL=12;BYMONTHDAY=31;COUNT=2",""
"Farmers Market - York","2014-01-31","All Day","2014-02-01","All Day","Last Friday in Month","","","Yes","normal","free","normal","Yes","RRULE;FREQ=MONTHLY;BYDAY=-1FR;COUNT=15",""
"Private Appointment","2014-02-02","All Day","2014-02-02","All Day","","","","Yes","normal","busy","private","Yes","RRULE;FREQ=YEARLY;INTERVAL=12;BYMONTHDAY=2;COUNT=2",""
"Private Appointment","2014-02-03","All Day","2014-02-03","All Day","","","","Yes","normal","busy","private","Yes","RRULE;FREQ=YEARLY;INTERVAL=12;BYMONTHDAY=3;COUNT=2",""
"Private Appointment","2014-02-06","All Day","2014-02-06","All Day","","","","Yes","normal","busy","private","Yes","RRULE;FREQ=YEARLY;INTERVAL=12;BYMONTHDAY=6;COUNT=2",""
"Private Appointment","2014-02-06","All Day","2014-02-07","All Day","","","","Yes","normal","free","private","Yes","RRULE;FREQ=YEARLY;INTERVAL=12;BYMONTHDAY=6;COUNT=2",""
"Private Appointment","2014-02-10","All Day","2014-02-10","All Day","","","","Yes","normal","busy","private","Yes","RRULE;FREQ=YEARLY;INTERVAL=12;BYMONTHDAY=10;COUNT=2",""
"Birthday - Sandra Turnbull (12/02/2014)","2014-02-12","All Day","2014-02-12","All Day","","","","Yes","normal","free","normal","Yes","RRULE;FREQ=YEARLY;INTERVAL=12;BYMONTHDAY=12;COUNT=2",""
"Private Appointment","2014-02-14","All Day","2014-02-15","All Day","","","","Yes","normal","free","private","Yes","RRULE;FREQ=YEARLY;INTERVAL=12;BYMONTHDAY=14;COUNT=2",""
"Private Appointment","2014-02-14","All Day","2014-02-14","All Day","","","","Yes","normal","busy","private","Yes","RRULE;FREQ=YEARLY;INTERVAL=12;BYMONTHDAY=14;COUNT=2",""
"Review prescription requirements and order","2014-02-14","All Day","2014-02-15","All Day","","","","Yes","normal","free","normal","Yes","RRULE;FREQ=MONTHLY;INTERVAL=2;BYMONTHDAY=14;COUNT=7",""
"Private Appointment","2014-02-16","All Day","2014-02-17","All Day","","","","Yes","normal","free","private","Yes","RRULE;FREQ=YEARLY;INTERVAL=12;BYMONTHDAY=16;COUNT=2",""
"Private Appointment","2014-02-18","All Day","2014-02-19","All Day","","","","Yes","normal","free","private","Yes","RRULE;FREQ=YEARLY;INTERVAL=12;BYMONTHDAY=18;COUNT=2",""
"Birthday - Eleanor (20/02/2014)","2014-02-20","All Day","2014-02-20","All Day","","","","Yes","normal","free","private","Yes","RRULE;FREQ=YEARLY;INTERVAL=12;BYMONTHDAY=20",""
"Private Appointment","2014-02-20","All Day","2014-02-21","All Day","","","","Yes","normal","free","private","Yes","RRULE;FREQ=YEARLY;INTERVAL=12;BYMONTHDAY=20;COUNT=2",""
"Birthday - Colin MacDonald (21/02/2014)","2014-02-21","All Day","2014-02-21","All Day","","","","Yes","normal","free","normal","Yes","RRULE;FREQ=YEARLY;INTERVAL=12;BYMONTHDAY=21;COUNT=2",""
"Private Appointment","2014-02-22","All Day","2014-02-23","All Day","","","","Yes","normal","free","private","Yes","RRULE;FREQ=YEARLY;INTERVAL=12;BYMONTHDAY=22;COUNT=2",""
"Birthday - Derek Currie 22nd Feb 1952 (22/02/2014)","2014-02-22","All Day","2014-02-22","All Day","","","","Yes","normal","free","normal","Yes","RRULE;FREQ=YEARLY;INTERVAL=12;BYMONTHDAY=22;COUNT=2",""
"Private Appointment","2014-02-28","All Day","2014-02-28","All Day","","","","Yes","normal","busy","private","Yes","RRULE;FREQ=YEARLY;INTERVAL=12;BYMONTHDAY=28;COUNT=2",""
"Raise Annual Genie Invoice","2014-03-01","All Day","2014-03-02","All Day","","","","Yes","normal","free","normal","Yes","RRULE;FREQ=YEARLY;INTERVAL=12;BYMONTHDAY=1;COUNT=2",""
"49 Sutherland Street - Gas Safety Cert expires this month","2014-03-01","All Day","2014-03-02","All Day","","","","Yes","normal","free","normal","Yes","RRULE;FREQ=YEARLY;INTERVAL=12;BYMONTHDAY=1;COUNT=2",""
"DDT Insurance expires in three weeks","2014-03-07","All Day","2014-03-08","All Day","","","","Yes","normal","free","normal","Yes","RRULE;FREQ=YEARLY;INTERVAL=12;BYMONTHDAY=7;COUNT=2",""
"Birthday - Richard Stephen (08/03/2014)","2014-03-08","All Day","2014-03-08","All Day","","","","Yes","normal","free","normal","Yes","RRULE;FREQ=YEARLY;INTERVAL=12;BYMONTHDAY=8;COUNT=2",""
"Anniversay - Tom & Eleanor (1978)","2014-03-10","All Day","2014-03-11","All Day","","","","Yes","normal","free","normal","Yes","RRULE;FREQ=YEARLY;INTERVAL=12;BYMONTHDAY=10;COUNT=2",""
"Pay White Rose by 31/3","2014-03-10","All Day","2014-03-11","All Day","","","","Yes","normal","free","normal","Yes","RRULE;FREQ=YEARLY;INTERVAL=12;BYMONTHDAY=10;COUNT=2",""
"Private Appointment","2014-03-13","All Day","2014-03-13","All Day","","","","Yes","normal","busy","private","Yes","RRULE;FREQ=YEARLY;INTERVAL=12;BYMONTHDAY=13;COUNT=2",""
"Private Appointment","2014-03-17","All Day","2014-03-18","All Day","","","","Yes","normal","free","private","Yes","RRULE;FREQ=YEARLY;INTERVAL=12;BYMONTHDAY=17;COUNT=2",""
"Private Appointment","2014-03-17","All Day","2014-03-17","All Day","","","","Yes","normal","busy","private","Yes","RRULE;FREQ=YEARLY;INTERVAL=12;BYMONTHDAY=17;COUNT=2",""
"Birthday - Jill Brown (17/03/2014)","2014-03-17","All Day","2014-03-17","All Day","","","","Yes","normal","free","normal","Yes","RRULE;FREQ=YEARLY;INTERVAL=12;BYMONTHDAY=17;COUNT=2",""
"Private Appointment","2014-03-18","All Day","2014-03-19","All Day","","","","Yes","normal","free","private","Yes","RRULE;FREQ=YEARLY;INTERVAL=12;BYMONTHDAY=18;COUNT=2",""
"Private Appointment","2014-03-22","All Day","2014-03-22","All Day","","","","Yes","normal","busy","private","Yes","RRULE;FREQ=YEARLY;INTERVAL=12;BYMONTHDAY=22;COUNT=2",""
"Private Appointment","2014-03-23","06:00:00","2014-03-23","06:00:00","","","","No","normal","busy","private","Yes","RRULE;FREQ=YEARLY;INTERVAL=12;BYMONTHDAY=23;COUNT=2",""
"Private Appointment","2014-03-25","All Day","2014-03-25","All Day","","","","Yes","normal","busy","private","Yes","RRULE;FREQ=YEARLY;INTERVAL=12;BYMONTHDAY=25;COUNT=2",""
"Birthday - Scott McGregor (26/03/2014)","2014-03-26","All Day","2014-03-26","All Day","","","","Yes","normal","free","normal","Yes","RRULE;FREQ=YEARLY;INTERVAL=12;BYMONTHDAY=26;COUNT=2",""
"F&T Induction at HCED","2014-03-28","09:00:00","2014-03-28","09:30:00","","","","No","normal","busy","normal","No","",""
"Anniversary - Barbie & Derek (29/03/2014)","2014-03-29","All Day","2014-03-29","All Day","","","","Yes","normal","free","normal","Yes","RRULE;FREQ=YEARLY;INTERVAL=12;BYMONTHDAY=29;COUNT=2",""
"Private Appointment","2014-04-03","All Day","2014-04-04","All Day","","","","Yes","normal","free","private","Yes","RRULE;FREQ=YEARLY;INTERVAL=12;BYMONTHDAY=3;COUNT=1",""
"Birthday - Vicky McGregor (03/04/2014)","2014-04-03","All Day","2014-04-03","All Day","","","","Yes","normal","free","normal","Yes","RRULE;FREQ=YEARLY;INTERVAL=12;BYMONTHDAY=3;COUNT=1",""
"Birthday - Alfie Parry (03/04/2014)","2014-04-03","All Day","2014-04-03","All Day","","","","Yes","normal","free","normal","Yes","RRULE;FREQ=YEARLY;INTERVAL=12;BYMONTHDAY=3;COUNT=1",""
"Birthday - Alan Thomas (06/04/2014)","2014-04-06","All Day","2014-04-06","All Day","","","","Yes","normal","free","normal","Yes","RRULE;FREQ=YEARLY;INTERVAL=12;BYMONTHDAY=6;COUNT=1",""
"Recycling & Green Bin Today","2014-04-07","All Day","2014-04-08","All Day","","","","Yes","normal","free","normal","Yes","RRULE;FREQ=WEEKLY;INTERVAL=2;BYDAY=MO;UNTIL=16001231",""
"Birthday - David Hamilton (07/04/2014)","2014-04-07","All Day","2014-04-07","All Day","","","","Yes","normal","free","normal","Yes","RRULE;FREQ=YEARLY;INTERVAL=12;BYMONTHDAY=7;COUNT=1",""
"Birthday - Daniel Prestage (07/04/2014)","2014-04-07","All Day","2014-04-07","All Day","","","","Yes","normal","free","normal","Yes","RRULE;FREQ=YEARLY;INTERVAL=12;BYMONTHDAY=7;COUNT=1",""
"Birthday - Jenny Dow (08/04/2014)","2014-04-08","All Day","2014-04-08","All Day","","","","Yes","normal","free","normal","Yes","RRULE;FREQ=YEARLY;INTERVAL=12;BYMONTHDAY=8;COUNT=1",""
"Ops Meeting","2014-04-08","08:00:00","2014-04-08","08:30:00","","","","No","normal","busy","normal","No","",""
"HCED Induction","2014-04-10","10:00:00","2014-04-10","11:00:00","","","","No","normal","busy","normal","No","",""
"Private Appointment","2014-04-11","All Day","2014-04-11","All Day","","","","Yes","normal","busy","private","Yes","RRULE;FREQ=YEARLY;INTERVAL=12;BYMONTHDAY=11;COUNT=1",""
"Birthday - Tracy Sewell (11/04/2014)","2014-04-11","All Day","2014-04-11","All Day","","","","Yes","normal","free","normal","Yes","RRULE;FREQ=YEARLY;INTERVAL=12;BYMONTHDAY=11;COUNT=1",""
"Birthday - Alison Owen/Dow/Sullivan/Marshall (13/04/2014)","2014-04-13","All Day","2014-04-13","All Day","","","","Yes","normal","free","normal","Yes","RRULE;FREQ=YEARLY;INTERVAL=12;BYMONTHDAY=13",""
"Birthday - Iona Currie (13/04/2014)","2014-04-13","All Day","2014-04-13","All Day","","","","Yes","normal","free","normal","Yes","RRULE;FREQ=YEARLY;INTERVAL=12;BYMONTHDAY=13;COUNT=1",""
"Private Appointment","2014-04-13","All Day","2014-04-13","All Day","","","","Yes","normal","busy","private","Yes","RRULE;FREQ=YEARLY;INTERVAL=12;BYMONTHDAY=13;COUNT=1",""
"Private Appointment","2014-04-13","All Day","2014-04-14","All Day","","","","Yes","normal","free","private","Yes","RRULE;FREQ=YEARLY;INTERVAL=12;BYMONTHDAY=13;COUNT=1",""
"Private Appointment","2014-04-13","05:00:00","2014-04-13","05:00:00","","","","No","normal","busy","private","Yes","RRULE;FREQ=YEARLY;INTERVAL=12;BYMONTHDAY=13;COUNT=1",""
"Birthday - Sam Judd (16/04/2014)","2014-04-16","All Day","2014-04-16","All Day","","","","Yes","normal","free","normal","Yes","RRULE;FREQ=YEARLY;INTERVAL=12;BYMONTHDAY=16;COUNT=1",""
"Private Appointment","2014-04-16","05:00:00","2014-04-16","05:00:00","","","","No","normal","busy","private","Yes","RRULE;FREQ=YEARLY;INTERVAL=12;BYMONTHDAY=16;COUNT=1",""
"Birthday - Di Blackhurst (19/04/2014)","2014-04-19","All Day","2014-04-19","All Day","","","","Yes","normal","free","normal","Yes","RRULE;FREQ=YEARLY;INTERVAL=12;BYMONTHDAY=19;COUNT=1",""
"Cat Boosters Due 19th April","2014-04-19","All Day","2014-04-20","All Day","","","","Yes","normal","free","normal","Yes","RRULE;FREQ=YEARLY;INTERVAL=12;BYMONTHDAY=19;COUNT=1",""
"Cats to VET: Tuesday 22nd - 08:30","2014-04-22","07:30:00","2014-04-22","09:00:00","","When: 22 April 2014 08:30-10:00 (UTC) Dublin, Edinburgh, Lisbon, London.
 
Note: The GMT offset above does not reflect daylight saving time adjustments.
 
*~*~*~*~*~*~*~*~*~*
 
 
* * * * * * * * * * * * * * * * * * * * * * * * * * * * * * * * * * * * * * * * * * * * * * 
Help protect the environment! - please don't print this email unless you really need to. 
* * * * * * * * * * * * * * * * * * * * * * * * * * * * * * * * * * * * * * * * * * * * * 

This communication is from City of York Council. 

The information contained within, and in any attachment(s), is confidential and legally privileged. It is for the exclusive use of the intended recipient(s). If you are not the intended recipient(s), please note that any form of distribution, copying or use of this communication, or the information within, is strictly prohibited and may be unlawful. Equally, you must not disclose all, or part, of its contents to any other person. 

If you have received this communication in error, please return it immediately to the sender, then delete and destroy any copies of it. 

City of York Council disclaims any liability for action taken in reliance on the content of this communication. 
","","No","normal","out-of-office","normal","No","",""
"Private Appointment","2014-04-23","All Day","2014-04-24","All Day","","","","Yes","normal","busy","private","Yes","RRULE;FREQ=YEARLY;INTERVAL=12;BYMONTHDAY=23;COUNT=1",""
"Private Appointment","2014-04-23","All Day","2014-04-23","All Day","","","","Yes","normal","busy","private","Yes","RRULE;FREQ=YEARLY;INTERVAL=12;BYMONTHDAY=23;COUNT=1",""
"Ivor Hartley's Birthday (23/04/2014)","2014-04-23","All Day","2014-04-23","All Day","","","","Yes","normal","free","normal","Yes","RRULE;FREQ=YEARLY;INTERVAL=12;BYMONTHDAY=23;COUNT=1",""
"Aniversary - Stuart & Alison (2004)","2014-04-25","All Day","2014-04-26","All Day","","","","Yes","normal","free","normal","Yes","RRULE;FREQ=YEARLY;INTERVAL=12;BYMONTHDAY=25;COUNT=1",""
"Birthday - Carolyn Towse (26/04/2014)","2014-04-26","All Day","2014-04-26","All Day","","","","Yes","normal","free","normal","Yes","RRULE;FREQ=YEARLY;INTERVAL=12;BYMONTHDAY=26;COUNT=1",""
"Stephen Dow's Birthday (27/04/2014)","2014-04-27","All Day","2014-04-27","All Day","","","","Yes","normal","free","normal","Yes","RRULE;FREQ=YEARLY;INTERVAL=12;BYMONTHDAY=27;COUNT=1",""
"Pay Tesco account today £2,625.71","2014-04-28","All Day","2014-04-29","All Day","","","","Yes","normal","free","normal","No","",""
"Private Appointment","2014-04-29","All Day","2014-04-29","All Day","","","","Yes","normal","busy","private","Yes","RRULE;FREQ=YEARLY;INTERVAL=12;BYMONTHDAY=29;COUNT=1",""
"Birthday - Julie Wright (29/04/2014)","2014-04-29","All Day","2014-04-29","All Day","","","","Yes","normal","free","normal","Yes","RRULE;FREQ=YEARLY;INTERVAL=12;BYMONTHDAY=29;COUNT=1",""
"VAT RETURN DUE 30/04","2014-04-30","All Day","2014-05-01","All Day","","","","Yes","normal","free","normal","Yes","RRULE;FREQ=YEARLY;INTERVAL=12;BYMONTHDAY=30;COUNT=1",""
"Private Appointment","2014-04-30","All Day","2014-04-30","All Day","","","","Yes","normal","busy","private","Yes","RRULE;FREQ=YEARLY;INTERVAL=12;BYMONTHDAY=30;COUNT=1",""
"Jim & Winnie Dennis's Anniversary (30/04/2014)","2014-04-30","All Day","2014-04-30","All Day","","","","Yes","normal","free","normal","Yes","RRULE;FREQ=YEARLY;INTERVAL=12;BYMONTHDAY=30;COUNT=1",""
"Private Appointment","2014-04-30","All Day","2014-05-01","All Day","","","","Yes","normal","free","private","Yes","RRULE;FREQ=YEARLY;INTERVAL=12;BYMONTHDAY=30;COUNT=1",""
"Birthday - Helen Dean / Harley (02/05/2014)","2014-05-02","All Day","2014-05-02","All Day","","","","Yes","normal","free","normal","Yes","RRULE;FREQ=YEARLY;INTERVAL=12;BYMONTHDAY=2;COUNT=1",""
"Birthday - Harry Broomhall (02/05/2014)","2014-05-02","All Day","2014-05-02","All Day","","","","Yes","normal","free","normal","Yes","RRULE;FREQ=YEARLY;INTERVAL=12;BYMONTHDAY=2;COUNT=1",""
"Birthday - Lee Armstrong (04/05/2014)","2014-05-04","All Day","2014-05-04","All Day","","","","Yes","normal","free","normal","Yes","RRULE;FREQ=YEARLY;INTERVAL=12;BYMONTHDAY=4;COUNT=1",""
"Kevin & Sue Humphrey's Anniversary (05/05/2014)","2014-05-05","All Day","2014-05-05","All Day","","","","Yes","normal","free","normal","Yes","RRULE;FREQ=YEARLY;INTERVAL=12;BYMONTHDAY=5;COUNT=1",""
"Anniversary - Colin & Jen (06/05/2014)","2014-05-06","All Day","2014-05-06","All Day","","","","Yes","normal","free","normal","Yes","RRULE;FREQ=YEARLY;INTERVAL=12;BYMONTHDAY=6;COUNT=1",""
"Anniversary - Kate & John (07/05/2014)","2014-05-07","All Day","2014-05-07","All Day","","","","Yes","normal","free","normal","Yes","RRULE;FREQ=YEARLY;INTERVAL=12;BYMONTHDAY=7;COUNT=1",""
"Suzanne Dow's Birthday (08/05/2014)","2014-05-08","All Day","2014-05-08","All Day","","","","Yes","normal","free","normal","Yes","RRULE;FREQ=YEARLY;INTERVAL=12;BYMONTHDAY=8;COUNT=1",""
"Birthday - Suzanne Dow (08/05/2014)","2014-05-08","All Day","2014-05-08","All Day","","","","Yes","normal","free","normal","Yes","RRULE;FREQ=YEARLY;INTERVAL=12;BYMONTHDAY=8;COUNT=1",""
"Private Appointment","2014-05-09","All Day","2014-05-10","All Day","","","","Yes","normal","free","private","Yes","RRULE;FREQ=YEARLY;INTERVAL=12;BYMONTHDAY=9;COUNT=1",""
"Claire Humphrey's Birthday (09/05/2014)","2014-05-09","All Day","2014-05-09","All Day","","","","Yes","normal","free","normal","Yes","RRULE;FREQ=YEARLY;INTERVAL=12;BYMONTHDAY=9;COUNT=1",""
"!Claire Humphrey's Birthday (09/05/2014)","2014-05-09","All Day","2014-05-09","All Day","","","","Yes","normal","free","normal","Yes","RRULE;FREQ=YEARLY;INTERVAL=12;BYMONTHDAY=9;COUNT=1",""
"Anniversary - Top Hat Computing Started (10/05/2014)","2014-05-10","All Day","2014-05-10","All Day","","","","Yes","normal","free","normal","Yes","RRULE;FREQ=YEARLY;INTERVAL=12;BYMONTHDAY=10;COUNT=1",""
"Anniversary - Paul & Carol Z (11/05/2014)","2014-05-11","All Day","2014-05-11","All Day","","","","Yes","normal","free","normal","Yes","RRULE;FREQ=YEARLY;INTERVAL=12;BYMONTHDAY=11;COUNT=1",""
"Birthday - Steve May (12/05/2014)","2014-05-12","All Day","2014-05-12","All Day","","","","Yes","normal","free","normal","Yes","RRULE;FREQ=YEARLY;INTERVAL=12;BYMONTHDAY=12;COUNT=1",""
"Birthday - Jim Dennis (16/05/2014)","2014-05-16","All Day","2014-05-16","All Day","","","","Yes","normal","free","normal","Yes","RRULE;FREQ=YEARLY;INTERVAL=12;BYMONTHDAY=16;COUNT=1",""
"Birthday - Malcolm Jarvis (18/05/2014)","2014-05-18","All Day","2014-05-18","All Day","","","","Yes","normal","free","normal","Yes","RRULE;FREQ=YEARLY;INTERVAL=12;BYMONTHDAY=18;COUNT=1",""
"Steve & Elaine Thourgood's Birthday (21/05/2014)","2014-05-21","All Day","2014-05-21","All Day","","","","Yes","normal","free","normal","Yes","RRULE;FREQ=YEARLY;INTERVAL=12;BYMONTHDAY=21;COUNT=1",""
"Birthday - Julie Affleck (24/05/2014)","2014-05-24","All Day","2014-05-24","All Day","","","","Yes","normal","free","normal","Yes","RRULE;FREQ=YEARLY;INTERVAL=12;BYMONTHDAY=24;COUNT=1",""
"CAR to Evans Halshaw","2014-05-24","07:00:00","2014-05-24","11:00:00","08:30 - 12:00","When: 24 May 2014 08:00-12:00 (UTC) Dublin, Edinburgh, Lisbon, London.
Where: 08:30 - 12:00
 
Note: The GMT offset above does not reflect daylight saving time adjustments.
 
*~*~*~*~*~*~*~*~*~*
 
 
* * * * * * * * * * * * * * * * * * * * * * * * * * * * * * * * * * * * * * * * * * * * * * 
Help protect the environment! - please don't print this email unless you really need to. 
* * * * * * * * * * * * * * * * * * * * * * * * * * * * * * * * * * * * * * * * * * * * * 

This communication is from City of York Council. 

The information contained within, and in any attachment(s), is confidential and legally privileged. It is for the exclusive use of the intended recipient(s). If you are not the intended recipient(s), please note that any form of distribution, copying or use of this communication, or the information within, is strictly prohibited and may be unlawful. Equally, you must not disclose all, or part, of its contents to any other person. 

If you have received this communication in error, please return it immediately to the sender, then delete and destroy any copies of it. 

City of York Council disclaims any liability for action taken in reliance on the content of this communication. 
","","No","normal","tentative","normal","No","",""
"Birthday - Jacqui  Boulton (25/05/2014)","2014-05-25","All Day","2014-05-25","All Day","","","","Yes","normal","free","normal","Yes","RRULE;FREQ=YEARLY;INTERVAL=12;BYMONTHDAY=25;COUNT=1",""
"Birthday - Anne Walker (25/05/2014)","2014-05-25","All Day","2014-05-25","All Day","","","","Yes","normal","free","normal","Yes","RRULE;FREQ=YEARLY;INTERVAL=12;BYMONTHDAY=25;COUNT=1",""
"Birthday - Lucy Collins (28/05/2014)","2014-05-28","All Day","2014-05-28","All Day","","","","Yes","normal","free","normal","Yes","RRULE;FREQ=YEARLY;INTERVAL=12;BYMONTHDAY=28;COUNT=1",""
"19a gas cert due this month (expires 30th June)","2014-06-01","All Day","2014-06-02","All Day","","","","Yes","normal","free","normal","Yes","RRULE;FREQ=YEARLY;INTERVAL=12;BYMONTHDAY=1;COUNT=1",""
"Penny & Chris Prestage-Roles's Birthday (02/06/2014)","2014-06-02","All Day","2014-06-02","All Day","","","","Yes","normal","free","normal","Yes","RRULE;FREQ=YEARLY;INTERVAL=12;BYMONTHDAY=2;COUNT=1",""
"Trevor & Jean Simmonds's Birthday (04/06/2014)","2014-06-04","All Day","2014-06-04","All Day","","","","Yes","normal","free","normal","Yes","RRULE;FREQ=YEARLY;INTERVAL=12;BYMONTHDAY=4;COUNT=1",""
"Birthday - Mark Howard (07/06/2014)","2014-06-07","All Day","2014-06-07","All Day","","","","Yes","normal","free","normal","Yes","RRULE;FREQ=YEARLY;INTERVAL=12;BYMONTHDAY=7;COUNT=1",""
"Birthday - Oliver Sewell (08/06/2014)","2014-06-08","All Day","2014-06-08","All Day","","","","Yes","normal","free","normal","Yes","RRULE;FREQ=YEARLY;INTERVAL=12;BYMONTHDAY=8",""
"Renewal of Picture Houses Membership - 9th June","2014-06-09","All Day","2014-06-10","All Day","Direct Debit set up in March 2013 (gave 3 months free)","","","Yes","normal","free","normal","No","",""
"Steve& Marie Clifford's Birthday (10/06/2014)","2014-06-10","All Day","2014-06-10","All Day","","","","Yes","normal","free","normal","Yes","RRULE;FREQ=YEARLY;INTERVAL=12;BYMONTHDAY=10;COUNT=1",""
"Steph & Ray Borwell's Birthday (13/06/2014)","2014-06-13","All Day","2014-06-13","All Day","","","","Yes","normal","free","normal","Yes","RRULE;FREQ=YEARLY;INTERVAL=12;BYMONTHDAY=13;COUNT=1",""
"Birthday - Oliver Sewell (15/06/2014)","2014-06-15","All Day","2014-06-15","All Day","","","","Yes","normal","free","normal","Yes","RRULE;FREQ=YEARLY;INTERVAL=12;BYMONTHDAY=15",""
"Richard Carr's Birthday (16/06/2014)","2014-06-16","All Day","2014-06-16","All Day","","","","Yes","normal","free","normal","Yes","RRULE;FREQ=YEARLY;INTERVAL=12;BYMONTHDAY=16;COUNT=1",""
"Dentist 09:35","2014-06-16","08:30:00","2014-06-16","09:15:00","Aldwark","When: 16 June 2014 09:30-10:15 (UTC) Dublin, Edinburgh, Lisbon, London.
Where: Aldwark
 
Note: The GMT offset above does not reflect daylight saving time adjustments.
 
*~*~*~*~*~*~*~*~*~*
 
 
* * * * * * * * * * * * * * * * * * * * * * * * * * * * * * * * * * * * * * * * * * * * * * 
Help protect the environment! - please don't print this email unless you really need to. 
* * * * * * * * * * * * * * * * * * * * * * * * * * * * * * * * * * * * * * * * * * * * * 

This communication is from City of York Council. 

The information contained within, and in any attachment(s), is confidential and legally privileged. It is for the exclusive use of the intended recipient(s). If you are not the intended recipient(s), please note that any form of distribution, copying or use of this communication, or the information within, is strictly prohibited and may be unlawful. Equally, you must not disclose all, or part, of its contents to any other person. 

If you have received this communication in error, please return it immediately to the sender, then delete and destroy any copies of it. 

City of York Council disclaims any liability for action taken in reliance on the content of this communication. 
","","No","normal","tentative","private","No","",""
"Private Appointment","2014-06-16","08:30:00","2014-06-16","09:15:00","","","","No","normal","tentative","private","No","",""
"Birthday - Elizabeth Parry (19/06/2014)","2014-06-19","All Day","2014-06-19","All Day","","","","Yes","normal","free","normal","Yes","RRULE;FREQ=YEARLY;INTERVAL=12;BYMONTHDAY=19",""
"Peter & Kay Eady's Birthday (20/06/2014)","2014-06-20","All Day","2014-06-20","All Day","","","","Yes","normal","free","normal","Yes","RRULE;FREQ=YEARLY;INTERVAL=12;BYMONTHDAY=20;COUNT=1",""
"Penny & Chris Prestage-Roles's Anniversary (20/06/2014)","2014-06-20","All Day","2014-06-20","All Day","","","","Yes","normal","free","normal","Yes","RRULE;FREQ=YEARLY;INTERVAL=12;BYMONTHDAY=20;COUNT=1",""
"Birthday - Lara Anne Sewell (23/06/2014)","2014-06-23","All Day","2014-06-23","All Day","","","","Yes","normal","free","normal","Yes","RRULE;FREQ=YEARLY;INTERVAL=12;BYMONTHDAY=23;COUNT=1",""
"Anne & Steve's Anniversary (24/06/2014)","2014-06-24","All Day","2014-06-24","All Day","","","","Yes","normal","free","normal","Yes","RRULE;FREQ=YEARLY;INTERVAL=12;BYMONTHDAY=24;COUNT=1",""
"Pay Tesco Credit Card Today","2014-06-26","07:00:00","2014-06-26","07:30:00","Due 29th","","","No","normal","busy","normal","Yes","RRULE;FREQ=MONTHLY;BYMONTHDAY=26",""
"Tom Cranstoun's Birthday (29/06/2014)","2014-06-29","All Day","2014-06-29","All Day","","","","Yes","normal","free","normal","Yes","RRULE;FREQ=YEARLY;INTERVAL=12;BYMONTHDAY=29;COUNT=1",""
"Debbie Haynes's Anniversary (30/06/2014)","2014-06-30","All Day","2014-06-30","All Day","","","","Yes","normal","free","normal","Yes","RRULE;FREQ=YEARLY;INTERVAL=12;BYMONTHDAY=30;COUNT=1",""
"Ian Haynes's Anniversary (30/06/2014)","2014-06-30","All Day","2014-06-30","All Day","","","","Yes","normal","free","normal","Yes","RRULE;FREQ=YEARLY;INTERVAL=12;BYMONTHDAY=30;COUNT=1",""
"Minster Alarms @ No 33 15:00 - 17:00","2014-06-30","13:00:00","2014-06-30","16:00:00","","When: 30 June 2014 14:00-17:00 (UTC) Dublin, Edinburgh, Lisbon, London.
 
Note: The GMT offset above does not reflect daylight saving time adjustments.
 
*~*~*~*~*~*~*~*~*~*
 
 
* * * * * * * * * * * * * * * * * * * * * * * * * * * * * * * * * * * * * * * * * * * * * * 
Help protect the environment! - please don't print this email unless you really need to. 
* * * * * * * * * * * * * * * * * * * * * * * * * * * * * * * * * * * * * * * * * * * * * 

This communication is from City of York Council. 

The information contained within, and in any attachment(s), is confidential and legally privileged. It is for the exclusive use of the intended recipient(s). If you are not the intended recipient(s), please note that any form of distribution, copying or use of this communication, or the information within, is strictly prohibited and may be unlawful. Equally, you must not disclose all, or part, of its contents to any other person. 

If you have received this communication in error, please return it immediately to the sender, then delete and destroy any copies of it. 

City of York Council disclaims any liability for action taken in reliance on the content of this communication. 
","","No","normal","tentative","private","No","",""
"Private Appointment","2014-06-30","13:00:00","2014-06-30","16:00:00","","","","No","normal","tentative","private","No","",""
"Has BBC Money for CID arrived?","2014-07-01","07:00:00","2014-07-01","07:30:00","","","","No","normal","busy","normal","No","",""
"Birthday - Bill Bray (01/07/2014)","2014-07-01","All Day","2014-07-01","All Day","","","","Yes","normal","busy","normal","Yes","RRULE;FREQ=YEARLY;INTERVAL=12;BYMONTHDAY=1;COUNT=1",""
"Clarence Street Screening appt: 14:14","2014-07-01","12:30:00","2014-07-01","14:00:00","","When: 01 July 2014 13:30-15:00 (UTC) Dublin, Edinburgh, Lisbon, London.
 
Note: The GMT offset above does not reflect daylight saving time adjustments.
 
*~*~*~*~*~*~*~*~*~*
 
 
* * * * * * * * * * * * * * * * * * * * * * * * * * * * * * * * * * * * * * * * * * * * * * 
Help protect the environment! - please don't print this email unless you really need to. 
* * * * * * * * * * * * * * * * * * * * * * * * * * * * * * * * * * * * * * * * * * * * * 

This communication is from City of York Council. 

The information contained within, and in any attachment(s), is confidential and legally privileged. It is for the exclusive use of the intended recipient(s). If you are not the intended recipient(s), please note that any form of distribution, copying or use of this communication, or the information within, is strictly prohibited and may be unlawful. Equally, you must not disclose all, or part, of its contents to any other person. 

If you have received this communication in error, please return it immediately to the sender, then delete and destroy any copies of it. 

City of York Council disclaims any liability for action taken in reliance on the content of this communication. 
","","No","normal","tentative","private","No","",""
"Private Appointment","2014-07-01","12:30:00","2014-07-01","14:00:00","","","","No","normal","tentative","private","No","",""
"Jill & Richard Brown's Anniversary (03/07/2014)","2014-07-03","All Day","2014-07-03","All Day","","","","Yes","normal","free","normal","Yes","RRULE;FREQ=YEARLY;INTERVAL=12;BYMONTHDAY=3;COUNT=1",""
"Richard Leathley's Birthday (04/07/2014)","2014-07-04","All Day","2014-07-04","All Day","","","","Yes","normal","free","normal","Yes","RRULE;FREQ=YEARLY;INTERVAL=12;BYMONTHDAY=4;COUNT=1",""
"Scott & Vicky McGregor's Anniversary (06/07/2014)","2014-07-06","All Day","2014-07-06","All Day","","","","Yes","normal","free","normal","Yes","RRULE;FREQ=YEARLY;INTERVAL=12;BYMONTHDAY=6;COUNT=1",""
"Vicky McGregor's Anniversary (06/07/2014)","2014-07-06","All Day","2014-07-06","All Day","","","","Yes","normal","free","normal","Yes","RRULE;FREQ=YEARLY;INTERVAL=12;BYMONTHDAY=6;COUNT=1",""
"Web Briefing renewal due 1st August (£20k)","2014-07-07","All Day","2014-07-08","All Day","REMINDER","","","Yes","normal","free","normal","Yes","RRULE;FREQ=YEARLY;INTERVAL=12;BYDAY=1MO;COUNT=1",""
"Simon & Jeanette Tranmer's Birthday (11/07/2014)","2014-07-11","All Day","2014-07-11","All Day","","","","Yes","normal","free","normal","Yes","RRULE;FREQ=YEARLY;INTERVAL=12;BYMONTHDAY=11;COUNT=1",""
"Raise Web Briefing Invoice for next year ","2014-07-14","All Day","2014-07-15","All Day","See invoice 1289 - September 2010","","","Yes","normal","free","normal","Yes","RRULE;FREQ=YEARLY;INTERVAL=12;BYMONTHDAY=14;COUNT=1",""
"Birthday - Lyla Parry (14/07/2014)","2014-07-14","All Day","2014-07-14","All Day","","","","Yes","normal","free","normal","Yes","RRULE;FREQ=YEARLY;INTERVAL=12;BYMONTHDAY=14;COUNT=1",""
"Blood Doning 18:20","2014-07-14","17:00:00","2014-07-14","18:00:00","Seacroft Leeds","When: 14 July 2014 18:00-19:00 (UTC) Dublin, Edinburgh, Lisbon, London.
Where: Seacroft Leeds
 
Note: The GMT offset above does not reflect daylight saving time adjustments.
 
*~*~*~*~*~*~*~*~*~*
 
 
* * * * * * * * * * * * * * * * * * * * * * * * * * * * * * * * * * * * * * * * * * * * * * 
Help protect the environment! - please don't print this email unless you really need to. 
* * * * * * * * * * * * * * * * * * * * * * * * * * * * * * * * * * * * * * * * * * * * * 

This communication is from City of York Council. 

The information contained within, and in any attachment(s), is confidential and legally privileged. It is for the exclusive use of the intended recipient(s). If you are not the intended recipient(s), please note that any form of distribution, copying or use of this communication, or the information within, is strictly prohibited and may be unlawful. Equally, you must not disclose all, or part, of its contents to any other person. 

If you have received this communication in error, please return it immediately to the sender, then delete and destroy any copies of it. 

City of York Council disclaims any liability for action taken in reliance on the content of this communication. 
","","No","normal","tentative","normal","No","",""
"Birthday - Rachel Wilkinson (17/07/2014)","2014-07-17","All Day","2014-07-17","All Day","","","","Yes","normal","free","normal","Yes","RRULE;FREQ=YEARLY;INTERVAL=12;BYMONTHDAY=17;COUNT=1",""
"Jacqui & Steve Boulton's Anniversary (19/07/2014)","2014-07-19","All Day","2014-07-19","All Day","","","","Yes","normal","free","normal","Yes","RRULE;FREQ=YEARLY;INTERVAL=12;BYMONTHDAY=19;COUNT=1",""
"Richard Hamilton's Birthday (20/07/2014)","2014-07-20","All Day","2014-07-20","All Day","","","","Yes","normal","free","normal","Yes","RRULE;FREQ=YEARLY;INTERVAL=12;BYMONTHDAY=20;COUNT=1",""
"work Richard Hamilton's Birthday (20/07/2014)","2014-07-20","All Day","2014-07-20","All Day","","","","Yes","normal","free","normal","Yes","RRULE;FREQ=YEARLY;INTERVAL=12;BYMONTHDAY=20;COUNT=1",""
"31st July - Pay Tom's Tax on account","2014-07-21","07:00:00","2014-07-21","07:30:00","£1,262.97","","","No","normal","busy","normal","No","",""
"Birthday - Barbie Currie (22/07/2014)","2014-07-22","All Day","2014-07-22","All Day","","","","Yes","normal","free","normal","Yes","RRULE;FREQ=YEARLY;INTERVAL=12;BYMONTHDAY=22;COUNT=1",""
"Monty Python @ City Screen","2014-07-24","19:00:00","2014-07-24","21:30:00","YORK","","","No","normal","busy","normal","No","",""
"Claire Le Fevre's Birthday (28/07/2014)","2014-07-28","All Day","2014-07-28","All Day","","","","Yes","normal","free","normal","Yes","RRULE;FREQ=YEARLY;INTERVAL=12;BYMONTHDAY=28;COUNT=1",""
"VAT RETURN DUE 31/07","2014-07-31","All Day","2014-08-01","All Day","","","","Yes","normal","free","normal","Yes","RRULE;FREQ=YEARLY;INTERVAL=12;BYMONTHDAY=31;COUNT=1",""
"CHECK IN FOR PULA OPENS SUNDAY 3rd","2014-08-03","All Day","2014-08-04","All Day","","","","Yes","normal","free","normal","No","",""
"Heather & Christopher Bates's Birthday (03/08/2014)","2014-08-03","All Day","2014-08-03","All Day","","","","Yes","normal","free","normal","Yes","RRULE;FREQ=YEARLY;INTERVAL=12;BYMONTHDAY=3;COUNT=1",""
"Birthday - Esther McGregor (03/08/2014)","2014-08-03","All Day","2014-08-03","All Day","","","","Yes","normal","free","normal","Yes","RRULE;FREQ=YEARLY;INTERVAL=12;BYMONTHDAY=3;COUNT=1",""
"Birthday - Les Turnbull (04/08/2014)","2014-08-04","All Day","2014-08-04","All Day","","","","Yes","normal","free","normal","Yes","RRULE;FREQ=YEARLY;INTERVAL=12;BYMONTHDAY=4;COUNT=1",""
"Dave & Barbara Rule's Birthday (09/08/2014)","2014-08-09","All Day","2014-08-09","All Day","","","","Yes","normal","free","normal","Yes","RRULE;FREQ=YEARLY;INTERVAL=12;BYMONTHDAY=9;COUNT=1",""
"Birthday - Lauren Jacovides's (10/08/2014)","2014-08-10","All Day","2014-08-10","All Day","","","","Yes","normal","free","normal","Yes","RRULE;FREQ=YEARLY;INTERVAL=12;BYMONTHDAY=10;COUNT=1",""
"Birthday - Steve Owen (11/08/2014)","2014-08-11","All Day","2014-08-11","All Day","","","","Yes","normal","free","normal","Yes","RRULE;FREQ=YEARLY;INTERVAL=12;BYMONTHDAY=11;COUNT=1",""
"Hair Wed 20th 12:15","2014-08-20","11:00:00","2014-08-20","11:30:00","","","","No","normal","busy","normal","No","",""
"Phil & Barbara Brown's Anniversary (22/08/2014)","2014-08-22","All Day","2014-08-22","All Day","","","","Yes","normal","free","normal","Yes","RRULE;FREQ=YEARLY;INTERVAL=12;BYMONTHDAY=22;COUNT=1",""
"David & Lynne Steel's Birthday (22/08/2014)","2014-08-22","All Day","2014-08-22","All Day","","","","Yes","normal","free","normal","Yes","RRULE;FREQ=YEARLY;INTERVAL=12;BYMONTHDAY=22;COUNT=1",""
"Osteo - Friday 29th 12:30","2014-08-29","11:30:00","2014-08-29","12:30:00","","","","No","normal","busy","normal","No","",""
"Lauren Fulton's Birthday (30/08/2014)","2014-08-30","All Day","2014-08-30","All Day","","","","Yes","normal","free","normal","Yes","RRULE;FREQ=YEARLY;INTERVAL=12;BYMONTHDAY=30;COUNT=1",""
"Birthday Glenna Hamilton (31/08/2014)","2014-08-31","All Day","2014-08-31","All Day","","","","Yes","normal","free","normal","Yes","RRULE;FREQ=YEARLY;INTERVAL=12;BYMONTHDAY=31;COUNT=1",""
"Glenna Hamilton (1994)","2014-08-31","All Day","2014-09-01","All Day","","","","Yes","normal","free","normal","Yes","RRULE;FREQ=YEARLY;INTERVAL=12;BYMONTHDAY=31;COUNT=1",""
"Lucy & Richard Collins's Anniversary (04/09/2014)","2014-09-04","All Day","2014-09-04","All Day","","","","Yes","normal","free","normal","Yes","RRULE;FREQ=YEARLY;INTERVAL=12;BYMONTHDAY=4;COUNT=1",""
"Roger & Margaret Spreckley's Anniversary (10/09/2014)","2014-09-10","All Day","2014-09-10","All Day","","","","Yes","normal","free","normal","Yes","RRULE;FREQ=YEARLY;INTERVAL=12;BYMONTHDAY=10;COUNT=1",""
"Birthday - Jill Currie (10/09/2014)","2014-09-10","All Day","2014-09-10","All Day","","","","Yes","normal","free","normal","Yes","RRULE;FREQ=YEARLY;INTERVAL=12;BYMONTHDAY=10;COUNT=1",""
"Jen & Geoff Prestage's Anniversary (19/09/2014)","2014-09-19","All Day","2014-09-19","All Day","","","","Yes","normal","free","normal","Yes","RRULE;FREQ=YEARLY;INTERVAL=12;BYMONTHDAY=19;COUNT=1",""
"Food Festival for 10 days","2014-09-19","08:00:00","2014-09-19","17:00:00","","","","No","normal","busy","normal","Yes","RRULE;FREQ=YEARLY;INTERVAL=12;BYDAY=3FR;COUNT=1",""
"Car to Puegot","2014-09-20","07:30:00","2014-09-20","11:00:00","","","","No","normal","busy","normal","No","",""
"Alex & Sandra MacPhail's Birthday (27/09/2014)","2014-09-27","All Day","2014-09-27","All Day","","","","Yes","normal","free","normal","Yes","RRULE;FREQ=YEARLY;INTERVAL=12;BYMONTHDAY=27;COUNT=1",""
"Andrew McGregor's Birthday (29/09/2014)","2014-09-29","All Day","2014-09-29","All Day","","","","Yes","normal","free","normal","Yes","RRULE;FREQ=YEARLY;INTERVAL=12;BYMONTHDAY=29;COUNT=1",""
"Do annual off-site back-up","2014-10-01","07:00:00","2014-10-01","07:30:00","","","","No","normal","busy","normal","Yes","RRULE;FREQ=YEARLY;INTERVAL=12;BYMONTHDAY=1;COUNT=1",""
"Daniel & Sue Prestage's Anniversary (03/10/2014)","2014-10-03","All Day","2014-10-03","All Day","","","","Yes","normal","free","normal","Yes","RRULE;FREQ=YEARLY;INTERVAL=12;BYMONTHDAY=3;COUNT=1",""
"David Annal's Birthday (04/10/2014)","2014-10-04","All Day","2014-10-04","All Day","","","","Yes","normal","free","normal","Yes","RRULE;FREQ=YEARLY;INTERVAL=12;BYMONTHDAY=4;COUNT=1",""
"SightSonic Festival of Digital Arts","2014-10-09","08:00:00","2014-10-09","16:00:00","","","","No","normal","busy","normal","Yes","RRULE;FREQ=YEARLY;INTERVAL=12;BYDAY=2TH;COUNT=1",""
"Birthday - Frankie Sewell (19??) (10/10/2014)","2014-10-10","All Day","2014-10-10","All Day","","","","Yes","normal","free","normal","Yes","RRULE;FREQ=YEARLY;INTERVAL=12;BYMONTHDAY=10;COUNT=1",""
"Osteo & Day off - CHANGE to Wed 8th?","2014-10-10","11:30:00","2014-10-10","12:30:00","","","","No","normal","busy","normal","No","",""
"Order Lanzopransole Refill","2014-10-12","All Day","2014-10-13","All Day","","","","Yes","normal","free","normal","Yes","RRULE;FREQ=MONTHLY;INTERVAL=2;BYDAY=2SU",""
"Birthday - Jane Bourke (13/10/2014)","2014-10-13","All Day","2014-10-13","All Day","","","","Yes","normal","free","normal","Yes","RRULE;FREQ=YEARLY;INTERVAL=12;BYMONTHDAY=13;COUNT=1",""
"Birthday - David Horsley (16/10/2014)","2014-10-16","All Day","2014-10-16","All Day","","","","Yes","normal","free","normal","Yes","RRULE;FREQ=YEARLY;INTERVAL=12;BYMONTHDAY=16;COUNT=1",""
"Birthday - Phil Barber (16/10/2014)","2014-10-16","All Day","2014-10-16","All Day","","","","Yes","normal","free","normal","Yes","RRULE;FREQ=YEARLY;INTERVAL=12;BYMONTHDAY=16;COUNT=1",""
"Bithday - Jean Fulton (1951)","2014-10-16","All Day","2014-10-17","All Day","","","","Yes","normal","free","normal","Yes","RRULE;FREQ=YEARLY;INTERVAL=12;BYMONTHDAY=16;COUNT=1",""
"Birthday - Rob Smart (16/10/2014)","2014-10-16","All Day","2014-10-16","All Day","","","","Yes","normal","free","normal","Yes","RRULE;FREQ=YEARLY;INTERVAL=12;BYMONTHDAY=16;COUNT=1",""
"Birthday - Judy Hemmings (17/10/2014)","2014-10-17","All Day","2014-10-17","All Day","","","","Yes","normal","free","normal","Yes","RRULE;FREQ=YEARLY;INTERVAL=12;BYMONTHDAY=17;COUNT=1",""
"Birthday  - Amy Fulton (20/10/2014)","2014-10-20","All Day","2014-10-20","All Day","","","","Yes","normal","free","normal","Yes","RRULE;FREQ=YEARLY;INTERVAL=12;BYMONTHDAY=20;COUNT=1",""
"Blood Doning Mon 20th 18:20 LEEDS","2014-10-20","16:00:00","2014-10-20","18:00:00","Leeds","","","No","normal","busy","normal","No","",""
"Book Acomb Blood Appt - Tues 10th Feb OR Barbican on Thurs 29th Jan","2014-10-21","All Day","2014-10-22","All Day","","","","Yes","normal","free","normal","No","",""
"Birthday - Jo Dean (25/10/2014)","2014-10-25","All Day","2014-10-25","All Day","","","","Yes","normal","free","normal","Yes","RRULE;FREQ=YEARLY;INTERVAL=12;BYMONTHDAY=25;COUNT=1",""
"30 Carron Crescent: Gas Safety Cert Expires","2014-10-29","All Day","2014-10-30","All Day","","","","Yes","normal","free","normal","Yes","RRULE;FREQ=YEARLY;INTERVAL=12;BYMONTHDAY=29;COUNT=1",""
"VAT RETRN DUE 31/10","2014-10-31","All Day","2014-11-01","All Day","","","","Yes","normal","free","normal","Yes","RRULE;FREQ=YEARLY;INTERVAL=12;BYMONTHDAY=31;COUNT=1",""
"49 Sutherland Street - Fixed Rate Mortgage ends in 3 months","2014-11-03","All Day","2014-11-04","All Day","Currently 4.99%.  Will revert to base rate + 4.5% on 1st Feb 15","","","Yes","normal","free","normal","No","",""
"Birthday - Maria Wood (04/11/2014)","2014-11-04","All Day","2014-11-04","All Day","","","","Yes","normal","free","normal","Yes","RRULE;FREQ=YEARLY;INTERVAL=12;BYMONTHDAY=4;COUNT=1",""
"Kevin Humphrey Birthday (05/11/2014)","2014-11-05","All Day","2014-11-05","All Day","","","","Yes","normal","busy","normal","Yes","RRULE;FREQ=YEARLY;INTERVAL=12;BYMONTHDAY=5;COUNT=1",""
"Birthday - Ian Foster (06/11/2014)","2014-11-06","All Day","2014-11-06","All Day","","","","Yes","normal","busy","normal","Yes","RRULE;FREQ=YEARLY;INTERVAL=12;BYMONTHDAY=6;COUNT=1",""
"Birthday - Elaine (10/11/2014)","2014-11-10","All Day","2014-11-10","All Day","","","","Yes","normal","free","normal","Yes","RRULE;FREQ=YEARLY;INTERVAL=12;BYMONTHDAY=10;COUNT=1",""
"Birthday - Shirley Miller (11/11/2014)","2014-11-11","All Day","2014-11-11","All Day","","","","Yes","normal","busy","normal","Yes","RRULE;FREQ=YEARLY;INTERVAL=12;BYMONTHDAY=11;COUNT=1",""
"Hair - Fri 14th","2014-11-14","12:30:00","2014-11-14","13:30:00","Pure","","","No","normal","busy","normal","No","",""
"Recycling Only","2014-11-17","All Day","2014-11-18","All Day","","","","Yes","normal","free","normal","Yes","RRULE;FREQ=WEEKLY;INTERVAL=2;BYDAY=MO;UNTIL=16001231",""
"Steve Holloway's Birthday (21/11/2014)","2014-11-21","All Day","2014-11-21","All Day","","","","Yes","normal","free","normal","Yes","RRULE;FREQ=YEARLY;INTERVAL=12;BYMONTHDAY=21;COUNT=1",""
"Osteo Fri 21st","2014-11-21","12:30:00","2014-11-21","13:30:00","","","","No","normal","busy","normal","No","",""
"House Insurance Expires - 8th December","2014-11-24","08:00:00","2014-11-24","08:30:00","","","","No","normal","busy","normal","Yes","RRULE;FREQ=YEARLY;INTERVAL=12;BYMONTHDAY=24",""
"Birthday - Pam Towning / Smart (25/11/2014)","2014-11-25","All Day","2014-11-25","All Day","","","","Yes","normal","free","normal","Yes","RRULE;FREQ=YEARLY;INTERVAL=12;BYMONTHDAY=25;COUNT=1",""
"Birthday - Steve Walker (28/11/2014)","2014-11-28","All Day","2014-11-28","All Day","","","","Yes","normal","free","normal","Yes","RRULE;FREQ=YEARLY;INTERVAL=12;BYMONTHDAY=28;COUNT=1",""
"Birthday - Ed Affleck (29/11/2014)","2014-11-29","All Day","2014-11-29","All Day","","","","Yes","normal","free","normal","Yes","RRULE;FREQ=YEARLY;INTERVAL=12;BYMONTHDAY=29;COUNT=1",""
"49 Sutherland Street - Fixed Rate Mortgage ends in 2 months on 1/2/15","2014-12-01","All Day","2014-12-02","All Day","","","","Yes","normal","free","normal","No","",""
"Dentist:  09:30","2014-12-04","09:00:00","2014-12-04","10:00:00","Aldwark","","","No","normal","busy","normal","No","",""
"Caravan Insurance - Has Renewal Notice Arrived ","2014-12-07","All Day","2014-12-08","All Day","RS Thom 01438 316651","","","Yes","normal","free","normal","Yes","RRULE;FREQ=YEARLY;INTERVAL=12;BYMONTHDAY=7;COUNT=1",""
"Birthday - Mark Ellis (09/12/2014)","2014-12-09","All Day","2014-12-09","All Day","","","","Yes","normal","busy","normal","Yes","RRULE;FREQ=YEARLY;INTERVAL=12;BYMONTHDAY=9;COUNT=1",""
"DENTIST - Wed 10th 08:30","2014-12-10","08:30:00","2014-12-10","09:00:00","Aldwark","","","No","normal","busy","normal","No","",""
"Peter & Miriam Hamilton's Anniversary (12/12/2014)","2014-12-12","All Day","2014-12-12","All Day","","","","Yes","normal","free","normal","Yes","RRULE;FREQ=YEARLY;INTERVAL=12;BYMONTHDAY=12;COUNT=1",""
"Colin & Theresa Dow's Birthday (17/12/2014)","2014-12-17","All Day","2014-12-17","All Day","","","","Yes","normal","free","normal","Yes","RRULE;FREQ=YEARLY;INTERVAL=12;BYMONTHDAY=17;COUNT=1",""
"Margaret & Sam McKinlay's Anniversary (19/12/2014)","2014-12-19","All Day","2014-12-19","All Day","","","","Yes","normal","free","normal","Yes","RRULE;FREQ=YEARLY;INTERVAL=12;BYMONTHDAY=19;COUNT=1",""
"Collect Cats","2014-12-22","09:00:00","2014-12-22","11:00:00","","","","No","normal","busy","normal","No","",""
"Collect pies ans seafood from waitrose - collection ref 2810132","2014-12-22","11:00:00","2014-12-22","13:00:00","11am - 13:00","","","No","normal","busy","normal","No","",""
"Collect order from Tesco","2014-12-23","10:00:00","2014-12-23","12:00:00","10:00 - 12:00","","","No","normal","busy","normal","No","",""
"Hair - tues 21","2014-12-23","12:30:00","2014-12-23","13:30:00","","","","No","normal","busy","normal","No","",""
"Visit Anne, Claire & Twins","2014-12-23","14:30:00","2014-12-23","16:00:00","","","","No","normal","busy","normal","No","",""
"Hobbit @ Vue","2014-12-24","16:00:00","2014-12-24","19:00:00","","","","No","normal","busy","normal","No","",""
"Lunch @ Sun Inn 12:15","2014-12-25","12:00:00","2014-12-25","15:00:00","","","","No","normal","busy","normal","No","",""
"49 Sutherland Street - Fixed Rate Mortgage ends in 1 month ie 1/2/15","2014-12-29","All Day","2014-12-30","All Day","","","","Yes","normal","free","normal","No","",""
"Osteo","2014-12-31","12:30:00","2014-12-31","13:30:00","","","","No","normal","busy","normal","No","",""
"Paddington at City Screen","2015-01-01","12:30:00","2015-01-01","14:00:00","","","","No","normal","busy","normal","No","",""
"Rab & Pam's for weekend - Sat 14:00","2015-01-03","All Day","2015-01-05","All Day","","","","Yes","normal","free","normal","No","",""
"Space Odyssey at City Screen","2015-01-04","14:00:00","2015-01-04","17:00:00","","","","No","normal","busy","normal","No","",""
"Right to Read 08:50 - 10:30","2015-01-06","08:00:00","2015-01-06","11:00:00","THPS","","","No","normal","busy","normal","No","",""
"Andrea re Thursday Meeting","2015-01-06","11:00:00","2015-01-06","12:30:00","Kings Court","","","No","normal","busy","normal","No","",""
"Sun Inn with Emma & Simon","2015-01-06","19:00:00","2015-01-06","21:00:00","","","","No","normal","busy","normal","No","",""
"Sauna","2015-01-07","19:00:00","2015-01-07","21:00:00","","","","No","normal","busy","normal","No","",""
"Preliminary Investigation Meeting with Sharon Brookes","2015-01-08","13:00:00","2015-01-08","14:00:00","HCED","","","No","normal","busy","normal","No","",""
"Tom to Dentist","2015-01-12","14:30:00","2015-01-12","15:00:00","","","","No","normal","busy","normal","No","",""
"Massage 18:15","2015-01-12","18:15:00","2015-01-12","19:45:00","York College","","","No","normal","busy","normal","No","",""
"Right to Read 08:50 - 10:30","2015-01-13","08:00:00","2015-01-13","10:30:00","","","","No","normal","busy","normal","No","",""
"Curator Talk - Fabulous Flints, Tuesday 13th 12:30 - 13:00","2015-01-13","12:00:00","2015-01-13","13:30:00","","","","No","normal","busy","normal","No","",""
"Meeting 2 with Sharon 09:15","2015-01-14","09:00:00","2015-01-14","12:00:00","HCED","","","No","normal","busy","normal","No","",""
"Collect Ollie (15:00) & Babysitting to late","2015-01-15","15:00:00","2015-01-15","23:00:00","","","","No","normal","busy","normal","No","",""
"Nurse re BP Check","2015-01-16","09:20:00","2015-01-16","09:50:00","South Bank","","","No","normal","busy","normal","No","",""
"Reversing Sensors to be fitted.  Arrive 11:00 - 14:00","2015-01-16","11:00:00","2015-01-16","15:30:00","Merchant Way","","","No","normal","busy","normal","No","",""
"Rob & Pam to stay o/night","2015-01-17","17:00:00","2015-01-17","17:30:00","","","","No","normal","busy","normal","No","",""
"Dance practice","2015-01-17","19:30:00","2015-01-17","22:00:00","Eddie & Julies","","","No","normal","busy","normal","No","",""
"Clean & Dry today","2015-01-20","All Day","2015-01-21","All Day","","","","Yes","normal","free","normal","No","",""
"Jazz to Halfords","2015-01-20","08:00:00","2015-01-20","08:30:00","","","","No","normal","busy","normal","No","",""
"Tang Hall Trip to Flamingoland","2015-01-20","08:45:00","2015-01-20","14:45:00","","","","No","normal","busy","normal","No","",""
"Curator Talk - A Roman in the basement, Tuesday 20th 12:30 - 13:00","2015-01-20","12:00:00","2015-01-20","13:30:00","","","","No","normal","busy","normal","No","",""
"Massage - 18:30","2015-01-20","17:30:00","2015-01-20","20:00:00","York College","","","No","normal","busy","normal","No","",""
"Tom's Eye test at Woolpack House 13:10","2015-01-21","13:00:00","2015-01-21","13:30:00","","","","No","normal","busy","normal","No","",""
"Diabetic Nurse Check-Up","2015-01-21","14:30:00","2015-01-21","15:00:00","Woolpack House","","","No","normal","busy","normal","No","",""
"Reflexology Thursday 09:30","2015-01-22","09:00:00","2015-01-22","11:00:00","York College","","","No","normal","busy","normal","Yes","RRULE;FREQ=WEEKLY;BYDAY=TH;COUNT=2",""
"Pictures in Leeds","2015-01-23","17:30:00","2015-01-23","20:30:00","","","","No","normal","busy","normal","No","",""
"Sue & Kevin Overnight","2015-01-24","All Day","2015-01-25","All Day","","","","Yes","normal","free","normal","No","",""
"Burns Night Prep","2015-01-24","12:00:00","2015-01-24","18:00:00","","","","No","normal","busy","normal","No","",""
"One Day M/Ship @ YSV","2015-01-26","All Day","2015-01-27","All Day","","","","Yes","normal","tentative","normal","No","",""
"Pilates @ YSV","2015-01-26","10:30:00","2015-01-26","11:30:00","","","","No","normal","busy","normal","No","",""
"Yoga @ YSV","2015-01-26","17:30:00","2015-01-26","18:30:00","","","","No","normal","busy","normal","No","",""
"Aqua @ YSV","2015-01-26","19:30:00","2015-01-26","20:30:00","","","","No","normal","busy","normal","No","",""
"Right to Read 08:50","2015-01-27","08:00:00","2015-01-27","11:00:00","THPS","","","No","normal","busy","normal","No","",""
"Curator Talk - The Backhouse Story, Tuesday 27th 12:30 - 13:00","2015-01-27","12:00:00","2015-01-27","13:30:00","","","","No","normal","busy","normal","No","",""
"Blood Doning,  Tuesday 15:20","2015-01-27","14:30:00","2015-01-27","16:00:00","Seacroft","","","No","normal","busy","normal","No","",""
"LONDON","2015-01-28","All Day","2015-01-30","All Day","","","","Yes","normal","busy","normal","No","",""
"Train to London 12:03","2015-01-28","12:00:00","2015-01-28","14:30:00","","","","No","normal","busy","normal","No","",""
"DDT Pseudo Christmas Dinner ","2015-01-28","19:00:00","2015-01-28","22:00:00","Elk in the Woods","","","No","normal","busy","normal","No","",""
"Harry Potter World","2015-01-29","13:00:00","2015-01-29","17:00:00","","","","No","normal","busy","normal","No","",""
"Train to York 19:15","2015-01-29","19:30:00","2015-01-29","21:30:00","","","","No","normal","busy","normal","No","",""
"Pay Eleanor's Tax - £2,543.44 by 31/1/15","2015-01-30","10:00:00","2015-01-30","10:30:00","","","","No","normal","busy","normal","No","",""
"JULIE - Reflexology","2015-01-30","11:00:00","2015-01-30","13:00:00","","","","No","normal","busy","normal","No","",""
"Andrea Dudding - Review paperwork; 14:30","2015-01-30","13:30:00","2015-01-30","16:30:00","Kings Court","","","No","normal","busy","normal","No","",""
"Pay HMRC Tax Balances by 31/1","2015-01-31","All Day","2015-02-01","All Day","","","","Yes","normal","free","normal","Yes","RRULE;FREQ=YEARLY;INTERVAL=12;BYMONTHDAY=31",""
"Pay HMRC Tax Balances by 31/1?","2015-01-31","All Day","2015-02-01","All Day","","","","Yes","normal","free","normal","Yes","RRULE;FREQ=YEARLY;INTERVAL=12;BYMONTHDAY=31;COUNT=1",""
"Catan Tournament","2015-01-31","14:00:00","2015-01-31","17:00:00","Bishopthope - St Andrews Church","","","No","normal","busy","normal","No","",""
"Harrogate Spa","2015-01-31","19:00:00","2015-01-31","22:00:00","","","","No","normal","busy","normal","No","",""
"Right to Read: 08:50","2015-02-02","08:00:00","2015-02-02","11:00:00","THPS","","","No","normal","busy","normal","No","",""
"Andrea re Notes Part 2","2015-02-02","11:00:00","2015-02-02","13:00:00","Kings Court","","","No","normal","busy","normal","No","",""
"Kingsman with the gang: 20:00","2015-02-02","19:30:00","2015-02-02","22:30:00","Vue","","","No","normal","busy","normal","No","",""
"Indian Head Massage (Tuesday 10:15)","2015-02-03","09:45:00","2015-02-03","11:45:00","York College","","","No","normal","busy","normal","No","",""
"Take Tom to Station","2015-02-03","13:00:00","2015-02-03","14:00:00","","","","No","normal","busy","normal","No","",""
"Anne Picks up Ollie","2015-02-03","14:00:00","2015-02-03","15:00:00","","","","No","normal","free","normal","Yes","RRULE;FREQ=WEEKLY;BYDAY=TU;UNTIL=16001231",""
"Julie - Reflexology circa 14:30 - 15:00","2015-02-03","14:30:00","2015-02-03","16:30:00","","","","No","normal","busy","normal","No","",""
"Jazz to Halfords:10:30","2015-02-04","10:00:00","2015-02-04","12:00:00","","","","No","normal","busy","normal","No","",""
"Massage 13:00","2015-02-04","12:00:00","2015-02-04","14:00:00","York College","","","No","normal","busy","normal","No","",""
"Dinner with Paul & Carol","2015-02-05","18:00:00","2015-02-05","20:30:00","","","","No","normal","busy","normal","No","",""
"Yoga: 09:15","2015-02-06","09:00:00","2015-02-06","10:30:00","St Andrews Church Hall","","","No","normal","busy","normal","Yes","RRULE;FREQ=WEEKLY;BYDAY=FR;COUNT=8",""
"Votes for Women Talk: 17:45 - 18:30","2015-02-06","17:00:00","2015-02-06","19:00:00","Castle Museum.  Paid","","","No","normal","busy","normal","No","",""
"Make an appointment for BP test next week","2015-02-09","08:00:00","2015-02-09","08:30:00","","","","No","normal","busy","normal","No","",""
"Right to Read: 08:50","2015-02-09","08:00:00","2015-02-09","11:00:00","","","","No","normal","busy","normal","No","",""
"Jazz to Halfords - 08:30","2015-02-09","08:30:00","2015-02-09","09:00:00","","","","No","normal","busy","normal","No","",""
"Collect Jazz form Halfords - 10:45","2015-02-09","10:30:00","2015-02-09","11:00:00","","","","No","normal","busy","normal","No","",""
"Julie - Reflexology??","2015-02-09","11:00:00","2015-02-09","14:00:00","","","","No","normal","busy","normal","No","",""
"Hair - 14:30","2015-02-09","14:00:00","2015-02-09","16:00:00","Pure","","","No","normal","busy","normal","No","",""
"Clean & Dry today","2015-02-10","All Day","2015-02-11","All Day","","","","Yes","normal","free","normal","No","",""
"Curator Talk - Volcanoes, Tuesday 10th 12:30 - 13:00","2015-02-10","12:00:00","2015-02-10","13:30:00","","","","No","normal","busy","normal","No","",""
"Train to London:13:57","2015-02-10","14:00:00","2015-02-10","16:00:00","","","","No","normal","busy","normal","No","",""
"EE Wembley Event","2015-02-10","17:00:00","2015-02-10","22:00:00","","","","No","normal","busy","normal","No","",""
"London","2015-02-11","All Day","2015-02-12","All Day","","","","Yes","normal","busy","normal","No","",""
"Claire, Grace & Chloe?","2015-02-11","10:00:00","2015-02-11","10:30:00","","","","No","normal","busy","normal","No","",""
"Becky & Jim in Scotland","2015-02-12","All Day","2015-02-20","All Day","","","","Yes","normal","free","normal","No","",""
"Surveyors to 49 Sutherland Street 11 - 2","2015-02-12","08:00:00","2015-02-12","08:30:00","","","","No","normal","busy","normal","No","",""
"Meet Barbara at  Dartford Station - 11ish","2015-02-12","11:00:00","2015-02-12","16:00:00","","","","No","normal","busy","normal","No","",""
"Train to York:19:15","2015-02-12","19:00:00","2015-02-12","21:00:00","","","","No","normal","busy","normal","No","",""
"Osteo 12:30","2015-02-13","11:30:00","2015-02-13","13:30:00","Stonebow","","","No","normal","busy","normal","No","",""
"Valentines Day Walk","2015-02-14","10:00:00","2015-02-14","15:00:00","","","","No","normal","busy","normal","No","",""
"Julie & Eddie in Budapest","2015-02-15","All Day","2015-02-20","All Day","","","","Yes","normal","free","normal","No","",""
"HALF TERM","2015-02-16","All Day","2015-02-21","All Day","","","","Yes","normal","free","normal","No","",""
"Lunch with Maria?","2015-02-16","12:00:00","2015-02-16","14:00:00","","","","No","normal","busy","normal","Yes","RRULE;FREQ=DAILY;INTERVAL=1440;UNTIL=16001231",""
"Lunch with Maria?","2015-02-16","12:30:00","2015-02-16","14:30:00","","","","No","normal","busy","normal","Yes","RRULE;FREQ=DAILY;INTERVAL=1440;COUNT=1",""
"Aqua Fit 09:15","2015-02-17","08:30:00","2015-02-17","10:30:00","Energise","","","No","normal","busy","normal","No","",""
"Viking Festival Walking Tour 13:00","2015-02-17","12:30:00","2015-02-17","14:30:00","Micklegate Bar","","","No","normal","tentative","normal","Yes","RRULE;FREQ=DAILY;INTERVAL=1440;COUNT=4",""
"Smart Meters to be fitted - am","2015-02-18","08:00:00","2015-02-18","13:00:00","","","","No","normal","busy","normal","No","",""
"Alternative Yoga Class  11:30 - 12:30","2015-02-19","11:00:00","2015-02-19","13:00:00","Acomb Yoga Centre","","","No","normal","tentative","normal","Yes","RRULE;FREQ=WEEKLY;BYDAY=TH;COUNT=6",""
"Birthday - Richard Cuff (20/02/2015)","2015-02-20","All Day","2015-02-20","All Day","","","","Yes","normal","free","normal","Yes","RRULE;FREQ=YEARLY;INTERVAL=12;BYMONTHDAY=20",""
"Drive Tom to Work","2015-02-20","08:30:00","2015-02-20","10:00:00","","","","No","normal","busy","normal","No","",""
"Nordic Walking 10:00","2015-02-20","09:30:00","2015-02-20","12:00:00","Rowntree Park Reading Cafe","","","No","normal","tentative","normal","Yes","RRULE;FREQ=WEEKLY;BYDAY=FR",""
"Nordic Walking 10:00","2015-02-20","10:00:00","2015-02-20","11:00:00","Rowntree Park Reading Cafe","","","No","normal","tentative","normal","Yes","RRULE;FREQ=WEEKLY;BYDAY=FR;COUNT=6",""
"Hotel Chocolate 18:00","2015-02-20","17:00:00","2015-02-20","20:00:00","Leeds","","","No","normal","busy","normal","No","",""
"Viking Finale","2015-02-21","18:00:00","2015-02-21","20:00:00","","","","No","normal","busy","normal","No","",""
"Cafe No8: 20:15","2015-02-21","20:00:00","2015-02-21","22:00:00","with Kate, Joh, Claire & Phil","","","No","normal","busy","normal","No","",""
"Lunch at Thirsk 15:00","2015-02-22","14:00:00","2015-02-22","18:00:00","","","","No","normal","busy","normal","No","",""
"Ring Brightwater re Booking","2015-02-23","09:00:00","2015-02-23","09:30:00","","","","No","normal","busy","normal","No","",""
"Ring Baring re Watch Repair","2015-02-23","09:30:00","2015-02-23","10:00:00","","","","No","normal","busy","normal","No","",""
"Swimming with Ed & Julie?","2015-02-23","11:30:00","2015-02-23","13:30:00","York Sports Village","","","No","normal","busy","normal","No","",""
"Clean & Dry Today (circa 12:30 - 14:30)","2015-02-24","All Day","2015-02-25","All Day","","","","Yes","normal","free","normal","Yes","RRULE;FREQ=WEEKLY;INTERVAL=2;BYDAY=TU;UNTIL=16001231",""
"Full Body Massage - 10:15","2015-02-24","09:30:00","2015-02-24","12:00:00","College","","","No","normal","busy","normal","No","",""
"Curator Talk - Bedale Hoard, Tuesday 24th 13:45 - 15:30","2015-02-24","13:30:00","2015-02-24","16:00:00","Yorkshire Museum.  Paid","","","No","normal","busy","normal","No","",""
"Stephensons House Auction: 18:00","2015-02-24","17:00:00","2015-02-24","19:00:00","Murton Auction Centre","","","No","normal","busy","normal","No","",""
"Peter Appleby's Leaving Do 15:30 - 19:00","2015-02-25","15:00:00","2015-02-25","17:00:00","Cedar Court","","","No","normal","busy","normal","No","",""
"Right to Read 08:50 - 10:30","2015-02-26","08:00:00","2015-02-26","11:00:00","","","","No","normal","busy","normal","No","",""
"Viewing at 24 Welton Avenue 16:00","2015-02-26","15:00:00","2015-02-26","17:00:00","","","","No","normal","busy","normal","No","",""
"Jupiter Ascending: 20:20","2015-02-26","20:00:00","2015-02-26","23:00:00","Vue","","","No","normal","busy","normal","No","",""
"Aloe Lotion at Tullivers?","2015-02-27","All Day","2015-02-28","All Day","","","","Yes","normal","free","normal","No","",""
"FRIDAY 27th Pay Tesco £2,030.48","2015-02-27","07:30:00","2015-02-27","08:00:00","","","","No","normal","free","normal","No","",""
"First Aid Course 09:00 - 16:00","2015-02-27","08:00:00","2015-02-27","16:30:00","York Uni","","","No","normal","busy","normal","No","",""
"Ryan Air Check In from Friday 27th Feb","2015-02-27","08:00:00","2015-02-27","08:30:00","","","","No","normal","free","normal","No","",""
"The History Boys: 19:30","2015-02-27","19:00:00","2015-02-27","22:00:00","Joseph Rowntree Theatre","","","No","normal","busy","normal","No","",""
"Tea with Rob & Pam","2015-02-28","16:00:00","2015-02-28","22:00:00","WRC","","","No","normal","busy","normal","No","",""
"Tim's Birthday Party","2015-03-01","14:00:00","2015-03-01","16:00:00","Hull","","","No","normal","busy","normal","No","",""
"Tom to London: 06:30","2015-03-02","06:00:00","2015-03-02","07:00:00","","","","No","normal","busy","normal","No","",""
"Aqua Fit - 09:15","2015-03-03","08:30:00","2015-03-03","11:00:00","Energise","","","No","normal","busy","normal","No","",""
"Reflexology - Julie","2015-03-03","11:00:00","2015-03-03","12:30:00","","","","No","normal","busy","normal","No","",""
"Spa Reflexology - 17:00","2015-03-03","16:30:00","2015-03-03","18:00:00","York College","","","No","normal","busy","normal","No","",""
"Right to Read 08:50","2015-03-04","08:00:00","2015-03-04","11:00:00","","","","No","normal","busy","normal","No","",""
"Alternative Yoga Class 13:30","2015-03-04","13:00:00","2015-03-04","15:00:00","Stockton-on-the-Forest","","","No","normal","busy","normal","No","",""
"Osteo:15:45","2015-03-04","15:30:00","2015-03-04","17:00:00","Stonebow","","","No","normal","busy","normal","No","",""
"Cats to Cattery - 09:00","2015-03-05","08:30:00","2015-03-05","09:30:00","","","","No","normal","busy","normal","No","",""
"Full Body Massage - 11:45","2015-03-05","11:00:00","2015-03-05","13:30:00","","","","No","normal","busy","normal","No","",""
"To Pam & Rob Overnight","2015-03-05","16:00:00","2015-03-05","16:30:00","","","","No","normal","busy","normal","No","",""
"FUERTEVENTURA","2015-03-06","All Day","2015-03-17","All Day","","","","Yes","normal","out-of-office","normal","No","",""
"Curator Talk - Women in Geology, Tuesday 10th 12:30 - 13:00","2015-03-10","12:00:00","2015-03-10","13:30:00","","","","No","normal","busy","normal","No","",""
"MOTHERS DAY","2015-03-15","All Day","2015-03-16","All Day","","","","Yes","normal","free","normal","No","",""
"Have we had ISS Alert for ","2015-03-17","08:30:00","2015-03-17","09:00:00","","","","No","normal","busy","normal","No","",""
"Massage 10:15","2015-03-17","09:30:00","2015-03-17","12:00:00","York College","","","No","normal","busy","normal","No","",""
"Curator Talk - Money in Pre History, Tuesday 17th 12:30 - 13:00","2015-03-17","12:00:00","2015-03-17","13:30:00","","","","No","normal","busy","normal","No","",""
"Right to Read 08:50 - 10:30","2015-03-18","08:00:00","2015-03-18","11:00:00","THPS","","","No","normal","busy","normal","No","",""
"Hair 12:45","2015-03-18","12:00:00","2015-03-18","14:00:00","Pure","","","No","normal","busy","normal","No","",""
"Andrea re Hearing Prep","2015-03-18","14:00:00","2015-03-18","17:00:00","Kings Court","","","No","normal","busy","normal","No","",""
"Hunters Auction - 18:00","2015-03-18","17:00:00","2015-03-18","20:00:00","Racecourse - Gimcrack Suite","","","No","normal","busy","normal","No","",""
"The Stromalites ","2015-03-19","19:00:00","2015-03-19","22:00:00","Wharf Chambers, Leeds","See email from Tom (6/2/15) for membership of Wharf Chambers
","","No","normal","busy","normal","No","",""
"Dentist 10:20","2015-03-20","10:00:00","2015-03-20","11:00:00","","","","No","normal","busy","normal","No","",""
"Andrea re Hearing Prep","2015-03-20","13:30:00","2015-03-20","17:00:00","Kings Court","","","No","normal","busy","normal","No","",""
"WR WORK WEEKEND","2015-03-21","All Day","2015-03-22","All Day","","","","Yes","normal","busy","normal","Yes","RRULE;FREQ=WEEKLY;BYDAY=SU,SA;COUNT=2",""
"Tom Hair: 09:00","2015-03-21","08:30:00","2015-03-21","10:00:00","Cube with Gemma","","","No","normal","busy","normal","No","",""
"Do we want to book for ""Cox & Box""?  ","2015-03-23","All Day","2015-03-24","All Day","See Notice Board","","","Yes","normal","free","normal","No","",""
"Dentist 12:40","2015-03-23","12:00:00","2015-03-23","13:00:00","Aldwark","","","No","normal","busy","normal","No","",""
"Optician:13:30","2015-03-23","13:00:00","2015-03-23","14:00:00","","","","No","normal","busy","normal","No","",""
"Literary Tour of York 14:15 - 16:15","2015-03-23","13:30:00","2015-03-23","16:30:00","Museum Garden Gates","","","No","normal","busy","normal","Yes","RRULE;FREQ=DAILY;INTERVAL=2880;COUNT=2",""
"Indian Head Massage 10:15","2015-03-24","09:30:00","2015-03-24","11:00:00","","","","No","normal","busy","normal","No","",""
"Pamper Brunch with Julie:  11:30","2015-03-24","11:00:00","2015-03-24","13:30:00","York College","","","No","normal","busy","normal","No","",""
"Curator Talk - Uncleby, Tuesday 24th 12:30 - 13:00","2015-03-24","12:00:00","2015-03-24","13:30:00","","","","No","normal","free","normal","No","",""
"Steve to Hospital","2015-03-25","All Day","2015-03-26","All Day","","","","Yes","normal","free","normal","No","",""
"Honda to Halfords Wed - 08:30","2015-03-25","08:00:00","2015-03-25","11:30:00","Foss Islands Road","","","No","normal","busy","normal","No","",""
"Right to Read:08:50","2015-03-25","08:00:00","2015-03-25","11:00:00","THPS","","","No","normal","busy","normal","No","",""
"Osteo 12:30","2015-03-25","12:00:00","2015-03-25","14:00:00","Stonebow","","","No","normal","busy","normal","No","",""
"IT Access","2015-03-25","14:00:00","2015-03-25","16:00:00","Barstow House","","","No","normal","busy","normal","No","",""
"Swimming Lesson","2015-03-25","19:00:00","2015-03-25","20:00:00","York Sports Village","","","No","normal","busy","normal","Yes","RRULE;FREQ=WEEKLY;BYDAY=WE;COUNT=8",""
"IT Access","2015-03-26","14:00:00","2015-03-26","16:00:00","Barstow House","","","No","normal","busy","normal","No","",""
"Hearing Preparation with Andrea","2015-03-27","10:30:00","2015-03-27","17:00:00","Kings Court","","","No","normal","busy","normal","No","",""
"Harrogate / Turkish Baths with E&J","2015-03-28","14:00:00","2015-03-28","22:00:00","","","","No","normal","busy","normal","No","",""
"Busy","2015-03-29","15:00:00","2015-03-29","17:00:00","","","","No","normal","busy","normal","No","",""
"School's Easter Break","2015-03-30","All Day","2015-04-11","All Day","","","","Yes","normal","free","normal","No","",""
"George's Leaving Do 16:00 - 19:00","2015-03-31","15:00:00","2015-03-31","18:00:00","Brigantes","","","No","normal","busy","normal","No","",""
"Denture Fitting 1: 09:50","2015-04-01","07:30:00","2015-04-01","09:30:00","Aldwark","","","No","normal","busy","normal","No","",""
"Disciplinary Hearing 09:00","2015-04-02","07:00:00","2015-04-02","16:00:00","","","","No","normal","busy","normal","No","",""
"GOOD FRIDAY","2015-04-03","All Day","2015-04-04","All Day","","","","Yes","normal","busy","normal","No","",""
"EASTER MONDAY","2015-04-06","All Day","2015-04-07","All Day","","","","Yes","normal","busy","normal","No","",""
"Curator Talk - Richard III, Tuesday 7th 12:30 - 13:00","2015-04-07","11:00:00","2015-04-07","12:30:00","","","","No","normal","busy","normal","No","",""
"Collect Glasses: 09:00","2015-04-09","07:00:00","2015-04-09","09:00:00","Spec Savers","","","No","normal","busy","normal","No","",""
"Denture Fitting: 09:25","2015-04-09","07:00:00","2015-04-09","09:00:00","Aldwark","","","No","normal","busy","normal","No","",""
"Penny & Miranda to Cardross en route to Iona","2015-04-10","All Day","2015-04-12","All Day","","","","Yes","normal","free","normal","No","",""
"Rob & Pams","2015-04-11","All Day","2015-04-13","All Day","","","","Yes","normal","busy","normal","No","",""
"Cox & Box 19:30","2015-04-11","17:30:00","2015-04-11","21:00:00","Jo Ro Theatre","","","No","normal","busy","normal","No","",""
"Mum?","2015-04-13","All Day","2015-04-20","All Day","","","","Yes","normal","free","normal","No","",""
"Tom to Dentist 10:10","2015-04-13","09:00:00","2015-04-13","09:30:00","Copmanthorpe","","","No","normal","busy","normal","No","",""
"Curator Talk - Treasure, Tuesday 14th 12:30 - 13:00","2015-04-14","11:00:00","2015-04-14","12:30:00","","","","No","normal","busy","normal","No","",""
"Right to Read: 08:50","2015-04-15","07:00:00","2015-04-15","09:30:00","THPS","","","No","normal","busy","normal","Yes","RRULE;FREQ=WEEKLY;BYDAY=WE;UNTIL=16001231",""
"Tom to Eye Clinic: 10:00","2015-04-17","07:30:00","2015-04-17","10:00:00","York Hospital","","","No","normal","busy","normal","No","",""
"Health & Healing Festival (2days)","2015-04-18","All Day","2015-04-20","All Day","York Race Course","Also Leeds 4th & 5th July
","","Yes","normal","free","normal","No","",""
"Curator Talk - Weatherby Hoard, Tuesday 21st, 12:30 - 13:00","2015-04-21","11:00:00","2015-04-21","12:30:00","","","","No","normal","busy","normal","No","",""
"Hair: 12:30","2015-04-22","11:00:00","2015-04-22","13:00:00","Pure","","","No","normal","busy","normal","No","",""
"Harrogate Spring Flower Show (4 days)","2015-04-23","All Day","2015-04-27","All Day","Yorkshire Showground","","","Yes","normal","free","normal","No","",""
"Tom to Dentist:14:00","2015-04-27","13:00:00","2015-04-27","13:30:00","","","","No","normal","busy","normal","No","",""
"Curator Talk - William Smith, Tuesday 28th 12:30 - 13:00","2015-04-28","11:00:00","2015-04-28","12:30:00","","","","No","normal","busy","normal","No","",""
"BANK HOLIDAY","2015-05-04","All Day","2015-05-05","All Day","","","","Yes","normal","busy","normal","No","",""
"Blood Doning 18:00","2015-05-05","16:00:00","2015-05-05","18:00:00","Seacroft","","","No","normal","busy","normal","No","",""
"ELECTIONS","2015-05-07","All Day","2015-05-08","All Day","","","","Yes","normal","busy","normal","No","",""
"COUNT","2015-05-08","All Day","2015-05-09","All Day","","","","Yes","normal","busy","normal","No","",""
"YORK RACE MEETING","2015-05-13","All Day","2015-05-16","All Day","3 days","","","Yes","normal","free","normal","No","",""
"Man & Superman 19:00","2015-05-14","17:30:00","2015-05-14","21:00:00","City Screen","","","No","normal","busy","normal","No","",""
"Eco Home Weekend","2015-05-16","All Day","2015-05-18","All Day","Organsised by St Nicks","","","Yes","normal","free","normal","No","",""
"Canceled: EC Return to work Meeting","2015-05-18","13:00:00","2015-05-18","14:00:00"," Alcuin Room, GO60 West Offices","When: 18 May 2015 14:00-15:00 (UTC) Dublin, Edinburgh, Lisbon, London.
Where:  Alcuin Room, GO60 West Offices
 
Note: The GMT offset above does not reflect daylight saving time adjustments.
 
*~*~*~*~*~*~*~*~*~*
 
Discussion with EC to discuss her return to work programme
 
* * * * * * * * * * * * * * * * * * * * * * * * * * * * * * * * * * * * * * * * * * * * * * 
Help protect the environment! - please don't print this email unless you really need to. 
* * * * * * * * * * * * * * * * * * * * * * * * * * * * * * * * * * * * * * * * * * * * * 

This communication is from City of York Council. 

The information contained within, and in any attachment(s), is confidential and legally privileged. It is for the exclusive use of the intended recipient(s). If you are not the intended recipient(s), please note that any form of distribution, copying or use of this communication, or the information within, is strictly prohibited and may be unlawful. Equally, you must not disclose all, or part, of its contents to any other person. 

If you have received this communication in error, please return it immediately to the sender, then delete and destroy any copies of it. 

City of York Council disclaims any liability for action taken in reliance on the content of this communication. 
","","No","high","free","normal","No","",""
"BANK HOLIDAY","2015-05-25","All Day","2015-05-26","All Day","","","","Yes","normal","busy","normal","No","",""
"Half Term","2015-05-25","All Day","2015-05-30","All Day","","","","Yes","normal","free","normal","No","",""
"YORK RACE MEETING","2015-05-30","All Day","2015-05-31","All Day","1 day","","","Yes","normal","free","normal","No","",""
"Check In for Valalta Sunday 7th (28days)","2015-06-06","23:00:00","2015-06-06","23:30:00","","","","No","normal","free","normal","No","",""
"Quantum Universe Talk: 19:00 - 20:30","2015-06-09","17:00:00","2015-06-09","20:00:00","St Peter's College","Booked 22/3/15
","","No","normal","busy","normal","No","",""
"Dentist: 09:00","2015-06-10","07:00:00","2015-06-10","09:00:00","Aldwark","","","No","normal","busy","normal","No","",""
"YORK RACE MEETING","2015-06-12","All Day","2015-06-14","All Day","2 days","","","Yes","normal","free","normal","No","",""
"Deadline for Holiday Balances £270.00","2015-06-23","All Day","2015-06-24","All Day","Brightwater - Staffordshire Hoard","","","Yes","normal","free","normal","No","",""
"Site Survey by Patchwork Energy: 09:30 - 10:00","2015-06-24","08:00:00","2015-06-24","08:30:00","","When: 24 June 2015 09:00-09:30 (UTC) Dublin, Edinburgh, Lisbon, London.
 
Note: The GMT offset above does not reflect daylight saving time adjustments.
 
*~*~*~*~*~*~*~*~*~*
 
 
* * * * * * * * * * * * * * * * * * * * * * * * * * * * * * * * * * * * * * * * * * * * * * 
Help protect the environment! - please don't print this email unless you really need to. 
* * * * * * * * * * * * * * * * * * * * * * * * * * * * * * * * * * * * * * * * * * * * * 

This communication is from City of York Council. 

The information contained within, and in any attachment(s), is confidential and legally privileged. It is for the exclusive use of the intended recipient(s). If you are not the intended recipient(s), please note that any form of distribution, copying or use of this communication, or the information within, is strictly prohibited and may be unlawful. Equally, you must not disclose all, or part, of its contents to any other person. 

If you have received this communication in error, please return it immediately to the sender, then delete and destroy any copies of it. 

City of York Council disclaims any liability for action taken in reliance on the content of this communication. 
","","No","normal","free","normal","No","",""
"Lunch (or Dinner?) at Annes","2015-06-28","12:00:00","2015-06-28","17:00:00","Details TBA","","","No","normal","busy","normal","No","",""
"Cats to Cattery","2015-07-04","08:00:00","2015-07-04","08:30:00","","","","No","normal","busy","normal","No","",""
"VALALTA","2015-07-05","All Day","2015-07-20","All Day","","","","Yes","normal","busy","normal","No","",""
"YORK RACE MEETING","2015-07-10","All Day","2015-07-12","All Day","2 days","","","Yes","normal","free","normal","No","",""
"School Summer Holidays ","2015-07-20","All Day","2015-09-05","All Day","","","","Yes","normal","free","normal","No","",""
"Cats from Cattery","2015-07-20","08:00:00","2015-07-20","08:30:00","","","","No","normal","busy","normal","No","",""
"YORK RACE MEETING","2015-07-24","All Day","2015-07-26","All Day","2 days (inc music evenings)","","","Yes","normal","free","normal","No","",""
"Set Up Interim Tax Payments Due 31/7?","2015-07-31","All Day","2015-08-01","All Day","","","","Yes","normal","free","normal","Yes","RRULE;FREQ=YEARLY;INTERVAL=12;BYMONTHDAY=31",""
"Pay HMRC Eleanor's Tax by 31/7 - £847.81","2015-07-31","09:00:00","2015-07-31","09:30:00","","","","No","normal","busy","normal","No","",""
"Doctor 08:50","2015-08-07","07:30:00","2015-08-07","08:30:00","Woolpack House","When: 07 August 2015 08:30-09:30 (UTC) Dublin, Edinburgh, Lisbon, London.
Where: Woolpack House
 
Note: The GMT offset above does not reflect daylight saving time adjustments.
 
*~*~*~*~*~*~*~*~*~*
 
 
* * * * * * * * * * * * * * * * * * * * * * * * * * * * * * * * * * * * * * * * * * * * * * 
Help protect the environment! - please don't print this email unless you really need to. 
* * * * * * * * * * * * * * * * * * * * * * * * * * * * * * * * * * * * * * * * * * * * * 

This communication is from City of York Council. 

The information contained within, and in any attachment(s), is confidential and legally privileged. It is for the exclusive use of the intended recipient(s). If you are not the intended recipient(s), please note that any form of distribution, copying or use of this communication, or the information within, is strictly prohibited and may be unlawful. Equally, you must not disclose all, or part, of its contents to any other person. 

If you have received this communication in error, please return it immediately to the sender, then delete and destroy any copies of it. 

City of York Council disclaims any liability for action taken in reliance on the content of this communication. 
","","No","normal","out-of-office","private","No","",""
"BIRMINGHAM with MUM","2015-08-16","All Day","2015-08-18","All Day","","","","Yes","normal","busy","normal","No","",""
"STAFFORDSHIRE HOARD HOLIDAY WITH MUM","2015-08-18","All Day","2015-08-22","All Day","","","","Yes","normal","busy","normal","No","",""
"YORK RACE MEETING (EBOR)","2015-08-19","All Day","2015-08-23","All Day","4 days (Thurs = Ladies Day)","","","Yes","normal","free","normal","No","",""
"Blood Doning 17:15","2015-08-26","15:00:00","2015-08-26","17:30:00","Seacroft","When: 26 August 2015 16:00-18:30 (UTC) Dublin, Edinburgh, Lisbon, London.
Where: Seacroft
 
Note: The GMT offset above does not reflect daylight saving time adjustments.
 
*~*~*~*~*~*~*~*~*~*
 
 
* * * * * * * * * * * * * * * * * * * * * * * * * * * * * * * * * * * * * * * * * * * * * * 
Help protect the environment! - please don't print this email unless you really need to. 
* * * * * * * * * * * * * * * * * * * * * * * * * * * * * * * * * * * * * * * * * * * * * 

This communication is from City of York Council. 

The information contained within, and in any attachment(s), is confidential and legally privileged. It is for the exclusive use of the intended recipient(s). If you are not the intended recipient(s), please note that any form of distribution, copying or use of this communication, or the information within, is strictly prohibited and may be unlawful. Equally, you must not disclose all, or part, of its contents to any other person. 

If you have received this communication in error, please return it immediately to the sender, then delete and destroy any copies of it. 

City of York Council disclaims any liability for action taken in reliance on the content of this communication. 
","","No","normal","out-of-office","private","No","",""
"FW: Facilities Consultation meeting ","2015-09-02","12:00:00","2015-09-02","13:00:00","Cerialis Room ","-----Original Appointment-----
From: Foley, Sue [ <mailto:Sue.Foley@york.gov.uk> mailto:Sue.Foley@york.gov.uk]
Sent: 24 August 2015 15:21
To: Foley, Sue; Dalby, Pat; Fawcett, Alan; Ledger, Chris; Dalby, Steve; Evans, Gillian; 'elearnor@shoal.demon.co.uk'; Conibere, Teri; Butler, Tom; Wood, Catherine; Armstrong, Jane; Brookes, Daniel; Snelling, Steve; Frankland, Aliya; Lang, Andy; Elliker, Lesley; Dudding, Andrea; Mercer, Andy; Robinson, Alan
Subject: Facilities Consultation meeting
When: 02 September 2015 13:00-14:00 (GMT) Greenwich Mean Time : Dublin, Edinburgh, Lisbon, London.
Where: Cerialis Room 

When: 02 September 2015 13:00-14:00 (UTC) Dublin, Edinburgh, Lisbon, London.

Where: Cerialis Room 

 

Note: The GMT offset above does not reflect daylight saving time adjustments.

 

+~+~+~+~+~+~+~+~+~+

 

Dear Colleagues

 

You are invited to attend a further consultation meeting led by Lesley Elliker on 2nd September at 1pm – 2pm in the Cerialis room on the 2nd floor.

 

We look forward to seeing you there

 

Best wishes

 

Sue

 

* * * * * * * * * * * * * * * * * * * * * * * * * * * * * * * * * * * * * * * * * * * * * *
Help protect the environment! - please don't print this email unless you really need to.
* * * * * * * * * * * * * * * * * * * * * * * * * * * * * * * * * * * * * * * * * * * * *

This communication is from City of York Council.

The information contained within, and in any attachment(s), is confidential and legally privileged. It is for the exclusive use of the intended recipient(s). If you are not the intended recipient(s), please note that any form of distribution, copying or use of this communication, or the information within, is strictly prohibited and may be unlawful. Equally, you must not disclose all, or part, of its contents to any other person.

If you have received this communication in error, please return it immediately to the sender, then delete and destroy any copies of it.

City of York Council disclaims any liability for action taken in reliance on the content of this communication. 

","","No","normal","tentative","normal","No","",""
"YORK RACE MEETING","2015-09-06","All Day","2015-09-07","All Day","1 day","","","Yes","normal","free","normal","No","",""
"Toms Passport Expires 6th October 15","2015-10-06","All Day","2015-10-07","All Day","Apply for new one from 6th Jan 15 (9 months)","","","Yes","normal","free","normal","No","",""
"YORK RACE MEETING","2015-10-09","All Day","2015-10-11","All Day","2 days","","","Yes","normal","free","normal","No","",""
"EHIC Cards expire today 27/11/15","2015-11-27","All Day","2015-11-28","All Day","","","","Yes","normal","free","normal","No","",""
"Contact Des Mahon re coffee","2016-01-05","08:30:00","2016-01-05","09:00:00","","","","No","normal","busy","normal","No","",""
"Car to Service @ Layerthorpe 09:00","2016-01-08","08:00:00","2016-01-08","08:30:00","","","","No","normal","busy","normal","No","",""
"FW: Absence Management Meeting - EC","2016-01-12","14:30:00","2016-01-12","15:30:00","Kings Court ","
  ________________________________
From: Asher, Ian
Sent: 06 January 2016 17:25:10 (UTC) Dublin, Edinburgh, Lisbon, London
To: Cranstoun, Eleanor; Dudding, Andrea
Subject: Absence Management Meeting - EC
When:
Where: Kings Court



When: 12 January 2016 14:30-15:30 (UTC) Dublin, Edinburgh, Lisbon, London.
Where: Kings Court

Note: The GMT offset above does not reflect daylight saving time adjustments.

+~+~+~+~+~+~+~+~+~+

First Formal Review Meeting

Purpose to investigate the reasons for absence, identify support to facilitate a sustained improvement in attendance, or where a return to work is not foreseeable what other action can be taken.

* * * * * * * * * * * * * * * * * * * * * * * * * * * * * * * * * * * * * * * * * * * * * *
Help protect the environment! - please don't print this email unless you really need to.
* * * * * * * * * * * * * * * * * * * * * * * * * * * * * * * * * * * * * * * * * * * * *

This communication is from City of York Council.

The information contained within, and in any attachment(s), is confidential and legally privileged. It is for the exclusive use of the intended recipient(s). If you are not the intended recipient(s), please note that any form of distribution, copying or use of this communication, or the information within, is strictly prohibited and may be unlawful. Equally, you must not disclose all, or part, of its contents to any other person.

If you have received this communication in error, please return it immediately to the sender, then delete and destroy any copies of it.

City of York Council disclaims any liability for action taken in reliance on the content of this communication.
","","No","normal","busy","normal","No","",""
"House Viewing - 44, Gladstone Street 09:15","2016-01-30","09:00:00","2016-01-30","09:30:00","IGLU - Rob","","","No","normal","busy","normal","No","",""
"Starr Carr Recent Discoveries 14:00 - 15:00","2016-04-26","12:00:00","2016-04-26","14:30:00","YM £10 Booking Required","","","No","normal","tentative","normal","No","",""
"Eleanor's Passport Expires 25th June 16","2016-06-25","All Day","2016-06-26","All Day","Apply for new one from 25th September 15","","","Yes","normal","free","normal","No","",""
"Bogota Visit","2016-09-18","All Day","2016-10-02","All Day","Bogota","




------------------------------------------------------------------------ 
Disclaimer The information in this email and any attachments may contain proprietary and confidential information that is intended for the addressee(s) only. If you are not the intended recipient, you are hereby notified that any disclosure, copying, distribution, retention or use of the contents of this information is prohibited. When addressed to our clients or vendors, any information contained in this e-mail or any attachments is subject to the terms and conditions in any governing contract. If you have received this e-mail in error, please immediately contact the sender and delete the e-mail. 
","","Yes","normal","free","normal","No","",""
"44 Gladstone St - Gas Safety Cert Expires 10/3","2017-03-10","All Day","2017-03-11","All Day","","","","Yes","normal","free","normal","Yes","RRULE;FREQ=YEARLY;INTERVAL=12;BYMONTHDAY=10",""
"Carriage Study Sample 1","2017-04-01","07:00:00","2017-04-01","08:00:00","","","","No","normal","busy","normal","Yes","RRULE;FREQ=WEEKLY;BYDAY=SA;COUNT=3",""
"Start antibiotics - Sunday lunchtime","2017-04-02","07:00:00","2017-04-02","07:30:00","","","","No","normal","free","normal","No","",""
"Resolve extractor fan at Gladstone Street.","2017-04-03","07:00:00","2017-04-03","08:00:00","","","","No","normal","busy","normal","No","",""
"Implant 12:30","2017-04-04","10:30:00","2017-04-04","13:00:00","Aldwark","","","No","normal","busy","normal","No","",""
"Childminding 16:30","2017-04-04","15:00:00","2017-04-04","16:00:00","30 Carron Crescent","","","No","normal","busy","normal","No","",""
"Hair Cut 10:00","2017-04-18","08:00:00","2017-04-18","10:00:00","Pure","","","No","normal","busy","normal","No","",""
"CANCELLED - Lunch with Maria & Malcolm 12:30","2017-04-21","11:00:00","2017-04-21","13:30:00","Cafe Rouge","","","No","normal","busy","normal","No","",""
"Tom in Nashville","2017-04-22","All Day","2017-05-21","All Day","","","","Yes","normal","free","normal","No","",""
"Cat Boosters 09:10","2017-04-24","07:00:00","2017-04-24","09:00:00","Minster Vets","","","No","normal","busy","normal","No","",""
"Richard Williams and Tony Farthing to 49 Sutherland St","2017-04-25","07:00:00","2017-04-25","08:00:00","","","","No","normal","busy","normal","No","",""
"Right to Read 08:50 - 10:30","2017-04-26","07:00:00","2017-04-26","09:30:00","","","","No","normal","busy","normal","Yes","RRULE;FREQ=WEEKLY;BYDAY=WE;UNTIL=16001231",""
"Fascial 13:15","2017-04-26","11:30:00","2017-04-26","13:30:00","York College","","","No","normal","busy","normal","No","",""
"Spanish 2 19:00","2017-04-26","17:30:00","2017-04-26","20:30:00","York High","","","No","normal","busy","normal","Yes","RRULE;FREQ=WEEKLY;BYDAY=WE;COUNT=5",""
"BOS re Mum's Accounts 09:00","2017-04-27","07:00:00","2017-04-27","09:30:00","Halifax, Parliament St","","","No","normal","busy","normal","No","",""
"Dru Yoga 13:00 - 14:30","2017-04-27","11:30:00","2017-04-27","13:30:00","Acomb Yoga Centre","","","No","normal","busy","normal","Yes","RRULE;FREQ=WEEKLY;BYDAY=TH;UNTIL=16001231",""
"RICHARD HOME","2017-04-28","All Day","2017-05-01","All Day","","","","Yes","normal","free","normal","Yes","RRULE;FREQ=WEEKLY;INTERVAL=2;BYDAY=FR;UNTIL=16001231",""
"Osteo 12:30","2017-04-28","11:00:00","2017-04-28","12:30:00","Stonebow","","","No","normal","busy","normal","No","",""
"Blood Doning 17:35","2017-04-28","15:30:00","2017-04-28","17:30:00","Wigginton Rec YO32 2PL","","","No","normal","busy","normal","No","",""
"Make Drs appt for Tom for 22/5","2017-05-02","07:00:00","2017-05-02","08:00:00","","","","No","normal","busy","normal","No","",""
"Aquafit 09:30","2017-05-02","08:00:00","2017-05-02","10:00:00","Energise","","","No","normal","busy","normal","Yes","RRULE;FREQ=WEEKLY;BYDAY=TU",""
"Yoga 19:30","2017-05-02","18:00:00","2017-05-02","20:30:00","Acaser Malbis Hall","","","No","normal","busy","normal","No","",""
"CARDROSS","2017-05-04","All Day","2017-05-10","All Day","","","","Yes","normal","free","normal","No","",""
"Train to Cardross 07:30","2017-05-04","05:30:00","2017-05-04","11:00:00","","","","No","normal","busy","normal","No","",""
"Gas Cert due 49 Sutherland St","2017-05-06","All Day","2017-05-07","All Day","","","","Yes","normal","free","normal","No","",""
"Gas Cert due 19 Baird Av","2017-05-06","All Day","2017-05-07","All Day","","","","Yes","normal","free","normal","No","",""
"Joan Nimmo 14:00","2017-05-08","11:30:00","2017-05-08","14:00:00","Clarke Boyle, Glasgow","","","No","normal","busy","normal","No","",""
"Drumchapel CAB 11:00","2017-05-09","09:00:00","2017-05-09","11:00:00","","","","No","normal","busy","normal","No","",""
"DHL Parcel expected","2017-05-11","All Day","2017-05-12","All Day","","","","Yes","normal","free","normal","No","",""
"CAR INSURANCE DUE 15/5","2017-05-15","All Day","2017-05-16","All Day","Swift Cover - Auto Renewal","","","Yes","normal","free","normal","Yes","RRULE;FREQ=YEARLY;INTERVAL=12;BYMONTHDAY=15",""
"Ring Doctors to make Diabestic Appt for 5th June","2017-05-15","07:00:00","2017-05-15","08:00:00","","","","No","normal","busy","normal","No","",""
"Pamper Day 09:30 - 14:00","2017-05-16","08:00:00","2017-05-16","13:00:00","York College","","","No","normal","busy","normal","No","",""
"PEBBLES TO Vet 17:40","2017-05-18","16:30:00","2017-05-18","17:00:00","","","","No","normal","busy","normal","No","",""
"Key to Tony Farthing for work at 49 on Monday","2017-05-19","07:00:00","2017-05-19","08:00:00","","","","No","normal","busy","normal","No","",""
"Duty Cover for S&K 11:45","2017-05-19","11:00:00","2017-05-19","19:00:00","","","","No","normal","busy","normal","No","",""
"WR Open Weekend","2017-05-20","All Day","2017-05-22","All Day","","","","Yes","normal","free","normal","No","",""
"Anne et al to Minorca","2017-05-20","All Day","2017-05-28","All Day","","","","Yes","normal","free","normal","No","",""
"WR - Sauna Duty","2017-05-20","14:00:00","2017-05-20","17:30:00","","","","No","normal","busy","normal","No","",""
"WR - Wild West Night","2017-05-20","18:00:00","2017-05-20","22:00:00","","","","No","normal","busy","normal","No","",""
"Tony Farthing to 49, Sutherland St","2017-05-22","All Day","2017-05-23","All Day","","","","Yes","normal","free","normal","No","",""
"Check Santander & LLoyds Offers for Hilton deal","2017-05-22","07:00:00","2017-05-22","08:00:00","","","","No","normal","busy","normal","No","",""
"Tom - Haircut 10:30","2017-05-22","09:00:00","2017-05-22","10:00:00","Cube","","","No","normal","busy","normal","No","",""
"Tom - Contact Lens Check 11:10","2017-05-22","10:00:00","2017-05-22","10:30:00","Specsavers","","","No","normal","busy","normal","No","",""
"Tom - Blood Test 12:00","2017-05-22","10:45:00","2017-05-22","11:15:00","Woolpack, Angie","","","No","normal","busy","normal","No","",""
"Hot Stones Massage 13:30","2017-05-22","12:00:00","2017-05-22","14:30:00","","","","No","normal","busy","normal","No","",""
"Pay Corporation Tax by 30th June","2017-05-23","All Day","2017-05-24","All Day","","Which Account? £95.80
","","Yes","normal","free","normal","No","",""
"Tom to Dr Barrett 15:30","2017-05-23","14:00:00","2017-05-23","15:00:00","South Bank","","","No","normal","busy","normal","No","",""
"Amaranth 15:00","2017-05-24","13:00:00","2017-05-24","16:00:00","Leeds","Lauren 0113-272-8918
","","No","normal","busy","normal","No","",""
"LONDON","2017-05-25","All Day","2017-05-27","All Day","","","","Yes","normal","busy","normal","No","",""
"DUTY WEEK","2017-05-28","All Day","2017-06-05","All Day","WR","","","Yes","normal","free","normal","No","",""
"Tom in Nashville","2017-05-28","All Day","2017-06-04","All Day","","","","Yes","normal","free","normal","No","",""
"THPS - Half Term","2017-05-29","All Day","2017-06-06","All Day","","","","Yes","normal","free","normal","No","",""
"Annual Travel Policy Expires 5th June","2017-06-05","All Day","2017-06-06","All Day","Higos","","","Yes","normal","free","normal","Yes","RRULE;FREQ=YEARLY;INTERVAL=12;BYMONTHDAY=5",""
"Hot Stones 13:30","2017-06-05","11:30:00","2017-06-05","14:00:00","York College","","","No","normal","busy","normal","No","",""
"Hair 09:00","2017-06-06","07:00:00","2017-06-06","09:00:00","Pure","","","No","normal","busy","normal","No","",""
"Right to Read?  11 - 12?","2017-06-06","09:30:00","2017-06-06","11:00:00","","","","No","normal","busy","normal","No","",""
"Tom 13:10 - Annual Diabetic Review","2017-06-06","11:00:00","2017-06-06","12:30:00","Woolpack House","","","No","normal","busy","normal","No","",""
"Back Massage 20:00","2017-06-06","18:30:00","2017-06-06","20:00:00","","","","No","normal","busy","normal","No","",""
"VALALTA","2017-06-07","All Day","2017-06-22","All Day","","","","Yes","normal","free","normal","No","",""
"Cats to Cattery","2017-06-07","07:00:00","2017-06-07","08:00:00","FOXGLOVES","","","No","normal","busy","normal","No","",""
"To Rob & Pam","2017-06-07","09:00:00","2017-06-07","10:00:00","","","","No","normal","busy","normal","No","",""
"Summer Solstice Yoga 19:00 - 21:00","2017-06-21","17:30:00","2017-06-21","20:30:00","Acaster Malbis","","","No","normal","busy","normal","No","",""
"Breast Screening 09:35","2017-06-22","07:00:00","2017-06-22","09:00:00","Clarence Street - Paperwork on Notice Board","","","No","normal","busy","normal","No","",""
"Tom - Bloods 10:40","2017-06-22","09:00:00","2017-06-22","10:00:00","Woolpack House","","","No","normal","busy","normal","No","",""
"12:30 Wayne re heating","2017-06-22","11:00:00","2017-06-22","12:30:00","","","","No","normal","busy","normal","No","",""
"Cardross??","2017-06-23","All Day","2017-06-27","All Day","","","","Yes","normal","free","normal","No","",""
"Train to Cardross 07:37","2017-06-23","06:00:00","2017-06-23","11:30:00","","","","No","normal","busy","normal","No","",""
"Slater Hogg & Howieson 16:00","2017-06-23","15:00:00","2017-06-23","16:00:00","Linmar","Graham Forbes
","","No","normal","busy","normal","No","",""
"Tom to York","2017-06-25","10:00:00","2017-06-25","16:00:00","","","","No","normal","busy","normal","No","",""
"Tom - Clifton Park Hospital 10:00","2017-06-26","09:00:00","2017-06-26","10:00:00","","","","No","normal","busy","normal","No","",""
